pair_id,a_speaker,b_speaker,i_merge_id,j_merge_id,i_text,j_text,i_addressees,A_gender,A_category,B_gender,B_category,a_articles,a_auxiliary_verbs,a_conjunctions,a_adverbs,a_impersonal_pronouns,a_negations,a_personal_pronouns,a_prepositions,a_quantifiers,b_articles,b_auxiliary_verbs,b_conjunctions,b_adverbs,b_impersonal_pronouns,b_negations,b_personal_pronouns,b_prepositions,b_quantifiers
00138,Mr. Herriton,Harriet,428,526,tut tut tutlet you d find a corpse extraordinarily inconvenient i heartily dislike the fellow but we know he didn t murder her in that letter though she said a lot she never said he was physically cruel,he s insolent to ladies we know but my brother can be trusted to bring him to his senses that woman philip whom you saw will carry the baby to the hotel of course you must tip her for it and try if you can to get poor lilia s silver bangles they were nice quiet things and will do for irma and there is an inlaid box i lent her lent not gave to keep her handkerchiefs in it s of no real value but this is our only chance don t ask for it but if you see it lying about just say,Harriet,M,major,F,major,1,1,1,1,1,1,1,1,1,1,1,1,1,1,1,1,1,0
00139,Mr. Herriton,Harriet,430,405,things which one must mention if one s to talk at all and things which one must keep in their proper place because he was unfaithful to his wife it doesn t follow that in every way he s absolutely vile,do you suppose do you suppose i am going to enter that man s house,Harriet,M,major,F,major,0,1,1,1,1,0,1,1,1,0,1,0,0,1,0,1,1,0
00140,Mr. Herriton,Harriet,432,415,oh stow it take it to the back kitchen it s no more a supreme test than anything else the italians never were chivalrous from the first if you condemn him for that you ll condemn the whole lot,not for me thank you,Harriet,M,major,F,major,1,1,1,1,1,1,1,1,1,0,0,0,0,0,1,1,1,0
00141,Mr. Herriton,Harriet,434,708,and the french as well,i retire to pack please remind signor carella philip that the baby is to be here by half past eight this evening,Harriet,M,major,F,major,1,0,1,1,0,0,0,1,0,1,1,0,1,1,0,1,1,1
00142,Mr. Herriton,Harriet,436,773,things aren t so jolly easy,philip do you happen to have those matches handy we might as well look at the baby again if you have oh i don t want all that bother try again,Harriet,M,major,F,major,0,0,1,1,1,0,0,0,0,1,1,1,1,1,0,1,1,1
00143,Mr. Herriton,Harriet,438,763,go where,oh the night air i suppose or perhaps the wet of the rain,Harriet,M,major,F,major,0,0,0,1,0,0,0,0,0,1,0,1,1,0,0,1,1,0
00144,Mr. Herriton,Harriet,442,435,i m damned if i ll go i want my tea,and the french as well,Harriet,M,major,F,major,0,0,1,0,0,0,1,0,0,1,0,1,1,0,0,0,1,0
00145,Mr. Herriton,Harriet,444,35,harriet don t act or act better,of course i mean an english church lilia promised me that she would always be in a large town on sundays,Harriet,M,major,F,major,0,0,1,0,0,0,0,0,0,1,1,0,1,1,0,1,1,1
00146,Mr. Herriton,Harriet,446,401,think of mother and don t straddle across the stairs let the cabman and the landlady come down and let me go up and choose rooms,did you hear though they are remarking on the cold i should never have thought it cold what a religion foreigners are a filthy nation i don t care if there are tunnels open the windows,Harriet,M,major,F,major,1,0,1,0,0,0,1,1,0,1,1,1,1,1,1,1,1,0
00147,Mr. Herriton,Harriet,448,761,harriet are you mad,nonsense we should hear him if he cried,Harriet,M,major,F,major,0,1,0,0,0,0,1,0,0,0,1,1,0,0,0,1,0,0
00148,Mr. Herriton,Harriet,454,522,we shall probably be arrested for brawling harriet have you the very slightest sense of the ludicrous,three hours then or four or make him learn english ways at florence we get a nurse,Harriet,M,major,F,major,1,1,0,1,0,0,1,1,0,1,0,1,0,0,0,1,1,1
00149,Mr. Herriton,Harriet,521,775,my dear sister you can t run on like that you don t buy a pair of gloves in two hours much less a baby,the baby the baby it slipped it s gone from my arms i stole it,Caroline Abbott; Harriet,M,major,F,major,1,1,0,0,1,0,1,1,1,1,0,0,0,1,0,1,1,0
00150,Mr. Herriton,Harriet,525,661,i dare say it will be all right but as i told you i thought the man i met on the rocca a strange difficult man,i shall not stop crying,Caroline Abbott; Harriet,M,major,F,major,1,1,1,0,1,0,1,1,1,0,1,0,0,0,1,1,0,0
00151,Mr. Herriton,Harriet,527,748,no harriet i ll try for the baby but for nothing else i promise to do that tomorrow and to do it in the way you wish but tonight as we re all tired we want a change of topic we want relaxation we want to go to the theatre,hush sleeping,Caroline Abbott; Harriet,M,major,F,major,1,1,1,1,1,1,1,1,1,0,0,0,0,0,0,0,0,0
00152,Mr. Herriton,Harriet,530,403,don t you think it s better than sitting in all the evening and getting nervous,a single for me i shall never get back alive,Caroline Abbott; Harriet,M,major,F,major,1,0,1,0,1,0,1,1,1,1,1,0,1,0,1,1,1,1
00153,Mr. Herriton,Harriet,532,548,but this is an opera lucia di lammermoor sir walter scott classical you know,ugh don t she will be very vulgar and i m sure it s even worse here than in the tunnel i wish we d never,Caroline Abbott; Harriet,M,major,F,major,1,1,1,0,1,0,1,0,0,1,1,1,1,1,1,1,1,0
00154,Mr. Herriton,Harriet,543,671,shut it,there can be no peace between me and her,Caroline Abbott; Harriet,M,major,F,major,0,0,0,0,1,0,0,0,0,0,1,1,1,0,1,1,1,0
00155,Mr. Herriton,Harriet,547,433,why it is the famous hot lady of the apennines the one who had never never before,i condemn the whole lot,Caroline Abbott; Harriet,M,major,F,major,1,1,1,1,1,1,1,1,0,1,0,0,0,0,0,1,0,1
00156,Mr. Herriton,Harriet,658,777,you mustn t accuse her of that though she is exasperating she hasn t come here to betray us,i stole it i stole it i stole it it slipped out of my arms,Harriet,M,major,F,major,0,1,1,1,1,0,1,1,0,0,0,0,0,1,0,1,1,0
00157,Mr. Herriton,Harriet,660,325,i ve not got the baby harriet but at the same time i haven t exactly failed i and signor carella are to have another interview this afternoon at the caffe garibaldi he is perfectly reasonable and pleasant should you be disposed to come with me you would find him quite willing to discuss things he is desperately in want of money and has no prospect of getting any i discovered that at the same time he has a certain affection for the child miss abbott has behaved extraordinarily but at the same time harriet you must listen my dear you must stop crying i have something quite important to say,he is the devil,Harriet,M,major,F,major,1,1,1,1,1,1,1,1,1,1,1,0,0,0,0,1,0,0
00158,Mr. Herriton,Harriet,662,327,remember that miss abbott has done us no harm she said nothing to him about the matter he assumes that she is working with us i gathered that,i will thank you not to scoff against religion think of that poor baby irma is right to pray for him what an entrance into life for an english child,Harriet,M,major,F,major,1,1,0,1,1,1,1,1,0,1,1,0,0,1,1,1,1,0
00159,Mr. Herriton,Harriet,664,423,yes but if you re careful she may be i interpret her behaviour thus she went to see him honestly intending to get the child away in the note she left me she says so and i don t believe she d lie,i m not clever philip i don t go in for it as you know but i know what s rude and i know what s wrong,Harriet,M,major,F,major,1,1,1,1,0,0,1,1,0,0,0,1,0,1,1,1,1,0
00160,Mr. Herriton,Harriet,666,779,when she got there there was some pretty domestic scene between him and the baby and she has got swept off in a gush of sentimentalism before very long if i know anything about psychology there will be a reaction she ll be swept back,i stole it i and the idiot no one was there,Harriet,M,major,F,major,1,1,1,1,1,0,1,1,1,1,1,1,1,1,1,1,0,0
00161,Mr. Herriton,Harriet,670,659,if you want to carry off the baby keep your peace with miss abbott for if she chooses she can help you better than i can,then why has she come here answer me that bursting in on me crying and looking a disgusting sight and says she has been to see the italian couldn t even talk properly pretended she had changed her opinions what are her opinions to us i was very calm i said miss abbott i think there is a little misapprehension in this matter my mother mrs herriton oh goodness my head of course you ve failed don t trouble to answer i know you ve failed where s the baby pray of course you haven t got it dear sweet caroline won t let you oh yes and we re to go away at once and trouble the father no more those are her commands commands commands,Harriet,M,major,F,major,1,1,1,0,0,0,1,1,0,1,1,1,1,1,1,1,1,1
00162,Mr. Herriton,Harriet,672,419,did you,beauty is the only test at least so you told me when i sketched old buildings for the sake i suppose of making yourself unpleasant,Harriet,M,major,F,major,0,1,0,0,0,0,1,0,0,1,1,1,1,0,0,1,1,1
00163,Mr. Herriton,Harriet,674,767,into santa deodata s,philip don t talk must i say it again don t talk the baby wants to sleep,Harriet,M,major,F,major,0,0,0,0,0,0,0,1,0,1,1,0,1,1,0,1,1,0
00164,Mr. Herriton,Harriet,707,445,look here it s too hot for this we ve been talking and interviewing each other all the morning and i have another interview this afternoon i do stipulate for silence let each lady retire to her bedroom with a book,we ve come here to get the baby back and for nothing else i ll not have this levity and slackness and talk about pictures and churches think of mother did she send you out for them,Caroline Abbott; Harriet,M,major,F,major,1,1,1,1,1,0,1,1,1,1,1,1,1,1,1,1,1,0
00165,Mr. Herriton,Harriet,709,757,oh certainly harriet i shall make a point of reminding him,all wrong,Caroline Abbott; Harriet,M,major,F,major,1,1,0,1,0,0,1,1,0,0,0,0,0,0,0,0,0,1
00166,Mr. Herriton,Harriet,714,715,why of course you would be going two carriages then two carriages for the evening train harriet whatever are you up to we shall never be ready,order my carriage for the evening train,Caroline Abbott; Harriet,M,major,F,major,1,1,1,1,1,1,1,1,1,1,0,0,0,0,0,1,1,0
00167,Mr. Herriton,Harriet,743,759,harriet harriet harriet harriet why don t you answer,of course with the shadows you couldn t see him,Harriet; The Driver,M,major,F,major,0,0,0,1,0,0,1,0,0,1,0,0,0,0,0,1,1,0
00168,Mr. Herriton,Harriet,747,407,whatever is that,to see that you do your duty,Harriet; The Driver,M,major,F,major,0,1,0,0,1,0,0,0,0,0,1,0,0,1,0,1,1,0
00169,Mr. Herriton,Harriet,754,744,i don t mind if i do wake him up i want to see him i ve as much right in him as you wait a minute but he s awake,i heard you coming,Harriet,M,major,F,major,1,1,1,0,0,0,1,1,1,0,0,0,0,0,0,1,0,0
00170,Mr. Herriton,Harriet,756,755,his face do you know struck me as all wrong,good ickle quiet boysey then,Harriet,M,major,F,major,0,1,1,0,0,0,1,1,1,0,0,1,0,0,0,0,0,0
00171,Mr. Herriton,Harriet,758,531,all puckered queerly,mother wouldn t like it it would be most unsuitable almost irreverent besides all that foreign theatres are notorious don t you remember those letters in the church family newspaper,Harriet,M,major,F,major,0,0,0,0,0,0,0,0,1,1,1,0,1,1,0,1,1,1
00172,Mr. Herriton,Harriet,760,533,well hold him up again,certainly one has so few opportunities of hearing music it is sure to be very bad but it might be better than sitting idle all the evening we have no book and i lost my crochet at florence,Harriet,M,major,F,major,0,0,0,1,0,0,1,1,0,1,1,1,1,1,1,1,1,1
00173,Mr. Herriton,Harriet,762,437,no he s crying hard i thought so before and i m certain now,what about the baby pray you ve said a lot of smart things and whittled away morality and religion and i don t know what but what about the baby you think me a fool but i ve been noticing you all today and you haven t mentioned the baby once you haven t thought about it even you don t care philip i shall not speak to you you are intolerable go,Harriet,M,major,F,major,0,0,1,1,0,1,1,1,0,1,1,1,1,1,1,1,1,1
00174,Mr. Herriton,Harriet,764,673,i say you haven t hurt it or held it the wrong way or anything it is too uncanny crying and no noise why didn t you get perfetta to carry it to the hotel instead of muddling with the messenger it s a marvel he understood about the note,oh not all i wanted she went away before i had finished speaking just like those cowardly people into the church,Harriet,M,major,F,major,1,1,1,1,1,1,1,1,0,1,1,1,1,1,1,1,1,0
00175,Mr. Herriton,Harriet,766,431,but why not gino or perfetta,it s the supreme test the man who is unchivalrous to a woman,Harriet,M,major,F,major,0,0,1,1,0,1,0,0,0,1,1,0,0,1,0,1,1,0
00176,Mr. Herriton,Harriet,768,427,i suppose he breathes and all that sort of thing,he her if you don t look out he ll murder you i wish he would,Harriet,M,major,F,major,0,0,1,0,1,0,1,1,1,0,1,1,0,0,0,1,1,0
00177,Mr. Herriton,Harriet,770,663,i m nervous too i wish he d scream it s too uncanny poor gino i m terribly sorry for gino,well she isn t,Harriet,M,major,F,major,0,0,0,1,1,0,1,1,0,0,0,0,1,0,0,1,0,0
00178,Mr. Herriton,Harriet,772,544,because he s weak like most of us he doesn t know what he wants he doesn t grip on to life but i like that man and i m sorry for him you despise him harriet and you despise me but you do us no good by it we fools want some one to set us on our feet suppose a really decent woman had set up gino i believe caroline abbott might have done it mightn t he have been another man,we must make a stand from the beginning they re talking,Harriet,M,major,F,major,1,1,1,1,1,1,1,1,1,1,1,0,0,0,0,1,1,0
00179,Mr. Herriton,Harriet,774,455,are you all right,you caroline here of all people,Harriet,M,major,F,major,0,1,0,0,0,0,1,0,1,0,0,0,1,0,0,1,1,1
00180,Mr. Herriton,Harriet,776,259,god help me,there s no need to twist the thing round to that,Harriet,M,major,F,major,0,0,0,0,0,0,1,0,0,1,0,0,1,1,1,0,1,0
00181,Mr. Herriton,Harriet,778,710,keep still let no one move we may tread on it keep still,and order a carriage to take us to the evening train,Harriet; The Driver,M,major,F,major,0,1,0,1,1,1,1,1,0,1,0,1,0,0,0,1,1,0
00182,Harriet,Mr. Herriton,33,749,i cannot understand people what can they be doing all day and there is no church there i suppose,poor gino he s no greater than i am after all,Mr. Herriton; Mrs. Herriton,F,major,M,major,0,1,1,1,1,1,1,0,1,0,1,1,0,0,1,1,1,1
00183,Harriet,Mr. Herriton,35,456,of course i mean an english church lilia promised me that she would always be in a large town on sundays,you will have a lot to tell miss abbott harriet and she may have as much to tell you so i ll pay my call on signor carella as you suggested and see how things stand tear each other s eyes out give it to her harriet teach her to leave us alone give it to her caroline teach her to be grateful to you go it ladies go it,Mr. Herriton; Mrs. Herriton,F,major,M,major,1,1,0,1,1,0,1,1,1,1,1,1,1,1,0,1,1,1
00184,Harriet,Mr. Herriton,38,778,every one to his taste,keep still let no one move we may tread on it keep still,Mr. Herriton; Mrs. Herriton,F,major,M,major,0,0,0,0,0,0,1,1,1,0,1,0,1,1,1,1,1,0
00185,Harriet,Mr. Herriton,247,758,after all she has suffered that letter kept me awake for nights the whole thing is like one of those horrible modern plays where no one is in the right but if we have mourning it will mean telling irma,all puckered queerly,Mr. Herriton; Mrs. Herriton,F,major,M,major,1,1,1,1,1,1,1,1,1,0,0,0,0,0,0,0,0,1
00186,Harriet,Mr. Herriton,325,436,he is the devil,things aren t so jolly easy,Mr. Herriton; Mrs. Herriton,F,major,M,major,1,1,0,0,0,0,1,0,0,0,0,1,1,1,0,0,0,0
00187,Harriet,Mr. Herriton,327,660,i will thank you not to scoff against religion think of that poor baby irma is right to pray for him what an entrance into life for an english child,i ve not got the baby harriet but at the same time i haven t exactly failed i and signor carella are to have another interview this afternoon at the caffe garibaldi he is perfectly reasonable and pleasant should you be disposed to come with me you would find him quite willing to discuss things he is desperately in want of money and has no prospect of getting any i discovered that at the same time he has a certain affection for the child miss abbott has behaved extraordinarily but at the same time harriet you must listen my dear you must stop crying i have something quite important to say,Mr. Herriton; Mrs. Herriton,F,major,M,major,1,1,0,0,1,1,1,1,0,1,1,1,1,1,1,1,1,1
00188,Harriet,Mr. Herriton,397,668,it upsets one s plans terribly but obviously it is my duty,when she s swept back she ll be invaluable for she has made quite an impression on him he thinks her so nice with the baby you know she washed it for him,Mr. Herriton,F,major,M,major,0,1,1,1,1,0,1,0,1,1,1,1,1,1,0,1,1,0
00189,Harriet,Mr. Herriton,399,666,yes indeed mother has written me a really beautiful letter she describes how it was that she gradually got to feel that we must rescue the poor baby from its terrible surroundings how she has tried by letter and it is no good nothing but insincere compliments and hypocrisy came back then she says there is nothing like personal influence you and philip will succeed where i have failed she says too that caroline abbott has been wonderful caroline feels it as keenly almost as us that is because she knows the man oh he must be loathsome goodness me i ve forgotten to pack the ammonia it has been a terrible lesson for caroline but i fancy it is her turning point i can t help liking to think that out of all this evil good will come,when she got there there was some pretty domestic scene between him and the baby and she has got swept off in a gush of sentimentalism before very long if i know anything about psychology there will be a reaction she ll be swept back,Mr. Herriton,F,major,M,major,1,1,1,1,1,1,1,1,1,1,1,1,1,1,0,1,1,1
00190,Harriet,Mr. Herriton,401,444,did you hear though they are remarking on the cold i should never have thought it cold what a religion foreigners are a filthy nation i don t care if there are tunnels open the windows,harriet don t act or act better,Mr. Herriton,F,major,M,major,1,1,1,1,1,1,1,1,0,0,0,1,0,0,0,0,0,0
00191,Harriet,Mr. Herriton,403,418,a single for me i shall never get back alive,i know it is but it s old awfully old,Mr. Herriton,F,major,M,major,1,1,0,1,0,1,1,1,1,0,1,1,1,1,0,1,0,0
00192,Harriet,Mr. Herriton,405,438,do you suppose do you suppose i am going to enter that man s house,go where,Mr. Herriton,F,major,M,major,0,1,0,0,1,0,1,1,0,0,0,0,1,0,0,0,0,0
00193,Harriet,Mr. Herriton,407,426,to see that you do your duty,harriet i am hot to whom do you refer,Mr. Herriton,F,major,M,major,0,1,0,0,1,0,1,1,0,0,1,0,0,0,0,1,1,0
00194,Harriet,Mr. Herriton,409,658,so mother told me for goodness sake get the tickets here comes that hot woman again she has the impudence to bow,you mustn t accuse her of that though she is exasperating she hasn t come here to betray us,Mr. Herriton,F,major,M,major,1,1,1,1,1,0,1,1,0,0,1,1,1,1,0,1,1,0
00195,Harriet,Mr. Herriton,413,766,what do they do there,but why not gino or perfetta,Mr. Herriton,F,major,M,major,0,1,0,1,1,0,1,0,0,0,0,1,1,0,1,0,0,0
00196,Harriet,Mr. Herriton,415,414,not for me thank you,there is a caffe a prison a theatre a church walls a view,Mr. Herriton,F,major,M,major,0,0,0,0,0,1,1,1,0,1,1,0,1,0,0,0,0,0
00197,Harriet,Mr. Herriton,417,450,nothing at all it s frightful,la signorina si sente male c e il sole,Mr. Herriton,F,major,M,major,0,0,0,0,1,1,0,1,1,0,0,0,0,0,0,0,0,0
00198,Harriet,Mr. Herriton,419,662,beauty is the only test at least so you told me when i sketched old buildings for the sake i suppose of making yourself unpleasant,remember that miss abbott has done us no harm she said nothing to him about the matter he assumes that she is working with us i gathered that,Mr. Herriton,F,major,M,major,1,1,1,1,0,0,1,1,1,1,1,0,1,1,1,1,1,0
00199,Harriet,Mr. Herriton,421,442,i shouldn t think you could it doesn t seem the best moment to begin your italy mania i thought you were cured of it by now instead will you kindly tell me what you are going to do when you arrive i do beg you will not be taken unawares this time,i m damned if i ll go i want my tea,Mr. Herriton,F,major,M,major,1,1,1,1,1,1,1,1,0,0,0,1,0,0,0,1,0,0
00200,Harriet,Mr. Herriton,425,408,you what s the good of cleverness if a man s murdered a woman,oh thanks,Mr. Herriton,F,major,M,major,1,0,1,0,1,0,1,1,0,0,0,0,0,0,0,0,0,0
00201,Harriet,Mr. Herriton,427,34,he her if you don t look out he ll murder you i wish he would,there is santa deodata one of the most beautiful churches in italy,Mr. Herriton,F,major,M,major,0,1,1,0,0,0,1,1,0,1,1,0,1,0,0,0,1,1
00202,Harriet,Mr. Herriton,429,328,he has murdered her the things he did things one can t even mention,my dear sister i can reassure you firstly the beastly baby is italian secondly it was promptly christened at santa deodata s and a powerful combination of saints watch over,Mr. Herriton,F,major,M,major,1,1,0,1,1,0,1,0,1,1,1,1,1,1,0,1,1,1
00203,Harriet,Mr. Herriton,431,406,it s the supreme test the man who is unchivalrous to a woman,then what have you come for pray for ornament,Mr. Herriton,F,major,M,major,1,1,0,0,1,0,1,1,0,0,1,1,0,1,0,1,1,0
00204,Harriet,Mr. Herriton,433,768,i condemn the whole lot,i suppose he breathes and all that sort of thing,Mr. Herriton,F,major,M,major,1,0,0,0,0,0,1,0,1,0,0,1,0,1,0,1,1,1
00205,Harriet,Mr. Herriton,435,402,and the french as well,singles or returns,Mr. Herriton,F,major,M,major,1,0,1,1,0,0,0,1,0,0,0,1,0,0,0,0,0,0
00206,Harriet,Mr. Herriton,437,410,what about the baby pray you ve said a lot of smart things and whittled away morality and religion and i don t know what but what about the baby you think me a fool but i ve been noticing you all today and you haven t mentioned the baby once you haven t thought about it even you don t care philip i shall not speak to you you are intolerable go,mother told you did she,Mr. Herriton,F,major,M,major,1,1,1,1,1,1,1,1,1,0,1,0,0,0,0,1,0,0
00207,Harriet,Mr. Herriton,439,448,to the italian go,harriet are you mad,Mr. Herriton,F,major,M,major,1,0,0,0,0,0,0,1,0,0,1,0,0,0,0,1,0,0
00208,Harriet,Mr. Herriton,441,532,go this instant now i ll stand it no longer go,but this is an opera lucia di lammermoor sir walter scott classical you know,Mr. Herriton,F,major,M,major,0,0,0,1,1,1,1,0,1,1,1,1,0,1,0,1,0,0
00209,Harriet,Mr. Herriton,443,760,swear if you like blaspheme abuse me but understand i m in earnest,well hold him up again,Mr. Herriton,F,major,M,major,0,0,1,0,0,0,1,1,0,0,0,0,1,0,0,1,1,0
00210,Harriet,Mr. Herriton,445,432,we ve come here to get the baby back and for nothing else i ll not have this levity and slackness and talk about pictures and churches think of mother did she send you out for them,oh stow it take it to the back kitchen it s no more a supreme test than anything else the italians never were chivalrous from the first if you condemn him for that you ll condemn the whole lot,Mr. Herriton,F,major,M,major,1,1,1,1,1,1,1,1,0,1,1,1,1,1,1,1,1,1
00211,Harriet,Mr. Herriton,447,36,i shan t,if she goes to a service at santa deodata s she will find more beauty and sincerity than there is in all the back kitchens of europe,Mr. Herriton,F,major,M,major,0,0,0,0,0,0,1,0,0,1,1,1,1,0,0,1,1,1
00212,Harriet,Mr. Herriton,449,398,if you like but you will not come up till you have seen the italian,did mother explain it all to you,Mr. Herriton,F,major,M,major,1,1,1,0,0,1,1,1,0,0,1,0,0,1,0,1,1,1
00213,Harriet,Mr. Herriton,455,770,you caroline here of all people,i m nervous too i wish he d scream it s too uncanny poor gino i m terribly sorry for gino,Caroline Abbott; Mr. Herriton,F,major,M,major,0,0,0,1,0,0,1,1,1,0,0,0,1,1,0,1,1,0
00214,Harriet,Mr. Herriton,520,772,you see him tomorrow at ten philip well don t forget the blank cheque say an hour for the business no italians are so slow say two twelve o clock lunch well then it s no good going till the evening train i can manage the baby as far as florence,because he s weak like most of us he doesn t know what he wants he doesn t grip on to life but i like that man and i m sorry for him you despise him harriet and you despise me but you do us no good by it we fools want some one to set us on our feet suppose a really decent woman had set up gino i believe caroline abbott might have done it mightn t he have been another man,Caroline Abbott; Mr. Herriton,F,major,M,major,1,1,1,1,1,1,1,1,1,1,1,1,1,1,1,1,1,1
00215,Harriet,Mr. Herriton,524,400,i don t know the meaning of the word i ve told the landlady that philip and i only want our rooms one night and we shall keep to it,absurd nonsense they talk about the heat supposing we were here for pleasure what could be more pleasurable than this,Caroline Abbott; Mr. Herriton,F,major,M,major,1,1,1,1,1,0,1,1,1,1,1,1,1,1,0,1,1,1
00216,Harriet,Mr. Herriton,526,762,he s insolent to ladies we know but my brother can be trusted to bring him to his senses that woman philip whom you saw will carry the baby to the hotel of course you must tip her for it and try if you can to get poor lilia s silver bangles they were nice quiet things and will do for irma and there is an inlaid box i lent her lent not gave to keep her handkerchiefs in it s of no real value but this is our only chance don t ask for it but if you see it lying about just say,no he s crying hard i thought so before and i m certain now,Caroline Abbott; Mr. Herriton,F,major,M,major,1,1,1,1,1,1,1,1,0,0,0,1,1,0,1,1,1,0
00217,Harriet,Mr. Herriton,531,547,mother wouldn t like it it would be most unsuitable almost irreverent besides all that foreign theatres are notorious don t you remember those letters in the church family newspaper,why it is the famous hot lady of the apennines the one who had never never before,Caroline Abbott; Mr. Herriton,F,major,M,major,1,1,0,1,1,0,1,1,1,1,1,1,1,1,1,1,1,0
