pair_id,a_speaker,b_speaker,i_merge_id,j_merge_id,i_text,j_text,i_addressees,A_gender,A_category,B_gender,B_category,a_articles,a_auxiliary_verbs,a_conjunctions,a_adverbs,a_impersonal_pronouns,a_negations,a_personal_pronouns,a_prepositions,a_quantifiers,b_articles,b_auxiliary_verbs,b_conjunctions,b_adverbs,b_impersonal_pronouns,b_negations,b_personal_pronouns,b_prepositions,b_quantifiers
00000,Lilia,Mr. Herriton,0,125,quite an ovation they ll take us for royalty oh mr kingcroft get us foot warmers,and i understood that signor carella was a member of the italian nobility,Harriet; Irma; Mr. Herriton; Mr. Kingcroft; Mrs. Herriton; Mrs. Theobald,F,intermediate,M,major,1,0,0,1,0,0,1,1,0,1,1,1,0,1,0,1,1,0
00001,Lilia,Mr. Herriton,2,1,how i wish you were coming philip,remember that it is only by going off the track that you get to know the country see the little towns gubbio pienza cortona san gemignano monteriano and don t let me beg you go with that awful tourist idea that italy s only a museum of antiquities and art love and understand the italians for the people are more marvellous than the land,Harriet; Irma; Mr. Herriton; Mrs. Herriton; Mrs. Theobald,F,intermediate,M,major,0,1,0,1,0,0,1,0,0,1,1,1,1,1,0,1,1,1
00002,Lilia,Mr. Herriton,117,123,well philip i am sure you are ready for by bye we shall meet at twelve o clock lunch tomorrow if we don t meet before they give us caffe later in our rooms,thank you for the information i know everything as i told you before i am also aware of the social position of an italian who pulls teeth in a minute provincial town,Caroline Abbott; Mr. Herriton; Signor Carella,F,intermediate,M,major,0,1,1,1,0,0,1,1,1,1,1,1,1,1,0,1,1,1
00003,Lilia,Mr. Herriton,120,133,see for yourself,poor lilia i know it may be painful but i have come to rescue you and book worm though i may be i am not frightened to stand up to a bully he s merely an insolent boy he thinks he can keep you to your word by threats he will be different when he sees he has a man to deal with,Mr. Herriton,F,intermediate,M,major,0,0,0,0,0,0,1,1,0,1,1,1,1,1,1,1,1,0
00004,Lilia,Mr. Herriton,122,131,there are no cads in italy he is the son of a dentist why not,because we expected her to so i am confident and you in your heart agree that this engagement will not last think of your life at home think of irma and i ll also say think of us for you know lilia that we count you more than a relation i should feel i was losing my own sister if you did this and my mother would lose a daughter,Mr. Herriton,F,intermediate,M,major,1,1,0,1,0,1,1,1,0,1,1,1,1,1,1,1,1,1
00005,Lilia,Mr. Herriton,124,129,indeed philip you surprise me i understood you went in for equality and so on,the whole thing is like a bad dream so bad that it cannot go on if there was one redeeming feature about the man i might be uneasy as it is i can trust to time for the moment lilia he has taken you in but you will find him out soon it is not possible that you a lady accustomed to ladies and gentlemen will tolerate a man whose position is well not equal to the son of the servants dentist in coronation place i am not blaming you now but i blame the glamour of italy i have felt it myself you know and i greatly blame miss abbott,Mr. Herriton,F,intermediate,M,major,0,0,1,1,0,0,1,1,0,1,1,1,1,1,1,1,1,1
00006,Lilia,Mr. Herriton,126,135,well we put it like that in the telegram so as not to shock dear mrs herriton but it is true he is a younger branch of course families ramify just as in yours there is your cousin joseph gino s father is courtesy itself and rising rapidly in his profession this very month he leaves monteriano and sets up at poggibonsi and for my own poor part i think what people are is what matters but i don t suppose you ll agree and i should like you to know that gino s uncle is a priest the same as a clergyman at home well his cousin s a lawyer at rome,yes and i forbid you to do it you despise me perhaps and think i m feeble but you re mistaken you are ungrateful and impertinent and contemptible but i will save you in order to save irma and our name there is going to be such a row in this town that you and he ll be sorry you came to it i shall shrink from nothing for my blood is up it is unwise of you to laugh i forbid you to marry carella and i shall tell him so now,Mr. Herriton,F,intermediate,M,major,1,1,1,1,1,1,1,1,1,1,1,1,1,1,1,1,1,0
00007,Lilia,Mr. Herriton,128,121,why a lawyer just like you are except that he has lots to do and can never get away,that he is probably a ruffian and certainly a cad,Mr. Herriton,F,intermediate,M,major,1,1,1,1,1,1,1,1,1,1,1,1,1,1,0,1,0,0
00008,Lilia,Mr. Herriton,130,3,caroline why blame her what s all this to do with caroline,i wish i were,Mr. Herriton,F,intermediate,M,major,0,1,0,1,1,0,1,1,1,0,1,0,0,0,0,1,0,0
00009,Lilia,Mr. Herriton,132,127,i can t break it off now,what kind of lawyer,Mr. Herriton,F,intermediate,M,major,0,1,0,1,1,0,1,1,0,0,0,0,0,1,0,0,1,0
00010,Lilia,Mr. Herriton,134,138,for once in my life i ll thank you to leave me alone i ll thank your mother too for twelve years you ve trained me and tortured me and i ll stand it no more do you think i m a fool do you think i never felt ah when i came to your house a poor young bride how you all looked me over never a kind word and discussed me and thought i might just do and your mother corrected me and your sister snubbed me and you said funny things about me to show how clever you were and when charles died i was still to run in strings for the honour of your beastly family and i was to be cooped up at sawston and learn to keep house and all my chances spoilt of marrying again no thank you no thank you bully insolent boy who s that pray but you but thank goodness i can stand up against the world now for i ve found gino and this time i marry for love,please sit down signor carella mrs herriton is rather agitated but there is no reason we should not be calm might i offer you a cigarette please sit down signor carella i will be frank with you i have come to prevent you marrying mrs herriton because i see you will both be unhappy together she is english you are italian she is accustomed to one thing you to another and pardon me if i say it she is rich and you are poor,Mr. Herriton,F,intermediate,M,major,1,1,1,1,1,1,1,1,1,1,1,1,1,1,1,1,1,1
00011,Lilia,Mr. Herriton,137,118,tell him so now have it out with him gino gino come in avanti fra filippo forbids the banns fra filippo s blood s up he shrinks from nothing oh take care he doesn t hurt you,i should like to see you now please in my room as i have come all the way on business,Mr. Herriton; Signor Carella,F,intermediate,M,major,1,1,1,1,1,1,1,1,0,1,1,1,1,0,0,1,1,1
00012,Mr. Herriton,Lilia,1,124,remember that it is only by going off the track that you get to know the country see the little towns gubbio pienza cortona san gemignano monteriano and don t let me beg you go with that awful tourist idea that italy s only a museum of antiquities and art love and understand the italians for the people are more marvellous than the land,indeed philip you surprise me i understood you went in for equality and so on,Harriet; Irma; Lilia; Mrs. Herriton; Mrs. Theobald,M,major,F,intermediate,1,1,1,1,1,0,1,1,1,0,0,1,1,0,0,1,1,0
00013,Mr. Herriton,Lilia,3,2,i wish i were,how i wish you were coming philip,Harriet; Irma; Lilia; Mrs. Herriton; Mrs. Theobald,M,major,F,intermediate,0,1,0,0,0,0,1,0,0,0,1,0,1,0,0,1,0,0
00014,Mr. Herriton,Lilia,119,130,my dear lilia don t let s have a scene before i arrived i thought i might have to question you it is unnecessary i know everything miss abbott has told me a certain amount and the rest i see for myself,caroline why blame her what s all this to do with caroline,Lilia,M,major,F,intermediate,1,1,1,0,1,0,1,1,1,0,1,0,1,1,0,1,1,1
00015,Mr. Herriton,Lilia,121,126,that he is probably a ruffian and certainly a cad,well we put it like that in the telegram so as not to shock dear mrs herriton but it is true he is a younger branch of course families ramify just as in yours there is your cousin joseph gino s father is courtesy itself and rising rapidly in his profession this very month he leaves monteriano and sets up at poggibonsi and for my own poor part i think what people are is what matters but i don t suppose you ll agree and i should like you to know that gino s uncle is a priest the same as a clergyman at home well his cousin s a lawyer at rome,Lilia,M,major,F,intermediate,1,1,1,1,1,0,1,0,0,1,1,1,1,1,1,1,1,1
00016,Mr. Herriton,Lilia,123,132,thank you for the information i know everything as i told you before i am also aware of the social position of an italian who pulls teeth in a minute provincial town,i can t break it off now,Lilia,M,major,F,intermediate,1,1,1,1,1,0,1,1,1,0,1,0,1,1,0,1,1,0
00017,Mr. Herriton,Lilia,125,122,and i understood that signor carella was a member of the italian nobility,there are no cads in italy he is the son of a dentist why not,Lilia,M,major,F,intermediate,1,1,1,0,1,0,1,1,0,1,1,0,1,0,1,1,1,0
00018,Mr. Herriton,Lilia,127,4,what kind of lawyer,good bye dear every one what a whirl good bye darling mind you re always good and do what granny tells you,Lilia,M,major,F,intermediate,0,0,0,0,1,0,0,1,0,1,1,1,1,1,0,1,0,1
00019,Mr. Herriton,Lilia,129,128,the whole thing is like a bad dream so bad that it cannot go on if there was one redeeming feature about the man i might be uneasy as it is i can trust to time for the moment lilia he has taken you in but you will find him out soon it is not possible that you a lady accustomed to ladies and gentlemen will tolerate a man whose position is well not equal to the son of the servants dentist in coronation place i am not blaming you now but i blame the glamour of italy i have felt it myself you know and i greatly blame miss abbott,why a lawyer just like you are except that he has lots to do and can never get away,Lilia,M,major,F,intermediate,1,1,1,1,1,1,1,1,1,1,1,1,1,1,1,1,1,1
00020,Mr. Herriton,Lilia,131,134,because we expected her to so i am confident and you in your heart agree that this engagement will not last think of your life at home think of irma and i ll also say think of us for you know lilia that we count you more than a relation i should feel i was losing my own sister if you did this and my mother would lose a daughter,for once in my life i ll thank you to leave me alone i ll thank your mother too for twelve years you ve trained me and tortured me and i ll stand it no more do you think i m a fool do you think i never felt ah when i came to your house a poor young bride how you all looked me over never a kind word and discussed me and thought i might just do and your mother corrected me and your sister snubbed me and you said funny things about me to show how clever you were and when charles died i was still to run in strings for the honour of your beastly family and i was to be cooped up at sawston and learn to keep house and all my chances spoilt of marrying again no thank you no thank you bully insolent boy who s that pray but you but thank goodness i can stand up against the world now for i ve found gino and this time i marry for love,Lilia,M,major,F,intermediate,1,1,1,1,1,1,1,1,1,1,1,1,1,1,1,1,1,1
00021,Mr. Herriton,Lilia,133,120,poor lilia i know it may be painful but i have come to rescue you and book worm though i may be i am not frightened to stand up to a bully he s merely an insolent boy he thinks he can keep you to your word by threats he will be different when he sees he has a man to deal with,see for yourself,Lilia,M,major,F,intermediate,1,1,1,1,1,1,1,1,0,0,0,0,0,0,0,1,1,0
00022,Lilia,Irma,4,5,good bye dear every one what a whirl good bye darling mind you re always good and do what granny tells you,i ll do my best,Harriet; Irma; Mr. Herriton; Mrs. Herriton; Mrs. Theobald,F,intermediate,F,minor,1,1,1,1,1,0,1,0,1,0,1,0,0,0,0,1,0,0
00023,Irma,Mrs. Herriton,5,6,i ll do my best,she is sure to be good,Harriet; Lilia; Mr. Herriton; Mrs. Herriton; Mrs. Theobald,F,minor,F,intermediate,0,1,0,0,0,0,1,0,0,0,1,0,0,0,0,1,1,0
00024,Irma,Mrs. Herriton,15,16,and granny when will the old ship get to italy,grandmother dear not granny and we say a boat or a steamer not a ship ships have sails and mother won t go all the way by sea you look at the map of europe and you ll see why harriet take her go with aunt harriet and she ll show you the map,Mr. Herriton; Mrs. Herriton,F,minor,F,intermediate,1,1,1,1,0,0,0,1,0,1,1,1,1,0,1,1,1,1
00025,Irma,Mrs. Herriton,314,315,aunt harriet uncle phil grandmamma what do you suppose my little brother is doing now has he begun to play do italian babies talk sooner than us or would he be an english baby born abroad oh i do long to see him and be the first to teach him the ten commandments and the catechism,really irma is getting too tiresome she forgot poor lilia soon enough,Harriet; Mr. Herriton; Mrs. Herriton,F,minor,F,intermediate,1,1,1,1,1,0,1,1,1,0,1,0,1,0,0,1,0,1
00026,Mrs. Herriton,Lilia,6,7,she is sure to be good,caroline my caroline jump in or your chaperon will go off without you,Harriet; Irma; Lilia; Mr. Herriton; Mrs. Theobald,F,intermediate,F,intermediate,0,1,0,0,0,0,1,1,0,0,1,1,1,0,0,1,1,0
00027,Lilia,Harriet,7,8,caroline my caroline jump in or your chaperon will go off without you,handkerchiefs and collars in my inlaid box i ve lent you my inlaid box,Caroline Abbott; Harriet; Irma; Mr. Herriton; Mrs. Herriton; Mrs. Theobald,F,intermediate,F,major,0,1,1,1,0,0,1,1,0,0,0,1,0,0,0,1,1,0
00028,Harriet,Lilia,8,9,handkerchiefs and collars in my inlaid box i ve lent you my inlaid box,good old harry,Irma; Lilia; Mr. Herriton; Mrs. Herriton; Mrs. Theobald,F,major,F,intermediate,0,0,1,0,0,0,1,1,0,0,0,0,0,0,0,0,0,0
00029,Mr. Kingcroft,Lilia,10,11,good bye mrs charles may you enjoy yourself and may god bless you,oh i am so sorry but you do look so funny oh you all look so funny waving oh pray,Harriet; Irma; Lilia; Mr. Herriton; Mrs. Herriton; Mrs. Theobald,M,minor,F,intermediate,0,1,1,0,0,0,1,0,0,0,1,1,1,0,0,1,0,1
00030,Lilia,Mrs. Theobald,11,12,oh i am so sorry but you do look so funny oh you all look so funny waving oh pray,high spirits to begin so long a journey,Harriet; Irma; Mr. Herriton; Mr. Kingcroft; Mrs. Herriton; Mrs. Theobald,F,intermediate,F,minor,0,1,1,1,0,0,1,0,1,1,0,1,1,0,0,0,1,1
00031,Mrs. Theobald,Mr. Kingcroft,12,13,high spirits to begin so long a journey,i wish that mrs charles had gotten the footwarmer these london porters won t take heed to a country chap,Harriet; Irma; Mr. Herriton; Mr. Kingcroft; Mrs. Herriton,F,minor,M,minor,1,0,1,1,0,0,0,1,1,1,1,0,0,1,0,1,1,0
00032,Mr. Kingcroft,Mrs. Herriton,13,14,i wish that mrs charles had gotten the footwarmer these london porters won t take heed to a country chap,but you did your best and i think it simply noble of you to have brought mrs theobald all the way here on such a day as this,Harriet; Irma; Mr. Herriton; Mrs. Herriton; Mrs. Theobald,M,minor,F,intermediate,1,1,0,0,1,0,1,1,0,1,1,1,1,1,0,1,1,1
00033,Mrs. Herriton,Irma,14,314,but you did your best and i think it simply noble of you to have brought mrs theobald all the way here on such a day as this,aunt harriet uncle phil grandmamma what do you suppose my little brother is doing now has he begun to play do italian babies talk sooner than us or would he be an english baby born abroad oh i do long to see him and be the first to teach him the ten commandments and the catechism,Harriet; Irma; Mr. Herriton; Mr. Kingcroft; Mrs. Theobald,F,intermediate,F,minor,1,1,1,1,1,0,1,1,1,1,1,1,1,1,0,1,1,1
00034,Mrs. Herriton,Irma,313,15,come with me dear and i will tell you now it is time for you to know,and granny when will the old ship get to italy,Harriet; Irma,F,intermediate,F,minor,0,1,1,1,1,0,1,1,0,1,1,1,1,0,0,0,1,0
00035,Mr. Herriton,Mrs. Herriton,18,41,here beginneth the new life,we will save the peas to the last they are the greatest fun,Mrs. Herriton,M,major,F,intermediate,1,0,0,1,0,0,0,0,0,1,1,0,0,0,0,1,1,0
00036,Mr. Herriton,Mrs. Herriton,20,253,and alas alas a look of old mrs theobald what appalling apparition was that i did think the lady was bedridden as well as imbecile why ever did she come,mrs theobald must be told but she doesn t count she is breaking up very quickly she doesn t even see mr kingcroft now he thank goodness i hear has at last consoled himself with someone else,Mrs. Herriton,M,major,F,intermediate,1,1,1,1,1,0,1,1,0,0,1,1,1,1,0,1,1,1
00037,Mr. Herriton,Mrs. Herriton,22,332,i hope he is satisfied i did not think my sister in law distinguished herself in her farewells,that is quite possible he knows that irma will worry us about the baby perhaps he hopes that we shall adopt it to quiet her,Mrs. Herriton,M,major,F,intermediate,0,1,0,0,0,1,1,1,0,1,1,0,1,1,0,1,1,0
00038,Mr. Herriton,Mrs. Herriton,24,394,i pity miss abbott fortunately one admirer is chained to england mr kingcroft cannot leave the crops or the climate or something i don t think either he improved his chances today he as well as lilia has the knack of being absurd in public,stop that nonsense philip i will not be disgraced by her i will have the child pay all we ve got for it i will have it,Mrs. Herriton,M,major,F,intermediate,1,1,1,1,1,1,1,1,1,1,1,0,0,1,1,1,1,1
00039,Mr. Herriton,Mrs. Herriton,26,270,no i believe she would take any one right up to the last when her boxes were packed she was playing the chinless curate both the curates are chinless but hers had the dampest hands i came on them in the park they were speaking of the pentateuch,yes dear but now it is really a new life because we are all at accord then you were still infatuated with italy it may be full of beautiful pictures and churches but we cannot judge a country by anything but its men,Mrs. Herriton,M,major,F,intermediate,1,1,1,1,0,1,1,1,1,1,1,1,1,1,1,1,1,1
00040,Mr. Herriton,Mrs. Herriton,28,257,the odd part is that she was quite eager always asking me for information and of course i was very glad to give it i admit she is a philistine appallingly ignorant and her taste in art is false still to have any taste at all is something and i do believe that italy really purifies and ennobles all who visit her she is the school as well as the playground of the world it is really to lilia s credit that she wants to go there,on irma why,Mrs. Herriton,M,major,F,intermediate,1,1,1,1,1,0,1,1,1,0,0,0,1,0,0,0,1,0
00041,Mr. Herriton,Mrs. Herriton,30,321,no mother no she was really keen on italy this travel is quite a crisis for her,she asked if she could pray for her new father for the italian,Mrs. Herriton,M,major,F,intermediate,1,1,0,1,1,1,1,1,0,1,1,1,0,0,0,1,1,0
00042,Mr. Herriton,Mrs. Herriton,36,251,if she goes to a service at santa deodata s she will find more beauty and sincerity than there is in all the back kitchens of europe,so one would have supposed but she never cared for her mother and little girls of nine don t reason clearly she looks on it as a long visit and it is important most important that she should not receive a shock all a child s life depends on the ideal it has of its parents destroy that and everything goes morals behaviour everything absolute trust in some one else is the essence of education that is why i have been so careful about talking of poor lilia before her,Harriet; Mrs. Herriton,M,major,F,intermediate,1,1,1,1,0,0,1,1,1,1,1,1,1,1,1,1,1,1
00043,Mr. Herriton,Mrs. Herriton,40,29,one moment irma i m going to the station i ll give you the pleasure of my company,she would go anywhere i and caroline abbott had the greatest difficulty in dissuading her from the riviera,Irma; Mrs. Herriton,M,major,F,intermediate,1,0,0,0,0,0,1,1,1,1,1,1,1,0,0,1,1,0
00044,Mr. Herriton,Mrs. Herriton,248,21,of course we must tell irma,mr kingcroft made her i am certain of it he wanted to see lilia again and this was the only way,Harriet; Mrs. Herriton,M,major,F,intermediate,0,1,0,0,0,0,1,1,0,1,1,1,1,1,0,1,1,0
00045,Mr. Herriton,Mrs. Herriton,250,31,i don t think that and she must have suspected something by now,it is something that she is contented but no one could live three months with caroline abbott and not be the better for it,Harriet; Mrs. Herriton,M,major,F,intermediate,0,1,1,1,1,0,1,1,0,1,1,1,0,1,1,1,1,1
00046,Mr. Herriton,Mrs. Herriton,252,323,but you forget this wretched baby waters and adamson write that there is a baby,i got up without saying anything,Harriet; Mrs. Herriton,M,major,F,intermediate,1,1,1,1,1,0,1,0,0,0,0,0,1,1,0,1,1,0
00047,Mr. Herriton,Mrs. Herriton,254,255,the child must know some time,the later the better every moment she is developing,Harriet; Mrs. Herriton,M,major,F,intermediate,1,1,0,0,0,0,0,0,1,1,1,0,0,0,0,1,0,1
00048,Mr. Herriton,Mrs. Herriton,256,382,i must say it seems rather hard luck doesn t it,what had you to fence about read the letters we have failed,Harriet; Mrs. Herriton,M,major,F,intermediate,0,1,0,1,1,0,1,0,0,1,1,0,1,1,0,1,1,0
00049,Mr. Herriton,Mrs. Herriton,261,390,it will make a difference in the money surely,if you don t go she will,Harriet; Mrs. Herriton,M,major,F,intermediate,1,1,0,1,1,0,0,1,0,0,1,1,0,0,0,1,0,0
00050,Mr. Herriton,Mrs. Herriton,263,338,good does the italian get anything,we can but trust to our influence,Harriet; Mrs. Herriton,M,major,F,intermediate,1,1,0,0,1,0,0,0,0,0,1,1,0,0,0,1,1,0
00051,Mr. Herriton,Mrs. Herriton,265,347,good so those are our tactics to tell no one about the baby not even miss abbott,poor lilia was almost a daughter to me once i know what miss abbott means but now things have altered any initiative would naturally come from mrs theobald,Harriet; Mrs. Herriton,M,major,F,intermediate,1,1,1,1,1,1,1,1,0,1,1,1,1,1,0,1,1,1
00052,Mr. Herriton,Mrs. Herriton,267,358,she was so mixed up in the affair,caroline has been extremely impertinent yet there may be something in what she says after all ought the child to grow up in that place and with that father let us admit frankly that after all we may have responsibilities,Harriet; Mrs. Herriton,M,major,F,intermediate,1,1,1,1,0,0,1,1,0,1,1,1,1,1,0,1,1,1
00053,Mr. Herriton,Mrs. Herriton,269,317,here beginneth the new life then do you remember mother that was what we said when we saw lilia off,i stopped that she is bringing him in everywhere it is most vexatious the other night she asked if she might include him in the people she mentions specially in her prayers,Harriet; Mrs. Herriton,M,major,F,intermediate,1,1,1,1,1,0,1,1,0,1,1,1,1,1,0,1,1,1
00054,Mr. Herriton,Mrs. Herriton,271,37,that is quite true,now dears don t listen to lilia s letter we love this place and i do not know how i shall ever thank philip for telling me it it is not only so quaint but one sees the italians unspoiled in all their simplicity and charm here the frescoes are wonderful caroline who grows sweeter every day is very busy sketching,Harriet; Mrs. Herriton,M,major,F,intermediate,0,1,0,1,1,0,0,0,0,1,1,1,1,1,1,1,1,1
00055,Mr. Herriton,Mrs. Herriton,273,274,did she ask no questions as to the nature of lilia s death i mean,she did but she has a mind of extraordinary delicacy she saw that i was reticent and she did not press me you see philip i can say to you what i could not say before harriet her ideas are so crude really we do not want it known in sawston that there is a baby all peace and comfort would be lost if people came inquiring after it,Mrs. Herriton,M,major,F,intermediate,1,1,1,0,0,1,1,1,0,1,1,1,1,1,1,1,1,1
00056,Mr. Herriton,Mrs. Herriton,316,396,a living brother is more to her than a dead mother she can knit him socks,harriet harriet shall go too harriet now will be invaluable,Harriet; Mrs. Herriton,M,major,F,intermediate,1,1,1,0,0,0,1,1,1,0,1,0,1,0,0,0,0,0
00057,Mr. Herriton,Mrs. Herriton,318,25,what did you say,when a man is neither well bred nor well connected nor handsome nor clever nor rich even lilia may discard him in time,Harriet; Mrs. Herriton,M,major,F,intermediate,0,1,0,0,1,0,1,0,0,1,1,1,1,0,1,1,1,0
00058,Mr. Herriton,Mrs. Herriton,320,386,and what happened this morning,no it is not that for some perverse reason he will not part with the child i must go and tell poor caroline she will be equally distressed the impudence the cursed impudence oh i m swearing i don t care that beastly woman how dare she interfere i ll philip dear i m sorry it s no good you must go,Harriet; Mrs. Herriton,M,major,F,intermediate,0,0,1,0,1,0,0,0,0,1,1,1,1,1,1,1,1,1
00059,Mr. Herriton,Mrs. Herriton,322,334,did you let her,at the same time he has the chance of corrupting the child s morals he entreats her to send the baby one,Harriet; Mrs. Herriton,M,major,F,intermediate,0,1,0,0,0,0,1,0,0,1,1,0,0,0,0,1,1,1
00060,Mr. Herriton,Mrs. Herriton,328,266,my dear sister i can reassure you firstly the beastly baby is italian secondly it was promptly christened at santa deodata s and a powerful combination of saints watch over,most certainly this is the proper course and why ever should we tell caroline,Harriet; Mrs. Herriton,M,major,F,intermediate,1,1,1,1,1,0,1,1,1,1,1,1,1,1,0,1,0,1
00061,Mr. Herriton,Mrs. Herriton,331,19,do you suppose that he guesses the situation how anxious we are to hush the scandal up,poor child how vulgar it s surprising that she isn t worse but she has got a look of poor charles about her,Mrs. Herriton,M,major,F,intermediate,1,1,0,1,1,0,1,1,0,1,1,1,1,1,0,1,1,0
00062,Mr. Herriton,Mrs. Herriton,333,27,hopeful indeed,my dear boy if possible she has got worse and worse it was your idea of italian travel that saved us,Mrs. Herriton,M,major,F,intermediate,0,0,0,1,0,0,0,0,0,0,1,1,0,1,0,1,1,0
00063,Mr. Herriton,Mrs. Herriton,335,262,she might do it too,no dear very little poor charles provided for every kind of contingency in his will the money will come to you and harriet as irma s guardians,Mrs. Herriton,M,major,F,intermediate,0,1,0,1,1,0,1,0,0,1,1,1,1,0,1,1,1,1
00064,Mr. Herriton,Mrs. Herriton,337,388,who s to watch her at school though she may bubble out any moment,she won t accept won t accept the letter as final you must go to monteriano,Mrs. Herriton,M,major,F,intermediate,0,1,1,1,0,0,1,1,0,1,1,1,0,0,0,1,1,0
