pair_id,a_speaker,b_speaker,i_merge_id,j_merge_id,i_text,j_text,i_addressees,A_gender,A_category,B_gender,B_category,a_articles,a_auxiliary_verbs,a_conjunctions,a_adverbs,a_impersonal_pronouns,a_negations,a_personal_pronouns,a_prepositions,a_quantifiers,b_articles,b_auxiliary_verbs,b_conjunctions,b_adverbs,b_impersonal_pronouns,b_negations,b_personal_pronouns,b_prepositions,b_quantifiers
00304,Mr. Herriton,Caroline Abbott,308,685,oh i quite sympathize with what you say it isn t nonsense and a year or two ago i should have been saying it too but i feel differently now and i hope that you also will change society is invincible to a certain degree but your real life is your own and nothing can touch it there is no power on earth that can prevent your criticizing and despising mediocrity nothing that can stop you retreating into splendour and beauty into the thoughts and beliefs that make the real life the real you,i can do no more but i tell you plainly i have changed sides,Caroline Abbott,M,major,F,major,1,1,1,1,1,1,1,1,1,0,1,1,0,0,1,1,0,1
00305,Mr. Herriton,Caroline Abbott,351,864,it is extraordinarily good of you to take this unexpected interest,nothing except the times we have seen each other,Caroline Abbott; Mrs. Herriton,M,major,F,major,0,1,0,0,1,0,1,1,0,1,1,0,0,0,1,1,1,0
00306,Mr. Herriton,Caroline Abbott,373,281,there are sure to be incidental expenses do you suppose we shall have difficulty with the man,i know you did lilia saw him several times again and i knew i ought to interfere i called her to my bedroom one night she was very frightened for she knew what it was about and how severe i could be do you love this man i asked yes or no she said yes and i said why don t you marry him if you think you ll be happy,Caroline Abbott; Mr. Abbott,M,major,F,major,1,1,0,1,0,0,1,1,0,0,1,1,1,1,1,1,1,1
00307,Mr. Herriton,Caroline Abbott,375,498,from what you saw of him should you conclude that he would make an affectionate parent,harriet may be right i am afraid,Caroline Abbott; Mr. Abbott,M,major,F,major,1,1,0,0,1,0,1,1,0,0,1,0,0,0,0,1,0,0
00308,Mr. Herriton,Caroline Abbott,377,697,well what do you conclude from that,that s not doing anything you would be doing something if you kidnapped the baby or if you went straight away but that to fail honourably to come out of the thing as well as you can is that all you are after,Caroline Abbott; Mr. Abbott,M,major,F,major,0,1,0,1,1,0,1,1,0,1,1,1,1,1,1,1,1,1
00309,Mr. Herriton,Caroline Abbott,379,693,yet thoroughly wicked men have loved their children look at rodrigo borgia for example,you do understand wonderfully you are the only one of us who has a general view of the muddle so what are you going to do,Caroline Abbott; Mr. Abbott,M,major,F,major,0,1,0,1,0,0,1,1,0,1,1,1,1,1,0,1,1,1
00310,Mr. Herriton,Caroline Abbott,471,691,i was going to make myself some tea,why aren t you angry with me,Caroline Abbott,M,major,F,major,0,1,0,0,0,0,1,1,1,0,0,0,1,0,0,1,1,0
00311,Mr. Herriton,Caroline Abbott,473,854,no more do i he was out,you ve upset me i thought i was past all this you re taking it wrongly i m in love with gino don t pass it off i mean it crudely you know what i mean so laugh at me,Caroline Abbott,M,major,F,major,0,1,0,0,0,1,1,1,1,0,1,1,1,1,0,1,1,1
00312,Mr. Herriton,Caroline Abbott,475,472,he was out you find me as ignorant as you have left harriet,i should be grateful you see harriet knows nothing,Caroline Abbott,M,major,F,major,0,1,1,0,0,0,1,1,0,0,1,0,0,0,1,1,0,0
00313,Mr. Herriton,Caroline Abbott,477,502,pray let us start clear permit me to begin by asking you a question in which capacity have you come to monteriano spy or traitor,oh no not that i never told him that you and harriet were coming you could have taken him by surprise if you liked he only asked for you and wished he hadn t been so rude to you eighteen months ago,Caroline Abbott,M,major,F,major,1,1,1,0,1,0,1,1,0,0,1,1,1,1,1,1,1,1
00314,Mr. Herriton,Caroline Abbott,479,858,it is hopeless to expect you to believe me but i can assert that we are here to get the child even if it costs us all we ve got my mother has fixed no money limit whatever i am here to carry out her instructions i think that you will approve of them as you have practically dictated them i do not approve of them they are absurd harriet also carries out your instructions she however approves of them and does not know that they proceed from you i think miss abbott you had better take entire charge of the rescue party i have asked for an interview with signor carella tomorrow morning do you acquiesce might i ask for details of your interview with him they might be helpful to me,if i saw him often i might remember what he is like or he might grow old but i dare not risk it so nothing can alter me now,Caroline Abbott,M,major,F,major,1,1,1,1,1,1,1,1,1,0,1,1,1,1,1,1,1,0
00315,Mr. Herriton,Caroline Abbott,481,818,from perfetta if it interests you,because i understand the place there is no need,Caroline Abbott,M,major,F,major,0,0,1,0,1,0,1,1,0,1,1,1,1,0,1,1,0,0
00316,Mr. Herriton,Caroline Abbott,483,97,the woman who must have let you in,i suppose so there is general conscription he was in the bersaglieri i think isn t that the crack regiment,Caroline Abbott,M,major,F,major,1,1,0,0,0,0,1,1,0,1,1,1,1,1,0,1,1,0
00317,Mr. Herriton,Caroline Abbott,485,279,into signor carella s house,the first evening we got to monteriano lilia went out for a walk alone saw that italian in a picturesque position on a wall and fell in love he was shabbily dressed and she did not even know he was the son of a dentist i must tell you i was used to this sort of thing once or twice before i had had to send people about their business,Caroline Abbott,M,major,F,major,0,0,0,0,0,0,0,1,0,1,1,1,1,1,1,1,1,1
00318,Mr. Herriton,Caroline Abbott,487,862,i suppose i misunderstood perfetta where did you have your interview then,what of,Caroline Abbott,M,major,F,major,0,1,1,1,0,0,1,0,0,0,0,0,0,1,0,0,1,0
00319,Mr. Herriton,Caroline Abbott,489,374,yes yes i know the rocca i told you of it,it depends,Caroline Abbott,M,major,F,major,1,0,0,0,1,0,1,1,0,0,0,0,0,1,0,0,0,0
00320,Mr. Herriton,Caroline Abbott,491,476,and you talked,what do you mean please please mr herriton don t be mysterious there isn t the time any moment harriet may be down and we shan t have decided how to behave to her sawston was different we had to keep up appearances but here we must speak out and i think i can trust you to do it otherwise we ll never start clear,Caroline Abbott,M,major,F,major,0,0,1,0,0,0,1,0,0,1,1,1,1,1,1,1,1,0
00321,Mr. Herriton,Caroline Abbott,493,69,and of what did you talk,a short time quite a short time,Caroline Abbott,M,major,F,major,0,1,1,0,1,0,1,1,0,1,0,0,1,0,0,0,0,1
00322,Mr. Herriton,Caroline Abbott,495,705,my dear miss abbott he is not a murderer i have just been driving that into harriet and when you know the italians as well as i do you will realize that in all that he said to you he was perfectly sincere the italians are essentially dramatic they look on death and love as spectacles i don t doubt that he persuaded himself for the moment that he had behaved admirably both as husband and widower,i wish something would happen to you my dear friend i wish something would happen to you,Caroline Abbott,M,major,F,major,1,1,1,1,1,1,1,1,1,0,1,0,0,1,0,1,1,0
00323,Mr. Herriton,Caroline Abbott,497,95,harriet would say he has no sense of sin,no position at all he is kicking his heels as my father would say you see he has only just finished his military service,Caroline Abbott,M,major,F,major,0,1,0,0,0,1,1,1,0,0,1,1,1,0,1,1,1,1
00324,Mr. Herriton,Caroline Abbott,499,804,if so perhaps he isn t sinful,thank him please when you write and give him my kindest regards,Caroline Abbott,M,major,F,major,0,0,1,1,0,0,1,0,0,0,0,1,1,0,0,1,0,0
00325,Mr. Herriton,Caroline Abbott,501,860,i should like to hear though what he said about me is he preparing a warm reception,oh you shall know quick enough,Caroline Abbott,M,major,F,major,1,1,1,1,1,0,1,1,0,0,1,0,0,0,0,1,0,1
00326,Mr. Herriton,Caroline Abbott,503,103,what a memory the fellow has for little things,his father well i don t suppose you ll think it a good match but that s not the point i mean the point is not i mean that social differences love after all not but what i gentlemen sometimes judge hardly but i feel that you and at all events your mother so really good in every sense so really unworldly after all love marriages are made in heaven,Caroline Abbott,M,major,F,major,1,1,0,0,1,0,0,1,1,1,1,1,1,1,1,1,1,1
00327,Mr. Herriton,Caroline Abbott,505,516,i lost my temper did he really what exactly did he say,but is there an opera right up here,Caroline Abbott,M,major,F,major,0,1,0,1,1,0,1,0,0,1,1,1,1,0,0,0,1,0
00328,Mr. Herriton,Caroline Abbott,507,107,the view from the rocca small gratuity is finest at sunset,stop i ll tell you no more,Caroline Abbott,M,major,F,major,1,1,0,0,0,0,0,1,1,0,0,0,0,0,1,1,0,1
00329,Mr. Herriton,Caroline Abbott,509,291,the view from the rocca wasn t it fine,it would have suited them lilia needed me and as for him i can t help feeling i might have got influence over him,Caroline Abbott,M,major,F,major,1,0,0,0,1,0,0,1,0,0,1,1,0,1,0,1,1,0
00330,Mr. Herriton,Caroline Abbott,511,492,because harriet,it was very awkward for me but i had to talk he seemed to make me you see he thought i was here as a tourist he thinks so still he intended to be civil and i judged it better to be civil also,Caroline Abbott,M,major,F,major,0,0,1,0,0,0,0,0,0,1,1,1,1,1,0,1,1,0
00331,Mr. Herriton,Caroline Abbott,513,480,it reaches up to heaven and down to the other place is it to be a symbol of the town,my interview how do you know of it,Caroline Abbott,M,major,F,major,1,1,1,0,1,0,0,1,0,0,1,0,1,1,0,1,1,0
00332,Mr. Herriton,Caroline Abbott,515,85,lucia di lammermoor by the master donizetti unique representation this evening,oh no please not at all i am here my own idea to give all information which you very naturally and to see if somehow please ask anything you like,Caroline Abbott,M,major,F,major,1,0,0,0,1,0,0,1,0,0,1,1,1,1,1,1,1,1
00333,Mr. Herriton,Caroline Abbott,517,824,why yes these people know how to live they would sooner have a thing bad than not have it at all that is why they have got to have so much that is good however bad the performance is tonight it will be alive italians don t love music silently like the beastly germans the audience takes its share sometimes more,have you told mrs herriton,Caroline Abbott,M,major,F,major,1,1,1,1,1,1,1,1,1,0,1,0,0,0,0,1,0,0
00334,Mr. Herriton,Caroline Abbott,534,299,good miss abbott you are coming too,i hated the idleness the stupidity the respectability the petty unselfishness,Caroline Abbott; Harriet,M,major,F,major,0,1,0,1,0,0,1,0,0,1,0,0,0,0,0,1,0,0
00335,Mr. Herriton,Caroline Abbott,538,701,oh that ll be all right we ll go as we are and buy the best we can get monteriano is not formal we do all right,none at all fight as if you think us wrong oh what s the use of your fair mindedness if you never decide for yourself any one gets hold of you and makes you do what they want and you see through them and laugh at them and do it it s not enough to see clearly i m muddle headed and stupid and not worth a quarter of you but i have tried to do what seemed right at the time and you your brain and your insight are splendid but when you see what s right you re too idle to do it you told me once that we shall be judged by our intentions not by our accomplishments i thought it a grand remark but we must intend to accomplish not sit intending on a chair,Caroline Abbott; Harriet,M,major,F,major,1,1,1,0,1,1,1,1,1,1,1,1,1,1,1,1,1,1
00336,Mr. Herriton,Caroline Abbott,540,105,don t you like it at all,mr herriton don t please mr herriton a dentist his father s a dentist,Caroline Abbott; Harriet,M,major,F,major,0,0,0,0,1,0,1,1,1,1,0,0,0,0,0,1,0,0
00337,Mr. Herriton,Caroline Abbott,564,147,yes rather,i can t stop here i daren t stop here you will have to take me with you,Caroline Abbott,M,major,F,major,0,0,0,1,0,0,0,0,0,0,1,0,1,0,0,1,1,0
00338,Mr. Herriton,Caroline Abbott,566,283,why no how could i the fact is well i got taken by surprise but after all what does it matter there s no earthly reason why we shouldn t do the business pleasantly he s a perfectly charming person and so are his friends i m his friend now his long lost brother what s the harm i tell you miss abbott it s one thing for england and another for italy there we plan and get on high moral horses here we find what asses we are for things go off quite easily all by themselves my hat what a night did you ever see a really purple sky and really silver stars before well as i was saying it s absurd to worry he s not a porky father he wants that baby as little as i do he s been ragging my dear mother just as he ragged me eighteen months ago and i ve forgiven him oh but he has a sense of humour,had you ever let her choose i m afraid that s rude,Caroline Abbott,M,major,F,major,1,1,1,1,1,1,1,1,1,0,1,0,1,1,0,1,0,0
00339,Mr. Herriton,Caroline Abbott,680,93,what might have happened to me he had made you believe that he loved the child,as far as i have seen him i do as far as i have seen him i do like him,Caroline Abbott,M,major,F,major,1,1,0,0,1,0,1,1,0,0,1,1,0,0,0,1,1,0
00340,Mr. Herriton,Caroline Abbott,682,506,at present it is still unsettled,he said he was sorry pleasantly as italians do say such things but he never mentioned the baby once,Caroline Abbott,M,major,F,major,0,1,0,1,1,0,0,1,0,1,1,1,1,1,1,1,1,1
00341,Mr. Herriton,Caroline Abbott,684,836,perhaps not well as i said i know what has happened and i am not here to scold you but i must ask you to withdraw from the thing for the present harriet is furious but she will calm down when she realizes that you have done us no harm and will do none,of course we shall meet whenever you come down and i hope that it will mean often,Caroline Abbott,M,major,F,major,1,1,1,1,1,1,1,1,1,0,1,1,1,1,0,1,1,0
00342,Mr. Herriton,Caroline Abbott,686,518,if you do no more that is all we want you promise not to prejudice our cause by speaking to signor carella,can t we go,Caroline Abbott,M,major,F,major,0,1,1,0,1,1,1,1,1,0,1,0,0,0,0,1,0,0
00343,Mr. Herriton,Caroline Abbott,690,567,well that s all i wanted to know i ll go and tell harriet of your promise and i think things ll quiet down now,this time the same place the same thing help me,Caroline Abbott,M,major,F,major,0,0,1,1,1,0,1,1,1,1,0,0,0,1,0,1,0,0
00344,Mr. Herriton,Caroline Abbott,692,73,because i understand you all sides i think harriet signor carella even my mother,close on three weeks,Caroline Abbott,M,major,F,major,0,0,1,1,0,0,1,0,1,0,0,0,0,0,0,0,1,1
00345,Mr. Herriton,Caroline Abbott,694,380,do this afternoon i have another interview,i have also seen examples of that in my district,Caroline Abbott,M,major,F,major,0,1,0,0,1,0,1,0,1,0,1,1,1,1,0,1,1,0
00346,Mr. Herriton,Caroline Abbott,696,695,then another if that fails i shall wire home for instructions i dare say we may fail altogether but we shall fail honourably,it will come to nothing well,Caroline Abbott,M,major,F,major,0,1,1,0,1,0,1,1,1,0,1,0,1,1,1,0,1,0
00347,Mr. Herriton,Caroline Abbott,698,307,why yes since we talk openly that is all i am after just now what else is there if i can persuade signor carella to give in so much the better if he won t i must report the failure to my mother and then go home why miss abbott you can t expect me to follow you through all these turns,i hope you see why i have troubled you with this long story women i heard you say the other day are never at ease till they tell their faults out loud lilia is dead and her husband gone to the bad all through me you see mr herriton it makes me specially unhappy it s the only time i ve ever gone into what my father calls real life and look what i ve made of it all that winter i seemed to be waking up to beauty and splendour and i don t know what and when the spring came i wanted to fight against the things i hated mediocrity and dulness and spitefulness and society i actually hated society for a day or two at monteriano i didn t see that all these things are invincible and that if we go against them they will break us to pieces thank you for listening to so much nonsense,Caroline Abbott,M,major,F,major,1,1,1,1,1,0,1,1,1,1,1,1,1,1,1,1,1,1
00348,Mr. Herriton,Caroline Abbott,700,293,because i understand the position of signor carella and of you it s no reason that,well i have explained,Caroline Abbott,M,major,F,major,1,0,1,0,1,1,1,1,0,0,1,0,1,0,0,1,0,0
00349,Mr. Herriton,Caroline Abbott,702,494,you are wonderful,the weather there will be rain he says by tomorrow evening the other towns england myself about you a little and he actually mentioned lilia he was perfectly disgusting he pretended he loved her he offered to show me her grave the grave of the woman he has murdered,Caroline Abbott,M,major,F,major,0,1,0,0,0,0,1,0,0,1,1,1,1,0,0,1,1,1
00350,Mr. Herriton,Caroline Abbott,704,87,miss abbott don t worry over me some people are born not to do things i m one of them i never did anything at school or at the bar i came out to stop lilia s marriage and it was too late i came out intending to get the baby and i shall return an honourable failure i never expect anything to happen now and so i am never disappointed you would be surprised to know what my great events are going to the theatre yesterday talking to you now i don t suppose i shall ever meet anything greater i seem fated to pass through the world without colliding with it or moving it and i m sure i can t tell you whether the fate s good or evil i don t die i don t fall in love and if other people die or fall in love they always do it when i m just not there you are quite right life to me is just a spectacle which thank god and thank italy and thank you is now more beautiful and heartening than it has ever been before,oh quite young twenty one i believe,Caroline Abbott,M,major,F,major,1,1,1,1,1,1,1,1,1,0,0,0,1,0,0,1,0,1
00351,Mr. Herriton,Caroline Abbott,712,486,you going,mr herriton how could you believe her do you suppose that i would have entered that man s house knowing about him all that i do i think you have very odd ideas of what is possible for a lady i hear you wanted harriet to go very properly she refused eighteen months ago i might have done such a thing but i trust i have learnt how to behave by now,Caroline Abbott; Harriet,M,major,F,major,0,0,0,0,0,0,1,0,0,1,1,1,1,1,0,1,1,1
00352,Mr. Herriton,Caroline Abbott,716,512,well i suppose i shall and i shall also have my interview with signor carella but why should you mind do you suppose that i shall have the slightest influence over him,mr herriton come here look at this,Caroline Abbott,M,major,F,major,1,1,1,1,1,0,1,1,0,0,0,0,1,1,0,0,1,0
00353,Mr. Herriton,Caroline Abbott,718,844,perhaps i ought but it isn t a very big ought whatever harriet and i do the issue is the same why i can see the splendour of it even the humour gino sitting up here on the mountain top with his cub we come and ask for it he welcomes us we ask for it again he is equally pleasant i m agreeable to spend the whole week bargaining with him but i know that at the end of it i shall descend empty handed to the plains it might be finer of me to make up my mind but i m not a fine character and nothing hangs on it,all the wonderful things are over that is just where it is,Caroline Abbott,M,major,F,major,1,1,1,1,1,1,1,1,1,1,1,0,1,1,0,0,1,1
00354,Mr. Herriton,Caroline Abbott,727,806,yes do now that we have quarrelled we scarcely want to travel in procession all the way down the hill well good bye it s all over at last another scene in my pageant has shifted,when will you see him again,Caroline Abbott,M,major,F,major,1,1,0,1,1,0,1,1,1,0,1,1,1,0,0,1,0,0
00355,Mr. Herriton,Caroline Abbott,729,866,you sound despondent don t forget that you return victorious,the time i thought you weak and heedless and went instead of you to get the baby that began it as far as i know the beginning or it may have begun when you took us to the theatre and i saw him mixed up with music and light but didn t understand till the morning then you opened the door and i knew why i had been so happy afterwards in the church i prayed for us all not for anything new but that we might just be as we were he with the child he loved you and i and harriet safe out of the place and that i might never see him or speak to him again i could have pulled through then the thing was only coming near like a wreath of smoke it hadn t wrapped me round,Caroline Abbott,M,major,F,major,0,0,0,0,1,0,1,0,0,1,1,1,1,1,1,1,1,1
00356,Mr. Herriton,Caroline Abbott,803,378,he will have to marry her i heard from him this morning just as we left milan he finds he has gone too far to back out it would be expensive i don t know how much he minds not as much as we suppose i think at all events there s not a word of blame in the letter i don t believe he even feels angry i never was so completely forgiven ever since you stopped him killing me it has been a vision of perfect friendship he nursed me he lied for me at the inquest and at the funeral though he was crying you would have thought it was my son who had died certainly i was the only person he had to be kind to he was so distressed not to make harriet s acquaintance and that he scarcely saw anything of you in his letter he says so again,that he is a thoroughly wicked man,Caroline Abbott,M,major,F,major,1,1,1,1,1,1,1,1,1,1,1,0,1,1,0,1,0,0
00357,Mr. Herriton,Caroline Abbott,805,719,indeed i will,perhaps i am extreme i ve been trying to run you just like your mother i feel you ought to fight it out with harriet every little trifle for some reason does seem incalculably important today and when you say of a thing that nothing hangs on it it sounds like blasphemy there s never any knowing how am i to put it which of our actions which of our idlenesses won t have things hanging on it for ever,Caroline Abbott,M,major,F,major,0,1,0,1,0,0,1,0,0,1,1,1,1,1,1,1,1,1
00358,Mr. Herriton,Caroline Abbott,807,71,i hope next spring perhaps we shall paint siena red for a day or two with some of the new wife s money it was one of the arguments for marrying her,exactly eleven days,Caroline Abbott,M,major,F,major,1,1,1,1,1,0,1,1,1,0,0,0,0,0,0,0,0,1
00359,Mr. Herriton,Caroline Abbott,809,541,no you re wrong he does he is unhappy like the rest of us but he doesn t try to keep up appearances as we do he knows that the things that have made him happy once will probably make him happy again,most awfully,Caroline Abbott,M,major,F,major,1,1,1,1,1,1,1,1,1,0,0,0,1,0,0,0,0,1
00360,Mr. Herriton,Caroline Abbott,811,500,in his passion not when he was calm we english say it when we are calm when we do not really believe it any longer gino is not ashamed of inconsistency it is one of the many things i like him for,i know what he has done what he says and what he thinks is of very little importance,Caroline Abbott,M,major,F,major,1,1,1,1,1,1,1,1,1,0,1,1,1,1,0,1,1,1
00361,Mr. Herriton,Caroline Abbott,815,488,i m sorry when will you come back do you think,not an interview an accident i am very sorry i meant you to have the chance of seeing him first though it is your fault you are a day late you were due here yesterday so i came yesterday and not finding you went up to the rocca you know that kitchen garden where they let you in and there is a ladder up to a broken tower where you can stand and see all the other towers below you and the plain and all the other hills,Caroline Abbott,M,major,F,major,0,1,1,1,0,0,1,0,0,1,1,1,1,1,1,1,1,1
00362,Mr. Herriton,Caroline Abbott,817,565,for whatever reason,i suppose you didn t settle anything,Caroline Abbott,M,major,F,major,0,0,0,0,1,0,0,1,0,0,0,0,0,1,0,1,0,0
00363,Mr. Herriton,Caroline Abbott,823,703,yes i can t live at sawston,oh you appreciate me i wish you didn t you appreciate us all see good in all of us and all the time you are dead dead dead look why aren t you angry you are so splendid mr herriton that i can t bear to see you wasted i can t bear she has not been good to you your mother,Caroline Abbott,M,major,F,major,0,1,0,0,0,0,1,1,0,1,1,1,1,1,1,1,1,1
00364,Mr. Herriton,Caroline Abbott,825,352,i wrote from monteriano i tried to explain things but she will never understand me her view will be that the affair is settled sadly settled since the baby is dead still it s over our family circle need be vexed no more she won t even be angry with you you see you have done us no harm in the long run unless of course you talk about harriet and make a scandal so that is my plan london and work what is yours,the child came into the world through my negligence it is natural i should take an interest in it,Caroline Abbott,M,major,F,major,1,1,1,1,1,1,1,1,1,1,1,0,0,1,0,1,1,0
00365,Mr. Herriton,Caroline Abbott,827,699,is harriet going to be all right,i don t but i do expect you to settle what is right and to follow that do you want the child to stop with his father who loves him and will bring him up badly or do you want him to come to sawston where no one loves him but where he will be brought up well there is the question put dispassionately enough even for you settle it settle which side you ll fight on but don t go talking about an honourable failure which means simply not thinking and not acting at all,Caroline Abbott,M,major,F,major,0,1,0,0,0,0,0,1,1,1,1,1,1,1,1,1,1,1
