pair_id,a_speaker,b_speaker,i_merge_id,j_merge_id,i_text,j_text,i_addressees,A_gender,A_category,B_gender,B_category,a_articles,a_auxiliary_verbs,a_conjunctions,a_adverbs,a_impersonal_pronouns,a_negations,a_personal_pronouns,a_prepositions,a_quantifiers,b_articles,b_auxiliary_verbs,b_conjunctions,b_adverbs,b_impersonal_pronouns,b_negations,b_personal_pronouns,b_prepositions,b_quantifiers
00510,Signor Carella,Lilia,116,174,fish live on water not on air,oh i forgot your horrid celibacy in england they would be the centre of everything but why shouldn t i know them would it make it easier if i called all round isn t that your foreign way but i must know some one who were the men you were talking to this afternoon but gino dear if they re low class why did you talk to them don t you care about your position,Caroline Abbott; Lilia; Mr. Herriton,M,major,F,intermediate,0,0,0,0,0,1,0,1,0,1,1,1,1,1,0,1,1,1
00511,Signor Carella,Lilia,150,228,the air is good so is the food she will be happy here and we shall not have to part with the money,and i ve got the money and you d better mend your manners for you d find it awkward if i stopped drawing cheques,Lilia,M,major,F,intermediate,1,1,1,1,0,1,1,1,1,1,0,1,0,1,0,1,1,0
00512,Signor Carella,Lilia,152,164,i am a married man i do not play games any more,not know your friends people,Lilia,M,major,F,intermediate,1,1,0,0,0,1,1,0,1,0,0,0,0,0,1,1,0,0
00513,Signor Carella,Lilia,154,157,i have no friends now,now gino don t be silly go and see your friends and bring them to see me we both of us like society i m ready too for people now i mean to wake you all up just as i woke up sawston let s have plenty of men and make them bring their womenkind i mean to have real english tea parties,Lilia,M,major,F,intermediate,0,1,0,1,0,1,1,0,0,0,1,1,1,0,0,1,1,1
00514,Signor Carella,Lilia,156,161,i want to see no one but you,poor fellow it is sad for him to discover that his people are vulgar,Lilia,M,major,F,intermediate,0,0,1,0,1,1,1,1,0,0,1,0,0,1,0,1,1,0
00515,Signor Carella,Lilia,158,114,there is my aunt and her husband but i thought you did not want to receive my relatives,oh look the poor wee fish,Lilia,M,major,F,intermediate,0,1,1,1,0,1,1,1,0,1,0,0,0,0,0,0,0,0
00516,Signor Carella,Lilia,160,233,but you would be right they are not for you many of them are in trade and even we are little more you should have gentlefolk and nobility for your friends,perhaps if i have a child he will be different i know he wants a son,Lilia,M,major,F,intermediate,0,1,1,1,0,1,1,1,1,1,1,1,1,0,0,1,0,0
00517,Signor Carella,Lilia,163,242,oh yes but of course i scarcely know them,you are a boy yourself gino,Lilia,M,major,F,intermediate,0,0,1,1,0,0,1,1,0,1,1,0,0,0,0,1,0,0
00518,Signor Carella,Lilia,165,166,why no if they are poor and have to work for their living i may see them but not otherwise except,how funny but i mean to change all that bring your friends to see me and i will make them bring their people well who are the principal people here who leads society well are they married,Lilia,M,major,F,intermediate,0,1,1,1,0,1,1,1,0,1,1,1,1,1,0,1,1,1
00519,Signor Carella,Lilia,169,170,yes in a way,i see they look down on you do they poor boy wait wait i ll soon stop that now who else is there,Lilia,M,major,F,intermediate,1,0,0,0,0,0,0,1,0,0,1,0,1,1,0,1,1,0
00520,Signor Carella,Lilia,173,153,the canons,go and see your friends then,Lilia,M,major,F,intermediate,1,0,0,0,0,0,0,0,0,0,0,1,0,0,0,1,0,0
00521,Signor Carella,Lilia,176,117,you must not go out alone it is not safe if you want to walk perfetta shall accompany you,well philip i am sure you are ready for by bye we shall meet at twelve o clock lunch tomorrow if we don t meet before they give us caffe later in our rooms,Lilia,M,major,F,intermediate,0,1,1,1,1,1,1,1,0,0,1,1,1,0,0,1,1,1
00522,Signor Carella,Lilia,225,159,this is italy,i never said such a,Lilia,M,major,F,intermediate,0,1,0,0,1,0,0,0,0,1,0,0,1,0,1,1,0,0
00523,Signor Carella,Lilia,227,240,i am your husband,it s nothing,Lilia,M,major,F,intermediate,0,1,0,0,0,0,1,0,0,0,0,0,0,1,1,0,0,0
00524,Signor Carella,Lilia,232,177,it was not i,very well very well,Lilia,M,major,F,intermediate,0,1,0,0,1,1,1,0,0,0,0,0,1,0,0,0,0,0
00525,Signor Carella,Lilia,239,151,gently gently,oh you idle boy go and play pallone,Lilia,M,major,F,intermediate,0,0,0,0,0,0,0,0,0,0,0,1,0,0,0,1,0,0
00526,Signor Carella,Lilia,241,226,my love my dearest lilia be calm i have never loved any one but you i have prayed all night for a boy,yes but i m older than you and i ll settle,Lilia,M,major,F,intermediate,1,1,1,1,0,1,1,1,1,0,0,1,0,0,0,1,1,0
00527,Caroline Abbott,Signor Carella,115,587,but may not the fish die they have no air,immense and the taxes but it will be better when ah but you have never guessed why i went to poggibonsi why it was that i was out when he called,Lilia; Mr. Herriton; Signor Carella,F,major,M,major,1,1,1,0,0,1,1,0,0,1,1,1,1,1,1,1,1,1
00528,Caroline Abbott,Signor Carella,575,643,most important business,it is very kind of you especially in your beautiful dress he is nearly clean already why i take the whole morning there is so much more of a baby than one expects and perfetta washes him just as she washes clothes then he screams for hours my wife is to have a light hand ah how he kicks has he splashed you i am very sorry,Signor Carella,F,major,M,major,0,0,0,0,0,0,0,0,1,1,1,1,1,1,0,1,1,1
00529,Caroline Abbott,Signor Carella,577,585,perhaps you are engaged and as i am not very well,exactly and when my poor wife died when my poor wife died i thought of having my relatives to live here my father wished to give up his practice at empoli my mother and sisters and two aunts were also willing but it was impossible they have their ways of doing things and when i was younger i was content with them but now i am a man i have my own ways do you understand,Signor Carella,F,major,M,major,0,1,1,1,0,1,1,1,0,1,1,1,1,1,0,1,1,1
00530,Caroline Abbott,Signor Carella,579,599,what a fine child signor carella and how nice of you to talk to it though i see that the ungrateful little fellow is asleep seven months no eight of course eight still he is a remarkably fine child for his age,why yes a little,Signor Carella,F,major,M,major,1,1,1,1,1,1,1,1,1,1,0,0,1,0,0,0,0,1
00531,Caroline Abbott,Signor Carella,582,631,mr herriton called yesterday but you were out,it is nothing if he cries silently then you may be frightened he thinks i am going to wash him and he is quite right,Signor Carella,F,major,M,major,0,1,1,0,0,0,1,1,0,0,1,1,1,1,1,1,1,0
00532,Caroline Abbott,Signor Carella,584,591,this house is a large house,but we are old friends and your approval will be grateful to me you gave it me once before will you give it now,Signor Carella,F,major,M,major,1,1,0,0,1,0,0,0,1,0,1,1,1,1,0,1,1,1
00533,Caroline Abbott,Signor Carella,586,641,yes i do it is a large house,who would have believed his mother was blonde for he is brown all over brown every inch of him ah but how beautiful he is and he is mine mine for ever even if he hates me he will be mine he cannot help it he is made out of me i am his father,Signor Carella,F,major,M,major,1,1,0,0,1,0,1,0,1,0,1,1,1,1,1,1,1,1
00534,Caroline Abbott,Signor Carella,588,597,i cannot guess signor carella i am here on business,but why,Signor Carella,F,major,M,major,0,1,0,1,0,1,1,1,0,0,0,1,1,0,0,0,0,0
00535,Caroline Abbott,Signor Carella,590,601,i cannot i hardly know you,i shall not say it it will be untrue now my poor wife so you do not advise me but why should it be a failure,Signor Carella,F,major,M,major,0,1,0,1,0,1,1,0,0,1,1,1,1,1,1,1,0,0
00536,Caroline Abbott,Signor Carella,592,800,i have not come as a friend this time i am not likely signor carella to approve of anything you do,philip have you had enough milk,Signor Carella,F,major,M,major,1,1,1,0,1,1,1,1,0,0,1,0,0,0,0,1,0,1
00537,Caroline Abbott,Signor Carella,594,580,where there is love,you must not stand let us sit on the loggia where it is cool i am afraid the room is very untidy,Signor Carella,F,major,M,major,0,1,0,1,0,0,0,0,0,1,1,0,1,1,1,1,1,0
00538,Caroline Abbott,Signor Carella,596,589,do i understand that you are proposing to marry again i forbid you then i forbid you,but try,Signor Carella,F,major,M,major,0,1,1,1,1,0,1,1,0,0,0,1,0,0,0,0,0,0
00539,Caroline Abbott,Signor Carella,598,635,you have ruined one woman i forbid you to ruin another it is not a year since lilia died you pretended to me the other day that you loved her it is a lie you wanted her money has this woman money too,but why are you going excuse me if i wash him while we talk,Signor Carella,F,major,M,major,1,1,1,1,1,1,1,1,1,0,1,1,1,0,0,1,0,0
00540,Caroline Abbott,Signor Carella,600,609,and i suppose you will say that you love her,why of course she knows why i am marrying her,Signor Carella,F,major,M,major,0,1,1,0,1,0,1,0,0,0,1,0,1,0,0,1,1,0
00541,Caroline Abbott,Signor Carella,602,613,how can it succeed where there is no love,it is an english marriage i do not care about the money i am having her for my son did you not understand that,Signor Carella,F,major,M,major,0,1,0,1,1,1,0,0,0,1,1,0,1,1,1,1,1,0
00542,Caroline Abbott,Signor Carella,606,645,then god help her,certainly certainly,Signor Carella,F,major,M,major,0,0,1,0,0,0,1,0,0,0,0,0,1,0,0,0,0,0
00543,Caroline Abbott,Signor Carella,608,583,her duty,but guess e manca questo,Signor Carella,F,major,M,major,0,0,0,0,0,0,1,0,0,0,0,1,0,0,0,0,0,0
00544,Caroline Abbott,Signor Carella,610,620,to succeed where lilia failed to be your housekeeper your slave you,empoli i would as soon have him in england,Signor Carella,F,major,M,major,0,1,0,1,0,0,1,1,0,0,1,1,1,0,0,1,1,0
00545,Caroline Abbott,Signor Carella,612,629,the baby,father son this woman will do exactly what i tell her she is fond of children she is clean she has a pleasant voice she is not beautiful i cannot pretend that to you for a moment but she is what i require,Signor Carella,F,major,M,major,1,0,0,0,0,0,0,0,0,1,1,1,0,1,1,1,1,0
00546,Caroline Abbott,Signor Carella,617,622,not at all suitable,he has a grandmother here no he is troublesome but i must have him with me i will not even have my father and mother too for they would separate us,Signor Carella,F,major,M,major,0,0,0,0,0,1,0,1,1,1,1,1,1,0,1,1,1,0
00547,Caroline Abbott,Signor Carella,619,603,oh no thank you but marriage signor carella is a very serious step could you not manage more simply your relative for example,but she does love me i forgot to tell you that,Signor Carella,F,major,M,major,1,1,1,1,0,1,1,1,1,0,1,1,0,1,0,1,1,0
00548,Caroline Abbott,Signor Carella,621,798,england then he has a grandmother there you know mrs theobald,will you not have some,Signor Carella,F,major,M,major,1,1,1,1,0,0,1,0,0,0,1,0,0,0,1,1,0,1
00549,Caroline Abbott,Signor Carella,626,593,oh take care,oh signorina surely you approve of marriage,Signor Carella,F,major,M,major,0,0,0,0,0,0,0,0,0,0,0,0,1,0,0,1,1,0
00550,Caroline Abbott,Signor Carella,628,607,but ought you to treat him like that,whatever i say displeases you signorina god help you for you are most unfair you say that i ill treated my dear wife it is not so i have never ill treated any one you complain that there is no love in this marriage i prove that there is and you become still more angry what do you want do you suppose she will not be contented glad enough she is to get me and she will do her duty well,Signor Carella,F,major,M,major,0,1,1,0,1,0,1,1,0,0,1,1,1,1,1,1,1,1
00551,Caroline Abbott,Signor Carella,630,796,oh do take care you are squeezing it,a little,Signor Carella,F,major,M,major,0,1,0,0,1,0,1,0,0,1,0,0,0,0,0,0,0,1
00552,Caroline Abbott,Signor Carella,632,116,wash him you here,fish live on water not on air,Signor Carella,F,major,M,major,0,0,0,1,0,0,1,0,0,0,0,0,0,0,1,0,1,0
00553,Caroline Abbott,Signor Carella,634,576,i have wasted your time,before business you must get well this is the best wine,Signor Carella,F,major,M,major,0,1,0,0,0,0,1,0,0,1,1,1,1,1,0,1,1,0
00554,Caroline Abbott,Signor Carella,636,627,i have nothing more to say,he is not much longer than my boot is he can you believe that in time his own boots will be as large and that he also,Signor Carella,F,major,M,major,0,1,0,0,0,1,1,1,1,0,1,1,1,1,1,1,1,1
00555,Caroline Abbott,Signor Carella,638,633,i have seen as much as i want thank you,i had gone to the farmacia and was sitting there comfortably when suddenly i remembered that perfetta had heated water an hour ago over there look covered with a cushion i came away at once for really he must be washed you must excuse me i can put it off no longer,Signor Carella,F,major,M,major,0,1,1,0,0,0,1,1,1,1,1,1,1,1,1,1,1,1
00556,Caroline Abbott,Signor Carella,640,637,i must go at once,oh but stop a moment you have not seen him yet,Signor Carella,F,major,M,major,0,1,0,1,0,0,1,1,1,1,1,1,1,0,1,1,0,0
00557,Caroline Abbott,Signor Carella,642,595,may i help you to wash him,where there is love,Signor Carella,F,major,M,major,0,1,0,0,0,0,1,1,0,0,1,0,1,0,0,0,0,0
00558,Caroline Abbott,Signor Carella,644,618,i am ready for a soft towel now,a little more wine,Signor Carella,F,major,M,major,1,1,0,1,0,0,1,1,0,1,0,0,0,0,0,0,0,1
00559,Caroline Abbott,Signor Carella,795,611,that milk need not be wasted take it signor carella and persuade mr herriton to drink is there any left,to look after the baby certainly,Mr. Herriton; Perfetta; Signor Carella,F,major,M,major,0,1,1,1,1,1,0,1,0,1,0,1,1,0,0,0,1,0
00560,Caroline Abbott,Signor Carella,797,639,then finish it,take him,Mr. Herriton; Perfetta; Signor Carella,F,major,M,major,0,0,1,0,1,0,0,0,0,0,0,0,0,0,0,1,0,0
00561,Caroline Abbott,Signor Carella,799,578,i do not care for milk finish it all,you are not well enough to go back and i am not engaged ah now i understand now i see what frightened you but why did you never speak,Mr. Herriton; Perfetta; Signor Carella,F,major,M,major,0,1,0,0,1,1,1,1,1,0,1,1,1,1,1,1,1,1
00562,Mr. Herriton,Signor Carella,138,139,please sit down signor carella mrs herriton is rather agitated but there is no reason we should not be calm might i offer you a cigarette please sit down signor carella i will be frank with you i have come to prevent you marrying mrs herriton because i see you will both be unhappy together she is english you are italian she is accustomed to one thing you to another and pardon me if i say it she is rich and you are poor,i am not marrying her because she is rich,Signor Carella,M,major,M,major,1,1,1,1,1,1,1,1,1,0,1,1,0,0,1,1,0,0
00563,Mr. Herriton,Signor Carella,140,652,i never suggested that for a moment you are honourable i am sure but are you wise and let me remind you that we want her with us at home her little daughter will be motherless our home will be broken up if you grant my request you will earn our thanks and you will not be without a reward for your disappointment,well your business,Signor Carella,M,major,M,major,1,1,1,1,1,1,1,1,1,0,0,0,1,0,0,1,0,0
00564,Mr. Herriton,Signor Carella,142,656,what about a thousand lire you can have them tonight,she came for business but she forgot about it so did i,Signor Carella,M,major,M,major,1,1,0,1,1,0,1,1,1,0,1,1,1,1,0,1,1,0
00565,Mr. Herriton,Signor Carella,144,723,but why,my poor fellow i will,Signor Carella,M,major,M,major,0,0,1,1,0,0,0,0,0,0,1,0,0,0,0,1,0,0
00566,Mr. Herriton,Signor Carella,651,725,what is it,then you will not be here this evening as you promised us all three leaving,Signor Carella,M,major,M,major,0,1,0,0,1,0,0,0,0,0,1,1,1,1,1,1,1,1
00567,Mr. Herriton,Signor Carella,655,788,but surely,oh the foul devil kill him kill him for me,Signor Carella,M,major,M,major,0,0,1,1,0,0,0,0,0,1,0,0,0,0,0,1,1,0
00568,Mr. Herriton,Signor Carella,720,145,well you are right this affair is being managed by the ladies,because because we are married married married as soon as i knew you were coming there was no time to tell you oh oh you have come all the way for nothing oh and oh your generosity please pardon me i am rude i am no better than a peasant and i,Signor Carella,M,major,M,major,1,1,0,1,1,0,1,1,0,1,1,1,1,0,1,1,1,1
00569,Mr. Herriton,Signor Carella,722,141,well i have done my best i shall face my mother with a good conscience will you bear me witness that i ve done my best,reward what reward,Signor Carella,M,major,M,major,1,1,0,1,1,0,1,1,0,0,0,0,0,1,0,0,0,0
00570,Mr. Herriton,Signor Carella,724,721,and that i have mia sorella poor harriet one more wrench and it will all be over for her we are leaving this evening,ah the ladies the ladies,Signor Carella,M,major,M,major,0,1,1,0,1,0,1,1,1,1,0,0,0,0,0,0,0,0
00571,Mr. Herriton,Signor Carella,787,802,help help,it does not matter it does not matter it will never be wanted any more,Caroline Abbott; Signor Carella,M,major,M,major,0,0,0,0,0,0,0,0,0,0,1,0,1,1,1,0,0,1
00572,Mr. Herriton,Signor Carella,801,143,yes thank you gino finish it all,it is too late,Caroline Abbott; Perfetta; Signor Carella,M,major,M,major,0,0,0,0,1,0,1,0,1,0,1,0,1,1,0,0,0,0
00573,Signor Carella,Mr. Herriton,139,653,i am not marrying her because she is rich,our business miss abbott has told you of that,Mr. Herriton,M,major,M,major,0,1,1,0,0,1,1,0,0,0,1,0,0,1,0,1,1,0
00574,Signor Carella,Mr. Herriton,141,726,reward what reward,all three by the night train at least that is my sister s plan so i m afraid i shan t be here,Mr. Herriton,M,major,M,major,0,0,0,0,1,0,0,0,0,1,1,1,1,1,0,1,1,1
00575,Signor Carella,Mr. Herriton,143,554,it is too late,oh i ve written i left a note this afternoon,Mr. Herriton,M,major,M,major,0,1,0,1,1,0,0,0,0,1,0,0,0,1,0,1,0,0
00576,Signor Carella,Mr. Herriton,145,140,because because we are married married married as soon as i knew you were coming there was no time to tell you oh oh you have come all the way for nothing oh and oh your generosity please pardon me i am rude i am no better than a peasant and i,i never suggested that for a moment you are honourable i am sure but are you wise and let me remind you that we want her with us at home her little daughter will be motherless our home will be broken up if you grant my request you will earn our thanks and you will not be without a reward for your disappointment,Mr. Herriton,M,major,M,major,1,1,1,1,0,1,1,1,1,1,1,1,1,1,1,1,1,1
00577,Signor Carella,Mr. Herriton,553,559,why have you not written why do you take me by surprise,i left a message,Mr. Herriton,M,major,M,major,0,1,0,1,0,1,1,1,0,1,0,0,0,0,0,1,0,0
00578,Signor Carella,Mr. Herriton,558,724,friends a relative a brother fra filippo who has come all the way from england and never written,and that i have mia sorella poor harriet one more wrench and it will all be over for her we are leaving this evening,Mr. Herriton,M,major,M,major,1,1,1,1,0,1,1,1,1,0,1,1,0,1,0,1,1,1
00579,Signor Carella,Mr. Herriton,649,722,signorina do stop a little after all your kindness,well i have done my best i shall face my mother with a good conscience will you bear me witness that i ve done my best,Caroline Abbott; Mr. Herriton,M,major,M,major,1,1,1,0,0,0,1,1,1,1,1,0,1,1,0,1,1,0
00580,Signor Carella,Mr. Herriton,652,785,well your business,my sister is ill and miss abbott is guiltless i should be glad if you did not have to trouble them it is through me it happened because i was cowardly and idle i have come to know what you will do gently man gently he is not here break down gino you must break down scream and curse and give in for a little you must break down it is time to be unhappy break down or you will be ill like my sister you will go gino you are to do what you like with me gino your son is dead gino he died in my arms remember it does not excuse me but he did die in my arms you brute kill me if you like but just you leave my broken arm alone do what you like but think first,Mr. Herriton,M,major,M,major,0,0,0,1,0,0,1,0,0,1,1,1,1,1,1,1,1,1
00581,Signor Carella,Mr. Herriton,721,146,ah the ladies the ladies,i sleep at the globo and start for sawston tomorrow morning early he has assaulted me i could prosecute him but shall not,Mr. Herriton,M,major,M,major,1,0,0,0,0,0,0,0,0,1,1,1,0,0,1,1,1,0
00582,Signor Carella,Mr. Herriton,723,142,my poor fellow i will,what about a thousand lire you can have them tonight,Mr. Herriton,M,major,M,major,0,1,0,0,0,0,1,0,0,1,1,0,1,1,0,1,1,1
00583,Signor Carella,Mr. Herriton,725,650,then you will not be here this evening as you promised us all three leaving,what is it,Mr. Herriton,M,major,M,major,0,1,1,1,1,1,1,1,1,0,1,0,0,1,0,0,0,0
00584,Signor Carella,Mr. Herriton,784,801,so you are back how glad i am we are all waiting,yes thank you gino finish it all,Mr. Herriton,M,major,M,major,0,1,1,1,0,0,1,0,1,0,0,0,0,1,0,1,0,1
00585,Signor Carella,Mr. Herriton,800,144,philip have you had enough milk,but why,Caroline Abbott; Mr. Herriton; Perfetta,M,major,M,major,0,1,0,0,0,0,1,0,1,0,0,1,1,0,0,0,0,0
00586,Signor Carella,Mr. Herriton,802,803,it does not matter it does not matter it will never be wanted any more,he will have to marry her i heard from him this morning just as we left milan he finds he has gone too far to back out it would be expensive i don t know how much he minds not as much as we suppose i think at all events there s not a word of blame in the letter i don t believe he even feels angry i never was so completely forgiven ever since you stopped him killing me it has been a vision of perfect friendship he nursed me he lied for me at the inquest and at the funeral though he was crying you would have thought it was my son who had died certainly i was the only person he had to be kind to he was so distressed not to make harriet s acquaintance and that he scarcely saw anything of you in his letter he says so again,Caroline Abbott; Mr. Herriton; Perfetta,M,major,M,major,0,1,0,1,1,1,0,0,1,1,1,1,1,1,1,1,1,1
00587,Lilia,Signor Carella,151,169,oh you idle boy go and play pallone,yes in a way,Signor Carella,F,intermediate,M,major,0,0,1,0,0,0,1,0,0,1,0,0,0,0,0,0,1,0
00588,Lilia,Signor Carella,153,225,go and see your friends then,this is italy,Signor Carella,F,intermediate,M,major,0,0,1,0,0,0,1,0,0,0,1,0,0,1,0,0,0,0
00589,Lilia,Signor Carella,155,160,silly silly silly you can t stop indoors all day,but you would be right they are not for you many of them are in trade and even we are little more you should have gentlefolk and nobility for your friends,Signor Carella,F,intermediate,M,major,0,1,0,0,0,0,1,0,1,0,1,1,1,0,1,1,1,1
00590,Lilia,Signor Carella,157,152,now gino don t be silly go and see your friends and bring them to see me we both of us like society i m ready too for people now i mean to wake you all up just as i woke up sawston let s have plenty of men and make them bring their womenkind i mean to have real english tea parties,i am a married man i do not play games any more,Signor Carella,F,intermediate,M,major,0,1,1,1,0,0,1,1,1,1,1,0,0,0,1,1,0,1
00591,Lilia,Signor Carella,159,163,i never said such a,oh yes but of course i scarcely know them,Signor Carella,F,intermediate,M,major,1,0,0,1,0,1,1,0,0,0,0,1,1,0,0,1,1,0
00592,Lilia,Signor Carella,162,175,but besides your relatives i must have other people here your friends have wives and sisters haven t they,ouf pouf how hot it is in here no air i sweat all over i expire i must cool myself or i shall never get to sleep and i though i am young am at all events a man and know what is right,Signor Carella,F,intermediate,M,major,0,1,1,1,0,0,1,1,0,1,1,1,1,1,1,1,1,1
00593,Lilia,Signor Carella,164,171,not know your friends people,the marchese sometimes and the canons of the collegiate church,Signor Carella,F,intermediate,M,major,0,0,0,0,0,1,1,0,0,1,0,1,0,0,0,0,1,0
00594,Lilia,Signor Carella,168,227,there we are do you know them,i am your husband,Signor Carella,F,intermediate,M,major,0,1,0,1,0,0,1,0,0,0,1,0,0,0,0,1,0,0
00595,Lilia,Signor Carella,170,158,i see they look down on you do they poor boy wait wait i ll soon stop that now who else is there,there is my aunt and her husband but i thought you did not want to receive my relatives,Signor Carella,F,intermediate,M,major,0,1,0,1,1,0,1,1,0,0,1,1,1,0,1,1,1,0
00596,Lilia,Signor Carella,174,154,oh i forgot your horrid celibacy in england they would be the centre of everything but why shouldn t i know them would it make it easier if i called all round isn t that your foreign way but i must know some one who were the men you were talking to this afternoon but gino dear if they re low class why did you talk to them don t you care about your position,i have no friends now,Signor Carella,F,intermediate,M,major,1,1,1,1,1,0,1,1,1,0,1,0,1,0,1,1,0,0
00597,Lilia,Signor Carella,224,165,i always do it in england,why no if they are poor and have to work for their living i may see them but not otherwise except,Signor Carella,F,intermediate,M,major,0,1,0,1,1,0,1,1,0,0,1,1,1,0,1,1,1,0
00598,Lilia,Signor Carella,226,237,yes but i m older than you and i ll settle,ah who could help it i who thought you knew and saw nothing i am tricked i am conquered i give in let us talk of it no more,Signor Carella,F,intermediate,M,major,0,0,1,0,0,0,1,1,0,0,1,1,0,1,1,1,1,1
00599,Lilia,Signor Carella,236,156,you laugh,i want to see no one but you,Perfetta; Signor Carella,F,intermediate,M,major,0,0,0,0,0,0,1,0,0,0,0,1,0,1,1,1,1,0
00600,Lilia,Signor Carella,240,241,it s nothing,my love my dearest lilia be calm i have never loved any one but you i have prayed all night for a boy,Signor Carella,F,intermediate,M,major,0,0,0,0,1,1,0,0,0,1,1,1,1,0,1,1,1,1
00601,Lilia,Signor Carella,242,243,you are a boy yourself gino,then we shall be brothers,Signor Carella,F,intermediate,M,major,1,1,0,0,0,0,1,0,0,0,1,1,0,0,0,1,0,0
00602,Spiridione,Signor Carella,178,191,they all do it myself excepted but tell me more she is english that is good very good an english wife is very good indeed and she is rich,but you would be surprised had she told me twenty eight i should not have disbelieved her,Signor Carella,M,intermediate,M,major,1,1,1,1,1,0,1,0,1,0,1,1,0,0,1,1,0,1
00603,Spiridione,Signor Carella,182,209,is it possible,i am a catholic but of course i never go to church,Signor Carella,M,intermediate,M,major,0,1,0,0,1,0,0,0,0,1,1,1,1,0,1,1,1,0
