quoteID,quoteText,quoteBy,quoteTo
Q342,they arise chiefly from what is passing at the time and though i sometimes amuse myself with suggesting and arranging such little elegant compliments as may be adapted to ordinary occasions i always wish to give them as unstudied an air as possible,Mr. Collins,"['Mary', 'Elizabeth', 'Lydia', 'Mrs. Bennet', 'Kitty', 'Jane', 'Mr. Bennet']"
Q343,do you know mama that my uncle philips talks of turning away richard and if he does colonel forster will hire him my aunt told me so herself on saturday i shall walk to meryton to morrow to hear more about it and to ask when mr denny comes back from town,Lydia,"['Mary', 'Elizabeth', 'Mrs. Bennet', 'Kitty', 'Jane', 'Mr. Collins', 'Mr. Bennet']"
Q344,i have often observed how little young ladies are interested by books of a serious stamp though written solely for their benefit it amazes me i confess for certainly there can be nothing so advantageous to them as instruction but i will no longer importune my young cousin,Mr. Collins,"['Mary', 'Elizabeth', 'Lydia', 'Mrs. Bennet', 'Kitty', 'Jane', 'Mr. Bennet']"
Q345,as to her younger daughters she could not take upon her to say she could not positively answer but she did not know of any prepossession her eldest daughter she must just mention she felt it incumbent on her to hint was likely to be very soon engaged,Mrs. Bennet,['Mr. Collins']
Q346,i know little of the game at present but i shall be glad to improve myself for in my situation of life,Mr. Collins,"['Mary', 'Elizabeth', 'Lydia', 'Kitty', 'Jane', 'Mrs. Philips', 'George Wickham', 'Mr. Philips']"
Q347,about a month he is a man of very large property in derbyshire i understand,Elizabeth,['George Wickham']
Q348,yes his estate there is a noble one a clear ten thousand per annum you could not have met with a person more capable of giving you certain information on that head than myself for i have been connected with his family in a particular manner from my infancy,George Wickham,['Elizabeth']
Q349,you may well be surprised miss bennet at such an assertion after seeing as you probably might the very cold manner of our meeting yesterday are you much acquainted with mr darcy,George Wickham,['Elizabeth']
Q350,as much as i ever wish to be i have spent four days in the same house with him and i think him very disagreeable,Elizabeth,['George Wickham']
Q351,i have no right to give my opinion as to his being agreeable or otherwise i am not qualified to form one i have known him too long and too well to be a fair judge it is impossible for me to be impartial but i believe your opinion of him would in general astonish and perhaps you would not express it quite so strongly anywhere else here you are in your own family,George Wickham,['Elizabeth']
Q352,upon my word i say no more here than i might say in any house in the neighbourhood except netherfield he is not at all liked in hertfordshire every body is disgusted with his pride you will not find him more favourably spoken of by any one,Elizabeth,['George Wickham']
Q353,i cannot pretend to be sorry that he or that any man should not be estimated beyond their deserts but with him i believe it does not often happen the world is blinded by his fortune and consequence or frightened by his high and imposing manners and sees him only as he chuses to be seen,George Wickham,['Elizabeth']
Q354,i should take him even on my slight acquaintance to be an ill tempered man,Elizabeth,['George Wickham']
Q355,i wonder whether he is likely to be in this country much longer,George Wickham,['Elizabeth']
Q356,i do not at all know but i heard nothing of his going away when i was at netherfield i hope your plans in favour of the shire will not be affected by his being in the neighbourhood,Elizabeth,['George Wickham']
Q357,oh no it is not for me to be driven away by mr darcy if he wishes to avoid seeing me he must go we are not on friendly terms and it always gives me pain to meet him but i have no reason for avoiding him but what i might proclaim to all the world a sense of very great ill usage and most painful regrets at his being what he is his father miss bennet the late mr darcy was one of the best men that ever breathed and the truest friend i ever had and i can never be in company with this mr darcy without being grieved to the soul by a thousand tender recollections his behaviour to myself has been scandalous but i verily believe i could forgive him any thing and every thing rather than his disappointing the hopes and disgracing the memory of his father,George Wickham,['Elizabeth']
Q358,it was the prospect of constant society and good society which was my chief inducement to enter the shire i knew it to be a most respectable agreeable corps and my friend denny tempted me farther by his account of their present quarters and the very great attentions and excellent acquaintance meryton had procured them society i own is necessary to me i have been a disappointed man and my spirits will not bear solitude i must have employment and society a military life is not what i was intended for but circumstances have now made it eligible the church ought to have been my profession i was brought up for the church and i should at this time have been in possession of a most valuable living had it pleased the gentleman we were speaking of just now,George Wickham,['Elizabeth']
Q359,indeed,Elizabeth,['George Wickham']
Q360,yes the late mr darcy bequeathed me the next presentation of the best living in his gift he was my godfather and excessively attached to me i cannot do justice to his kindness he meant to provide for me amply and thought he had done it but when the living fell it was given elsewhere,George Wickham,['Elizabeth']
Q361,good heavens but how could that be how could his will be disregarded why did not you seek legal redress,Elizabeth,['George Wickham']
Q362,there was just such an informality in the terms of the bequest as to give me no hope from law a man of honour could not have doubted the intention but mr darcy chose to doubt it or to treat it as a merely conditional recommendation and to assert that i had forfeited all claim to it by extravagance imprudence in short any thing or nothing certain it is that the living became vacant two years ago exactly as i was of an age to hold it and that it was given to another man and no less certain is it that i cannot accuse myself of having really done any thing to deserve to lose it i have a warm unguarded temper and i may perhaps have sometimes spoken my opinion of him and to him too freely i can recal nothing worse but the fact is that we are very different sort of men and that he hates me,George Wickham,['Elizabeth']
Q363,this is quite shocking he deserves to be publicly disgraced,Elizabeth,['George Wickham']
Q364,some time or other he will be but it shall not be by me till i can forget his father i can never defy or expose him,George Wickham,['Elizabeth']
Q365,but what can have been his motive what can have induced him to behave so cruelly,Elizabeth,['George Wickham']
Q366,a thorough determined dislike of me a dislike which i cannot but attribute in some measure to jealousy had the late mr darcy liked me less his son might have borne with me better but his father s uncommon attachment to me irritated him i believe very early in life he had not a temper to bear the sort of competition in which we stood the sort of preference which was often given me,George Wickham,['Elizabeth']
Q367,i had not thought mr darcy so bad as this though i have never liked him i had not thought so very ill of him i had supposed him to be despising his fellow creatures in general but did not suspect him of descending to such malicious revenge such injustice such inhumanity as this,Elizabeth,['George Wickham']
Q368,i do remember his boasting one day at netherfield of the implacability of his resentments of his having an unforgiving temper his disposition must be dreadful,Elizabeth,['George Wickham']
Q369,i will not trust myself on the subject i can hardly be just to him,George Wickham,['Elizabeth']
Q370,to treat in such a manner the god son the friend the favourite of his father a young man too like you whose very countenance may vouch for your being amiable and one too who had probably been his own companion from childhood connected together as i think you said in the closest manner,Elizabeth,['George Wickham']
Q371,we were born in the same parish within the same park the greatest part of our youth was passed together inmates of the same house sharing the same amusements objects of the same parental care my father began life in the profession which your uncle mr philips appears to do so much credit to but he gave up every thing to be of use to the late mr darcy and devoted all his time to the care of the pemberley property he was most highly esteemed by mr darcy a most intimate confidential friend mr darcy often acknowledged himself to be under the greatest obligations to my father s active superintendance and when immediately before my father s death mr darcy gave him a voluntary promise of providing for me i am convinced that he felt it to be as much a debt of gratitude to him as of affection to myself,George Wickham,['Elizabeth']
Q372,how strange how abominable i wonder that the very pride of this mr darcy has not made him just to you if from no better motive that he should not have been too proud to be dishonest for dishonesty i must call it,Elizabeth,['George Wickham']
Q373,it is wonderful for almost all his actions may be traced to pride and pride has often been his best friend it has connected him nearer with virtue than any other feeling but we are none of us consistent and in his behaviour to me there were stronger impulses even than pride,George Wickham,['Elizabeth']
Q374,can such abominable pride as his have ever done him good,Elizabeth,['George Wickham']
Q375,yes it has often led him to be liberal and generous to give his money freely to display hospitality to assist his tenants and relieve the poor family pride and filial pride for he is very proud of what his father was have done this not to appear to disgrace his family to degenerate from the popular qualities or lose the influence of the pemberley house is a powerful motive he has also brotherly pride which with some brotherly affection makes him a very kind and careful guardian of his sister and you will hear him generally cried up as the most attentive and best of brothers,George Wickham,['Elizabeth']
Q376,what sort of a girl is miss darcy,Elizabeth,['George Wickham']
Q377,i wish i could call her amiable it gives me pain to speak ill of a darcy but she is too much like her brother very very proud as a child she was affectionate and pleasing and extremely fond of me and i have devoted hours and hours to her amusement but she is nothing to me now she is a handsome girl about fifteen or sixteen and i understand highly accomplished since her father s death her home has been london where a lady lives with her and superintends her education,George Wickham,['Elizabeth']
Q378,i am astonished at his intimacy with mr bingley how can mr bingley who seems good humour itself and is i really believe truly amiable be in friendship with such a man how can they suit each other do you know mr bingley,Elizabeth,['George Wickham']
Q379,not at all,George Wickham,['Elizabeth']
Q380,he is a sweet tempered amiable charming man he cannot know what mr darcy is,Elizabeth,['George Wickham']
Q381,probably not but mr darcy can please where he chuses he does not want abilities he can be a conversible companion if he thinks it worth his while among those who are at all his equals in consequence he is a very different man from what he is to the less prosperous his pride never deserts him but with the rich he is liberal minded just sincere rational honourable and perhaps agreeable allowing something for fortune and figure,George Wickham,['Elizabeth']
Q382,i know very well madam that when persons sit down to a card table they must take their chance of these things and happily i am not in such circumstances as to make five shillings any object there are undoubtedly many who could not say the same but thanks to lady catherine de bourgh i am removed far beyond the necessity of regarding little matters,Mr. Collins,"['Mary', 'Elizabeth', 'Lydia', 'Kitty', 'Jane', 'Mrs. Philips', 'George Wickham']"
Q383,lady catherine de bourgh has very lately given him a living i hardly know how mr collins was first introduced to her notice but he certainly has not known her long,Elizabeth,['George Wickham']
Q384,you know of course that lady catherine de bourgh and lady anne darcy were sisters consequently that she is aunt to the present mr darcy,George Wickham,['Elizabeth']
Q385,no indeed i did not i knew nothing at all of lady catherine s connections i never heard of her existence till the day before yesterday,Elizabeth,['George Wickham']
Q386,her daughter miss de bourgh will have a very large fortune and it is believed that she and her cousin will unite the two estates,George Wickham,['Elizabeth']
Q387,mr collins speaks highly both of lady catherine and her daughter but from some particulars that he has related of her ladyship i suspect his gratitude misleads him and that in spite of her being his patroness she is an arrogant conceited woman,Elizabeth,['George Wickham']
Q388,i believe her to be both in a great degree i have not seen her for many years but i very well remember that i never liked her and that her manners were dictatorial and insolent she has the reputation of being remarkably sensible and clever but i rather believe she derives part of her abilities from her rank and fortune part from her authoritative manner and the rest from the pride of her nephew who chuses that every one connected with him should have an understanding of the first class,George Wickham,['Elizabeth']
Q389,they have both been deceived i dare say in some way or other of which we can form no idea interested people have perhaps misrepresented each to the other it is in short impossible for us to conjecture the causes or circumstances which may have alienated them without actual blame on either side,Jane,['Elizabeth']
Q390,very true indeed and now my dear jane what have you got to say in behalf of the interested people who have probably been concerned in the business do clear them too or we shall be obliged to think ill of somebody,Elizabeth,['Jane']
Q391,laugh as much as you chuse but you will not laugh me out of my opinion my dearest lizzy do but consider in what a disgraceful light it places mr darcy to be treating his father s favourite in such a manner one whom his father had promised to provide for it is impossible no man of common humanity no man who had any value for his character could be capable of it can his most intimate friends be so excessively deceived in him oh no,Jane,['Elizabeth']
Q392,i can much more easily believe mr bingley s being imposed on than that mr wickham should invent such a history of himself as he gave me last night names facts every thing mentioned without ceremony if it be not so let mr darcy contradict it besides there was truth in his looks,Elizabeth,['Jane']
Q393,it is difficult indeed it is distressing one does not know what to think,Jane,['Elizabeth']
Q394,i beg your pardon one knows exactly what to think,Elizabeth,['Jane']
Q395,while i can have my mornings to myself it is enough i think it no sacrifice to join occasionally in evening engagements society has claims on us all and i profess myself one of those who consider intervals of recreation and amusement as desirable for every body,Mary,"['Elizabeth', 'Lydia', 'Mrs. Bennet', 'Kitty', 'Jane', 'Mr. Bennet']"
Q396,i am by no means of opinion i assure you that a ball of this kind given by a young man of character to respectable people can have any evil tendency and i am so far from objecting to dancing myself that i shall hope to be honoured with the hands of all my fair cousins in the course of the evening and i take this opportunity of soliciting yours miss elizabeth for the two first dances especially a preference which i trust my cousin jane will attribute to the right cause and not to any disrespect for her,Mr. Collins,['Elizabeth']
Q397,i do not imagine his business would have called him away just now if he had not wished to avoid a certain gentleman here,Mr. Denney,"['Elizabeth', 'Lydia']"
Q398,i dare say you will find him very agreeable,Charlotte Lucas,['Elizabeth']
Q399,heaven forbid that would be the greatest misfortune of all to find a man agreeable whom one is determined to hate do not wish me such an evil,Elizabeth,['Charlotte Lucas']
Q400,it is your turn to say something now mr darcy i talked about the dance and you ought to make some kind of remark on the size of the room or the number of couples,Elizabeth,['Mr. Darcy']
Q401,very well that reply will do for the present perhaps by and bye i may observe that private balls are much pleasanter than public ones but now we may be silent,Elizabeth,['Mr. Darcy']
Q402,do you talk by rule then while you are dancing,Mr. Darcy,['Elizabeth']
Q403,sometimes one must speak a little you know it would look odd to be entirely silent for half an hour together and yet for the advantage of some conversation ought to be so arranged as that they may have the trouble of saying as little as possible,Elizabeth,['Mr. Darcy']
Q404,are you consulting your own feelings in the present case or do you imagine that you are gratifying mine,Mr. Darcy,['Elizabeth']
Q405,both for i have always seen a great similarity in the turn of our minds we are each of an unsocial taciturn disposition unwilling to speak unless we expect to say something that will amaze the whole room and be handed down to posterity with all the eclat of a proverb,Elizabeth,['Mr. Darcy']
Q406,this is no very striking resemblance of your own character i am sure how near it may be to mine i cannot pretend to say you think it a faithful portrait undoubtedly,Mr. Darcy,['Elizabeth']
Q407,i must not decide on my own performance,Elizabeth,['Mr. Darcy']
Q408,when you met us there the other day we had just been forming a new acquaintance,Elizabeth,['Mr. Darcy']
Q409,mr wickham is blessed with such happy manners as may ensure his making friends whether he may be equally capable of retaining them is less certain,Mr. Darcy,['Elizabeth']
Q410,he has been so unlucky as to lose your friendship and in a manner which he is likely to suffer from all his life,Elizabeth,['Mr. Darcy']
Q411,i have been most highly gratified indeed my dear sir such very superior dancing is not often seen it is evident that you belong to the first circles allow me to say however that your fair partner does not disgrace you and that i must hope to have this pleasure often repeated especially when a certain desirable event my dear miss eliza glancing at her sister and bingley shall take place what congratulations will then flow in i appeal to mr darcy but let me not interrupt you sir you will not thank me for detaining you from the bewitching converse of that young lady whose bright eyes are also upbraiding me,Sir William Lucas,"['Mr. Darcy', 'Elizabeth']"
Q412,sir william s interruption has made me forget what we were talking of,Mr. Darcy,['Elizabeth']
Q413,i do not think we were speaking at all sir william could not have interrupted any two people in the room who had less to say for themselves we have tried two or three subjects already without success and what we are to talk of next i cannot imagine,Elizabeth,['Mr. Darcy']
Q414,what think you of books,Mr. Darcy,['Elizabeth']
Q415,books oh no i am sure we never read the same or not with the same feelings,Elizabeth,['Mr. Darcy']
Q416,i am sorry you think so but if that be the case there can at least be no want of subject we may compare our different opinions,Mr. Darcy,['Elizabeth']
Q417,no i cannot talk of books in a ball room my head is always full of something else,Elizabeth,['Mr. Darcy']
Q418,the present always occupies you in such scenes does it,Mr. Darcy,['Elizabeth']
Q419,yes always,Elizabeth,['Mr. Darcy']
Q420,i remember hearing you once say mr darcy that you hardly ever forgave that your resentment once created was unappeasable you are very cautious i suppose as to its being created,Elizabeth,['Mr. Darcy']
Q421,i am,Mr. Darcy,['Elizabeth']
Q422,and never allow yourself to be blinded by prejudice,Elizabeth,['Mr. Darcy']
Q423,i hope not,Mr. Darcy,['Elizabeth']
Q424,it is particularly incumbent on those who never change their opinion to be secure of judging properly at first,Elizabeth,['Mr. Darcy']
Q425,may i ask to what these questions tend,Mr. Darcy,['Elizabeth']
Q426,merely to the illustration of your character i am trying to make it out,Elizabeth,['Mr. Darcy']
Q427,and what is your success,Mr. Darcy,['Elizabeth']
Q428,i do not get on at all i hear such different accounts of you as puzzle me exceedingly,Elizabeth,['Mr. Darcy']
Q429,i can readily believe that report may vary greatly with respect to me and i could wish miss bennet that you were not to sketch my character at the present moment as there is reason to fear that the performance would reflect no credit on either,Mr. Darcy,['Elizabeth']
Q430,but if i do not take your likeness now i may never have another opportunity,Elizabeth,['Mr. Darcy']
Q431,i would by no means suspend any pleasure of yours,Mr. Darcy,['Elizabeth']
Q432,so miss eliza i hear you are quite delighted with george wickham your sister has been talking to me about him and asking me a thousand questions and i find that the young man forgot to tell you among his other communications that he was the son of old wickham the late mr darcy s steward let me recommend you however as a friend not to give implicit confidence to all his assertions for as to mr darcy s using him ill it is perfectly false for on the contrary he has been always remarkably kind to him though george wickham has treated mr darcy in a most infamous manner i do not know the particulars but i know very well that mr darcy is not in the least to blame that he cannot bear to hear george wickham mentioned and that though my brother thought he could not well avoid including him in his invitation to the officers he was excessively glad to find that he had taken himself out of the way his coming into the country at all is a most insolent thing indeed and i wonder how he could presume to do it i pity you miss eliza for this discovery of your favourite s guilt but really considering his descent one could not expect much better,Miss Bingley,['Elizabeth']
Q433,his guilt and his descent appear by your account to be the same for i have heard you accuse him of nothing worse than of being the son of mr darcy s steward and of that i can assure you he informed me himself,Elizabeth,['Miss Bingley']
Q434,i beg your pardon excuse my interference it was kindly meant,Miss Bingley,['Elizabeth']
Q435,insolent girl you are much mistaken if you expect to influence me by such a paltry attack as this i see nothing in it but your own wilful ignorance and the malice of mr darcy,Elizabeth,['Elizabeth']
Q436,i want to know what you have learnt about mr wickham but perhaps you have been too pleasantly engaged to think of any third person in which case you may be sure of my pardon,Elizabeth,['Jane']
Q437,no i have not forgotten him but i have nothing satisfactory to tell you mr bingley does not know the whole of his history and is quite ignorant of the circumstances which have principally offended mr darcy but he will vouch for the good conduct the probity and honour of his friend and is perfectly convinced that mr wickham has deserved much less attention from mr darcy than he has received and i am sorry to say that by his account as well as his sister s mr wickham is by no means a respectable young man i am afraid he has been very imprudent and has deserved to lose mr darcy s regard,Jane,['Elizabeth']
Q438,mr bingley does not know mr wickham himself,Elizabeth,['Jane']
Q439,no he never saw him till the other morning at meryton,Jane,['Elizabeth']
Q440,this account then is what he has received from mr darcy i am perfectly satisfied but what does he say of the living,Elizabeth,['Jane']
Q441,he does not exactly recollect the circumstances though he has heard them from mr darcy more than once but he believes that it was left to him conditionally only,Jane,['Elizabeth']
Q442,i have not a doubt of mr bingley s sincerity but you must excuse my not being convinced by assurances only mr bingley s defence of his friend was a very able one i dare say but since he is unacquainted with several parts of the story and has learnt the rest from that friend himself i shall venture still to think of both gentlemen as i did before,Elizabeth,['Jane']
Q443,i have found out by a singular accident that there is now in the room a near relation of my patroness i happened to overhear the gentleman himself mentioning to the young lady who does the honours of this house the names of his cousin miss de bourgh and of her mother lady catherine how wonderfully these sort of things occur who would have thought of my meeting with perhaps a nephew of lady catherine de bourgh in this assembly i am most thankful that the discovery is made in time for me to pay my respects to him which i am now going to do and trust he will excuse my not having done it before my total ignorance of the connection must plead my apology,Mr. Collins,"['Elizabeth', 'Charlotte Lucas']"
Q444,you are not going to introduce yourself to mr darcy,Elizabeth,"['Mr. Collins', 'Charlotte Lucas']"
Q445,indeed i am i shall intreat his pardon for not having done it earlier i believe him to be lady catherine s nephew it will be in my power to assure him that her ladyship was quite well yesterday se night,Mr. Collins,"['Elizabeth', 'Charlotte Lucas']"
