quoteID,quoteText,quoteBy,quoteTo
Q830,i say no more than the truth and what every body will say that knows him i have never had a cross word from him in my life and i have known him ever since he was four years old,Mrs. Reynolds,"['Elizabeth', 'Mrs. Gardiner', 'Mr. Gardiner']"
Q831,there are very few people of whom so much can be said you are lucky in having such a master,Mr. Gardiner,"['Elizabeth', 'Mrs. Reynolds', 'Mrs. Gardiner']"
Q832,yes sir i know i am if i was to go through the world i could not meet with a better but i have always observed that they who are good natured when children are good natured when they grow up and he was always the sweetest tempered most generous hearted boy in the world,Mrs. Reynolds,"['Elizabeth', 'Mrs. Gardiner', 'Mr. Gardiner']"
Q833,can this be mr darcy,Elizabeth,[]
Q834,his father was an excellent man,Mrs. Gardiner,"['Elizabeth', 'Mrs. Reynolds', 'Mr. Gardiner']"
Q835,yes ma am that he was indeed and his son will be just like him just as affable to the poor,Mrs. Reynolds,"['Elizabeth', 'Mrs. Gardiner', 'Mr. Gardiner']"
Q836,he is the best landlord and the best master that ever lived not like the wild young men now a days who think of nothing but themselves there is not one of his tenants or servants but what will give him a good name some people call him proud but i am sure i never saw any thing of it to my fancy it is only because he does not rattle away like other young men,Mrs. Reynolds,"['Elizabeth', 'Mrs. Gardiner', 'Mr. Gardiner']"
Q837,in what an amiable light does this place him,Elizabeth,[]
Q838,this fine account of him is not quite consistent with his behaviour to our poor friend,Mrs. Gardiner,['Elizabeth']
Q839,perhaps we might be deceived,Elizabeth,['Mrs. Gardiner']
Q840,that is not very likely our authority was too good,Mrs. Gardiner,['Elizabeth']
Q841,he is certainly a good brother,Elizabeth,"['Mrs. Gardiner', 'Mr. Gardiner', 'Mrs. Reynolds']"
Q842,and this is always the way with him whatever can give his sister any pleasure is sure to be done in a moment there is nothing he would not do for her,Mrs. Reynolds,"['Elizabeth', 'Mrs. Gardiner', 'Mr. Gardiner']"
Q843,delightful charming,Elizabeth,"['Mrs. Gardiner', 'Mr. Darcy', 'Mr. Gardiner']"
Q844,what will be his surprise when he knows who they are he takes them now for people of fashion,Elizabeth,[]
Q845,why is he so altered from what can it proceed it cannot be for me it cannot be for my sake that his manners are thus softened my reproofs at hunsford could not work such a change as this it is impossible that he should still love me,Elizabeth,[]
Q846,for your housekeeper informed us that you would certainly not be here till to morrow and indeed before we left bakewell we understood that you were not immediately expected in the country,Elizabeth,"['Mrs. Gardiner', 'Mr. Darcy', 'Mr. Gardiner']"
Q847,they will join me early to morrow and among them are some who will claim an acquaintance with you mr bingley and his sisters there is also one other person in the party who more particularly wishes to be known to you will you allow me or do i ask too much to introduce my sister to your acquaintance during your stay at lambton,Mr. Darcy,"['Elizabeth', 'Mrs. Gardiner', 'Mr. Gardiner']"
Q848,he is perfectly well behaved polite and unassuming,Mr. Gardiner,"['Elizabeth', 'Mrs. Gardiner']"
Q849,there is something a little stately in him to be sure but it is confined to his air and is not unbecoming i can now say with the housekeeper that though some people may call him proud i have seen nothing of it,Mrs. Gardiner,"['Elizabeth', 'Mr. Gardiner']"
Q850,i was never more surprised than by his behaviour to us it was more than civil it was really attentive and there was no necessity for such attention his acquaintance with elizabeth was very trifling,Mr. Gardiner,"['Elizabeth', 'Mrs. Gardiner']"
Q851,to be sure lizzy he is not so handsome as wickham or rather he has not wickham s countenance for his features are perfectly good but how came you to tell us that he was so disagreeable,Mrs. Gardiner,"['Elizabeth', 'Mr. Gardiner']"
Q852,but perhaps he may be a little whimsical in his civilities your great men often are and therefore i shall not take him at his word about fishing as he might change his mind another day and warn me off his grounds,Mr. Gardiner,"['Elizabeth', 'Mrs. Gardiner']"
Q853,from what we have seen of him i really should not have thought that he could have behaved in so cruel a way by any body as he has done by poor wickham he has not an ill natured look on the contrary there is something pleasing about his mouth when he speaks and there is something of dignity in his countenance that would not give one an unfavourable idea of his heart but to be sure the good lady who shewed us the house did give him a most flaming character i could hardly help laughing aloud sometimes but he is a liberal master i suppose and that in the eye of a servant comprehends every virtue,Mrs. Gardiner,"['Elizabeth', 'Mr. Gardiner']"
Q854,it is above eight months we have not met since the 26th of november when we were all dancing together at netherfield,Mr. Bingley,['Elizabeth']
Q855,pray miss eliza are not the shire militia removed from meryton they must be a great loss to your family,Miss Bingley,"['Mr. Darcy', 'Elizabeth', 'Mrs. Gardiner', 'Mr. Gardiner', 'Mr. Bingley', 'Miss Darcy']"
Q856,how very ill eliza bennet looks this morning mr darcy i never in my life saw any one so much altered as she is since the winter she is grown so brown and coarse louisa and i were agreeing that we should not have known her again,Miss Bingley,"['Miss Darcy', 'Mr. Darcy']"
Q857,for my own part i must confess that i never could see any beauty in her her face is too thin her complexion has no brilliancy and her features are not at all handsome her nose wants character there is nothing marked in its lines her teeth are tolerable but not out of the common way and as for her eyes which have sometimes been called so fine i never could perceive any thing extraordinary in them they have a sharp shrewish look which i do not like at all and in her air altogether there is a self sufficiency without fashion which is intolerable,Miss Bingley,"['Miss Darcy', 'Mr. Darcy']"
Q858,i remember when we first knew her in hertfordshire how amazed we all were to find that she was a reputed beauty and i particularly recollect your saying one night after they had been dining at netherfield but afterwards she seemed to improve on you and i believe you thought her rather pretty at one time,Miss Bingley,"['Miss Darcy', 'Mr. Darcy']"
Q859,yes but that was only when i first knew her for it is many months since i have considered her as one of the handsomest women of my acquaintance,Mr. Darcy,"['Miss Bingley', 'Miss Darcy']"
Q860,oh where where is my uncle,Elizabeth,['Elizabeth']
Q861,i beg your pardon but i must leave you i must find mr gardiner this moment on business that cannot be delayed i have not an instant to lose,Elizabeth,['Mr. Darcy']
Q862,good god what is the matter i will not detain you a minute but let me or let the servant go after mr and mrs gardiner you are not well enough you cannot go yourself,Mr. Darcy,['Elizabeth']
Q863,let me call your maid is there nothing you could take to give you present relief a glass of wine shall i get you one you are very ill,Mr. Darcy,['Elizabeth']
Q864,no i thank you there is nothing the matter with me i am quite well i am only distressed by some dreadful news which i have just received from longbourn,Elizabeth,['Mr. Darcy']
Q865,i have just had a letter from jane with such dreadful news it cannot be concealed from any one my youngest sister has left all her friends has eloped has thrown herself into the power of of mr wickham they are gone off together from brighton you know him too well to doubt the rest she has no money no connections nothing that can tempt him to she is lost for ever,Elizabeth,['Mr. Darcy']
Q866,when i consider that i might have prevented it i who knew what he was had i but explained some part of it only some part of what i learnt to my own family had his character been known this could not have happened but it is all all too late now,Elizabeth,['Mr. Darcy']
Q867,i am grieved indeed grieved shocked but is it certain absolutely certain,Mr. Darcy,['Elizabeth']
Q868,oh yes they left brighton together on sunday night and were traced almost to london but not beyond they are certainly not gone to scotland,Elizabeth,['Mr. Darcy']
Q869,and what has been done what has been attempted to recover her,Mr. Darcy,['Elizabeth']
Q870,my father is gone to london and jane has written to beg my uncle s immediate assistance and we shall be off i hope in half an hour but nothing can be done i know very well that nothing can be done how is such a man to be worked on how are they even to be discovered i have not the smallest hope it is every way horrible,Elizabeth,['Mr. Darcy']
Q871,when my eyes were opened to his real character oh had i known what i ought what i dared to do but i knew not i was afraid of doing too much wretched wretched mistake,Elizabeth,['Mr. Darcy']
Q872,i am afraid you have been long desiring my absence nor have i any thing to plead in excuse of my stay but real though unavailing concern would to heaven that any thing could be either said or done on my part that might offer consolation to such distress but i will not torment you with vain wishes which may seem purposely to ask for your thanks this unfortunate affair will i fear prevent my sister s having the pleasure of seeing you at pemberley to day,Mr. Darcy,['Elizabeth']
Q873,oh yes be so kind as to apologize for us to miss darcy say that urgent business calls us home immediately conceal the unhappy truth as long as it is possible i know it cannot be long,Elizabeth,['Mr. Darcy']
Q874,but what is to be done about pemberley john told us mr darcy was here when you sent for us was it so,Mrs. Gardiner,"['Elizabeth', 'Mr. Gardiner']"
Q875,yes and i told him we should not be able to keep our engagement that is all settled,Elizabeth,"['Mrs. Gardiner', 'Mr. Gardiner']"
Q876,that is all settled,Mrs. Gardiner,"['Elizabeth', 'Mr. Gardiner']"
Q877,and are they upon such terms as for her to disclose the real truth oh that i knew how it was,Mrs. Gardiner,['Mrs. Gardiner']
Q878,i have been thinking it over again elizabeth and really upon serious consideration i am much more inclined than i was to judge as your eldest sister does of the matter it appears to me so very unlikely that any young man should form such a design against a girl who is by no means unprotected or friendless and who was actually staying in his colonel s family that i am strongly inclined to hope the best could he expect that her friends would not step forward could he expect to be noticed again by the regiment after such an affront to colonel forster his temptation is not adequate to the risk,Mr. Gardiner,"['Elizabeth', 'Mrs. Gardiner']"
Q879,do you really think so,Elizabeth,"['Mrs. Gardiner', 'Mr. Gardiner']"
Q880,upon my word i begin to be of your uncle s opinion it is really too great a violation of decency honour and interest for him to be guilty of it i cannot think so very ill of wickham can you yourself lizzy so wholly give him up as to believe him capable of it,Mrs. Gardiner,"['Elizabeth', 'Mr. Gardiner']"
Q881,not perhaps of neglecting his own interest but of every other neglect i can believe him capable if indeed it should be so but i dare not hope it why should they not go on to scotland if that had been the case,Elizabeth,"['Mrs. Gardiner', 'Mr. Gardiner']"
Q882,in the first place there is no absolute proof that they are not gone to scotland,Mr. Gardiner,"['Elizabeth', 'Mrs. Gardiner']"
Q883,oh but their removing from the chaise into an hackney coach is such a presumption and besides no traces of them were to be found on the barnet road,Elizabeth,"['Mrs. Gardiner', 'Mr. Gardiner']"
Q884,well then supposing them to be in london they may be there though for the purpose of concealment for no more exceptionable purpose it is not likely that money should be very abundant on either side and it might strike them that they could be more economically though less expeditiously married in london than in scotland,Mr. Gardiner,"['Elizabeth', 'Mrs. Gardiner']"
Q885,but why all this secrecy why any fear of detection why must their marriage be private oh no no this is not likely his most particular friend you see by jane s account was persuaded of his never intending to marry her wickham will never marry a woman without some money he cannot afford it and what claims has lydia what attractions has she beyond youth health and good humour that could make him for her sake forego every chance of benefiting himself by marrying well as to what restraint the apprehension of disgrace in the corps might throw on a dishonourable elopement with her i am not able to judge for i know nothing of the effects that such a step might produce but as to your other objection i am afraid it will hardly hold good lydia has no brothers to step forward and he might imagine from my father s behaviour from his indolence and the little attention he has ever seemed to give to what was going forward in his family that he would do as little and think as little about it as any father could do in such a matter,Elizabeth,"['Mrs. Gardiner', 'Mr. Gardiner']"
Q886,but can you think that lydia is so lost to every thing but love of him as to consent to live with him on any other terms than marriage,Mr. Gardiner,"['Elizabeth', 'Mrs. Gardiner']"
Q887,it does seem and it is most shocking indeed that a sister s sense of decency and virtue in such a point should admit of doubt but really i know not what to say perhaps i am not doing her justice but she is very young she has never been taught to think on serious subjects and for the last half year nay for a twelvemonth she has been given up to nothing but amusement and vanity she has been allowed to dispose of her time in the most idle and frivolous manner and to adopt any opinions that came in her way since the shire were first quartered in meryton nothing but love flirtation and officers have been in her head she has been doing every thing in her power by thinking and talking on the subject to give greater what shall i call it susceptibility to her feelings which are naturally lively enough and we all know that wickham has every charm of person and address that can captivate a woman,Elizabeth,"['Mrs. Gardiner', 'Mr. Gardiner']"
Q888,but you see that jane does not think so ill of wickham as to believe him capable of the attempt,Mrs. Gardiner,"['Elizabeth', 'Mr. Gardiner']"
Q889,of whom does jane ever think ill and who is there whatever might be their former conduct that she would believe capable of such an attempt till it were proved against them but jane knows as well as i do what wickham really is we both know that he has been profligate in every sense of the word that he has neither integrity nor honour that he is as false and deceitful as he is insinuating,Elizabeth,"['Mrs. Gardiner', 'Mr. Gardiner']"
Q890,and do you really know all this,Mrs. Gardiner,"['Elizabeth', 'Mr. Gardiner']"
Q891,i do indeed i told you the other day of his infamous behaviour to mr darcy and you yourself when last at longbourn heard in what manner he spoke of the man who had behaved with such forbearance and liberality towards him and there are other circumstances which i am not at liberty which it is not worth while to relate but his lies about the whole pemberley family are endless from what he said of miss darcy i was thoroughly prepared to see a proud reserved disagreeable girl yet he knew to the contrary himself he must know that she was as amiable and unpretending as we have found her,Elizabeth,"['Mrs. Gardiner', 'Mr. Gardiner']"
Q892,but does lydia know nothing of this can she be ignorant of what you and jane seem so well to understand,Mrs. Gardiner,"['Elizabeth', 'Mr. Gardiner']"
Q893,oh yes that that is the worst of all till i was in kent and saw so much both of mr darcy and his relation colonel fitzwilliam i was ignorant of the truth myself and when i returned home the shire was to leave meryton in a week or fortnight s time as that was the case neither jane to whom i related the whole nor i thought it necessary to make our knowledge public for of what use could it apparently be to any one that the good opinion which all the neighbourhood had of him should then be overthrown and even when it was settled that lydia should go with mrs forster the necessity of opening her eyes to his character never occurred to me that she could be in any danger from the deception never entered my head that such a consequence as this should ensue you may easily believe was far enough from my thoughts,Elizabeth,"['Mrs. Gardiner', 'Mr. Gardiner']"
Q894,when they all removed to brighton therefore you had no reason i suppose to believe them fond of each other,Mrs. Gardiner,"['Elizabeth', 'Mr. Gardiner']"
Q895,not the slightest i can remember no symptom of affection on either side and had any thing of the kind been perceptible you must be aware that ours is not a family on which it could be thrown away when first he entered the corps she was ready enough to admire him but so we all were every girl in or near meryton was out of her senses about him for the first two months but he never distinguished her by any particular attention and consequently after a moderate period of extravagant and wild admiration her fancy for him gave way and others of the regiment who treated her with more distinction again became her favourites,Elizabeth,"['Mrs. Gardiner', 'Mr. Gardiner']"
Q896,not yet but now that my dear uncle is come i hope every thing will be well,Jane,['Elizabeth']
Q897,is my father in town,Elizabeth,['Jane']
Q898,yes he went on tuesday as i wrote you word,Jane,['Elizabeth']
Q899,and have you heard from him often,Elizabeth,['Jane']
Q900,we have heard only once he wrote me a few lines on wednesday to say that he had arrived in safety and to give me his directions which i particularly begged him to do he merely added that he should not write again till he had something of importance to mention,Jane,['Elizabeth']
Q901,and my mother how is she how are you all,Elizabeth,['Jane']
Q902,my mother is tolerably well i trust though her spirits are greatly shaken she is up stairs and will have great satisfaction in seeing you all she does not yet leave her dressing room mary and kitty thank heaven are quite well,Jane,['Elizabeth']
Q903,but you how are you you look pale how much you must have gone through,Elizabeth,['Jane']
Q904,if i had been able to carry my point of going to brighton with all my family this would not have happened but poor dear lydia had nobody to take care of her why did the forsters ever let her go out of their sight i am sure there was some great neglect or other on their side for she is not the kind of girl to do such a thing if she had been well looked after i always thought they were very unfit to have the charge of her but i was over ruled as i always am poor dear child and now here s mr bennet gone away and i know he will fight wickham wherever he meets him and then he will be killed and what is to become of us all the collinses will turn us out before he is cold in his grave and if you are not kind to us brother i do not know what we shall do,Mrs. Bennet,"['Elizabeth', 'Mrs. Gardiner', 'Jane', 'Mr. Gardiner']"
Q905,do not give way to useless alarm though it is right to be prepared for the worst there is no occasion to look on it as certain it is not quite a week since they left brighton in a few days more we may gain some news of them and till we know that they are not married and have no design of marrying do not let us give the matter over as lost as soon as i get to town i shall go to my brother and make him come home with me to gracechurch street and then we may consult together as to what is to be done,Mr. Gardiner,"['Elizabeth', 'Mrs. Bennet', 'Mrs. Gardiner']"
Q906,oh my dear brother that is exactly what i could most wish for and now do when you get to town find them out wherever they may be and if they are not married already make them marry and as for wedding clothes do not let them wait for that but tell lydia she shall have as much money as she chuses to buy them after they are married and above all things keep mr bennet from fighting tell him what a dreadful state i am in that i am frightened out of my wits and have such tremblings such flutterings all over me such spasms in my side and pains in my head and such beatings at heart that i can get no rest by night nor by day and tell my dear lydia not to give any directions about her clothes till she has seen me for she does not know which are the best warehouses oh brother how kind you are i know you will contrive it all,Mrs. Bennet,"['Elizabeth', 'Mrs. Gardiner', 'Jane', 'Mr. Gardiner']"
Q907,this is a most unfortunate affair and will probably be much talked of but we must stem the tide of malice and pour into the wounded bosoms of each other the balm of sisterly consolation,Mary,['Elizabeth']
Q908,unhappy as the event must be for lydia we may draw from it this useful lesson that loss of virtue in a female is irretrievable that one false step involves her in endless ruin that her reputation is no less brittle than it is beautiful and that she cannot be too much guarded in her behaviour towards the undeserving of the other sex,Mary,['Elizabeth']
Q909,but tell me all and every thing about it which i have not already heard give me farther particulars what did colonel forster say had they no apprehension of any thing before the elopement took place they must have seen them together for ever,Elizabeth,['Jane']
Q910,colonel forster did own that he had often suspected some partiality especially on lydia s side but nothing to give him any alarm i am so grieved for him his behaviour was attentive and kind to the utmost he was coming to us in order to assure us of his concern before he had any idea of their not being gone to scotland when that apprehension first got abroad it hastened his journey,Jane,['Elizabeth']
Q911,and was denny convinced that wickham would not marry did he know of their intending to go off had colonel forster seen denny himself,Elizabeth,['Jane']
Q912,yes but when questioned by him denny denied knowing any thing of their plan and would not give his real opinion about it he did not repeat his persuasion of their not marrying and from that i am inclined to hope he might have been misunderstood before,Jane,['Elizabeth']
Q913,and till colonel forster came himself not one of you entertained a doubt i suppose of their being really married,Elizabeth,['Jane']
Q914,how was it possible that such an idea should enter our brains i felt a little uneasy a little fearful of my sister s happiness with him in marriage because i knew that his conduct had not been always quite right my father and mother knew nothing of that they only felt how imprudent a match it must be kitty then owned with a very natural triumph on knowing more than the rest of us that in lydia s last letter she had prepared her for such a step she had known it seems of their being in love with each other many weeks,Jane,['Elizabeth']
Q915,but not before they went to brighton,Elizabeth,['Jane']
Q916,no i believe not,Jane,['Elizabeth']
Q917,and did colonel forster appear to think ill of wickham himself does he know his real character,Elizabeth,['Jane']
Q918,i must confess that he did not speak so well of wickham as he formerly did he believed him to be imprudent and extravagant and since this sad affair has taken place it is said that he left meryton greatly in debt but i hope this may be false,Jane,['Elizabeth']
Q919,oh jane had we been less secret had we told what we knew of him this could not have happened,Elizabeth,['Jane']
Q920,perhaps it would have been better but to expose the former faults of any person without knowing what their present feelings were seemed unjustifiable we acted with the best intentions,Jane,['Elizabeth']
Q921,could colonel forster repeat the particulars of lydia s note to his wife,Elizabeth,['Jane']
Q922,he brought it with him for us to see,Jane,['Elizabeth']
Q923,oh thoughtless thoughtless lydia what a letter is this to be written at such a moment but at least it shews that she was serious in the object of her journey whatever he might afterwards persuade her to it was not on her side a scheme of infamy my poor father how he must have felt it,Elizabeth,['Jane']
Q924,i never saw any one so shocked he could not speak a word for full ten minutes my mother was taken ill immediately and the whole house in such confusion,Jane,['Elizabeth']
Q925,oh jane was there a servant belonging to it who did not know the whole story before the end of the day,Elizabeth,['Jane']
Q926,i do not know i hope there was but to be guarded at such a time is very difficult my mother was in hysterics and though i endeavoured to give her every assistance in my power i am afraid i did not do so much as i might have done but the horror of what might possibly happen almost took from me my faculties,Jane,['Elizabeth']
Q927,your attendance upon her has been too much for you you do not look well oh that i had been with you you have had every care and anxiety upon yourself alone,Elizabeth,['Jane']
Q928,mary and kitty have been very kind and would have shared in every fatigue i am sure but i did not think it right for either of them kitty is slight and delicate and mary studies so much that her hours of repose should not be broken in on my aunt philips came to longbourn on tuesday after my father went away and was so good as to stay till thursday with me she was of great use and comfort to us all and lady lucas has been very kind she walked here on wednesday morning to condole with us and offered her services or any of her daughters if they could be of use to us,Jane,['Elizabeth']
