uid,pair_id,side,text
p00222_A,00222,A,george don t go george has been in such good spirits today and i am sure he will end by coming up this afternoon
p00223_A,00223,A,proteges you shall see for yourself how your proteges are george emerson is coming up this afternoon he is a most interesting man to talk to only don t
p00224_A,00224,A,now play us the other garden the one in parsifal
p00225_A,00225,A,not very dutiful
p00226_A,00226,A,oh i had no idea
p00227_A,00227,A,our performer has changed her mind
p00228_A,00228,A,yes so do i i vote you have a men s four
p00229_A,00229,A,not for me thank you i will not spoil the set
p00230_A,00230,A,oh come along cecil i m bad floyd s rotten and so i dare say s emerson
p00231_A,00231,A,i am not bad
p00232_A,00232,A,then certainly i won t play
p00233_A,00233,A,i agree with you mr vyse you had much better not play much better not
p00234_A,00234,A,i shall miss every ball anyway so what does it matter
p00235_A,00235,A,then it will have to be lucy you must fall back on lucy there is no other way out of it lucy go and change your frock
p00236_A,00236,A,i shall want to live i tell you
p00237_A,00237,A,the scene is laid in florence
p00238_A,00238,A,you didn t attend
p00239_A,00239,A,who may miss lavish be
p00240_A,00240,A,of course i do i saw her the day i arrived at summer street it was she who told me that you lived here
p00241_A,00241,A,it is so i will inflict joseph emery prank on you no longer
p00242_A,00242,A,what do you mean
p00243_A,00243,A,i expect your father has been reading dante
p00244_A,00244,A,what a splendid idea i shall enjoy hearing your father talk again i m so sorry he s not so well
p00245_A,00245,A,no he isn t well
p00246_A,00246,A,there s an absurd account of a view in this book also that men fall into two classes those who forget views and those who remember them even in small rooms
p00247_A,00247,A,my mother i was meaning
p00248_A,00248,A,no read away i think nothing s funnier than to hear silly things read out loud if mr emerson thinks us frivolous he can go
p00249_A,00249,A,mr emerson go and find tennis balls
p00250_A,00250,A,am i really to go
p00251_A,00251,A,this isn t the passage i wanted there is another much funnier further on
p00252_A,00252,A,very well no one will help me i will speak to him myself
p00253_A,00253,A,no nothing to eat
p00254_A,00254,A,she s started on her sunday writing she s in the drawing room
p00255_A,00255,A,that s all right you go away
p00256_A,00256,A,you say mr vyse wants me to listen to him mr emerson pardon me for suggesting that you have caught the habit
p00257_A,00257,A,and mr vyse does he not matter that i love cecil and shall be his wife shortly a detail of no importance i suppose may i ask what you intend to gain by this exhibition
p00258_A,00258,A,it is our last chance i shall do all that i can you wouldn t stop us this second time if you understood i have been into the dark and i am going back into it unless you will try to understand it is being young it is being certain that lucy cares for me really it is that love and youth matter intellectually
p00259_A,00259,A,mr emerson has had to go
p00260_A,00260,A,what a nuisance that spoils the four i say cecil do play do there s a good chap it s floyd s last day do play tennis with us just this once
p00261_A,00261,A,good bye cecil
p00262_A,00262,A,yes
p00263_A,00263,A,i was coming to show you this delightful letter from those friends of miss honeychurch isn t it wonderful isn t it romance most certainly they will go to constantinople they are taken in a snare that cannot fail they will end by going round the world isn t romance capricious i never notice it in you young people you do nothing but play lawn tennis and say that romance is dead while the miss alans are struggling with all the weapons of propriety against the terrible thing so they call it out of decency but in their hearts they want a pension with magic windows opening on the foam of perilous seas in fairyland forlorn no ordinary view will content the miss alans they want the pension keats
p00264_A,00264,A,i m awfully sorry to interrupt mr beebe but have you any matches
p00265_A,00265,A,then you don t see the wonder of this greek visit i haven t been to greece myself and don t mean to go and i can t imagine any of my friends going it is altogether too big for our little lot don t you think so italy is just about as much as we can manage italy is heroic but greece is godlike or devilish i am not sure which and in either case absolutely out of our suburban focus all right freddy i am not being clever upon my word i am not i took the idea from another fellow and give me those matches when you ve done with them i was saying if our poor little cockney lives must have a background let it be italian big enough in all conscience the ceiling of the sistine chapel for me there the contrast is just as much as i can realize but not the parthenon not the frieze of phidias at any price and here comes the victoria
p00266_A,00266,A,you re quite right greece is not for our little lot
p00267_A,00267,A,how do you do
p00268_A,00268,A,oh must you yes do not the scissors thank you charlotte when both my hands are full already i m perfectly certain that the orange cactus will go before i can get to it yes charlotte i don t want you do go there s nothing to stop about for either in the house or out of it
p00269_A,00269,A,perhaps we ought to send miss honeychurch down to her mother or will she come with us
p00270_A,00270,A,i think we had better leave lucy to herself and to her own pursuits
p00271_A,00271,A,they re angry with miss honeychurch because she was late for breakfast and floyd has gone and mr vyse has gone and freddy won t play with me in fact uncle arthur the house is not at all what it was yesterday
p00272_A,00272,A,it is what i gathered from my own observation of mr vyse it is what i gather from all that i have known of you i do sympathize and agree most profoundly i agree so much that you must let me make one little criticism is it worth while rushing off to greece
p00273_A,00273,A,but i must go somewhere i have been worrying all the morning and here comes the very thing i must and the time i shall have with mother and all the money she spent on me last spring you all think much too highly of me i wish you weren t so kind
p00274_A,00274,A,i must get away ever so far i must know my own mind and where i want to go
p00275_A,00275,A,come along tea tea tea
p00276_A,00276,A,lucy can always play
p00277_A,00277,A,one is very thankful that she has such a resource she is evidently much worried as of course she ought to be i know all about it the marriage was so near that it must have been a hard struggle before she could wind herself up to speak
p00278_A,00278,A,so she says herself and since another lady agrees with her i must own that i am partially convinced perhaps she must have a change i have no sisters or and i don t understand these things but why need she go as far as greece
p00279_A,00279,A,you may well ask that why greece what is it minnie dear jam why not tunbridge wells oh mr beebe i had a long and most unsatisfactory interview with dear lucy this morning i cannot help her i will say no more perhaps i have already said too much i am not to talk i wanted her to spend six months with me at tunbridge wells and she refused
p00280_A,00280,A,otherwise
p00281_A,00281,A,mrs honeychurch go to greece she must come up to the house and let s talk it over do you in the first place mind her breaking with vyse
p00282_A,00282,A,mr beebe i m thankful simply thankful
p00283_A,00283,A,so am i
p00284_A,00284,A,here s mr beebe
p00285_A,00285,A,it isn t very good i forget why harmony or something
p00286_A,00286,A,i suspected it was unscholarly it s so beautiful
p00287_A,00287,A,how stupidly you talk
p00288_A,00288,A,or does his work keep him in london
p00289_A,00289,A,however we shall see him when he sees you off i do so long to see him
p00290_A,00290,A,no one will see lucy off she doesn t like it
p00291_A,00291,A,no i hate seeings off
p00292_A,00292,A,really how funny i should have thought that in this case
p00293_A,00293,A,oh mrs honeychurch you aren t going it is such a pleasure to have met you
p00294_A,00294,A,you re tired of windy corner
p00295_A,00295,A,charlotte again my dear that s all her very words
p00296_A,00296,A,they have gone then
p00297_A,00297,A,certainly i forgot it was friday let s all go powell can go round to the stables
p00298_A,00298,A,don t you think it very plucky of her mr emerson to undertake the two miss alans now miss honeychurch go back keep warm i think three is such a courageous number to go travelling
p00299_A,00299,A,i was saying why should you trust her when she deceived you
p00300_A,00300,A,one minute mother
p00301_A,00301,A,i don t follow you mr emerson to whom do you refer trust whom
p00302_A,00302,A,i mean she has pretended to you that she did not love george they have loved one another all along
p00303_A,00303,A,mr beebe i have misled you i have misled myself
p00304_A,00304,A,oh rubbish miss honeychurch
p00305_A,00305,A,it is not rubbish it s the part of people that you don t understand
p00306_A,00306,A,mr beebe could you help me
p00307_A,00307,A,nothing mr emerson except that he no longer interests me marry george miss honeychurch he will do admirably
p00308_A,00308,A,now it is all dark now beauty and passion seem never to have existed i know but remember the mountains over florence and the view ah dear if i were george and gave you one kiss it would make you brave you have to go cold into a battle that needs warmth out into the muddle that you have made yourself and your mother and all your friends will despise you oh my darling and rightly if it is ever right to despise george still dark all the tussle and the misery without a word from him am i justified yes for we fight for more than love or pleasure there is truth truth counts truth does count
p00309_A,00309,A,san miniato i ll just finish your sock
p00310_A,00310,A,signorino domani faremo uno giro
p00311_A,00311,A,signorino domani faremo uno giro
p00312_A,00312,A,signorino domani faremo
p00313_A,00313,A,scusi tanto signora buona sera e grazie
p00314_A,00314,A,niente
p00000_B,00000,B,a view oh a view how delightful a view is
p00001_B,00001,B,you see we don t like to take
p00002_B,00002,B,but why women like looking at a view men don t george persuade them
p00003_B,00003,B,it s so obvious they should have the rooms there s nothing else to say
p00004_B,00004,B,eat your dinner dear eat your dinner dear this pension is a failure to morrow we will make a change
p00005_B,00005,B,oh oh why it s mr beebe oh how perfectly lovely oh charlotte we must stop now however bad the rooms are oh
p00006_B,00006,B,quite right i move into the rectory at summer street next june i am lucky to be appointed to such a charming neighbourhood
p00007_B,00007,B,lucy dearest let mr beebe eat his dinner
p00008_B,00008,B,i am eating it thank you and enjoying it
p00009_B,00009,B,don t neglect the country round the first fine afternoon drive up to fiesole and round by settignano or something of that sort
p00010_B,00010,B,that lady looks so clever we are in luck
p00011_B,00011,B,emerson
p00012_B,00012,B,i was hoping that he was nice i do so always hope that people will be nice
p00013_B,00013,B,am i to conclude that he is a socialist and presumably he has brought up his son to be a socialist too
p00014_B,00014,B,was i a bore why didn t you talk lucy he prefers young people i m sure i do hope i haven t monopolized him i hoped you would have him all the evening as well as all dinner time
p00015_B,00015,B,he is nice just what i remember he seems to see good in everyone no one would take him for a clergyman
p00016_B,00016,B,undoubtedly he was
p00017_B,00017,B,my own wishes dearest lucy are unimportant in comparison with yours it would be hard indeed if i stopped you doing as you liked at florence when i am only here through your kindness if you wish me to turn these gentlemen out of their rooms i will do it would you then mr beebe kindly tell mr emerson that i accept his kind offer and then conduct him to me in order that i may thank him personally
p00018_B,00018,B,remember lucy i alone am implicated in this i do not wish the acceptance to come from you grant me that at all events
p00019_B,00019,B,mr emerson is engaged but here is his son instead
p00020_B,00020,B,poor young man
p00021_B,00021,B,how angry he is with his father about the rooms it is all he can do to keep polite
p00022_B,00022,B,in half an hour or so your rooms will be ready
p00023_B,00023,B,i think one might venture now no lucy do not stir i will superintend the move
p00024_B,00024,B,how you do do everything
p00025_B,00025,B,is it a very nice smell
p00026_B,00026,B,i m not sure she understands english
p00027_B,00027,B,that woman understands everything but what are you doing here are you doing the church are you through with the church
p00028_B,00028,B,yes why shouldn t you come by yourself
p00029_B,00029,B,but miss lavish has even taken away baedeker
p00030_B,00030,B,baedeker i m glad it s that you minded it s worth minding the loss of a baedeker that s worth minding
p00031_B,00031,B,if you ve no baedeker you d better join us
p00032_B,00032,B,thank you very much but i could not think of that i hope you do not suppose that i came to join on to you i really came to help with the child and to thank you for so kindly giving us your rooms last night i hope that you have not been put to any great inconvenience
p00033_B,00033,B,my dear i think that you are repeating what you have heard older people say you are pretending to be touchy but you are not really stop being so tiresome and tell me instead what part of the church you want to see to take you to it will be a real pleasure
p00034_B,00034,B,remember the facts about this church of santa croce how it was built by faith in the full fervour of medievalism before any taint of the renaissance had appeared observe how giotto in these frescoes now unhappily ruined by restoration is untroubled by the snares of anatomy and perspective could anything be more majestic more pathetic beautiful true how little we feel avails knowledge and technical cleverness against a man who truly feels
p00035_B,00035,B,no remember nothing of the sort built by faith indeed that simply means the workmen weren t paid properly and as for the frescoes i see no truth in them look at that fat man in blue he must weigh as much as i do and he is shooting into the sky like an air balloon now did this happen or didn t it yes or no
p00036_B,00036,B,stop there s plenty of room for us all stop
p00037_B,00037,B,george i do believe that clergyman is the brixton curate
p00038_B,00038,B,perhaps he is i don t remember
p00039_B,00039,B,my father has that effect on nearly everyone he will try to be kind
p00040_B,00040,B,i hope we all try
p00041_B,00041,B,were you snubbed
p00042_B,00042,B,oh but your son wants employment has he no particular hobby why i myself have worries but i can generally forget them at the piano and collecting stamps did no end of good for my brother perhaps italy bores him you ought to try the alps or the lakes
p00043_B,00043,B,poor girl poor girl
p00044_B,00044,B,if miss honeychurch ever takes to live as she plays it will be very exciting both for us and for her
p00045_B,00045,B,i quite agree with you miss alan the italians are a most unpleasant people they pry everywhere they see everything and they know what we want before we know it ourselves we are at their mercy they read our thoughts they foretell our desires from the cab driver down to to giotto they turn us inside out and i resent it yet in their heart of hearts they are how superficial they have no conception of the intellectual life how right is signora bertolini who exclaimed to me the other day that belongs to lavish a good fellow lavish but i wish she d start a pipe
p00046_B,00046,B,what was that
p00047_B,00047,B,stomach he warned miss pole of her stomach acidity he called it and he may have meant to be kind i must say i forgot myself and laughed it was so sudden as teresa truly said it was no laughing matter but the point is that miss lavish was positively attracted by his mentioning s and said she liked plain speaking and meeting different grades of thought she thought they were commercial travellers was the word she used and all through dinner she tried to prove that england our great and beloved country rests on nothing but commerce teresa was very much annoyed and left the table before the cheese saying as she did so and pointed to that beautiful picture of lord tennyson then miss lavish said just imagine tut the early victorians my sister had gone and i felt bound to speak i said it was horrible speaking i reminded her how the queen had been to ireland when she did not want to go and i must say she was dumbfounded and made no reply but unluckily mr emerson overheard this part and called in his deep voice the woman i tell things so badly but you see what a tangle we were in by this time all on account of s having been mentioned in the first place but that was not all after dinner miss lavish actually came up and said needless to say i refused such an unsuitable invitation and she had the impertinence to tell me that it would broaden my ideas and said that she had four brothers all university men except one who was in the army who always made a point of talking to commercial travellers
p00048_B,00048,B,let me finish the story miss lavish tried miss pole myself everyone and finally said she went at the end of five minutes she returned unobtrusively with a green baize board and began playing patience
p00049_B,00049,B,whatever happened
p00050_B,00050,B,violets oh dear who told you about the violets how do things get round a pension is a bad place for gossips no i cannot forget how they behaved at mr eager s lecture at santa croce oh poor miss honeychurch it really was too bad no i have quite changed i do not like the emersons they are not nice but aren t they always waylaying you to go out with them dear
p00051_B,00051,B,only once charlotte didn t like it and said something quite politely of course
p00052_B,00052,B,i wish we could unluckily i have letters if you do want to go out alone won t you be better on your feet
p00053_B,00053,B,italians dear you know
p00054_B,00054,B,perhaps i shall meet someone who reads me through and through
p00055_B,00055,B,she oughtn t really to go at all and she knows it i put it down to too much beethoven
p00056_B,00056,B,and the murderer tried to kiss him you say how very odd italians are and gave himself up to the police mr beebe was saying that italians know everything but i think they are rather childish when my cousin and i were at the pitti yesterday what was that what did you throw in
p00057_B,00057,B,no charlotte it s very kind of mr beebe but i am certainly coming with you i had much rather
p00058_B,00058,B,oh let me congratulate you after your despair of yesterday what a fortunate thing
p00059_B,00059,B,i m sorry if you could manage without it i think i would rather not
p00060_B,00060,B,what is the heroine s name
p00061_B,00061,B,she is emancipated but only in the very best sense of the word none but the superficial would be shocked at her we had a long talk yesterday she believes in justice and truth and human interest she told me also that she has a high opinion of the destiny of woman mr eager why how nice what a pleasant surprise
p00062_B,00062,B,practically
p00063_B,00063,B,one of our pension acquaintances kindly brought her home
p00064_B,00064,B,for her also it must have been a terrible experience i trust that neither of you was at all that it was not in your immediate proximity
p00065_B,00065,B,he died by the fountain i believe
p00066_B,00066,B,willingly would i purchase
p00067_B,00067,B,what
p00068_B,00068,B,lucy dear
p00069_B,00069,B,i should be astonished if you knew all the boy an innocent child at the time i will exclude god knows what his education and his inherited qualities may have made him
p00070_B,00070,B,you have said very little
p00071_B,00071,B,how could you think she was defending them
p00072_B,00072,B,i must be going
p00073_B,00073,B,drive oh is our drive to come off
p00074_B,00074,B,bother the drive it is just the drive we had arranged with mr beebe without any fuss at all why should he invite us in that absurd manner we might as well invite him we are each paying for ourselves
p00075_B,00075,B,oh dear me no oh no
p00076_B,00076,B,perhaps as a student of human nature like myself
p00077_B,00077,B,oh indeed are you indeed if you will not think me rude we residents sometimes pity you poor tourists not a little handed about like a parcel of goods from venice to florence from florence to rome living herded together in pensions or hotels quite unconscious of anything that is outside baedeker their one anxiety to get done or through and go on somewhere else the result is they mix up towns rivers palaces in one inextricable whirl you know the american girl in punch who says and the father replies there s travelling for you ha ha ha
p00078_B,00078,B,i quite agree the narrowness and superficiality of the anglo saxon tourist is nothing less than a menace
p00079_B,00079,B,piano piano
p00080_B,00080,B,most certainly i would let them be but i dare say i shall receive scant support i have always flown in the face of the conventions all my life this is what i call an adventure
p00081_B,00081,B,we must not submit i knew he was trying it on he is treating us as if we were a party of cook s tourists
p00082_B,00082,B,victory at last
p00083_B,00083,B,it is not victory it is defeat you have parted two people who were happy we have tried to buy what cannot be bought with money he has bargained to drive us and he is doing it we have no rights over his soul
p00084_B,00084,B,he was not driving us well he jolted us
p00085_B,00085,B,would render a correct meaning
p00086_B,00086,B,the railway oh but i shall die of course it was the railway he is the image of a porter on on the south eastern
p00087_B,00087,B,eleanor be quiet hush they ll hear the emersons
p00088_B,00088,B,miss honeychurch listening pouf wouf you naughty girl go away
p00089_B,00089,B,oh lucy you ought to be with mr eager i m sure
p00090_B,00090,B,i can t find them now and i don t want to either
p00091_B,00091,B,no i agree it s like a school feast the boys have got separated from the girls miss lucy you are to go we wish to converse on high topics unsuited for your ear
p00092_B,00092,B,how tired one gets oh i do wish freddy and your mother could be here
p00093_B,00093,B,dove dove buoni uomini
p00094_B,00094,B,uno piu piccolo has the cigar been given to you by mr beebe the smaller of the two good men
p00095_B,00095,B,would she like to see them
p00096_B,00096,B,courage miss honeychurch courage and faith if i might say so there is something almost blasphemous in this horror of the elements are we seriously to suppose that all these clouds all this immense electrical display is simply called into existence to extinguish you or me
p00097_B,00097,B,no of course
p00098_B,00098,B,go mr eager don t ask our driver our driver is no help go and support poor mr beebe he is nearly demented
p00099_B,00099,B,typical behaviour in the presence of reality that kind of person invariably breaks down
p00100_B,00100,B,what does he know charlotte how much does mr eager know
p00101_B,00101,B,nothing dearest he knows nothing but he knows everything dearest had we better shall i it is dreadful to be entangled with low class people he saw it all
p00102_B,00102,B,silenzio
p00103_B,00103,B,charlotte dear charlotte kiss me kiss me again only you can understand me you warned me to be careful and i i thought i was developing
p00104_B,00104,B,do not cry dearest take your time
p00105_B,00105,B,steady on
p00106_B,00106,B,not a kiss for me
p00107_B,00107,B,would you take them into the garden and tell mrs honeychurch all about it and i d stop here and tell my mother
p00108_B,00108,B,we go with lucy
p00109_B,00109,B,he is only a boy i represent all that he despises why should he want me for a brother in law
p00110_B,00110,B,indeed i have mrs honeychurch i m going to do what i am always supposed to do but generally i m too shy i want to invoke every kind of blessing on them grave and gay great and small i want them all their lives to be supremely good and supremely happy as husband and wife as father and mother and now i want my tea
p00111_B,00111,B,fiasco
p00112_B,00112,B,do you go to much of this sort of thing
p00113_B,00113,B,plenty of society
p00114_B,00114,B,to me it seemed perfectly appalling disastrous portentous
p00115_B,00115,B,i am so sorry that you were stranded
p00116_B,00116,B,we weren t talking of real fences
p00117_B,00117,B,a parson fenceless would mean a parson defenceless
p00118_B,00118,B,don t you like mr beebe
p00119_B,00119,B,hush dear poor old man what was his name
p00120_B,00120,B,isn t mr eager a parson of the cultured type
p00121_B,00121,B,i don t know i hate him i ve heard him lecture on giotto i hate him nothing can hide a petty nature i hate him
p00122_B,00122,B,my goodness gracious me child you ll blow my head off whatever is there to shout over i forbid you and cecil to hate any more clergymen
p00123_B,00123,B,i count myself a lucky person when i m in london i feel i could never live out of it when i m in the country i feel the same about the country after all i do believe that birds and trees and the sky are the most wonderful things in life and that the people who live amongst them must be the best it s true that in nine cases out of ten they don t seem to notice anything the country gentleman and the country labourer are each in their way the most depressing of companions yet they may have a tacit sympathy with the workings of nature which is denied to us of the town do you feel that mrs honeychurch
p00124_B,00124,B,what height
