uid,pair_id,side,text
p00000_A,00000,A,the signora had no business to do it no business at all she promised us south rooms with a view close together instead of which here are north rooms looking into a courtyard and a long way apart oh lucy
p00001_A,00001,A,and a cockney besides it might be london charlotte don t you feel too that we might be in london i can hardly believe that all kinds of other things are just outside i suppose it is one s being so tired
p00002_A,00002,A,this meat has surely been used for soup
p00003_A,00003,A,i want so to see the arno the rooms the signora promised us in her letter would have looked over the arno the signora had no business to do it at all oh it is a shame
p00004_A,00004,A,any nook does for me but it does seem hard that you shouldn t have a view
p00005_A,00005,A,charlotte you mustn t spoil me of course you must look over the arno too i meant that the first vacant room in the front
p00006_A,00006,A,you must have it
p00007_A,00007,A,no no you must have it
p00008_A,00008,A,i insist on it your mother would never forgive me lucy
p00009_A,00009,A,i have a view i have a view
p00010_A,00010,A,a view oh a view how delightful a view is
p00011_A,00011,A,this is my son his name s george he has a view too
p00012_A,00012,A,ah
p00013_A,00013,A,what i mean is that you can have our rooms and we ll have yours we ll change
p00014_A,00014,A,thank you very much indeed that is out of the question
p00015_A,00015,A,why
p00016_A,00016,A,because it is quite out of the question thank you
p00017_A,00017,A,you see we don t like to take
p00018_A,00018,A,but why women like looking at a view men don t george persuade them
p00019_A,00019,A,it s so obvious they should have the rooms there s nothing else to say
p00020_A,00020,A,eat your dinner dear eat your dinner dear this pension is a failure to morrow we will make a change
p00021_A,00021,A,oh oh why it s mr beebe oh how perfectly lovely oh charlotte we must stop now however bad the rooms are oh
p00022_A,00022,A,how do you do mr beebe i expect that you have forgotten us miss bartlett and miss honeychurch who were at tunbridge wells when you helped the vicar of st peter s that very cold easter
p00023_A,00023,A,i am so glad to see you just fancy how small the world is summer street too makes it so specially funny
p00024_A,00024,A,miss honeychurch lives in the parish of summer street and she happened to tell me in the course of conversation that you have just accepted the living
p00025_A,00025,A,yes i heard from mother so last week she didn t know that i knew you at tunbridge wells but i wrote back at once and i said mr beebe is
p00026_A,00026,A,quite right i move into the rectory at summer street next june i am lucky to be appointed to such a charming neighbourhood
p00027_A,00027,A,oh how glad i am the name of our house is windy corner there is mother and me generally and my brother though it s not often we get him to ch the church is rather far off i mean
p00028_A,00028,A,lucy dearest let mr beebe eat his dinner
p00029_A,00029,A,don t neglect the country round the first fine afternoon drive up to fiesole and round by settignano or something of that sort
p00030_A,00030,A,no mr beebe you are wrong the first fine afternoon your ladies must go to prato
p00031_A,00031,A,prato they must go to prato that place is too sweetly squalid for words i love it i revel in shaking off the trammels of respectability as you know
p00032_A,00032,A,we are most grateful to you the first evening means so much when you arrived we were in for a peculiarly mauvais quart d heure do you by any chance know the name of an old man who sat opposite us at dinner
p00033_A,00033,A,emerson
p00034_A,00034,A,is he a friend of yours
p00035_A,00035,A,we are friendly as one is in pensions
p00036_A,00036,A,then i will say no more i am as it were the chaperon of my young cousin lucy and it would be a serious thing if i put her under an obligation to people of whom we know nothing his manner was somewhat unfortunate i hope i acted for the best
p00037_A,00037,A,you acted very naturally all the same i don t think much harm would have come of accepting
p00038_A,00038,A,no harm of course but we could not be under an obligation
p00039_A,00039,A,he is rather a peculiar man i think he would not take advantage of your acceptance nor expect you to show gratitude he has the merit if it is one of saying exactly what he means he has rooms he does not value and he thinks you would value them he no more thought of putting you under an obligation than he thought of being polite it is so difficult at least i find it difficult to understand people who speak the truth
p00040_A,00040,A,i was hoping that he was nice i do so always hope that people will be nice
p00041_A,00041,A,i think he is nice and tiresome i differ from him on almost every point of any importance and so i expect i may say i hope you will differ but his is a type one disagrees with rather than deplores when he first came here he not unnaturally put people s backs up he has no tact and no manners i don t mean by that that he has bad manners and he will not keep his opinions to himself we nearly complained about him to our depressing signora but i am glad to say we thought better of it
p00042_A,00042,A,am i to conclude that he is a socialist and presumably he has brought up his son to be a socialist too
p00043_A,00043,A,i hardly know george for he hasn t learnt to talk yet he seems a nice creature and i think he has brains of course he has all his father s mannerisms and it is quite possible that he too may be a socialist
p00044_A,00044,A,oh you relieve me so you think i ought to have accepted their offer you feel i have been narrow minded and suspicious
p00045_A,00045,A,not at all i never suggested that
p00046_A,00046,A,was i a bore why didn t you talk lucy he prefers young people i m sure i do hope i haven t monopolized him i hoped you would have him all the evening as well as all dinner time
p00047_A,00047,A,he is nice just what i remember he seems to see good in everyone no one would take him for a clergyman
p00048_A,00048,A,my dear lucia
p00049_A,00049,A,well you know what i mean and you know how clergymen generally laugh mr beebe laughs just like an ordinary man
p00050_A,00050,A,funny girl how you do remind me of your mother i wonder if she will approve of mr beebe
p00051_A,00051,A,i m sure she will and so will freddy
p00052_A,00052,A,i think everyone at windy corner will approve it is the fashionable world i am used to tunbridge wells where we are all hopelessly behind the times
p00053_A,00053,A,yes
p00054_A,00054,A,i am afraid you are finding me a very depressing companion
p00055_A,00055,A,but here you are as safe as in england signora bertolini is so english
p00056_A,00056,A,yet our rooms smell we dread going to bed
p00057_A,00057,A,ah then you look into the court if only mr emerson was more tactful we were so sorry for you at dinner
p00058_A,00058,A,i think he was meaning to be kind
p00059_A,00059,A,undoubtedly he was
p00060_A,00060,A,mr beebe has just been scolding me for my suspicious nature of course i was holding back on my cousin s account about old mr emerson i hardly know no he is not tactful yet have you ever noticed that there are people who do things which are most indelicate and yet at the same time beautiful
p00061_A,00061,A,beautiful are not beauty and delicacy the same
p00062_A,00062,A,miss bartlett it s all right about the rooms i m so glad mr emerson was talking about it in the smoking room and knowing what i did i encouraged him to make the offer again he has let me come and ask you he would be so pleased
p00063_A,00063,A,oh charlotte we must have the rooms now the old man is just as nice and kind as he can be
p00064_A,00064,A,i fear that i have been officious i must apologize for my interference
p00065_A,00065,A,mr emerson is engaged but here is his son instead
p00066_A,00066,A,my father is in his bath so you cannot thank him personally but any message given by you to me will be given by me to him as soon as he comes out
p00067_A,00067,A,poor young man
p00068_A,00068,A,how angry he is with his father about the rooms it is all he can do to keep polite
p00069_A,00069,A,in half an hour or so your rooms will be ready
p00070_A,00070,A,i think one might venture now no lucy do not stir i will superintend the move
p00071_A,00071,A,how you do do everything
p00072_A,00072,A,naturally dear it is my affair
p00073_A,00073,A,but i would like to help you
p00074_A,00074,A,no dear i want to explain why it is that i have taken the largest room naturally of course i should have given it to you but i happen to know that it belongs to the young man and i was sure your mother would not like it if you are to accept a favour it is more suitable you should be under an obligation to his father than to him i am a woman of the world in my small way and i know where things lead to however mr beebe is a guarantee of a sort that they will not presume on this
p00075_A,00075,A,mother wouldn t mind i m sure
p00076_A,00076,A,a smell a true florentine smell every city let me teach you has its own smell
p00077_A,00077,A,is it a very nice smell
p00078_A,00078,A,one doesn t come to italy for niceness one comes for life buon giorno buon giorno look at that adorable wine cart how the driver stares at us dear simple soul buon giorno take the word of an old woman miss lucy you will never repent of a little civility to your inferiors that is the true democracy though i am a real radical as well there now you re shocked
p00079_A,00079,A,indeed i m not we are radicals too out and out my father always voted for mr gladstone until he was so dreadful about ireland
p00080_A,00080,A,i see i see and now you have gone over to the enemy
p00081_A,00081,A,oh please if my father was alive i am sure he would vote radical again now that ireland is all right and as it is the glass over our front door was broken last election and freddy is sure it was the tories but mother says nonsense a tramp
p00082_A,00082,A,shameful a manufacturing district i suppose
p00083_A,00083,A,no in the surrey hills about five miles from dorking looking over the weald
p00084_A,00084,A,what a delightful part i know it so well it is full of the very nicest people do you know sir harry otway a radical if ever there was
p00085_A,00085,A,very well indeed
p00086_A,00086,A,and old mrs butterworth the philanthropist
p00087_A,00087,A,why she rents a field of us how funny
p00088_A,00088,A,oh you have property in surrey
p00089_A,00089,A,hardly any only thirty acres just the garden all downhill and some fields
p00090_A,00090,A,bless us bless us and save us we ve lost the way lost lost my dear miss lucy during our political diatribes we have taken a wrong turning how those horrid conservatives would jeer at us what are we to do two lone females in an unknown town now this is what i call an adventure oh but that is the word of a craven and no you are not not not to look at your baedeker give it to me i shan t let you carry it we will simply drift stop a minute let those two people go on or i shall have to speak to them i do detest conventional intercourse nasty they are going into the church too oh the britisher abroad
p00091_A,00091,A,we sat opposite them at dinner last night they have given us their rooms they were so very kind
p00092_A,00092,A,look at their figures they walk through my italy like a pair of cows it s very naughty of me but i would like to set an examination paper at dover and turn back every tourist who couldn t pass it
p00093_A,00093,A,what would you ask us
p00094_A,00094,A,you are a clever woman you have done more than all the relics in the world i am not of your creed but i do believe in those who make their fellow creatures happy there is no scheme of the universe
p00095_A,00095,A,niente
p00096_A,00096,A,i m not sure she understands english
p00097_A,00097,A,that woman understands everything but what are you doing here are you doing the church are you through with the church
p00098_A,00098,A,no i came here with miss lavish who was to explain everything and just by the door it is too bad she simply ran away and after waiting quite a time i had to come in by myself
p00099_A,00099,A,why shouldn t you
p00100_A,00100,A,yes why shouldn t you come by yourself
p00101_A,00101,A,but miss lavish has even taken away baedeker
p00102_A,00102,A,baedeker i m glad it s that you minded it s worth minding the loss of a baedeker that s worth minding
p00103_A,00103,A,if you ve no baedeker you d better join us
p00104_A,00104,A,thank you very much but i could not think of that i hope you do not suppose that i came to join on to you i really came to help with the child and to thank you for so kindly giving us your rooms last night i hope that you have not been put to any great inconvenience
p00105_A,00105,A,my dear i think that you are repeating what you have heard older people say you are pretending to be touchy but you are not really stop being so tiresome and tell me instead what part of the church you want to see to take you to it will be a real pleasure
p00106_A,00106,A,i am not touchy i hope it is the giottos that i want to see if you will kindly tell me which they are
p00107_A,00107,A,remember the facts about this church of santa croce how it was built by faith in the full fervour of medievalism before any taint of the renaissance had appeared observe how giotto in these frescoes now unhappily ruined by restoration is untroubled by the snares of anatomy and perspective could anything be more majestic more pathetic beautiful true how little we feel avails knowledge and technical cleverness against a man who truly feels
p00108_A,00108,A,no remember nothing of the sort built by faith indeed that simply means the workmen weren t paid properly and as for the frescoes i see no truth in them look at that fat man in blue he must weigh as much as i do and he is shooting into the sky like an air balloon now did this happen or didn t it yes or no
p00109_A,00109,A,it happened like this if it happened at all i would rather go up to heaven by myself than be pushed by cherubs and if i got there i should like my friends to lean out of it just as they do here
p00110_A,00110,A,you will never go up you and i dear boy will lie at peace in the earth that bore us and our names will disappear as surely as our work survives
p00111_A,00111,A,pardon me the chapel is somewhat small for two parties we will incommode you no longer
p00112_A,00112,A,george i do believe that clergyman is the brixton curate
p00113_A,00113,A,perhaps he is i don t remember
p00114_A,00114,A,then i had better speak to him and remind him who i am it s that mr eager why did he go did we talk too loud how vexatious i shall go and say we are sorry hadn t i better then perhaps he will come back
p00115_A,00115,A,my father has that effect on nearly everyone he will try to be kind
p00116_A,00116,A,i hope we all try
p00117_A,00117,A,because we think it improves our characters but he is kind to people because he loves them and they find him out and are offended or frightened
p00118_A,00118,A,how silly of them i think that a kind action done tactfully
p00119_A,00119,A,were you snubbed
p00120_A,00120,A,don t let us spoil yours have you looked at those saints
p00121_A,00121,A,yes they are lovely do you know which is the tombstone that is praised in ruskin
p00122_A,00122,A,why will he look at that fresco i saw nothing in it
p00123_A,00123,A,i like giotto it is so wonderful what they say about his tactile values though i like things like the della robbia babies better
p00124_A,00124,A,so you ought a baby is worth a dozen saints and my baby s worth the whole of paradise and as far as i can see he lives in hell in hell he s unhappy
p00125_A,00125,A,oh dear
p00126_A,00126,A,how can he be unhappy when he is strong and alive what more is one to give him and think how he has been brought up free from all the superstition and ignorance that lead men to hate one another in the name of god with such an education as that i thought he was bound to grow up happy what are we to do with him he comes out for his holiday to italy and behaves like that like the little child who ought to have been playing and who hurt himself upon the tombstone eh what did you say now don t be stupid over this i don t require you to fall in love with my boy but i do think you might try and understand him you are nearer his age and if you let yourself go i am sure you are sensible you might help me he has known so few women and you have the time you stop here several weeks i suppose but let yourself go you are inclined to get muddled if i may judge from last night let yourself go pull out from the depths those thoughts that you do not understand and spread them out in the sunlight and know the meaning of them by understanding george you may learn to understand yourself it will be good for both of you i only know what it is that s wrong with him not why it is
p00127_A,00127,A,and what is it
p00128_A,00128,A,the old trouble things won t fit
p00129_A,00129,A,what things
p00130_A,00130,A,the things of the universe it is quite true they don t
p00131_A,00131,A,oh mr emerson whatever do you mean
p00132_A,00132,A,george and i both know this but why does it distress him we know that we come from the winds and that we shall return to them that all life is perhaps a knot a tangle a blemish in the eternal smoothness but why should this make us unhappy let us rather love one another and work and rejoice i don t believe in this world sorrow then make my boy think like us make him realize that by the side of the everlasting why there is a yes a transitory yes if you like but a yes
p00133_A,00133,A,miss bartlett
p00134_A,00134,A,oh good gracious me where where
p00135_A,00135,A,in the nave
p00136_A,00136,A,i see those gossiping little miss alans must have
p00137_A,00137,A,poor girl poor girl
p00138_A,00138,A,who is she
p00139_A,00139,A,cousin of one of my parishioners i do not consider her choice of a piece happy beethoven is so usually simple and direct in his appeal that it is sheer perversity to choose a thing like that which if anything disturbs
p00140_A,00140,A,introduce me
p00141_A,00141,A,she will be delighted she and miss bartlett are full of the praises of your sermon
p00142_A,00142,A,oh what a funny thing some one said just the same to mother and she said she trusted i should never live a duet
p00143_A,00143,A,doesn t mrs honeychurch like music
p00144_A,00144,A,she doesn t mind it but she doesn t like one to get excited over anything she thinks i am silly about it she thinks i can t make out once you know i said that i liked my own playing better than any one s she has never got over it of course i didn t mean that i played well i only meant
p00145_A,00145,A,of course
p00146_A,00146,A,music
p00147_A,00147,A,what about music
p00148_A,00148,A,poor charlotte will be sopped
p00149_A,00149,A,miss lavish has led your cousin astray she hopes to find the true italy in the wet i believe
p00150_A,00150,A,miss lavish is so original is it true that miss lavish is writing a book
p00151_A,00151,A,they do say so
p00152_A,00152,A,what is it about
p00153_A,00153,A,it will be a novel dealing with modern italy let me refer you for an account to miss catharine alan who uses words herself more admirably than any one i know
p00154_A,00154,A,i wish miss lavish would tell me herself we started such friends but i don t think she ought to have run away with baedeker that morning in santa croce charlotte was most annoyed at finding me practically alone and so i couldn t help being a little annoyed with miss lavish
p00155_A,00155,A,fa niente sono vecchia
p00156_A,00156,A,i quite agree with you miss alan the italians are a most unpleasant people they pry everywhere they see everything and they know what we want before we know it ourselves we are at their mercy they read our thoughts they foretell our desires from the cab driver down to to giotto they turn us inside out and i resent it yet in their heart of hearts they are how superficial they have no conception of the intellectual life how right is signora bertolini who exclaimed to me the other day that belongs to lavish a good fellow lavish but i wish she d start a pipe
p00157_A,00157,A,oh mr beebe indeed though it is dreadful for her to smoke it is not quite as dreadful as you suppose she took to it practically in despair after her life s work was carried away in a landslip surely that makes it more excusable
p00158_A,00158,A,what was that
p00159_A,00159,A,let me finish the story miss lavish tried miss pole myself everyone and finally said she went at the end of five minutes she returned unobtrusively with a green baize board and began playing patience
p00160_A,00160,A,whatever happened
p00161_A,00161,A,no one knows no one will ever know miss lavish will never dare to tell and mr emerson does not think it worth telling
p00162_A,00162,A,mr beebe old mr emerson is he nice or not nice i do so want to know no but it is so difficult sometimes he is so silly and then i do not mind him miss alan what do you think is he nice
p00163_A,00163,A,i consider that you are bound to class him as nice miss alan after that business of the violets
p00164_A,00164,A,violets oh dear who told you about the violets how do things get round a pension is a bad place for gossips no i cannot forget how they behaved at mr eager s lecture at santa croce oh poor miss honeychurch it really was too bad no i have quite changed i do not like the emersons they are not nice but aren t they always waylaying you to go out with them dear
p00165_A,00165,A,only once charlotte didn t like it and said something quite politely of course
p00166_A,00166,A,most right of her they don t understand our ways they must find their level too late to go out all the galleries are shut
p00167_A,00167,A,i think i shall go out i want to go round the town in the circular tram on the platform by the driver
p00168_A,00168,A,i wish we could unluckily i have letters if you do want to go out alone won t you be better on your feet
p00169_A,00169,A,italians dear you know
p00170_A,00170,A,perhaps i shall meet someone who reads me through and through
p00171_A,00171,A,oh what have i done
p00172_A,00172,A,you fainted
p00173_A,00173,A,i i am very sorry
p00174_A,00174,A,how are you now
p00175_A,00175,A,perfectly well absolutely well
p00176_A,00176,A,then let us come home there s no point in our stopping
p00177_A,00177,A,how very kind you have been i might have hurt myself falling but now i am well i can go alone thank you oh my photographs
p00178_A,00178,A,what photographs
p00179_A,00179,A,i bought some photographs at alinari s i must have dropped them out there in the square would you add to your kindness by fetching them
p00180_A,00180,A,miss honeychurch you sit still you aren t fit to go home alone
p00181_A,00181,A,yes i am thank you so very much
p00182_A,00182,A,no you aren t you d go openly if you were
p00183_A,00183,A,but i had rather
p00184_A,00184,A,then i don t fetch your photographs
p00185_A,00185,A,i had rather be alone
p00186_A,00186,A,the man is dead the man is probably dead sit down till you are rested and don t move till i come back
p00187_A,00187,A,and the murderer tried to kiss him you say how very odd italians are and gave himself up to the police mr beebe was saying that italians know everything but i think they are rather childish when my cousin and i were at the pitti yesterday what was that what did you throw in
p00188_A,00188,A,things i didn t want
p00189_A,00189,A,mr emerson
p00190_A,00190,A,well
p00191_A,00191,A,where are the photographs i believe it was my photographs that you threw away
p00192_A,00192,A,i didn t know what to do with them they were covered with blood there i m glad i ve told you and all the time we were making conversation i was wondering what to do with them they ve gone i did mind them so and one is so foolish it seemed better that they should go out to the sea i don t know i may just mean that they frightened me for something tremendous has happened i must face it without getting muddled it isn t exactly that a man has died it has happened and i mean to find out what it is
p00193_A,00193,A,mr emerson
p00194_A,00194,A,i want to ask you something before we go in
p00195_A,00195,A,i have behaved ridiculously i was never so much ashamed of myself in my life i cannot think what came over me
p00196_A,00196,A,i nearly fainted myself
p00197_A,00197,A,well i owe you a thousand apologies
p00198_A,00198,A,oh all right
p00199_A,00199,A,and this is the real point you know how silly people are gossiping ladies especially i am afraid you understand what i mean
p00200_A,00200,A,i m afraid i don t
p00201_A,00201,A,i mean would you not mention it to any one my foolish behaviour
p00202_A,00202,A,your behaviour oh yes all right all right
p00203_A,00203,A,thank you so much and would you well thank you so much how quickly these accidents do happen and then one returns to the old life
p00204_A,00204,A,i don t i shall probably want to live
p00205_A,00205,A,but why mr emerson what do you mean
p00206_A,00206,A,no charlotte it s very kind of mr beebe but i am certainly coming with you i had much rather
p00207_A,00207,A,oh let me congratulate you after your despair of yesterday what a fortunate thing
p00208_A,00208,A,aha miss honeychurch come you here i am in luck now you are to tell me absolutely everything that you saw from the beginning but perhaps you would rather not
p00209_A,00209,A,i m sorry if you could manage without it i think i would rather not
p00210_A,00210,A,it is i who am sorry literary hacks are shameless creatures i believe there s no secret of the human heart into which we wouldn t pry
p00211_A,00211,A,what is the heroine s name
p00212_A,00212,A,leonora
p00213_A,00213,A,i do hope she s nice and what is the plot
