uid,pair_id,side,text
p00054_B,00054,B,i must have been selfish or unkind i must be more careful it is so dreadful for charlotte being poor
p00055_B,00055,B,yet our rooms smell we dread going to bed
p00056_B,00056,B,ah then you look into the court if only mr emerson was more tactful we were so sorry for you at dinner
p00057_B,00057,B,i think he was meaning to be kind
p00058_B,00058,B,undoubtedly he was
p00059_B,00059,B,mr beebe has just been scolding me for my suspicious nature of course i was holding back on my cousin s account about old mr emerson i hardly know no he is not tactful yet have you ever noticed that there are people who do things which are most indelicate and yet at the same time beautiful
p00060_B,00060,B,beautiful are not beauty and delicacy the same
p00061_B,00061,B,so one would have thought but things are so difficult i sometimes think
p00062_B,00062,B,oh charlotte we must have the rooms now the old man is just as nice and kind as he can be
p00063_B,00063,B,i fear that i have been officious i must apologize for my interference
p00064_B,00064,B,my own wishes dearest lucy are unimportant in comparison with yours it would be hard indeed if i stopped you doing as you liked at florence when i am only here through your kindness if you wish me to turn these gentlemen out of their rooms i will do it would you then mr beebe kindly tell mr emerson that i accept his kind offer and then conduct him to me in order that i may thank him personally
p00065_B,00065,B,my father is in his bath so you cannot thank him personally but any message given by you to me will be given by me to him as soon as he comes out
p00066_B,00066,B,poor young man
p00067_B,00067,B,how angry he is with his father about the rooms it is all he can do to keep polite
p00068_B,00068,B,in half an hour or so your rooms will be ready
p00069_B,00069,B,i think one might venture now no lucy do not stir i will superintend the move
p00070_B,00070,B,how you do do everything
p00071_B,00071,B,naturally dear it is my affair
p00072_B,00072,B,but i would like to help you
p00073_B,00073,B,no dear i want to explain why it is that i have taken the largest room naturally of course i should have given it to you but i happen to know that it belongs to the young man and i was sure your mother would not like it if you are to accept a favour it is more suitable you should be under an obligation to his father than to him i am a woman of the world in my small way and i know where things lead to however mr beebe is a guarantee of a sort that they will not presume on this
p00074_B,00074,B,mother wouldn t mind i m sure
p00075_B,00075,B,what does it mean
p00076_B,00076,B,is it a very nice smell
p00077_B,00077,B,one doesn t come to italy for niceness one comes for life buon giorno buon giorno look at that adorable wine cart how the driver stares at us dear simple soul buon giorno take the word of an old woman miss lucy you will never repent of a little civility to your inferiors that is the true democracy though i am a real radical as well there now you re shocked
p00078_B,00078,B,indeed i m not we are radicals too out and out my father always voted for mr gladstone until he was so dreadful about ireland
p00079_B,00079,B,i see i see and now you have gone over to the enemy
p00080_B,00080,B,oh please if my father was alive i am sure he would vote radical again now that ireland is all right and as it is the glass over our front door was broken last election and freddy is sure it was the tories but mother says nonsense a tramp
p00081_B,00081,B,shameful a manufacturing district i suppose
p00082_B,00082,B,no in the surrey hills about five miles from dorking looking over the weald
p00083_B,00083,B,what a delightful part i know it so well it is full of the very nicest people do you know sir harry otway a radical if ever there was
p00084_B,00084,B,very well indeed
p00085_B,00085,B,and old mrs butterworth the philanthropist
p00086_B,00086,B,why she rents a field of us how funny
p00087_B,00087,B,oh you have property in surrey
p00088_B,00088,B,hardly any only thirty acres just the garden all downhill and some fields
p00089_B,00089,B,bless us bless us and save us we ve lost the way lost lost my dear miss lucy during our political diatribes we have taken a wrong turning how those horrid conservatives would jeer at us what are we to do two lone females in an unknown town now this is what i call an adventure oh but that is the word of a craven and no you are not not not to look at your baedeker give it to me i shan t let you carry it we will simply drift stop a minute let those two people go on or i shall have to speak to them i do detest conventional intercourse nasty they are going into the church too oh the britisher abroad
p00090_B,00090,B,we sat opposite them at dinner last night they have given us their rooms they were so very kind
p00091_B,00091,B,look at their figures they walk through my italy like a pair of cows it s very naughty of me but i would like to set an examination paper at dover and turn back every tourist who couldn t pass it
p00092_B,00092,B,what would you ask us
p00093_B,00093,B,there goes my local colour box i must have a word with him
p00094_B,00094,B,niente
p00095_B,00095,B,i m not sure she understands english
p00096_B,00096,B,that woman understands everything but what are you doing here are you doing the church are you through with the church
p00097_B,00097,B,no i came here with miss lavish who was to explain everything and just by the door it is too bad she simply ran away and after waiting quite a time i had to come in by myself
p00098_B,00098,B,why shouldn t you
p00099_B,00099,B,yes why shouldn t you come by yourself
p00100_B,00100,B,but miss lavish has even taken away baedeker
p00101_B,00101,B,baedeker i m glad it s that you minded it s worth minding the loss of a baedeker that s worth minding
p00102_B,00102,B,if you ve no baedeker you d better join us
p00103_B,00103,B,thank you very much but i could not think of that i hope you do not suppose that i came to join on to you i really came to help with the child and to thank you for so kindly giving us your rooms last night i hope that you have not been put to any great inconvenience
p00104_B,00104,B,my dear i think that you are repeating what you have heard older people say you are pretending to be touchy but you are not really stop being so tiresome and tell me instead what part of the church you want to see to take you to it will be a real pleasure
p00105_B,00105,B,i am not touchy i hope it is the giottos that i want to see if you will kindly tell me which they are
p00106_B,00106,B,remember the facts about this church of santa croce how it was built by faith in the full fervour of medievalism before any taint of the renaissance had appeared observe how giotto in these frescoes now unhappily ruined by restoration is untroubled by the snares of anatomy and perspective could anything be more majestic more pathetic beautiful true how little we feel avails knowledge and technical cleverness against a man who truly feels
p00107_B,00107,B,no remember nothing of the sort built by faith indeed that simply means the workmen weren t paid properly and as for the frescoes i see no truth in them look at that fat man in blue he must weigh as much as i do and he is shooting into the sky like an air balloon now did this happen or didn t it yes or no
p00108_B,00108,B,it happened like this if it happened at all i would rather go up to heaven by myself than be pushed by cherubs and if i got there i should like my friends to lean out of it just as they do here
p00109_B,00109,B,you will never go up you and i dear boy will lie at peace in the earth that bore us and our names will disappear as surely as our work survives
p00110_B,00110,B,some of the people can only see the empty grave not the saint whoever he is going up it did happen like that if it happened at all
p00111_B,00111,B,stop there s plenty of room for us all stop
p00112_B,00112,B,perhaps he is i don t remember
p00113_B,00113,B,then i had better speak to him and remind him who i am it s that mr eager why did he go did we talk too loud how vexatious i shall go and say we are sorry hadn t i better then perhaps he will come back
p00114_B,00114,B,he will not come back
p00115_B,00115,B,i hope we all try
p00116_B,00116,B,because we think it improves our characters but he is kind to people because he loves them and they find him out and are offended or frightened
p00117_B,00117,B,how silly of them i think that a kind action done tactfully
p00118_B,00118,B,tact
p00119_B,00119,B,but we have spoilt the pleasure of i don t know how many people they won t come back
p00120_B,00120,B,yes they are lovely do you know which is the tombstone that is praised in ruskin
p00121_B,00121,B,why will he look at that fresco i saw nothing in it
p00122_B,00122,B,i like giotto it is so wonderful what they say about his tactile values though i like things like the della robbia babies better
p00123_B,00123,B,so you ought a baby is worth a dozen saints and my baby s worth the whole of paradise and as far as i can see he lives in hell in hell he s unhappy
p00124_B,00124,B,oh dear
p00125_B,00125,B,how can he be unhappy when he is strong and alive what more is one to give him and think how he has been brought up free from all the superstition and ignorance that lead men to hate one another in the name of god with such an education as that i thought he was bound to grow up happy what are we to do with him he comes out for his holiday to italy and behaves like that like the little child who ought to have been playing and who hurt himself upon the tombstone eh what did you say now don t be stupid over this i don t require you to fall in love with my boy but i do think you might try and understand him you are nearer his age and if you let yourself go i am sure you are sensible you might help me he has known so few women and you have the time you stop here several weeks i suppose but let yourself go you are inclined to get muddled if i may judge from last night let yourself go pull out from the depths those thoughts that you do not understand and spread them out in the sunlight and know the meaning of them by understanding george you may learn to understand yourself it will be good for both of you i only know what it is that s wrong with him not why it is
p00126_B,00126,B,and what is it
p00127_B,00127,B,the old trouble things won t fit
p00128_B,00128,B,what things
p00129_B,00129,B,the things of the universe it is quite true they don t
p00130_B,00130,B,oh mr emerson whatever do you mean
p00131_B,00131,B,george and i both know this but why does it distress him we know that we come from the winds and that we shall return to them that all life is perhaps a knot a tangle a blemish in the eternal smoothness but why should this make us unhappy let us rather love one another and work and rejoice i don t believe in this world sorrow then make my boy think like us make him realize that by the side of the everlasting why there is a yes a transitory yes if you like but a yes
p00132_B,00132,B,i m very sorry you ll think me unfeeling but but
p00133_B,00133,B,oh good gracious me where where
p00134_B,00134,B,in the nave
p00135_B,00135,B,i see those gossiping little miss alans must have
p00136_B,00136,B,poor girl poor girl
p00137_B,00137,B,poor girl i fail to understand the point of that remark i think myself a very fortunate girl i assure you i m thoroughly happy and having a splendid time pray don t waste time mourning over me there s enough sorrow in the world isn t there without trying to invent it good bye thank you both so much for all your kindness ah yes there does come my cousin a delightful morning santa croce is a wonderful church
p00138_B,00138,B,cousin of one of my parishioners i do not consider her choice of a piece happy beethoven is so usually simple and direct in his appeal that it is sheer perversity to choose a thing like that which if anything disturbs
p00139_B,00139,B,introduce me
p00140_B,00140,B,she will be delighted she and miss bartlett are full of the praises of your sermon
p00141_B,00141,B,my sermon why ever did she listen to it
p00142_B,00142,B,doesn t mrs honeychurch like music
p00143_B,00143,B,she doesn t mind it but she doesn t like one to get excited over anything she thinks i am silly about it she thinks i can t make out once you know i said that i liked my own playing better than any one s she has never got over it of course i didn t mean that i played well i only meant
p00144_B,00144,B,of course
p00145_B,00145,B,music
p00146_B,00146,B,what about music
p00147_B,00147,B,poor charlotte will be sopped
p00148_B,00148,B,miss lavish has led your cousin astray she hopes to find the true italy in the wet i believe
p00149_B,00149,B,miss lavish is so original is it true that miss lavish is writing a book
p00150_B,00150,B,they do say so
p00151_B,00151,B,what is it about
p00152_B,00152,B,it will be a novel dealing with modern italy let me refer you for an account to miss catharine alan who uses words herself more admirably than any one i know
p00153_B,00153,B,i wish miss lavish would tell me herself we started such friends but i don t think she ought to have run away with baedeker that morning in santa croce charlotte was most annoyed at finding me practically alone and so i couldn t help being a little annoyed with miss lavish
p00154_B,00154,B,the two ladies at all events have made it up
p00155_B,00155,B,i quite agree with you miss alan the italians are a most unpleasant people they pry everywhere they see everything and they know what we want before we know it ourselves we are at their mercy they read our thoughts they foretell our desires from the cab driver down to to giotto they turn us inside out and i resent it yet in their heart of hearts they are how superficial they have no conception of the intellectual life how right is signora bertolini who exclaimed to me the other day that belongs to lavish a good fellow lavish but i wish she d start a pipe
p00156_B,00156,B,oh mr beebe indeed though it is dreadful for her to smoke it is not quite as dreadful as you suppose she took to it practically in despair after her life s work was carried away in a landslip surely that makes it more excusable
p00157_B,00157,B,what was that
p00158_B,00158,B,it was a novel and i am afraid from what i can gather not a very nice novel it is so sad when people who have abilities misuse them and i must say they nearly always do anyhow she left it almost finished in the grotto of the calvary at the capuccini hotel at amalfi while she went for a little ink she said but you know what italians are and meanwhile the grotto fell roaring on to the beach and the saddest thing of all is that she cannot remember what she has written the poor thing was very ill after it and so got tempted into cigarettes it is a great secret but i am glad to say that she is writing another novel she told teresa and miss pole the other day that she had got up all the local colour this novel is to be about modern italy the other was historical but that she could not start till she had an idea first she tried perugia for an inspiration then she came here this must on no account get round and so cheerful through it all i cannot help thinking that there is something to admire in everyone even if you do not approve of them all the same she is a little too i hardly like to say unwomanly but she behaved most strangely when the emersons arrived i don t know miss honeychurch if you have noticed that miss pole the lady who has so much yellow hair takes lemonade that old mr emerson who puts things very strangely
p00159_B,00159,B,whatever happened
p00160_B,00160,B,no one knows no one will ever know miss lavish will never dare to tell and mr emerson does not think it worth telling
p00161_B,00161,B,mr beebe old mr emerson is he nice or not nice i do so want to know no but it is so difficult sometimes he is so silly and then i do not mind him miss alan what do you think is he nice
p00162_B,00162,B,i consider that you are bound to class him as nice miss alan after that business of the violets
p00163_B,00163,B,violets oh dear who told you about the violets how do things get round a pension is a bad place for gossips no i cannot forget how they behaved at mr eager s lecture at santa croce oh poor miss honeychurch it really was too bad no i have quite changed i do not like the emersons they are not nice but aren t they always waylaying you to go out with them dear
p00164_B,00164,B,only once charlotte didn t like it and said something quite politely of course
p00165_B,00165,B,most right of her they don t understand our ways they must find their level too late to go out all the galleries are shut
p00166_B,00166,B,i think i shall go out i want to go round the town in the circular tram on the platform by the driver
p00167_B,00167,B,i wish we could unluckily i have letters if you do want to go out alone won t you be better on your feet
p00168_B,00168,B,italians dear you know
p00169_B,00169,B,perhaps i shall meet someone who reads me through and through
p00170_B,00170,B,she oughtn t really to go at all and she knows it i put it down to too much beethoven
p00171_B,00171,B,you fainted
p00172_B,00172,B,i i am very sorry
p00173_B,00173,B,how are you now
p00174_B,00174,B,perfectly well absolutely well
p00175_B,00175,B,then let us come home there s no point in our stopping
p00176_B,00176,B,how very kind you have been i might have hurt myself falling but now i am well i can go alone thank you oh my photographs
p00177_B,00177,B,what photographs
p00178_B,00178,B,i bought some photographs at alinari s i must have dropped them out there in the square would you add to your kindness by fetching them
p00179_B,00179,B,miss honeychurch you sit still you aren t fit to go home alone
p00180_B,00180,B,yes i am thank you so very much
p00181_B,00181,B,no you aren t you d go openly if you were
p00182_B,00182,B,but i had rather
p00183_B,00183,B,then i don t fetch your photographs
p00184_B,00184,B,i had rather be alone
p00185_B,00185,B,the man is dead the man is probably dead sit down till you are rested and don t move till i come back
p00186_B,00186,B,oh what have i done
p00187_B,00187,B,things i didn t want
p00188_B,00188,B,mr emerson
p00189_B,00189,B,well
p00190_B,00190,B,where are the photographs i believe it was my photographs that you threw away
p00191_B,00191,B,i didn t know what to do with them they were covered with blood there i m glad i ve told you and all the time we were making conversation i was wondering what to do with them they ve gone i did mind them so and one is so foolish it seemed better that they should go out to the sea i don t know i may just mean that they frightened me for something tremendous has happened i must face it without getting muddled it isn t exactly that a man has died it has happened and i mean to find out what it is
p00192_B,00192,B,mr emerson
p00193_B,00193,B,i want to ask you something before we go in
p00194_B,00194,B,i have behaved ridiculously i was never so much ashamed of myself in my life i cannot think what came over me
p00195_B,00195,B,i nearly fainted myself
p00196_B,00196,B,well i owe you a thousand apologies
p00197_B,00197,B,oh all right
p00198_B,00198,B,and this is the real point you know how silly people are gossiping ladies especially i am afraid you understand what i mean
p00199_B,00199,B,i m afraid i don t
p00200_B,00200,B,i mean would you not mention it to any one my foolish behaviour
p00201_B,00201,B,your behaviour oh yes all right all right
p00202_B,00202,B,thank you so much and would you well thank you so much how quickly these accidents do happen and then one returns to the old life
p00203_B,00203,B,i don t i shall probably want to live
p00204_B,00204,B,but why mr emerson what do you mean
p00205_B,00205,B,i shall want to live i say
p00206_B,00206,B,very well dear how i do wish freddy and your mother could see this too look lucia oh you are watching for the torre del gallo party i feared you would repent you of your choice
p00207_B,00207,B,aha miss honeychurch come you here i am in luck now you are to tell me absolutely everything that you saw from the beginning but perhaps you would rather not
p00208_B,00208,B,i m sorry if you could manage without it i think i would rather not
p00209_B,00209,B,it is i who am sorry literary hacks are shameless creatures i believe there s no secret of the human heart into which we wouldn t pry
p00210_B,00210,B,what is the heroine s name
p00211_B,00211,B,leonora
p00212_B,00212,B,i do hope she s nice and what is the plot
p00213_B,00213,B,i hope you will excuse me for boring on like this it is so tempting to talk to really sympathetic people of course this is the barest outline there will be a deal of local colouring descriptions of florence and the neighbourhood and i shall also introduce some humorous characters and let me give you all fair warning i intend to be unmerciful to the british tourist
p00214_B,00214,B,oh you wicked woman i am sure you are thinking of the emersons
p00215_B,00215,B,i confess that in italy my sympathies are not with my own countrymen it is the neglected italians who attract me and whose lives i am going to paint so far as i can for i repeat and i insist and i have always held most strongly that a tragedy such as yesterday s is not the less tragic because it happened in humble life
p00216_B,00216,B,she is my idea of a really clever woman that last remark struck me as so particularly true it should be a most pathetic novel
p00217_B,00217,B,ah not for me for i have been watching you and miss honeychurch for quite a little time
p00218_B,00218,B,we were chatting to miss lavish
p00219_B,00219,B,so i saw were you indeed andate via sono occupato i am about to venture a suggestion would you and miss honeychurch be disposed to join me in a drive some day this week a drive in the hills we might go up by fiesole and back by settignano there is a point on that road where we could get down and have an hour s ramble on the hillside the view thence of florence is most beautiful far better than the hackneyed view of fiesole it is the view that alessio baldovinetti is fond of introducing into his pictures that man had a decided feeling for landscape decidedly but who looks at it to day ah the world is too much for us so we shall be a partie carree in these days of toil and tumult one has great needs of the country and its message of purity andate via andate presto presto ah the town beautiful as it is it is the town this very square so i am told witnessed yesterday the most sordid of tragedies to one who loves the florence of dante and savonarola there is something portentous in such desecration portentous and humiliating
p00220_B,00220,B,humiliating indeed miss honeychurch happened to be passing through as it happened she can hardly bear to speak of it
p00221_B,00221,B,and how came we to have you here
p00222_B,00222,B,do not blame her please mr eager the fault is mine i left her unchaperoned
p00223_B,00223,B,so you were here alone miss honeychurch
p00224_B,00224,B,practically
p00225_B,00225,B,one of our pension acquaintances kindly brought her home
p00226_B,00226,B,for her also it must have been a terrible experience i trust that neither of you was at all that it was not in your immediate proximity
p00227_B,00227,B,he died by the fountain i believe
p00228_B,00228,B,and you and your friend
p00229_B,00229,B,were over at the loggia
p00230_B,00230,B,that must have saved you much you have not of course seen the disgraceful illustrations which the gutter press this man is a public nuisance he knows that i am a resident perfectly well and yet he goes on worrying me to buy his vulgar views this is too much
p00231_B,00231,B,willingly would i purchase
p00232_B,00232,B,ignore him
p00233_B,00233,B,how wonderfully people rise in these days
p00234_B,00234,B,generally one has only sympathy for their success the desire for education and for social advance in these things there is something not wholly vile there are some working men whom one would be very willing to see out here in florence little as they would make of it
p00235_B,00235,B,is he a journalist now
p00236_B,00236,B,he is not he made an advantageous marriage
p00237_B,00237,B,oh so he has a wife
p00238_B,00238,B,dead miss bartlett dead i wonder yes i wonder how he has the effrontery to look me in the face to dare to claim acquaintance with me he was in my london parish long ago the other day in santa croce when he was with miss honeychurch i snubbed him let him beware that he does not get more than a snub
p00239_B,00239,B,what
p00240_B,00240,B,exposure
p00241_B,00241,B,do you mean that he is an irreligious man we know that already
p00242_B,00242,B,lucy dear
p00243_B,00243,B,i should be astonished if you knew all the boy an innocent child at the time i will exclude god knows what his education and his inherited qualities may have made him
p00244_B,00244,B,perhaps it is something that we had better not hear
p00245_B,00245,B,to speak plainly it is i will say no more
p00246_B,00246,B,you have said very little
p00247_B,00247,B,it was my intention to say very little murder if you want to know that man murdered his wife
p00248_B,00248,B,how
p00249_B,00249,B,to all intents and purposes he murdered her that day in santa croce did they say anything against me
p00250_B,00250,B,not a word mr eager not a single word
p00251_B,00251,B,oh i thought they had been libelling me to you but i suppose it is only their personal charms that makes you defend them
p00252_B,00252,B,i m not defending them they re nothing to me
p00253_B,00253,B,how could you think she was defending them
p00254_B,00254,B,drive oh is our drive to come off
p00255_B,00255,B,if that is so dear if the drive we and mr beebe are going with mr eager is really the same as the one we are going with mr beebe then i foresee a sad kettle of fish
p00256_B,00256,B,how
