uid,pair_id,side,text
p00479_B,00479,B,i am so sorry that you were stranded
p00480_B,00480,B,not that but the congratulations it is so disgusting the way an engagement is regarded as public property a kind of waste place where every outsider may shoot his vulgar sentiment all those old women smirking
p00481_B,00481,B,one has to go through it i suppose they won t notice us so much next time
p00482_B,00482,B,but my point is that their whole attitude is wrong an engagement horrid word in the first place is a private matter and should be treated as such
p00483_B,00483,B,how tiresome couldn t you have escaped to tennis
p00484_B,00484,B,i don t play tennis at least not in public the neighbourhood is deprived of the romance of me being athletic such romance as i have is that of the inglese italianato
p00485_B,00485,B,inglese italianato
p00486_B,00486,B,e un diavolo incarnato you know the proverb well i cannot help it if they do disapprove of me there are certain irremovable barriers between myself and them and i must accept them
p00487_B,00487,B,we all have our limitations i suppose
p00488_B,00488,B,sometimes they are forced on us though
p00489_B,00489,B,how
p00490_B,00490,B,it makes a difference doesn t it whether we fully fence ourselves in or whether we are fenced out by the barriers of others
p00491_B,00491,B,we were speaking of motives
p00492_B,00492,B,my dear cecil look here this is me that s windy corner the rest of the pattern is the other people motives are all very well but the fence comes here
p00493_B,00493,B,we weren t talking of real fences
p00494_B,00494,B,oh i see dear poetry i tell you who has no as you call them and that s mr beebe
p00495_B,00495,B,a parson fenceless would mean a parson defenceless
p00496_B,00496,B,don t you like mr beebe
p00497_B,00497,B,i never said so i consider him far above the average i only denied
p00498_B,00498,B,now a clergyman that i do hate a clergyman that does have fences and the most dreadful ones is mr eager the english chaplain at florence he was truly insincere not merely the manner unfortunate he was a snob and so conceited and he did say such unkind things
p00499_B,00499,B,what sort of things
p00500_B,00500,B,there was an old man at the bertolini whom he said had murdered his wife
p00501_B,00501,B,perhaps he had
p00502_B,00502,B,no
p00503_B,00503,B,why
p00504_B,00504,B,he was such a nice old man i m sure well i did try to sift the thing mr eager would never come to the point he prefers it vague said the old man had practically murdered his wife had murdered her in the sight of god
p00505_B,00505,B,hush dear poor old man what was his name
p00506_B,00506,B,harris
p00507_B,00507,B,let s hope that mrs harris there warn t no sich person
p00508_B,00508,B,isn t mr eager a parson of the cultured type
p00509_B,00509,B,i don t know i hate him i ve heard him lecture on giotto i hate him nothing can hide a petty nature i hate him
p00510_B,00510,B,my goodness gracious me child you ll blow my head off whatever is there to shout over i forbid you and cecil to hate any more clergymen
p00511_B,00511,B,i count myself a lucky person when i m in london i feel i could never live out of it when i m in the country i feel the same about the country after all i do believe that birds and trees and the sky are the most wonderful things in life and that the people who live amongst them must be the best it s true that in nine cases out of ten they don t seem to notice anything the country gentleman and the country labourer are each in their way the most depressing of companions yet they may have a tacit sympathy with the workings of nature which is denied to us of the town do you feel that mrs honeychurch
p00512_B,00512,B,what height
p00513_B,00513,B,let us take mrs honeychurch s advice and hate clergymen no more what s this place
p00514_B,00514,B,summer street of course
p00515_B,00515,B,stop here s sir harry now we shall know sir harry pull those things down at once
p00516_B,00516,B,mrs honeychurch i meant to i can t i really can t turn out miss flack
p00517_B,00517,B,am i not always right she ought to have gone before the contract was signed does she still live rent free as she did in her nephew s time
p00518_B,00518,B,but what can i do an old lady so very vulgar and almost bedridden
p00519_B,00519,B,turn her out
p00520_B,00520,B,the rent is absurdly low and perhaps i am an easy landlord but it is such an awkward size it is too large for the peasant class and too small for any one the least like ourselves
p00521_B,00521,B,you ought to find a tenant at once it would be a perfect paradise for a bank clerk
p00522_B,00522,B,exactly that is exactly what i fear mr vyse it will attract the wrong type of people the train service has improved a fatal improvement to my mind and what are five miles from a station in these days of bicycles
p00523_B,00523,B,rather a strenuous clerk it would be sir harry i have an idea how would you like spinsters
p00524_B,00524,B,my dear lucy it would be splendid do you know any such
p00525_B,00525,B,yes i met them abroad
p00526_B,00526,B,gentlewomen
p00527_B,00527,B,yes indeed and at the present moment homeless i heard from them last week miss teresa and miss catharine alan i m really not joking they are quite the right people mr beebe knows them too may i tell them to write to you
p00528_B,00528,B,indeed you may here we are with the difficulty solved already how delightful it is extra facilities please tell them they shall have extra facilities for i shall have no agents fees oh the agents the appalling people they have sent me one woman when i wrote a tactful letter you know asking her to explain her social position to me replied that she would pay the rent in advance as if one cares about that and several references i took up were most unsatisfactory people swindlers or not respectable and oh the deceit i have seen a good deal of the seamy side this last week the deceit of the most promising people my dear lucy the deceit
p00529_B,00529,B,my advice is to have nothing to do with lucy and her decayed gentlewomen at all i know the type preserve me from people who have seen better days and bring heirlooms with them that make the house smell stuffy it s a sad thing but i d far rather let to someone who is going up in the world than to someone who has come down
p00530_B,00530,B,i think i follow you but it is as you say a very sad thing
p00531_B,00531,B,the misses alan aren t that
p00532_B,00532,B,yes they are i haven t met them but i should say they were a highly unsuitable addition to the neighbourhood
p00533_B,00533,B,don t listen to him sir harry he s tiresome
p00534_B,00534,B,it s i who am tiresome i oughtn t to come with my troubles to young people but really i am so worried and lady otway will only say that i cannot be too careful which is quite true but no real help
p00535_B,00535,B,then may i write to my misses alan
p00536_B,00536,B,please
p00537_B,00537,B,beware they are certain to have canaries sir harry beware of canaries they spit the seed out through the bars of the cages and then the mice come beware of women altogether only let to a man
p00538_B,00538,B,really
p00539_B,00539,B,men don t gossip over tea cups if they get drunk there s an end of them they lie down comfortably and sleep it off if they re vulgar they somehow keep it to themselves it doesn t spread so give me a man of course provided he s clean
p00540_B,00540,B,mrs honeychurch what if we two walk home and leave you
p00541_B,00541,B,certainly
p00542_B,00542,B,aha young people young people
p00543_B,00543,B,hopeless vulgarian
p00544_B,00544,B,oh cecil
p00545_B,00545,B,i can t help it it would be wrong not to loathe that man
p00546_B,00546,B,he isn t clever but really he is nice
p00547_B,00547,B,no lucy he stands for all that is bad in country life in london he would keep his place he would belong to a brainless club and his wife would give brainless dinner parties but down here he acts the little god with his gentility and his patronage and his sham aesthetics and everyone even your mother is taken in
p00548_B,00548,B,all that you say is quite true i wonder whether whether it matters so very much
p00549_B,00549,B,it matters supremely sir harry is the essence of that garden party oh goodness how cross i feel how i do hope he ll get some vulgar tenant in that villa some woman so really vulgar that he ll notice it gentlefolks ugh with his bald head and retreating chin but let s forget him
p00550_B,00550,B,which way shall we go
p00551_B,00551,B,are there two ways
p00552_B,00552,B,perhaps the road is more sensible as we re got up smart
p00553_B,00553,B,i d rather go through the wood why is it lucy that you always say the road do you know that you have never once been with me in the fields or the wood since we were engaged
p00554_B,00554,B,haven t i the wood then
p00555_B,00555,B,i had got an idea i dare say wrongly that you feel more at home with me in a room
p00556_B,00556,B,a room
p00557_B,00557,B,yes or at the most in a garden or on a road never in the real country like this
p00558_B,00558,B,oh cecil whatever do you mean i have never felt anything of the sort you talk as if i was a kind of poetess sort of person
p00559_B,00559,B,i don t know that you aren t i connect you with a view a certain type of view why shouldn t you connect me with a room
p00560_B,00560,B,do you know that you re right i do i must be a poetess after all when i think of you it s always as in a room how funny
p00561_B,00561,B,a drawing room pray with no view
p00562_B,00562,B,yes with no view i fancy why not
p00563_B,00563,B,i d rather that you connected me with the open air
p00564_B,00564,B,oh cecil whatever do you mean the sacred lake
p00565_B,00565,B,why do you call it that
p00566_B,00566,B,i can t remember why i suppose it comes out of some book it s only a puddle now but you see that stream going through it well a good deal of water comes down after heavy rains and can t get away at once and the pool becomes quite large and beautiful then freddy used to bathe there he is very fond of it
p00567_B,00567,B,and you
p00568_B,00568,B,i bathed here too till i was found out then there was a row
p00569_B,00569,B,who found you out
p00570_B,00570,B,charlotte she was stopping with us charlotte charlotte
p00571_B,00571,B,poor girl lucy
p00572_B,00572,B,yes i suppose we ought to be going
p00573_B,00573,B,lucy i want to ask something of you that i have never asked before
p00574_B,00574,B,what cecil
p00575_B,00575,B,hitherto never not even that day on the lawn when you agreed to marry me
p00576_B,00576,B,yes
p00577_B,00577,B,up to now i have never kissed you
p00578_B,00578,B,no more you have
p00579_B,00579,B,then i ask you may i now
p00580_B,00580,B,of course you may cecil you might before i can t run at you you know emerson was the name not harris
p00581_B,00581,B,what name
p00582_B,00582,B,the old man s
p00583_B,00583,B,what old man
p00584_B,00584,B,that old man i told you about the one mr eager was so unkind to
p00585_B,00585,B,but they really are coming now i wrote to miss teresa a few days ago she was wondering how often the butcher called and my reply of once a month must have impressed her favourably they are coming i heard from them this morning
p00586_B,00586,B,i shall hate those miss alans just because they re old and silly one s expected to say how sweet i hate their if ing and but ing and and ing and poor lucy serve her right worn to a shadow
p00587_B,00587,B,well if they are coming no minnie not saturn if they are coming sir harry will let them move in before the twenty ninth and he will cross out the clause about whitewashing the ceilings because it made them nervous and put in the fair wear and tear one that doesn t count i told you not saturn
p00588_B,00588,B,saturn doesn t bounce
p00589_B,00589,B,saturn bounces enough
p00590_B,00590,B,no he doesn t
p00591_B,00591,B,well he bounces better than the beautiful white devil
p00592_B,00592,B,hush dear
p00593_B,00593,B,but look at lucy complaining of saturn and all the time s got the beautiful white devil in her hand ready to plug it in that s right minnie go for her get her over the shins with the racquet get her over the shins
p00594_B,00594,B,the name of this ball is vittoria corombona please i wish the miss alans could see this
p00595_B,00595,B,who are the miss alans
p00596_B,00596,B,they have taken cissie villa
p00597_B,00597,B,that wasn t the name
p00598_B,00598,B,wasn t what name
p00599_B,00599,B,alan wasn t the name of the people sir harry s let to
p00600_B,00600,B,nonsense freddy you know nothing about it
p00601_B,00601,B,nonsense yourself i ve this minute seen him he said to me i said ooray old boy and slapped him on the back
p00602_B,00602,B,exactly the miss alans
p00603_B,00603,B,rather not more like anderson
p00604_B,00604,B,oh good gracious there isn t going to be another muddle do you notice lucy i m always right i said don t interfere with cissie villa i m always right i m quite uneasy at being always right so often
p00605_B,00605,B,it s only another muddle of freddy s freddy doesn t even know the name of the people he pretends have taken it instead
p00606_B,00606,B,yes i do i ve got it emerson
p00607_B,00607,B,what name
p00608_B,00608,B,emerson i ll bet you anything you like
p00609_B,00609,B,what a weathercock sir harry is i wish i had never bothered over it at all
p00610_B,00610,B,emerson freddy do you know what emersons they are
p00611_B,00611,B,i don t know whether they re any emersons
p00612_B,00612,B,i trust they are the right sort of person all right lucy i see you looking down your nose and thinking your mother s a snob but there is a right sort and a wrong sort and it s affectation to pretend there isn t
p00613_B,00613,B,emerson s a common enough name
p00614_B,00614,B,i was merely going to remark freddy that i trusted they were no relations of emerson the philosopher a most trying man pray does that satisfy you
p00615_B,00615,B,oh yes and you will be satisfied too for they re friends of cecil so you and the other country families will be able to call in perfect safety
p00616_B,00616,B,cecil
p00617_B,00617,B,don t be rude dear lucy don t screech it s a new bad habit you re getting into
p00618_B,00618,B,but has cecil
p00619_B,00619,B,friends of cecil s
p00620_B,00620,B,but cecil s emersons they can t possibly be the same ones there is that
p00621_B,00621,B,the emersons who were at florence do you mean no i don t suppose it will prove to be them it is probably a long cry from them to friends of mr vyse s oh mrs honeychurch the oddest people the queerest people for our part we liked them didn t we
p00622_B,00622,B,fiasco s done you this time
p00623_B,00623,B,these particular emersons consisted of a father and a son the son a goodly if not a good young man not a fool i fancy but very immature pessimism et cetera our special joy was the father such a sentimental darling and people declared he had murdered his wife
p00624_B,00624,B,murdered his wife lucy don t desert us go on playing bumble puppy really the pension bertolini must have been the oddest place that s the second murderer i ve heard of as being there whatever was charlotte doing to stop by the by we really must ask charlotte here some time
p00625_B,00625,B,oh don t go
p00626_B,00626,B,harris
p00627_B,00627,B,cecil
p00628_B,00628,B,hullo i was hoping you d come i heard you all bear gardening but there s better fun up here i even i have won a great victory for the comic muse george meredith s right the cause of comedy and the cause of truth are really the same and i even i have found tenants for the distressful cissie villa don t be angry don t be angry you ll forgive me when you hear it all
p00629_B,00629,B,i have heard freddy has told us naughty cecil i suppose i must forgive you just think of all the trouble i took for nothing certainly the miss alans are a little tiresome and i d rather have nice friends of yours but you oughtn t to tease one so
p00630_B,00630,B,friends of mine but lucy the whole joke is to come come here do you know where i met these desirable tenants in the national gallery when i was up to see my mother last week
p00631_B,00631,B,what an odd place to meet people i don t quite understand
p00632_B,00632,B,in the umbrian room absolute strangers they were admiring luca signorelli of course quite stupidly however we got talking and they refreshed me not a little they had been to italy
p00633_B,00633,B,but cecil
p00634_B,00634,B,in the course of conversation they said that they wanted a country cottage the father to live there the son to run down for week ends i thought what a chance of scoring off sir harry and i took their address and a london reference found they weren t actual blackguards it was great sport and wrote to him making out
p00635_B,00635,B,cecil no it s not fair i ve probably met them before
p00636_B,00636,B,perfectly fair anything is fair that punishes a snob that old man will do the neighbourhood a world of good sir harry is too disgusting with his decayed gentlewomen i meant to read him a lesson some time no lucy the classes ought to mix and before long you ll agree with me there ought to be intermarriage all sorts of things i believe in democracy
p00637_B,00637,B,no you don t you don t know what the word means
p00638_B,00638,B,no you don t
p00639_B,00639,B,it isn t fair cecil i blame you i blame you very much indeed you had no business to undo my work about the miss alans and make me look ridiculous you call it scoring off sir harry but do you realize that it is all at my expense i consider it most disloyal of you
p00640_B,00640,B,temper
p00641_B,00641,B,so you do love me little thing
p00642_B,00642,B,oh cecil i do i do i don t know what i should do without you
p00643_B,00643,B,now some beethoven
p00644_B,00644,B,make lucy one of us lucy is becoming wonderful wonderful
p00645_B,00645,B,her music always was wonderful
p00646_B,00646,B,yes but she is purging off the honeychurch taint most excellent honeychurches but you know what i mean she is not always quoting servants or asking one how the pudding is made
p00647_B,00647,B,italy has done it
p00648_B,00648,B,perhaps it is just possible cecil mind you marry her next january she is one of us already
p00649_B,00649,B,but her music the style of her how she kept to schumann when like an idiot i wanted beethoven schumann was right for this evening schumann was the thing do you know mother i shall have our children educated just like lucy bring them up among honest country folks for freshness send them to italy for subtlety and then not till then let them come to london i don t believe in these london educations at all events not for women
p00650_B,00650,B,make her one of us
p00651_B,00651,B,bad dreams
p00652_B,00652,B,just dreams
p00653_B,00653,B,you should have heard us talking about you dear he admires you more than ever dream of that
p00654_B,00654,B,m m
p00655_B,00655,B,they might amuse you i suggested we should hinder them they are worth it hullo
p00656_B,00656,B,i ve brought someone to see you
p00657_B,00657,B,i ll be down in a minute
p00658_B,00658,B,i fancy they know how to read a rare accomplishment what have they got byron exactly a shropshire lad never heard of it the way of all flesh never heard of it gibbon hullo dear george reads german um um schopenhauer nietzsche and so we go on well i suppose your generation knows its own business honeychurch
p00659_B,00659,B,mr beebe look at that
p00660_B,00660,B,i know isn t it jolly i like that i m certain that s the old man s doing
p00661_B,00661,B,how very odd of him
p00662_B,00662,B,surely you agree pictures giotto they got that at florence i ll be bound
p00663_B,00663,B,the same as lucy s got
p00664_B,00664,B,oh by the by did miss honeychurch enjoy london
p00665_B,00665,B,she came back yesterday
p00666_B,00666,B,i suppose she had a good time
p00667_B,00667,B,yes very she and cecil are thicker than ever
p00668_B,00668,B,that s good hearing
p00669_B,00669,B,i wish i wasn t such a fool mr beebe lucy used to be nearly as stupid as i am but it ll be very different now mother thinks she will read all kinds of books
p00670_B,00670,B,so will you
p00671_B,00671,B,only medical books not books that you can talk about afterwards cecil is teaching lucy italian and he says her playing is wonderful there are all kinds of things in it that we have never noticed cecil says
p00672_B,00672,B,what on earth are those people doing upstairs emerson we think we ll come another time
p00673_B,00673,B,how d ye do come and have a bathe
p00674_B,00674,B,oh all right
p00675_B,00675,B,that s the best conversational opening i ve ever heard but i m afraid it will only act between men can you picture a lady who has been introduced to another lady by a third lady opening civilities with how do you do come and have a bathe and yet you will tell me that the sexes are equal
p00676_B,00676,B,we are to raise ladies to our level
p00677_B,00677,B,the garden of eden which you place in the past is really yet to come we shall enter it when we no longer despise our bodies in this not in other things we men are ahead we despise the body less than women do but not until we are comrades shall we enter the garden
p00678_B,00678,B,i say what about this bathe
p00679_B,00679,B,i believed in a return to nature once but how can we return to nature when we have never been with her to day i believe that we must discover nature after many conquests we shall attain simplicity it is our heritage
p00680_B,00680,B,let me introduce mr honeychurch whose sister you will remember at florence
p00681_B,00681,B,how do you do very glad to see you and that you are taking george for a bathe very glad to hear that your sister is going to marry marriage is a duty i am sure that she will be happy for we know mr vyse too he has been most kind he met us by chance in the national gallery and arranged everything about this delightful house though i hope i have not vexed sir harry otway i have met so few liberal landowners and i was anxious to compare his attitude towards the game laws with the conservative attitude ah this wind you do well to bathe yours is a glorious country honeychurch
p00682_B,00682,B,not a bit i must that is to say i have to have the pleasure of calling on you later on my mother says i hope
p00683_B,00683,B,call my lad who taught us that drawing room twaddle call on your grandmother listen to the wind among the pines yours is a glorious country
p00684_B,00684,B,mr emerson he will call i shall call you or your son will return our calls before ten days have elapsed i trust that you have realized about the ten days interval it does not count that i helped you with the stair eyes yesterday it does not count that they are going to bathe this afternoon
p00685_B,00685,B,yes go and bathe george why do you dawdle talking bring them back to tea bring back some milk cakes honey the change will do you good george has been working very hard at his office i can t believe he s well
p00686_B,00686,B,do you really want this bathe it is only a pond don t you know i dare say you are used to something better
p00687_B,00687,B,and what a coincidence that you should meet mr vyse did you realize that you would find all the pension bertolini down here
p00688_B,00688,B,i did not miss lavish told me
p00689_B,00689,B,when i was a young man i always meant to write a history of coincidence though as a matter of fact coincidences are much rarer than we suppose for example it isn t purely coincidentally that you are here now when one comes to reflect
p00690_B,00690,B,it is i have reflected it is fate everything is fate we are flung together by fate drawn apart by fate flung together drawn apart the twelve winds blow us we settle nothing
p00691_B,00691,B,you have not reflected at all
p00692_B,00692,B,italy
p00693_B,00693,B,and where did you meet mr vyse who is going to marry miss honeychurch
p00694_B,00694,B,national gallery
p00695_B,00695,B,looking at italian art there you are and yet you talk of coincidence and fate you naturally seek out things italian and so do we and our friends this narrows the field immeasurably we meet again in it
p00696_B,00696,B,it is fate that i am here but you can call it italy if it makes you less unhappy
p00697_B,00697,B,and so for this and for other reasons my history of coincidence is still to write we are all so glad that you have come
p00698_B,00698,B,here we are
p00699_B,00699,B,oh good
p00700_B,00700,B,in there s the pond i wish it was bigger
p00701_B,00701,B,it s distinctly successful as ponds go no apologies are necessary for the pond aren t those masses of willow herb splendid i love willow herb in seed what s the name of this aromatic plant these abrupt changes of vegetation this little spongeous tract of water plants and on either side of it all the growths are tough or brittle heather bracken hurts pines very charming very charming
p00702_B,00702,B,mr beebe aren t you bathing water s wonderful
p00703_B,00703,B,water s water
p00704_B,00704,B,apooshoo apooshoo apooshoo
p00705_B,00705,B,is it worth it
p00706_B,00706,B,hee poof i ve swallowed a pollywog mr beebe water s wonderful water s simply ripping
p00707_B,00707,B,water s not so bad
p00708_B,00708,B,water s wonderful mr beebe do
p00709_B,00709,B,apooshoo kouf
p00710_B,00710,B,i may as well wash too
p00711_B,00711,B,race you round it then a try a try
p00712_B,00712,B,socker rules
p00713_B,00713,B,goal
p00714_B,00714,B,goal
p00715_B,00715,B,pass
p00716_B,00716,B,take care my watch take care my hat no that s enough freddy dress now no i say that ll do hi steady on i see people coming you fellows
p00717_B,00717,B,gracious alive whoever were those unfortunate people oh dears look away and poor mr beebe too whatever has happened
p00718_B,00718,B,come this way immediately
p00719_B,00719,B,oh poor mr beebe was that his waistcoat we left in the path cecil mr beebe s waistcoat
p00720_B,00720,B,no business of ours
