uid,pair_id,side,text
p00136_B,00136,B,you why i hate you yes yes i hate you i love you no more than i do de griers buy me would you would you would you buy me for fifty thousand francs as de griers did you love me do you you who were willing even to quarrel with the baron at my bidding no no you are my dear one you are the man i trust you love me you love me will you always love me yes yes he is there open the window and see if he is not shall we go away tomorrow how would it be if we were to try and overtake grandmamma i think we should do so at berlin and what think you she would have to say to us when we caught her up and her eyes first lit upon us what too about mr astley he would not leap from the shlangenberg for my sake no of that i am very sure do you know where he is going next year he says he intends to go to the north pole for scientific investigations and has invited me to go with him ha ha ha he also says that we russians know nothing can do nothing without european help but he is a good fellow all the same for instance he does not blame the general in the matter but declares that mlle blanche that love but no i do not know i do not know what poor creatures these people are how sorry i am for them and for grandmamma but when are you going to kill de griers surely you do not intend actually to murder him you fool do you suppose that i should allow you to fight de griers nor shall you kill the baron how absurd you looked when you were talking to the burmergelms i was watching you all the time watching you from where i was sitting and how unwilling you were to go when i sent you oh how i laughed and laughed well are you going to hand me over my fifty thousand francs
p00137_B,00137,B,yes i do challenge you go for such is my will
p00138_B,00138,B,yes they are true what then
p00139_B,00139,B,what do not you also hope something from it did you not tell me again and again two weeks ago that you were certain of winning at roulette if you played here and did you not ask me not to consider you a fool for doing so were you joking you cannot have been for i remember that you spoke with a gravity which forbade the idea of your jesting
p00140_B,00140,B,you are losing the thread of the argument if you do not wish to purchase me at all events you wish to purchase my respect
p00141_B,00141,B,and because you do not believe in my nobility of soul you think to purchase me with money
p00142_B,00142,B,yes absolutely it amuses me to see you grow angry however inasmuch as i allow you to indulge in these questions and conjectures you ought to pay me something for the privilege
p00143_B,00143,B,of course all of us and every minute of the day for a year and a half now we have been looking for this
p00144_B,00144,B,yes that is true as soon as ever he learnt that i was likely to inherit something from her he began to pay me his addresses i thought you ought to know that
p00145_B,00145,B,yes but then the frenchman is a marquis and the cleverer of the two
p00146_B,00146,B,if you were to do that he would merely tell you to be so good as first to return him the fifty thousand francs what then would be the use of having a quarrel with him you talk sheer nonsense
p00147_B,00147,B,oh no there is no doubt about it he does possess some ch teau or other last night the general told me that for certain now are you satisfied
p00148_B,00148,B,last time you told me when on the shlangenberg that at a word from me you would be ready to jump down a thousand feet into the abyss some day i may remind you of that saying in order to see if you will be as good as your word yes you may depend upon it that i shall do so i hate you because i have allowed you to go to such lengths and i also hate you and still more because you are so necessary to me for the time being i want you so i must keep you
p00149_B,00149,B,in frankfort where he will be staying for the next three days
p00150_B,00150,B,because i am not in the habit of receiving money for nothing
p00151_B,00151,B,why do you ask me these questions
p00152_B,00152,B,yes looking for it i am not her blood relation you know i am merely the general s step daughter yet i am certain that the old lady has remembered me in her will
p00153_B,00153,B,you know he has not but where on earth did you pick up this englishman
p00154_B,00154,B,no i am not but i order you nevertheless to be silent what rubbish
p00155_B,00155,B,if i said to you kill that man would you kill him
p00156_B,00156,B,then take your fifty thousand francs
p00157_B,00157,B,yes he is in love with me
p00158_B,00158,B,i am not going to talk to you on that subject i have asked you a question and am waiting for an answer
p00159_B,00159,B,and why are you so certain
p00160_B,00160,B,then are you so certain that your roulette playing will get us out of our difficulties
p00161_B,00161,B,what makes you speak of her i cannot go and live with her nor will i go down upon my knees to any one
p00162_B,00162,B,you are giving too much for me the beloved of de griers is not worth fifty thousand francs
p00163_B,00163,B,yes it is very horrible consequently i am the more surprised that you should be so cheerful what are you so pleased about about the fact that you have gone and lost my money
p00164_B,00164,B,you have changed your mind then ha ha ha you are sorry you ever promised them the francs are mine then are they they are mine
p00165_B,00165,B,and why are you yourself so interested in them
p00166_B,00166,B,it may be so
p00167_B,00167,B,well absurd though it be i place great hopes on your playing of roulette wherefore you ought to play as my partner and on equal shares wherefore of course you will do as i wish
p00168_B,00168,B,take this letter and hand it personally to mr astley go as quickly as ever you can please no answer will be required he himself
p00169_B,00169,B,do not ask me questions return me answers i repeat whomsoever i wish i desire to see if you were speaking seriously just now
p00170_B,00170,B,that has nothing to do with it listen to me take these 700 florins and go and play roulette with them win as much for me as you can for i am badly in need of money
p00171_B,00171,B,what you yourself wish me to leave you for him
p00172_B,00172,B,perhaps because one cannot help winning if one is fanatically certain of doing so
p00173_B,00173,B,if i am here i have come with all that i have to bring such has always been my way as you shall presently see please light a candle read it
p00174_B,00174,B,no no the general has not got it
p00175_B,00175,B,and why
p00176_B,00176,B,what stupid rubbish
p00177_B,00177,B,why should i have wanted you to leap from the shlangenberg that would have been of no use to me
p00178_B,00178,B,my affairs cannot possibly interest you still if you do wish to know i am in debt i borrowed some money and must pay it back again i have a curious senseless idea that i am bound to win at the gaming tables why i think so i cannot tell but i do think so and with some assurance perhaps it is because of that assurance that i now find myself without any other resource
p00179_B,00179,B,hush not so loud
p00180_B,00180,B,yes something i believe will happen to him
p00181_B,00181,B,yes and i suppose you want to know why you are aware are you not that the general is mortgaged to the marquis with all his property consequently if the general s mother does not die the frenchman will become the absolute possessor of everything which he now holds only in pledge
p00182_B,00182,B,why should you think that i am going to let you off i shall bid you do it or else renounce me could you ever do the latter no you know that you couldn t you would first kill whom i had bidden you and then kill me for having dared to send you away do you see that fat baroness it is the baroness burmergelm she arrived three days ago just look at her husband that tall wizened prussian there with the stick in his hand do you remember how he stared at us the other day well go to the baroness take off your hat to her and say something in french
p00183_B,00183,B,oh no why so i believe you surely you are not a coward
p00184_B,00184,B,you talk like a child it is always possible to comport oneself with dignity if one has a quarrel it ought to elevate rather than to degrade one
p00185_B,00185,B,yes for she is fond of me but how come you to think so
p00186_B,00186,B,i expected nothing at all from him long ago i made up my mind on the subject for i could read his thoughts and knew what he was thinking he thought that possibly i should sue him that one day i might become a nuisance so of set purpose i redoubled my contemptuous treatment of him and waited to see what he would do if a telegram to say that we had become legatees had arrived from st petersburg i should have flung at him a quittance for my foolish stepfather s debts and then dismissed him for a long time i have hated him even in earlier days he was not a man and now oh how gladly i could throw those fifty thousand roubles in his face and spit in it and then rub the spittle in
p00187_B,00187,B,damn the gambling yes i should certainly have given it up were it not that
p00188_B,00188,B,which means that you are vexed at not having found me more abased and humiliated than i am
p00189_B,00189,B,yet he possesses a good circle of friends
p00190_B,00190,B,then see here on the one hand you are a sugar refiner while on the other hand you are an apollo belvedere but the two characters do not mix with one another i again am not even a sugar refiner i am a mere roulette gambler who has also served as a lacquey of this fact mlle polina is probably well aware since she appears to have an excellent force of police at her disposal
p00191_B,00191,B,then you are minded to keep her there
p00192_B,00192,B,and she is in your rooms
p00193_B,00193,B,no mr astley after all that has been said i
p00194_B,00194,B,what a strange thing for i know no russians at all here so it cannot have been a russian who befriended me in russia we orthodox folk do go bail for one another but in this case i thought it must have been done by some english stranger who was not conversant with the ways of the country
p00195_B,00195,B,yes yes that is so for me to go and desert the children now would mean their total abandonment whereas if i remain i should be able to defend their interests and perhaps to save a moiety of their property yes yes that is quite true and yet and yet oh i can well understand why they are all so interested in the general s mother
p00196_B,00196,B,but why should she be calling me hear her calling again see she is beckoning to us
p00197_B,00197,B,indeed then i wish you joy mr astley apropos you have reminded me of something were you beneath my window last night every moment mlle polina kept telling me to open the window and see if you were there after which she always smiled
p00198_B,00198,B,then you know all about it
p00199_B,00199,B,and what of mlle blanche
p00200_B,00200,B,i really cannot say
p00201_B,00201,B,what a splendid fellow you are mr astley and since i have not yet had my coffee and you have in all probability scarcely tasted yours let us adjourn to the casino caf where we can sit and smoke and have a talk i do not intend to go away i intend on the contrary to remain here
p00202_B,00202,B,enough you need say no more very well very well then i stand confounded and have no further opinions to offer but you are a good fellow and i am glad to know what you think about it all even though i do not need your advice for instance what reason should you assign for the general taking fright in this way why should my stupid clowning have led the world to elevate it into a serious incident even de griers has found it necessary to put in his oar and he only interferes on the most important occasions and to visit me and to address to me the most earnest supplications yes he de griers has actually been playing the suppliant to me and mark you although he came to me as early as nine o clock he had ready prepared in his hand mlle polina s note when i would ask was that note written mlle polina must have been aroused from sleep for the express purpose of writing it at all events the circumstance shows that she is an absolute slave to the frenchman since she actually begs my pardon in the note actually begs my pardon yet what is her personal concern in the matter why is she interested in it at all why too is the whole party so afraid of this precious baron and what sort of a business do you call it for the general to be going to marry mlle blanche de cominges he told me last night that because of the circumstance he must move with especial care at present what is your opinion of it all your look convinces me that you know more about it than i do
p00203_B,00203,B,then i beg your pardon a thousand times mr astley i meant nothing offensive to mlle polina for i have nothing of which to accuse her moreover the question of there being anything between this frenchman and this russian lady is not one which you and i need discuss nor even attempt to understand
p00204_B,00204,B,quite so quite so i admit that yet that is not the question what do you make of it when i met you i was just coming to ask you your opinion for myself i could have killed this frenchman and am not sure that i shall not do so even yet
p00205_B,00205,B,oh oh
p00206_B,00206,B,what in spite of our old friendship
p00207_B,00207,B,i agree but therein lies the horror of it all that how trepidation playing ever mean and farcical my accusations may be they are none the less true but i am only wasting words
p00208_B,00208,B,what you think that he is waiting for that
p00209_B,00209,B,no i have never noticed whether she does so or not
p00210_B,00210,B,no i fear not
p00211_B,00211,B,she ought to see a doctor you know mr astley
p00212_B,00212,B,good bye but i am not going to paris likewise pardon me what is to become of this family i mean that the affair of the general and mlle polina will soon be all over the town
p00213_B,00213,B,perhaps i shall need it for a meal
p00214_B,00214,B,no i know nothing for certain about them no nothing
p00215_B,00215,B,how closely you watch the doings of your old friends that does you infinite credit but stop a moment you have reminded me of something was it you who bailed me out of roulettenberg prison when i was lying there for a debt of two hundred g lden someone did so
p00216_B,00216,B,where have you been today
p00217_B,00217,B,yes certainly
p00218_B,00218,B,and de griers is he too travelling in switzerland
p00219_B,00219,B,indeed is that really so
p00220_B,00220,B,yes and de griers
p00221_B,00221,B,yes i will take it if at the same time you will embrace me
p00222_B,00222,B,how do you know that is every one aware of the fact
p00223_B,00223,B,then how come you to know it
p00224_B,00224,B,no i do not tell me mr astley why if you knew this history all along and consequently always knew who this mlle blanche is you never warned either myself or the general nor most of all mlle polina how could you do it
p00225_B,00225,B,enough mr astley kindly do not recall to me any more recollections for i can remember things for myself only for a time have i put them out of my head only until i shall have rehabilitated myself am i keeping my memory dulled when that hour shall come you will see me arise from the dead
p00226_B,00226,B,i suppose he means to shoot me in a duel should polina die yes that is what he intends to do
p00227_B,00227,B,but why
p00228_B,00228,B,ah i see you are interested mr astley but it is a long long story and calls for a lengthy preface at the same time the question is an important one however ridiculous it may seem at the first glance a frenchman mr astley is merely a fine figure of a man with this you as a britisher may not agree with it i also as a russian may not agree out of envy yet possibly our good ladies are of another opinion for instance one may look upon racine as a broken down hobbledehoy perfumed individual one may even be unable to read him and i too may think him the same as well as in some respects a subject for ridicule yet about him mr astley there is a certain charm and above all things he is a great poet though one might like to deny it yes the frenchman the parisian as a national figure was in process of developing into a figure of elegance before we russians had even ceased to be bears the revolution bequeathed to the french nobility its heritage and now every whipper snapper of a parisian may possess manners methods of expression and even thoughts that are above reproach in form while all the time he himself may share in that form neither in initiative nor in intellect nor in soul his manners and the rest having come to him through inheritance yes taken by himself the frenchman is frequently a fool of fools and a villain of villains per contra there is no one in the world more worthy of confidence and respect than this young russian lady de griers might so mask his face and play a part as easily to overcome her heart for he has an imposing figure mr astley and this young lady might easily take that figure for his real self for the natural form of his heart and soul instead of the mere cloak with which heredity has dowered him and even though it may offend you i feel bound to say that the majority also of english people are uncouth and unrefined whereas we russian folk can recognise beauty wherever we see it and are always eager to cultivate the same but to distinguish beauty of soul and personal originality there is needed far more independence and freedom than is possessed by our women especially by our younger ladies at all events they need more experience for instance this mlle polina pardon me but the name has passed my lips and i cannot well recall it is taking a very long time to make up her mind to prefer you to monsieur de griers she may respect you she may become your friend she may open out her heart to you yet over that heart there will be reigning that loathsome villain that mean and petty usurer de griers this will be due to obstinacy and self love to the fact that de griers once appeared to her in the transfigured guise of a marquis of a disenchanted and ruined liberal who was doing his best to help her family and the frivolous old general and although these transactions of his have since been exposed you will find that the exposure has made no impression upon her mind only give her the de griers of former days and she will ask of you no more the more she may detest the present de griers the more will she lament the de griers of the past even though the latter never existed but in her own imagination you are a sugar refiner mr astley are you not
p00229_B,00229,B,on business
p00230_B,00230,B,say no more and to show you that i have not wholly forgotten the past may i enquire where mlle polina is if it was not you who bailed me out of prison it must have been she yet never have i heard a word concerning her
p00231_B,00231,B,indeed on what subject then have i a better right to speak to you than on this with it are bound up all your recollections and mine however do not be alarmed i have no wish to probe too far into your private your secret affairs my interest in mlle polina does not extend beyond her outward circumstances and surroundings about them you could tell me in two words
p00232_B,00232,B,do you know what i believe that you have already heard the story from some one very possibly from mlle polina herself
p00233_B,00233,B,pardon me but what do you mean
p00234_B,00234,B,no i won a hundred thousand florins
p00235_B,00235,B,but i do i do he is waiting also for the old woman s will for the reason that it awards mlle polina a dowry as soon as ever the money is received she will throw herself upon the frenchman s neck all women are like that even the proudest of them become abject slaves where marriage is concerned what polina is good for is to fall head over ears in love that is my opinion look at her especially when she is sitting alone and plunged in thought all this was pre ordained and foretold and is accursed polina could perpetrate any mad act she she but who called me by name who is shouting for me i heard some one calling in russian it was a woman s voice listen
p00236_B,00236,B,no none whatever
p00237_B,00237,B,in the old woman of moscow who declines to die yet concerning whom they are for ever expecting telegrams to notify the fact of her death
p00238_B,00238,B,enough to me it is as clear as day that mlle polina knows all about this mlle blanche but cannot bring herself to part with her frenchman wherefore she consents also to be seen in public with mlle blanche you may be sure that nothing else would ever have induced her either to walk about with this frenchwoman or to send me a note not to touch the baron yes it is there that the influence lies before which everything in the world must bow yet she herself it was who launched me at the baron the devil take it but i was left no choice in the matter
p00239_B,00239,B,perhaps you could tell me who did bail me out
p00240_B,00240,B,but what could i do in paris in summer time i love her mr astley surely you know that
p00241_B,00241,B,but mr astley that will raise a scandal it ought not to be allowed besides she is very ill perhaps you had not remarked that
p00242_B,00242,B,at all events she in her turn has promised to give me an explanation to night and to reveal to me something or another
p00243_B,00243,B,which means that she has dealt you a serious wound
p00244_B,00244,B,yes i belong to the well known firm of lovell and co
p00245_B,00245,B,that you are losing i thought so you need not tell me any more i know how things stand for you have said that last in despair and therefore truthfully have you no other employment than gambling
p00246_B,00246,B,also i may tell you that mlle blanche has been in roulettenberg before for she was staying here three seasons ago i myself was in the place at the time and in those days mlle blanche was not known as mlle de cominges nor was her mother the widow de cominges even in existence in any case no one ever mentioned the latter de griers too had not materialised and i am convinced that not only do the parties stand in no relation to one another but also they have not long enjoyed one another s acquaintance likewise the marquisate de griers is of recent creation of that i have reason to be sure owing to a certain circumstance even the name de griers itself may be taken to be a new invention seeing that i have a friend who once met the said marquis under a different name altogether
p00247_B,00247,B,yes i am minded to keep her there
p00248_B,00248,B,yes she is in my rooms
p00249_B,00249,B,indeed she arrived at the casino even before i had taken my departure by train so i knew she had been playing if i should have time i will go to the casino to night and take a look at her the thing interests me
p00250_B,00250,B,you are saying this because you are feeling bitter yet there is not the least originality in your words
p00251_B,00251,B,yes you are for you are only talking nonsense are you aware that wretched ignoble petty unfortunate man though you are it was at her request i came to homburg in order to see you and to have a long serious talk with you and to report to her your feelings and thoughts and hopes yes and your recollections of her too
p00252_B,00252,B,well i must tell you that she first appeared here in company with an italian a prince of some sort a man who bore an historic name barberini or something of the kind the fellow was simply a mass of rings and diamonds real diamonds too and the couple used to drive out in a marvellous carriage at first mlle blanche played trente et quarante with fair success but later her luck took a marked change for the worse i distinctly remember that in a single evening she lost an enormous sum but worse was to ensue for one fine morning her prince disappeared horses carriage and all also the hotel bill which he left unpaid was enormous upon this mlle zelma the name which she assumed after figuring as madame barberini was in despair she shrieked and howled all over the hotel and even tore her clothes in her frenzy in the hotel there was staying also a polish count you must know that all travelling poles are counts and the spectacle of mlle zelma tearing her clothes and catlike scratching her face with her beautiful scented nails produced upon him a strong impression so the pair had a talk together and by luncheon time she was consoled indeed that evening the couple entered the casino arm in arm mlle zelma laughing loudly according to her custom and showing even more expansiveness in her manners than she had before shown for instance she thrust her way into the file of women roulette players in the exact fashion of those ladies who to clear a space for themselves at the tables push their fellow players roughly aside doubtless you have noticed them
p00253_B,00253,B,yes i did hear a woman s voice calling but whose i do not know the someone was calling you in russian ah now i can see whence the cries come they come from that lady there the one who is sitting on the settee the one who has just been escorted to the verandah by a crowd of lacqueys behind her see that pile of luggage she must have arrived by train
p00254_B,00254,B,ah then of course their interests centre around her it is a question of succession let that but be settled and the general will marry mlle polina will be set free and de griers
p00255_B,00255,B,what you cannot say
p00256_B,00256,B,and concerning this marquis and mlle polina you know nothing beyond surmise
p00257_B,00257,B,well my belief is that at the present moment mlle blanche has in very truth a special reason for wishing to avoid any trouble with the baron and the baroness it might lead not only to some unpleasantness but even to a scandal
