uid,pair_id,side,text
p00476_A,00476,A,you and your waters do not anger me prascovia surely you are trying to say then will you or will you not come with me
p00477_A,00477,A,you mean that you are not coming
p00478_A,00478,A,now now do not frown but i do not intend to slur things over you will take care that no harm befalls you will you not for you are a girl of sense and i am sorry for you i regard you in a different light to the rest of them and now please leave me good bye
p00479_A,00479,A,and how are you grandmother were you long on the journey
p00480_A,00480,A,there is a ruined castle and the shlangenberg
p00481_A,00481,A,no a mountain on the summit of which there is a place fenced off from it you can get a most beautiful view
p00482_A,00482,A,prince nilski grandmamma
p00483_A,00483,A,no grandmamma it is my own
p00484_A,00484,A,yes we are going to see it grandmamma
p00485_A,00485,A,yes quite a number of things
p00486_A,00486,A,i do not know for certain grandmamma but from mlle blanche s account for she does not appear to think it necessary to conceal anything i conclude that
p00487_A,00487,A,first of all let me ask of you whether you are intending to depart at once
p00488_A,00488,A,but what about the waters grandmamma surely you came here to take the waters
p00489_A,00489,A,grandmamma i am very very grateful to you for the shelter which you have so kindly offered me also to a certain extent you have guessed my position aright and i am beholden to you to such an extent that it may be that i will come and live with you and that very soon yet there are important reasons why why i cannot make up my mind just yet if you would let me have say a couple of weeks to decide in
p00490_A,00490,A,i mean only that i cannot come just yet at all events i could not well leave my little brother and sister here since since if i were to leave them they would be abandoned altogether but if grandmamma you would take the little ones and myself then of course i could come with you and would do all i could to serve you only without the little ones i cannot come
p00491_A,00491,A,but let me stay with you a little longer
p00492_A,00492,A,no i don t want to see them i hate kissing children for their noses are always wet how are you getting on theodosia
p00493_A,00493,A,i am very well thank you madame and how is your ladyship we have been feeling so anxious about you
p00494_A,00494,A,i have only to say that i am indeed glad to see you in such good health
p00495_A,00495,A,trente six
p00496_A,00496,A,faites le jeu messieurs faites le jeu messieurs rien ne va plus
p00497_A,00497,A,oui madame no single stake must exceed four thousand florins that is the regulation
p00498_A,00498,A,le jeu est fait
p00499_A,00499,A,how do not allow surely you are wrong monsieur monsieur combien zero douze douze
p00500_A,00500,A,then there is nothing else for it we must risk in g lden
p00501_A,00501,A,quelle victoire
p00502_A,00502,A,madame les chances peuvent tourner une seule mauvaise chance et vous perdrez tout surtout avec votre jeu c tait terrible
p00503_A,00503,A,eight thousand roubles what a splendid thing and to think of you simpletons sitting there and doing nothing potapitch martha see what i have won
p00504_A,00504,A,what a pity he is such a nice sort of man
p00505_A,00505,A,we are off again
p00506_A,00506,A,how did you do it madame eight thousand roubles
p00507_A,00507,A,i was watching you all the time madame and i asked potapitch what mistress was trying to do and my word the heaps and heaps of money that were lying upon the table never in my life have i seen so much money and there were gentlefolk around it and other gentlefolk sitting down so i asked potapitch where all these gentry had come from for thought i maybe the holy mother of god will help our mistress among them yes i prayed for you madame and my heart died within me so that i kept trembling and trembling the lord be with her i thought to myself and in answer to my prayer he has now sent you what he has done even yet i tremble i tremble to think of it all
p00508_A,00508,A,but whither madame
p00509_A,00509,A,and i am going to give you fifty g lden apiece there they are and to each bearer also i will give a ten g lden piece let them have it out of the gold alexis ivanovitch but why is this footman bowing to me and that other man as well are they congratulating me well let them have ten g lden apiece
p00510_A,00510,A,madame la princesse un pauvre expatri malheur continuel les princes russes sont si g n reux
p00511_A,00511,A,was ist der teufel
p00512_A,00512,A,she is in a bad humour my mistress was unable to sleep so after tossing about for a while she suddenly rose called for her chair and sent me to look for you she is now in the verandah
p00513_A,00513,A,what business is that of yours let the cricket stick to its hearth potapitch have everything packed for we are returning to moscow at once i have fooled away fifteen thousand roubles
p00514_A,00514,A,come come if when in moscow you have no place where you can lay your head come and see me and i will give you a recommendation now potapitch get things ready
p00515_A,00515,A,what folly very well then do not come and i will find my way alone potapitch you must come with me lift up the chair and carry me along
p00516_A,00516,A,fifteen thousand roubles good mistress my god
p00517_A,00517,A,sir my mistress is asking for you
p00518_A,00518,A,indeed but she is just departing is she not the train leaves in ten minutes time
p00519_A,00519,A,go away now go away now
p00520_A,00520,A,you are a bold young fellow but mind you depart early tomorrow as early as you can for if you do not you will lose everything that you have won
p00521_A,00521,A,how much
p00522_A,00522,A,bibi comme tu es b te come in here for i can t hear you where you are now nous ferons bombance n est ce pas mon fils as tu du c ur
p00523_A,00523,A,see here please search for my stockings and help me to dress aussi si tu n es pas trop b te je te prends paris i am just off let me tell you
p00524_A,00524,A,in half an hour eh bien tu verras paris dis donc qu est ce que c est qu un utchitel tu tais bien b te quand tu tais utchitel where are my stockings please help me to dress eh bien que feras tu si je te prends avec moi first of all i must have fifty thousand francs and you shall give them to me at frankfurt then we will go on to paris where we will live together et je te ferai voir des toiles en plein jour yes you shall see such women as your eyes have never lit upon
p00525_A,00525,A,another hundred thousand francs please to remember besides i could live with you in your rooms for a month or even for two or even for longer but it would not take us more than two months to get through fifty thousand francs for look you je suis bonne enfante et tu verras des toiles you may be sure
p00526_A,00526,A,certainly does that surprise you very much ah vil esclave why one month of that life would be better than all your previous existence one month et apr s le d luge mais tu ne peux comprendre va away away you are not worth it ah que fais tu eh bien mon utchitel je t attends si tu veux i start in a quarter of an hour s time
p00527_A,00527,A,what is the matter with you how dull you are come come we are going to spend your two hundred thousand francs for you et tu seras heureux comme un petit roi i myself will tie your tie for you and introduce you to hortense and when we have spent your money you shall return here and break the bank again what did those two jews tell you that the thing most needed is daring and that you possess it consequently this is not the first time that you will be hurrying to paris with money in your pocket quant moi je veux cinquante mille francs de rente et alors
p00528_A,00528,A,the general you know well enough that at about this hour every day he goes to buy me a bouquet on this occasion i took care to tell him that he must hunt for the choicest of flowers and when he returns home the poor fellow will find the bird flown possibly he may take wing in pursuit ha ha ha and if so i shall not be sorry for he could be useful to me in paris and mr astley will pay his debts here et les cent mille francs qui nous restent tu les mangeras avec moi mon utchitel so that once and for all i may be on a decent footing and proof against any stones which may be thrown at me at all events for a long time to come what do you want with money see what care and taste can do with the most wretched of means c est un utchitel qui a gagn deux cent mille francs and but for me would have had not a notion how to spend them presently he will have to return to his tutoring does any one know of a vacant post you know one must do something for him bibi surely you are not angry
p00529_A,00529,A,you see i decided to spend so much upon these horses only because i can easily sell them again they would go at any time for twenty thousand francs
p00530_A,00530,A,then you are not angry
p00531_A,00531,A,well well what a man you are mais tu as l esprit pour comprendre sais tu mon gar on although you are a tutor you ought to have been born a prince are you not sorry that your money should be going so quickly
p00532_A,00532,A,mais sais tu mais dis donc are you really rich mais sais tu you have too much contempt for money qu est ce que tu feras apr s dis donc
p00533_A,00533,A,oui oui c est a c est magnifique ah i know you will win them and bring them to me when you have done so dis donc you will end by making me love you since you are what you are i mean to love you all the time and never to be unfaithful to you you see i have not loved you before parce que je croyais que tu n es qu un utchitel quelque chose comme un lacquais n est ce pas yet all the time i have been true to you parce que je suis bonne fille
p00534_A,00534,A,oh oh mais tu es
p00535_A,00535,A,il a de la chance for the grandmother is now really ill and therefore bound to die mr astley has just sent a telegram to say so and you will agree with me that the general is likely to be her heir even if he should not be so he will not come amiss since in the first place he has his pension and in the second place he will be content to live in a back room whereas i shall be madame general and get into a good circle of society and become a russian ch telaine yes i shall have a mansion of my own and peasants and a million of money at my back
p00536_A,00536,A,oh dear no how ridiculous that would be of him besides i have taken measures to prevent it you need not be alarmed that is to say i have induced him to sign notes of hand in albert s name consequently at any time i could get him punished isn t he ridiculous
p00537_A,00537,A,a hundred thousand florins
p00538_A,00538,A,tout autre
p00539_A,00539,A,this moment
p00540_A,00540,A,stop a moment if i were to give you those fifty thousand francs what should i have left for myself
p00541_A,00541,A,what you mean to say that we should spend the whole in two months
p00542_A,00542,A,but what about the general
p00543_A,00543,A,no o o i am merely tired
p00544_A,00544,A,yes yes they are splendid horses and you have got a splendid turn out i am quite content let me hear no more of the matter
p00545_A,00545,A,no why should i be you are wise to provide yourself with what you need for it will all come in handy in the future yes i quite see the necessity of your establishing yourself on a good basis for without it you will never earn your million my hundred thousand francs i look upon merely as a beginning as a mere drop in the bucket
p00546_A,00546,A,no the quicker it goes the better
p00547_A,00547,A,apr s i shall go to homburg and win another hundred thousand francs
p00548_A,00548,A,you lie did i not see you the other day with albert with that black jowled officer
p00549_A,00549,A,yes you are lying right enough but what makes you suppose that i should be angry rubbish il faut que jeunesse se passe even if that officer were here now i should refrain from putting him out of the room if i thought you really cared for him only mind you do not give him any of my money you hear
p00550_A,00550,A,but suppose he should prove jealous he might demand all sorts of things you know do you follow me
p00551_A,00551,A,very well then marry him
p00000_B,00000,B,to the german method of heaping up riches i have not been here very long but i can tell you that what i have seen and verified makes my tartar blood boil good lord i wish for no virtues of that kind yesterday i went for a walk of about ten versts and everywhere i found that things were even as we read of them in good german picture books that every house has its vater who is horribly beneficent and extraordinarily honourable so honourable is he that it is dreadful to have anything to do with him and i cannot bear people of that sort each such vater has his family and in the evenings they read improving books aloud over their roof trees there murmur elms and chestnuts the sun has sunk to his rest a stork is roosting on the gable and all is beautifully poetic and touching do not be angry general let me tell you something that is even more touching than that i can remember how of an evening my own father now dead used to sit under the lime trees in his little garden and to read books aloud to myself and my mother yes i know how things ought to be done yet every german family is bound to slavery and to submission to its vater they work like oxen and amass wealth like jews suppose the vater has put by a certain number of g lden which he hands over to his eldest son in order that the said son may acquire a trade or a small plot of land well one result is to deprive the daughter of a dowry and so leave her among the unwedded for the same reason the parents will have to sell the younger son into bondage or the ranks of the army in order that he may earn more towards the family capital yes such things are done for i have been making inquiries on the subject it is all done out of sheer rectitude out of a rectitude which is magnified to the point of the younger son believing that he has been rightly sold and that it is simply idyllic for the victim to rejoice when he is made over into pledge what more have i to tell well this that matters bear just as hardly upon the eldest son perhaps he has his gretchen to whom his heart is bound but he cannot marry her for the reason that he has not yet amassed sufficient g lden so the pair wait on in a mood of sincere and virtuous expectation and smilingly deposit themselves in pawn the while gretchen s cheeks grow sunken and she begins to wither until at last after some twenty years their substance has multiplied and sufficient g lden have been honourably and virtuously accumulated then the vater blesses his forty year old heir and the thirty five year old gretchen with the sunken bosom and the scarlet nose after which he bursts into tears reads the pair a lesson on morality and dies in turn the eldest son becomes a virtuous vater and the old story begins again in fifty or sixty years time the grandson of the original vater will have amassed a considerable sum and that sum he will hand over to his son and the latter to his son and so on for several generations until at length there will issue a baron rothschild or a hoppe and company or the devil knows what is it not a beautiful spectacle the spectacle of a century or two of inherited labour patience intellect rectitude character perseverance and calculation with a stork sitting on the roof above it all what is more they think there can never be anything better than this wherefore from their point of view they begin to judge the rest of the world and to censure all who are at fault that is to say who are not exactly like themselves yes there you have it in a nutshell for my own part i would rather grow fat after the russian manner or squander my whole substance at roulette i have no wish to be hoppe and company at the end of five generations i want the money for myself for in no way do i look upon my personality as necessary to or meet to be given over to capital i may be wrong but there you have it those are my views
p00001_B,00001,B,excuse me general but did he make an express point of it that i should cease to belong to your establishment as you call it
p00002_B,00002,B,then how will you pay your hotel bill and what shall you do afterwards
p00003_B,00003,B,do not think that it was not so at all i grant you that my behaviour was bad i fully confess that it was so and make no secret of the fact i would even go so far as to grant you that my behaviour might well be called stupid and indecent tomfoolery but more than that it was not also let me tell you that i am very sorry for my conduct yet there is one circumstance which in my eyes almost absolves me from regret in the matter of late that is to say for the last two or three weeks i have been feeling not at all well that is to say i have been in a sick nervous irritable fanciful condition so that i have periodically lost control over myself for instance on more than one occasion i have tried to pick a quarrel even with monsieur le marquise here and under the circumstances he had no choice but to answer me in short i have recently been showing signs of ill health whether the baroness burmergelm will take this circumstance into consideration when i come to beg her pardon for i do intend to make her amends i do not know but i doubt if she will and the less so since so far as i know the circumstance is one which of late has begun to be abused in the legal world in that advocates in criminal cases have taken to justifying their clients on the ground that at the moment of the crime they the clients were unconscious of what they were doing that in short they were out of health my client committed the murder that is true but he has no recollection of having committed it and doctors actually support these advocates by affirming that there really is such a malady that there really can arise temporary delusions which make a man remember nothing of a given deed or only a half or a quarter of it but the baron and baroness are members of an older generation as well as prussian junkers and landowners to them such a process in the medico judicial world will be unknown and therefore they are the more unlikely to accept any such explanation what is your opinion about it general
p00004_B,00004,B,i should be glad if we could come straight to the point probably you are referring to my encounter of today with a german
p00005_B,00005,B,not in the least you must know that when i was in berlin i frequently used to hear the berliners repeat and repellently prolong a certain phrase namely and happening to meet this couple in the carriage drive i found for some reason or another that this phrase suddenly recurred to my memory and exercised a rousing effect upon my spirits moreover on the three previous occasions that i have met the baroness she has walked towards me as though i were a worm which could easily be crushed with the foot not unnaturally i too possess a measure of self respect wherefore on this occasion i took off my hat and said politely yes i assure you it was said politely then the baron turned round and said whereupon i felt moved to ejaculate in answer twice i shouted it at him the first time in an ordinary tone and the second time with the greatest prolonging of the words of which i was capable that is all
p00006_B,00006,B,i have no money for gambling
p00007_B,00007,B,the matter cannot end here i regret very much that you should have been put to unpleasantness at the baron s hands but the fault pardon me is your own how came you to answer for me to the baron and what did you mean by saying that i formed part of your household i am merely your family tutor not a son of yours nor yet your ward nor a person of any kind for whose acts you need be responsible i am a judicially competent person a man of twenty five years of age a university graduate a gentleman and until i met yourself a complete stranger to you only my boundless respect for your merits restrains me from demanding satisfaction at your hands as well as a further explanation as to the reasons which have led you to take it upon yourself to answer for my conduct nor do i intend to let the baron off and since you general have today been so good as to listen to the baron s complaints and to enter into his concerns since you have made yourself a participator in the affair i have the honour to inform you that tomorrow morning at the latest i shall in my own name demand of the said baron a formal explanation as to the reasons which have led him to disregard the fact that the matter lies between him and myself alone and to put a slight upon me by referring it to another person as though i were unworthy to answer for my own conduct
p00008_B,00008,B,general one cannot arrest a man for brawling until he has brawled i have not so much as begun my explanations to the baron and you are altogether ignorant as to the form and time which my intended procedure is likely to assume i wish but to disabuse the baron of what is to me a shameful supposition namely that i am under the guardianship of a person who is qualified to exercise control over my free will it is vain for you to disturb and alarm yourself
p00009_B,00009,B,i beg pardon yet it would be difficult to say which is the worst of the two russian ineptitude or the german method of growing rich through honest toil
p00010_B,00010,B,why do i continue to dance attendance upon the general instead of having left him and his family long ago
p00011_B,00011,B,no i have not
p00012_B,00012,B,but general possibly mlle blanche has scarcely even remarked my existence what could i do with her
p00013_B,00013,B,tell me general how am i to do so on what footing do i stand here
p00014_B,00014,B,just so you must know that on one occasion when for two days i had felt certain that at any moment i might have to depart for rome on business i repaired to the embassy of the holy see in paris to have my passport visaed there i encountered a sacristan of about fifty and a man dry and cold of mien after listening politely but with great reserve to my account of myself this sacristan asked me to wait a little i was in a great hurry to depart but of course i sat down pulled out a copy of l opinion nationale and fell to reading an extraordinary piece of invective against russia which it happened to contain as i was thus engaged i heard some one enter an adjoining room and ask for monsignor after which i saw the sacristan make a low bow to the visitor and then another bow as the visitor took his leave i ventured to remind the good man of my own business also whereupon with an expression of if anything increased dryness he again asked me to wait soon a third visitor arrived who like myself had come on business he was an austrian of some sort and as soon as ever he had stated his errand he was conducted upstairs this made me very angry i rose approached the sacristan and told him that since monsignor was receiving callers his lordship might just as well finish off my affair as well upon this the sacristan shrunk back in astonishment it simply passed his understanding that any insignificant russian should dare to compare himself with other visitors of monsignor s in a tone of the utmost effrontery as though he were delighted to have a chance of insulting me he looked me up and down and then said but i only cried the louder screeched the sacristan again shrinking back in horror then rushing to the door he spread out his arms as though he would rather die than let me enter
p00015_B,00015,B,you had better try and stop her yourself
p00016_B,00016,B,but she would soon find some one else to take my place
p00017_B,00017,B,you are only making fun of me
p00018_B,00018,B,what do you intend to go on with this damned nonsense do you not realise the harm that it is doing me i beg of you not to laugh at me sir not to laugh at me for we have police authorities here who out of respect for my rank and for that of the baron in short sir i swear to you that i will have you arrested and marched out of the place to prevent any further brawling on your part do you understand what i say
p00019_B,00019,B,how far you may be right in what you have said i do not know but i do know that you are becoming an insufferable far eur whenever you are given the least chance
p00020_B,00020,B,but you will soon be in receipt of some let us calculate we must translate these roubles into thalers here take 100 thalers as a round sum the rest will be safe in my hands you must not be offended at what i say you are too touchy about these things what i have said i have said merely as a warning to do so is no more than my right
p00021_B,00021,B,with a german why the german was the baron burmergelm a most important personage i hear that you have been rude both to him and to the baroness
p00022_B,00022,B,no i of my own initiative thought that i ought to afford him that satisfaction and with it he was satisfied so we must part good sir it is my duty to hand over to you forty g lden three florins as per the accompanying statement here is the money and here the account which you are at liberty to verify farewell from henceforth we are strangers from you i have never had anything but trouble and unpleasantness i am about to call the landlord and explain to him that from tomorrow onwards i shall no longer be responsible for your hotel expenses also i have the honour to remain your obedient servant
