A,B,i_merge_id,j_merge_id,i_text,j_text,i_addressees,A_gender,A_category,B_gender,B_category
Alexis Ivanovitch,Antonida Vassilievna Tarassevitcha,435,332,would one of the clerks do madame,how do not allow surely you are wrong monsieur monsieur combien zero douze douze,Antonida Vassilievna Tarassevitcha,M,major,F,major
Alexis Ivanovitch,Antonida Vassilievna Tarassevitcha,437,321,the clerk says that others will give you even less than he,stake stake it is not your money,Antonida Vassilievna Tarassevitcha,M,major,F,major
Alexis Ivanovitch,Antonida Vassilievna Tarassevitcha,453,315,the next train leaves at 9 30 madame,rubbish stake please,Antonida Vassilievna Tarassevitcha; Martha; Potapitch,M,major,F,major
Alexis Ivanovitch,Antonida Vassilievna Tarassevitcha,455,422,half past eight,rubbish i am determined to retrieve my losses take me away and call those fools of bearers hurry hurry show me the nearest way to the money changer s is it far,Antonida Vassilievna Tarassevitcha; Martha; Potapitch,M,major,F,major
Alexis Ivanovitch,Antonida Vassilievna Tarassevitcha,477,414,i thank you humbly madame but i am ashamed to,well then stake four thousand you see you see stake another four thousand,Antonida Vassilievna Tarassevitcha; Martha; Potapitch,M,major,F,major
Alexis Ivanovitch,Antonida Vassilievna Tarassevitcha,483,373,but whither madame,what a pity he is such a nice sort of man,Antonida Vassilievna Tarassevitcha; Potapitch,M,major,F,major
Alexis Ivanovitch,Antonida Vassilievna Tarassevitcha,485,223,with your leave madame i will not go with you,do they observe the convenances and keep up appearances such things always give one tone i have heard that they are keeping a carriage even as russian gentlefolks ought to do when abroad our russian people always cut a dash is prascovia here too,Antonida Vassilievna Tarassevitcha; Potapitch,M,major,F,major
Alexis Ivanovitch,Antonida Vassilievna Tarassevitcha,487,478,pardon me but i have nothing to reproach myself with i merely will not go i merely intend neither to witness nor to join in your play i also beg to return you your five hundred g lden farewell,come come if when in moscow you have no place where you can lay your head come and see me and i will give you a recommendation now potapitch get things ready,Antonida Vassilievna Tarassevitcha; Potapitch,M,major,F,major
Antonida Vassilievna Tarassevitcha,Mr. Astley,231,266,oh an englishman then that is why he stared at me without even opening his lips however i like englishmen now take me upstairs direct to their rooms where are they lodging,i have only to say that i am indeed glad to see you in such good health,Alexis Ivanovitch; Mr. Astley,F,major,M,intermediate
Antonida Vassilievna Tarassevitcha,Mr. Astley,265,232,oh a russian why i had no idea that he could understand me surely he did not hear what i said as for mr astley i have seen him already and i see that he is here again how do you do have you nothing to say to me say something for goodness sake translate to him polina,she interests me tremendously,Alexis Ivanovitch; Marqis De Griers; Mlle. Blanche; Mr. Astley; Polina Alexandrovna; Potapitch; The General; Theodosia,F,major,M,intermediate
Antonida Vassilievna Tarassevitcha,The General,233,274,well here i am and instead of a telegram too what you were not expecting me,as much as you like but i myself yes and polina and monsieur de griers too we all of us hope to have the pleasure of escorting you,Alexis Ivanovitch; Marqis De Griers; Mlle. Blanche; Mr. Astley; Polina Alexandrovna; Potapitch; The General,F,major,M,intermediate
Antonida Vassilievna Tarassevitcha,The General,243,292,how the woman sticks out her eyes at me how she mows and minces i have taken up my abode here so am going to be your next door neighbour are you glad to hear that or are you not,what mother before you have so much as rested from your journey,Alexis Ivanovitch; Marqis De Griers; Mlle. Blanche; Mr. Astley; Polina Alexandrovna; Potapitch; The General,F,major,M,intermediate
Antonida Vassilievna Tarassevitcha,The General,245,252,fibs fibs,after this after what you have just said i do not know whether,Alexis Ivanovitch; Marqis De Griers; Mlle. Blanche; Mr. Astley; Polina Alexandrovna; Potapitch; The General,F,major,M,intermediate
Antonida Vassilievna Tarassevitcha,The General,249,234,the most sensible question that i have yet been asked well you shall hear for yourself how it all happened i lay and lay and was doctored and doctored until at last i drove the physicians from me and called in an apothecary from nicolai who had cured an old woman of a malady similar to my own cured her merely with a little hayseed well he did me a great deal of good for on the third day i broke into a sweat and was able to leave my bed then my german doctors held another consultation put on their spectacles and told me that if i would go abroad and take a course of the waters the indisposition would finally pass away why should it not i thought to myself so i had got things ready and on the following day a friday set out for here i occupied a special compartment in the train and where ever i had to change i found at the station bearers who were ready to carry me for a few coppers you have nice quarters here but where on earth did you get the money for them my good sir i thought that everything of yours had been mortgaged this frenchman alone must be your creditor for a good deal oh i know all about it all about it,antonida vassilievna o my dearest mother but how on earth did you did you,Alexis Ivanovitch; Marqis De Griers; Mlle. Blanche; Mr. Astley; Polina Alexandrovna; Potapitch; The General,F,major,M,intermediate
Antonida Vassilievna Tarassevitcha,The General,251,254,they do not exceed it fie why you are robbing your children of their last kopeck you their guardian,roulette indeed i play roulette really in view of my position recollect what you are saying my dearest mother you must still be unwell,Alexis Ivanovitch; Marqis De Griers; Mlle. Blanche; Mr. Astley; Polina Alexandrovna; Potapitch; The General,F,major,M,intermediate
Antonida Vassilievna Tarassevitcha,The General,253,290,you do not know what by heavens are you never going to drop that roulette of yours are you going to whistle all your property away,pardon me madame but are duels really feasible,Alexis Ivanovitch; Marqis De Griers; Mlle. Blanche; Mr. Astley; Polina Alexandrovna; Potapitch; The General,F,major,M,intermediate
Antonida Vassilievna Tarassevitcha,The General,269,286,well well i do not like the stupid fashions of today you are very good looking i should have fallen in love with you if i had been a man why do you not get married it is time now that i was going i want to walk yet i always have to ride are you still in a bad temper,do not alarm yourself my dear mother i am quite capable of managing my own affairs moreover alexis ivanovitch has not given you a true account of the matter,Alexis Ivanovitch; Marqis De Griers; Mlle. Blanche; Mr. Astley; Polina Alexandrovna; Potapitch; The General; Theodosia,F,major,M,intermediate
Antonida Vassilievna Tarassevitcha,The General,273,298,but i want to look round a little will you lend me alexis ivanovitch for the purpose,no no mother really she cannot come they would not admit even potapitch to the casino,Alexis Ivanovitch; Marqis De Griers; Mlle. Blanche; Mr. Astley; Polina Alexandrovna; Potapitch; The General; Theodosia,F,major,M,intermediate
Antonida Vassilievna Tarassevitcha,The General,285,250,what you permitted yourself to treat your tutor thus you nincompoop and to dismiss him from his post you are a blockhead an utter blockhead i can see that clearly,i i am surprised at you my dearest mother i i am greatly surprised but i do not need any extraneous control of my finances moreover my expenses do not exceed my income and we,Alexis Ivanovitch; Marqis De Griers; Martha; Polina Alexandrovna; Potapitch; The General,F,major,M,intermediate
Antonida Vassilievna Tarassevitcha,The General,289,244,and why did you so protest for i can see no difference between you and the baron nor can i bear that german visage of yours,my dear mother believe me when i say that i am sincerely delighted we have been so dismayed and upset by the news of your indisposition we had received such hopeless telegrams about you then suddenly,Alexis Ivanovitch; Marqis De Griers; Martha; Polina Alexandrovna; Potapitch; The General,F,major,M,intermediate
Antonida Vassilievna Tarassevitcha,The General,291,270,why not all men are crowing cocks and that is why they quarrel you though i perceive are a blockhead a man who does not even know how to carry his breeding lift me up potapitch see to it that you always have two bearers ready go and arrange for their hire but we shall not require more than two for i shall need only to be carried upstairs on the level or in the street i can be wheeled along go and tell them that and pay them in advance so that they may show me some respect you too potapitch are always to come with me and you alexis ivanovitch are to point out to me this baron as we go along in order that i may get a squint at the precious von and where is that roulette played then take me straight there and do you walk on in front of me alexis ivanovitch,no indeed,Alexis Ivanovitch; Marqis De Griers; Martha; Polina Alexandrovna; Potapitch; The General,F,major,M,intermediate
Antonida Vassilievna Tarassevitcha,The General,297,300,martha you must come with me as well,but mother,Alexis Ivanovitch; Marqis De Griers; Martha; Polina Alexandrovna; Potapitch; The General,F,major,M,intermediate
Antonida Vassilievna Tarassevitcha,The General,299,246,rubbish because she is my servant is that a reason for turning her out why she is only a human being like the rest of us and as she has been travelling for a week she might like to look about her with whom else could she go out but myself she would never dare to show her nose in the street alone,how on earth too did you come to decide upon the journey surely at your age and in your present state of health the thing is so unexpected that our surprise is at least intelligible however i am glad to see you as indeed are we all and will use my best endeavours to render your stay here as pleasant as possible,Alexis Ivanovitch; Marqis De Griers; Martha; Polina Alexandrovna; Potapitch; The General,F,major,M,intermediate
Antonida Vassilievna Tarassevitcha,The General,429,430,begone with you and your views,and there are trees there and we could have tea under them,Alexis Ivanovitch; Marqis De Griers; Mlle. Blanche; The General,F,major,M,intermediate
The General,Antonida Vassilievna Tarassevitcha,234,287,antonida vassilievna o my dearest mother but how on earth did you did you,what did you do next,Alexis Ivanovitch; Antonida Vassilievna Tarassevitcha; Marqis De Griers; Mlle. Blanche; Mr. Astley; Polina Alexandrovna; Potapitch,M,intermediate,F,major
The General,Antonida Vassilievna Tarassevitcha,244,299,my dear mother believe me when i say that i am sincerely delighted we have been so dismayed and upset by the news of your indisposition we had received such hopeless telegrams about you then suddenly,rubbish because she is my servant is that a reason for turning her out why she is only a human being like the rest of us and as she has been travelling for a week she might like to look about her with whom else could she go out but myself she would never dare to show her nose in the street alone,Alexis Ivanovitch; Antonida Vassilievna Tarassevitcha; Marqis De Griers; Mlle. Blanche; Mr. Astley; Polina Alexandrovna; Potapitch,M,intermediate,F,major
The General,Antonida Vassilievna Tarassevitcha,246,253,how on earth too did you come to decide upon the journey surely at your age and in your present state of health the thing is so unexpected that our surprise is at least intelligible however i am glad to see you as indeed are we all and will use my best endeavours to render your stay here as pleasant as possible,you do not know what by heavens are you never going to drop that roulette of yours are you going to whistle all your property away,Alexis Ivanovitch; Antonida Vassilievna Tarassevitcha; Marqis De Griers; Mlle. Blanche; Mr. Astley; Polina Alexandrovna; Potapitch,M,intermediate,F,major
The General,Antonida Vassilievna Tarassevitcha,250,235,i i am surprised at you my dearest mother i i am greatly surprised but i do not need any extraneous control of my finances moreover my expenses do not exceed my income and we,how on earth did i what why i just got into the train and came here what else is the railway meant for but you thought that i had turned up my toes and left my property to the lot of you oh i know all about the telegrams which you have been dispatching they must have cost you a pretty sum i should think for telegrams are not sent from abroad for nothing well i picked up my heels and came here who is this frenchman monsieur de griers i suppose,Alexis Ivanovitch; Antonida Vassilievna Tarassevitcha; Marqis De Griers; Mlle. Blanche; Mr. Astley; Polina Alexandrovna; Potapitch,M,intermediate,F,major
The General,Antonida Vassilievna Tarassevitcha,252,255,after this after what you have just said i do not know whether,rubbish rubbish the truth is that you cannot be got away from that roulette you are simply telling lies this very day i mean to go and see for myself what roulette is like prascovia tell me what there is to be seen here and do you alexis ivanovitch show me everything and do you potapitch make me a list of excursions what is there to be seen,Alexis Ivanovitch; Antonida Vassilievna Tarassevitcha; Marqis De Griers; Mlle. Blanche; Mr. Astley; Polina Alexandrovna; Potapitch,M,intermediate,F,major
The General,Antonida Vassilievna Tarassevitcha,254,293,roulette indeed i play roulette really in view of my position recollect what you are saying my dearest mother you must still be unwell,why should i rest i am not tired for i have been sitting still these past five days let us see what your medicinal springs and waters are like and where they are situated what too about that that what did you call it prascovia oh about that mountain top,Alexis Ivanovitch; Antonida Vassilievna Tarassevitcha; Marqis De Griers; Mlle. Blanche; Mr. Astley; Polina Alexandrovna; Potapitch,M,intermediate,F,major
The General,Antonida Vassilievna Tarassevitcha,270,291,no indeed,why not all men are crowing cocks and that is why they quarrel you though i perceive are a blockhead a man who does not even know how to carry his breeding lift me up potapitch see to it that you always have two bearers ready go and arrange for their hire but we shall not require more than two for i shall need only to be carried upstairs on the level or in the street i can be wheeled along go and tell them that and pay them in advance so that they may show me some respect you too potapitch are always to come with me and you alexis ivanovitch are to point out to me this baron as we go along in order that i may get a squint at the precious von and where is that roulette played then take me straight there and do you walk on in front of me alexis ivanovitch,Alexis Ivanovitch; Antonida Vassilievna Tarassevitcha; Marqis De Griers; Mlle. Blanche; Mr. Astley; Polina Alexandrovna; Potapitch; Theodosia,M,intermediate,F,major
The General,Antonida Vassilievna Tarassevitcha,286,301,do not alarm yourself my dear mother i am quite capable of managing my own affairs moreover alexis ivanovitch has not given you a true account of the matter,are you ashamed to be seen with me stop at home then and you will be asked no questions a pretty general you are to be sure i am a general s widow myself but after all why should i drag the whole party with me i will go and see the sights with only alexis ivanovitch as my escort,Alexis Ivanovitch; Antonida Vassilievna Tarassevitcha; Marqis De Griers; Martha; Polina Alexandrovna; Potapitch,M,intermediate,F,major
The General,Antonida Vassilievna Tarassevitcha,290,251,pardon me madame but are duels really feasible,they do not exceed it fie why you are robbing your children of their last kopeck you their guardian,Alexis Ivanovitch; Antonida Vassilievna Tarassevitcha; Marqis De Griers; Martha; Polina Alexandrovna; Potapitch,M,intermediate,F,major
The General,Antonida Vassilievna Tarassevitcha,292,245,what mother before you have so much as rested from your journey,fibs fibs,Alexis Ivanovitch; Antonida Vassilievna Tarassevitcha; Marqis De Griers; Martha; Polina Alexandrovna; Potapitch,M,intermediate,F,major
The General,Antonida Vassilievna Tarassevitcha,298,271,no no mother really she cannot come they would not admit even potapitch to the casino,i quite understand that at your time of life,Alexis Ivanovitch; Antonida Vassilievna Tarassevitcha; Marqis De Griers; Martha; Polina Alexandrovna; Potapitch,M,intermediate,F,major
The General,Antonida Vassilievna Tarassevitcha,300,429,but mother,begone with you and your views,Alexis Ivanovitch; Antonida Vassilievna Tarassevitcha; Marqis De Griers; Martha; Polina Alexandrovna; Potapitch,M,intermediate,F,major
The General,Antonida Vassilievna Tarassevitcha,428,247,my good mother my good mother pray let let let us hire a carriage and go for a drive near here there is an enchanting view to be obtained we we we were just coming to invite you to go and see it,enough all this is empty chatter you are talking the usual nonsense i shall know quite well how to spend my time how did i come to undertake the journey you ask well is there anything so very surprising about it it was done quite simply what is every one going into ecstasies about how do you do prascovia what are you doing here,Alexis Ivanovitch; Antonida Vassilievna Tarassevitcha; Marqis De Griers; Mlle. Blanche,M,intermediate,F,major
Antonida Vassilievna Tarassevitcha,Marqis De Griers,235,272,how on earth did i what why i just got into the train and came here what else is the railway meant for but you thought that i had turned up my toes and left my property to the lot of you oh i know all about the telegrams which you have been dispatching they must have cost you a pretty sum i should think for telegrams are not sent from abroad for nothing well i picked up my heels and came here who is this frenchman monsieur de griers i suppose,cette vieille est tomb e en enfance,Alexis Ivanovitch; Marqis De Griers; Mlle. Blanche; Mr. Astley; Polina Alexandrovna; Potapitch; The General,F,major,M,intermediate
Antonida Vassilievna Tarassevitcha,Marqis De Griers,271,363,i quite understand that at your time of life,que diable c est une terrible vieille,Alexis Ivanovitch; Marqis De Griers; Mlle. Blanche; Mr. Astley; Polina Alexandrovna; Potapitch; The General; Theodosia,F,major,M,intermediate
Antonida Vassilievna Tarassevitcha,Marqis De Griers,301,369,are you ashamed to be seen with me stop at home then and you will be asked no questions a pretty general you are to be sure i am a general s widow myself but after all why should i drag the whole party with me i will go and see the sights with only alexis ivanovitch as my escort,madame les chances peuvent tourner une seule mauvaise chance et vous perdrez tout surtout avec votre jeu c tait terrible,Alexis Ivanovitch; Marqis De Griers; Martha; Polina Alexandrovna; Potapitch; The General,F,major,M,intermediate
Antonida Vassilievna Tarassevitcha,Marqis De Griers,362,236,not very much see here i will lend you five hundred if you wish take this purse of mine but you need not expect to receive any,oui madame et croyez je suis si enchant votre sant c est un miracle vous voir ici une surprise charmante,Alexis Ivanovitch; Marqis De Griers; Martha; Mlle. Blanche; Polina Alexandrovna; Potapitch; The General,F,major,M,intermediate
Antonida Vassilievna Tarassevitcha,Marqis De Griers,368,302,what else do you suppose are you going only to sit here and grow sour and let me look at you,mais elle est tomb e en enfance seule elle fera des b tises,Alexis Ivanovitch; Marqis De Griers; Martha; Mlle. Blanche; Polina Alexandrovna; Potapitch; The General,F,major,M,intermediate
Antonida Vassilievna Tarassevitcha,Marqis De Griers,442,443,but why not show me what i ought to do away with you you talk sheer nonsense for though you keep on saying you haven t the least notion what ought to be done away with you i say,mais madame,Alexis Ivanovitch; Marqis De Griers,F,major,M,intermediate
Marqis De Griers,Antonida Vassilievna Tarassevitcha,236,276,oui madame et croyez je suis si enchant votre sant c est un miracle vous voir ici une surprise charmante,plaisir indeed why i look upon you as a perfect fool monsieur i am not going to let you have any of my money i must be off to my rooms now to see what they are like afterwards we will look round a little lift me up,Alexis Ivanovitch; Antonida Vassilievna Tarassevitcha; Mlle. Blanche; Mr. Astley; Polina Alexandrovna; Potapitch; The General,M,intermediate,F,major
Marqis De Griers,Antonida Vassilievna Tarassevitcha,275,442,mais madame cela sera un plaisir,but why not show me what i ought to do away with you you talk sheer nonsense for though you keep on saying you haven t the least notion what ought to be done away with you i say,Alexis Ivanovitch; Antonida Vassilievna Tarassevitcha; Mlle. Blanche; Mr. Astley; Polina Alexandrovna; Potapitch; The General; Theodosia,M,intermediate,F,major
Marqis De Griers,Antonida Vassilievna Tarassevitcha,431,444,nous boirons du lait sur l herbe fraiche,stake just once as he advises and then we shall see what we shall see of course his stake might win,Alexis Ivanovitch; Antonida Vassilievna Tarassevitcha; Mlle. Blanche; The General,M,intermediate,F,major
Marqis De Griers,Antonida Vassilievna Tarassevitcha,441,237,madame madame that stake will never win no no it is impossible no no,just so charmante i happen to know you as a mountebank and therefore trust you no more than this and who is that who is that woman there,Alexis Ivanovitch; Antonida Vassilievna Tarassevitcha,M,intermediate,F,major
Marqis De Griers,Antonida Vassilievna Tarassevitcha,443,432,mais madame,have done with you and your milk go and stuff yourself as much as you like but my stomach simply recoils from the idea what are you stopping for i have nothing to say to you,Alexis Ivanovitch; Antonida Vassilievna Tarassevitcha,M,intermediate,F,major
Antonida Vassilievna Tarassevitcha,Mlle. Blanche,241,242,is she good company i mean is she or is she not a bore can she speak russian when this de griers was in moscow he soon learnt to make himself understood bonjour then,bonjour madame,Alexis Ivanovitch; Marqis De Griers; Mlle. Blanche; Mr. Astley; Polina Alexandrovna; Potapitch; The General,F,major,F,intermediate
Antonida Vassilievna Tarassevitcha,Mlle. Blanche,352,353,give him ten g lden no give him twenty now enough of that or i shall never get done with you all take a moment s rest and then carry me away prascovia i mean to buy a new dress for you tomorrow yes and for you too mlle blanche please translate prascovia,merci madame,A Man; Alexis Ivanovitch; Marqis De Griers; Martha; Mlle. Blanche; Polina Alexandrovna; Potapitch; The General,F,major,F,intermediate
Antonida Vassilievna Tarassevitcha,Mlle. Blanche,457,458,away with you you rascals what have my affairs to do with you why in particular do you come sneaking here with your goat s beard and what do you want of me what are you finicking for,diantre elle vivra cent ans,Alexis Ivanovitch; Marqis De Griers; Martha; Mlle. Blanche; Potapitch; The General,F,major,F,intermediate
Mlle. Blanche,Antonida Vassilievna Tarassevitcha,242,347,bonjour madame,yes i have won twelve thousand florins and then there is all this gold with it the total ought to come to nearly thirteen thousand how much is that in russian money six thousand roubles i think,Alexis Ivanovitch; Antonida Vassilievna Tarassevitcha; Marqis De Griers; Mr. Astley; Polina Alexandrovna; Potapitch; The General,F,intermediate,F,major
Mlle. Blanche,Antonida Vassilievna Tarassevitcha,346,371,mais madame c tait du feu,what has that got to do with you it is not your money that i am going to lose it is my own and where is that mr astley of yours,A Man; Alexis Ivanovitch; Antonida Vassilievna Tarassevitcha; Marqis De Griers; Polina Alexandrovna; The General,F,intermediate,F,major
Mlle. Blanche,Antonida Vassilievna Tarassevitcha,353,459,merci madame,so you have been counting upon my death have you away with you clear them out of the room alexis ivanovitch what business is it of theirs it is not their money that i have been squandering but my own,Alexis Ivanovitch; Antonida Vassilievna Tarassevitcha; Marqis De Griers; Martha; Polina Alexandrovna; Potapitch; The General,F,intermediate,F,major
Mlle. Blanche,Antonida Vassilievna Tarassevitcha,370,243,oui vous perdrez absolument,how the woman sticks out her eyes at me how she mows and minces i have taken up my abode here so am going to be your next door neighbour are you glad to hear that or are you not,Alexis Ivanovitch; Antonida Vassilievna Tarassevitcha; Marqis De Griers; Martha; Polina Alexandrovna; Potapitch; The General,F,intermediate,F,major
Mlle. Blanche,Antonida Vassilievna Tarassevitcha,458,354,diantre elle vivra cent ans,how surprised theodosia too will be she like yourselves shall have the price of a new gown here alexis ivanovitch give that beggar something,Alexis Ivanovitch; Antonida Vassilievna Tarassevitcha; Marqis De Griers; Martha; Potapitch; The General,F,intermediate,F,major
