pair_id,a_speaker,b_speaker,i_merge_id,j_merge_id,i_text,j_text,i_addressees,A_gender,A_category,B_gender,B_category,a_articles,a_auxiliary_verbs,a_conjunctions,a_adverbs,a_impersonal_pronouns,a_negations,a_personal_pronouns,a_prepositions,a_quantifiers,b_articles,b_auxiliary_verbs,b_conjunctions,b_adverbs,b_impersonal_pronouns,b_negations,b_personal_pronouns,b_prepositions,b_quantifiers
00590,Emma,Mr. Knightley,646,647,this present from the campbells this pianoforte is very kindly given,yes but they would have done better had they given her notice of it surprizes are foolish things the pleasure is not enhanced and the inconvenience is often considerable i should have expected better judgment in colonel campbell,Mr. Knightley,F,major,M,major,1,1,0,1,1,0,0,1,0,1,1,1,1,1,1,1,1,1
00591,Mr. Knightley,Mr. Frank Churchill,648,649,that will do you have sung quite enough for one evening now be quiet,i think you could manage this without effort the first part is so very trifling the strength of the song falls on the second,Emma; Harriet Smith; Jane Fairfax; Miss Bates; Mr. Frank Churchill; Mr. Weston; Mrs. Cole; Mrs. Weston,M,major,M,major,0,1,0,1,1,0,1,1,1,1,1,1,1,1,0,1,1,1
00592,Mr. Frank Churchill,Mr. Knightley,649,650,i think you could manage this without effort the first part is so very trifling the strength of the song falls on the second,that fellow thinks of nothing but shewing off his own voice this must not be,Emma; Harriet Smith; Jane Fairfax; Miss Bates; Mr. Knightley; Mr. Weston; Mrs. Cole; Mrs. Weston,M,major,M,major,1,1,1,1,1,0,1,1,1,0,1,1,0,1,1,1,1,0
00593,Harriet Smith,Emma,653,654,oh if i could but play as well as you and miss fairfax,don t class us together harriet my playing is no more like her s than a lamp is like sunshine,Emma,F,major,F,major,0,1,1,1,0,0,1,1,0,1,1,1,0,0,1,1,1,1
00594,Emma,Harriet Smith,654,655,don t class us together harriet my playing is no more like her s than a lamp is like sunshine,oh dear i think you play the best of the two i think you play quite as well as she does i am sure i had much rather hear you every body last night said how well you played,Harriet Smith,F,major,F,major,1,1,1,0,0,1,1,1,1,1,1,1,1,0,0,1,1,1
00595,Harriet Smith,Emma,655,656,oh dear i think you play the best of the two i think you play quite as well as she does i am sure i had much rather hear you every body last night said how well you played,those who knew any thing about it must have felt the difference the truth is harriet that my playing is just good enough to be praised but jane fairfax s is much beyond it,Emma,F,major,F,major,1,1,1,1,0,0,1,1,1,1,1,1,1,1,0,1,1,1
00596,Emma,Harriet Smith,656,657,those who knew any thing about it must have felt the difference the truth is harriet that my playing is just good enough to be praised but jane fairfax s is much beyond it,well i always shall think that you play quite as well as she does or that if there is any difference nobody would ever find it out mr cole said how much taste you had and mr frank churchill talked a great deal about your taste and that he valued taste much more than execution,Harriet Smith,F,major,F,major,1,1,1,1,1,0,1,1,1,1,1,1,1,1,1,1,1,1
00597,Harriet Smith,Emma,657,658,well i always shall think that you play quite as well as she does or that if there is any difference nobody would ever find it out mr cole said how much taste you had and mr frank churchill talked a great deal about your taste and that he valued taste much more than execution,ah but jane fairfax has them both harriet,Emma,F,major,F,major,1,1,1,1,1,1,1,1,1,0,1,1,0,0,0,1,0,1
00598,Emma,Harriet Smith,658,659,ah but jane fairfax has them both harriet,are you sure i saw she had execution but i did not know she had any taste nobody talked about it and i hate italian singing there is no understanding a word of it besides if she does play so very well you know it is no more than she is obliged to do because she will have to teach the coxes were wondering last night whether she would get into any great family how did you think the coxes looked,Harriet Smith,F,major,F,major,0,1,1,0,0,0,1,0,1,1,1,1,1,1,1,1,1,1
00599,Harriet Smith,Emma,659,660,are you sure i saw she had execution but i did not know she had any taste nobody talked about it and i hate italian singing there is no understanding a word of it besides if she does play so very well you know it is no more than she is obliged to do because she will have to teach the coxes were wondering last night whether she would get into any great family how did you think the coxes looked,just as they always do very vulgar,Emma,F,major,F,major,1,1,1,1,1,1,1,1,1,0,1,1,1,0,0,1,1,0
00600,Emma,Harriet Smith,660,661,just as they always do very vulgar,they told me something but it is nothing of any consequence they told me that mr martin dined with them last saturday,Harriet Smith,F,major,F,major,0,1,1,1,0,0,1,1,0,0,1,1,0,1,1,1,1,0
00601,Harriet Smith,Emma,665,666,they talked a great deal about him especially anne cox i do not know what she meant but she asked me if i thought i should go and stay there again next summer,she meant to be impertinently curious just as such an anne cox should be,Emma,F,major,F,major,1,1,1,1,1,1,1,1,0,1,1,1,1,0,0,1,1,0
00602,Emma,Harriet Smith,666,667,she meant to be impertinently curious just as such an anne cox should be,she said he was very agreeable the day he dined there he sat by her at dinner miss nash thinks either of the coxes would be very glad to marry him,Harriet Smith,F,major,F,major,1,1,1,1,0,0,1,1,0,1,1,1,1,0,0,1,1,1
00603,Harriet Smith,Emma,667,668,she said he was very agreeable the day he dined there he sat by her at dinner miss nash thinks either of the coxes would be very glad to marry him,very likely i think they are without exception the most vulgar girls in highbury,Emma,F,major,F,major,1,1,1,1,0,0,1,1,1,1,1,0,1,0,0,1,1,1
00604,Mrs. Weston,Mr. Frank Churchill,669,670,for my companion tells me that i absolutely promised miss bates last night that i would come this morning i was not aware of it myself i did not know that i had fixed a day but as he says i did i am going now,and while mrs weston pays her visit i may be allowed i hope to join your party and wait for her at hartfield if you are going home,Emma; Mr. Frank Churchill,F,intermediate,M,major,1,1,1,1,1,1,1,1,1,0,1,1,0,0,0,1,1,0
00605,Mr. Frank Churchill,Mrs. Weston,670,671,and while mrs weston pays her visit i may be allowed i hope to join your party and wait for her at hartfield if you are going home,i thought you meant to go with me they would be very much pleased,Emma; Mrs. Weston,M,major,F,intermediate,0,1,1,0,0,0,1,1,0,0,1,0,1,0,0,1,1,1
00606,Mrs. Weston,Mr. Frank Churchill,671,672,i thought you meant to go with me they would be very much pleased,me i should be quite in the way but perhaps i may be equally in the way here miss woodhouse looks as if she did not want me my aunt always sends me off when she is shopping she says i fidget her to death and miss woodhouse looks as if she could almost say the same what am i to do,Emma; Mr. Frank Churchill,F,intermediate,M,major,0,1,0,1,0,0,1,1,1,1,1,1,1,1,1,1,1,1
00607,Mr. Frank Churchill,Emma,672,673,me i should be quite in the way but perhaps i may be equally in the way here miss woodhouse looks as if she did not want me my aunt always sends me off when she is shopping she says i fidget her to death and miss woodhouse looks as if she could almost say the same what am i to do,i am here on no business of my own i am only waiting for my friend she will probably have soon done and then we shall go home but you had better go with mrs weston and hear the instrument,Emma; Mrs. Weston,M,major,F,major,1,1,1,1,1,1,1,1,1,1,1,1,1,0,1,1,1,0
00608,Emma,Mr. Frank Churchill,673,674,i am here on no business of my own i am only waiting for my friend she will probably have soon done and then we shall go home but you had better go with mrs weston and hear the instrument,well if you advise it but if colonel campbell should have employed a careless friend and if it should prove to have an indifferent tone what shall i say i shall be no support to mrs weston she might do very well by herself a disagreeable truth would be palatable through her lips but i am the wretchedest being in the world at a civil falsehood,Mr. Frank Churchill; Mrs. Weston,F,major,M,major,1,1,1,1,0,1,1,1,0,1,1,1,1,1,1,1,1,0
00609,Mr. Frank Churchill,Emma,674,675,well if you advise it but if colonel campbell should have employed a careless friend and if it should prove to have an indifferent tone what shall i say i shall be no support to mrs weston she might do very well by herself a disagreeable truth would be palatable through her lips but i am the wretchedest being in the world at a civil falsehood,i do not believe any such thing i am persuaded that you can be as insincere as your neighbours when it is necessary but there is no reason to suppose the instrument is indifferent quite otherwise indeed if i understood miss fairfax s opinion last night,Emma; Mrs. Weston,M,major,F,major,1,1,1,1,1,1,1,1,0,1,1,1,1,1,1,1,1,0
00610,Emma,Mrs. Weston,675,676,i do not believe any such thing i am persuaded that you can be as insincere as your neighbours when it is necessary but there is no reason to suppose the instrument is indifferent quite otherwise indeed if i understood miss fairfax s opinion last night,do come with me if it be not very disagreeable to you it need not detain us long we will go to hartfield afterwards we will follow them to hartfield i really wish you to call with me it will be felt so great an attention and i always thought you meant it,Mr. Frank Churchill; Mrs. Weston,F,major,F,intermediate,1,1,1,1,1,1,1,1,0,1,1,1,1,1,1,1,1,1
00611,Mrs. Ford,Harriet Smith,677,678,should i send it to mrs goddard s ma am,yes no yes to mrs goddard s only my pattern gown is at hartfield no you shall send it to hartfield if you please but then mrs goddard will want to see it and i could take the pattern gown home any day but i shall want the ribbon directly so it had better go to hartfield at least the ribbon you could make it into two parcels mrs ford could not you,Emma; Harriet Smith,F,minor,F,major,0,1,0,0,1,0,1,1,0,1,1,1,1,1,1,1,1,1
00612,Harriet Smith,Emma,678,679,yes no yes to mrs goddard s only my pattern gown is at hartfield no you shall send it to hartfield if you please but then mrs goddard will want to see it and i could take the pattern gown home any day but i shall want the ribbon directly so it had better go to hartfield at least the ribbon you could make it into two parcels mrs ford could not you,it is not worth while harriet to give mrs ford the trouble of two parcels,Emma; Mrs. Ford,F,major,F,major,1,1,1,1,1,1,1,1,1,1,1,1,0,1,1,0,1,1
00613,Emma,Harriet Smith,679,680,it is not worth while harriet to give mrs ford the trouble of two parcels,no more it is,Harriet Smith; Mrs. Ford,F,major,F,major,1,1,1,0,1,1,0,1,1,0,1,0,0,1,1,0,0,1
00614,Harriet Smith,Mrs. Ford,680,681,no more it is,no trouble in the world ma am,Emma; Mrs. Ford,F,major,F,minor,0,1,0,0,1,1,0,0,1,1,1,0,0,0,1,0,1,0
00615,Mrs. Ford,Harriet Smith,681,682,no trouble in the world ma am,oh but indeed i would much rather have it only in one then if you please you shall send it all to mrs goddard s i do not know no i think miss woodhouse i may just as well have it sent to hartfield and take it home with me at night what do you advise,Emma; Harriet Smith,F,minor,F,major,1,1,0,0,0,1,0,1,0,0,1,1,1,1,1,1,1,1
00616,Harriet Smith,Emma,682,683,oh but indeed i would much rather have it only in one then if you please you shall send it all to mrs goddard s i do not know no i think miss woodhouse i may just as well have it sent to hartfield and take it home with me at night what do you advise,that you do not give another half second to the subject to hartfield if you please mrs ford,Emma; Mrs. Ford,F,major,F,major,0,1,1,1,1,1,1,1,1,1,1,1,0,1,1,1,1,1
00617,Emma,Harriet Smith,683,684,that you do not give another half second to the subject to hartfield if you please mrs ford,aye that will be much best i should not at all like to have it sent to mrs goddard s,Harriet Smith; Mrs. Ford,F,major,F,major,1,1,1,0,1,1,1,1,1,0,1,0,0,1,1,1,1,1
00618,Miss Bates,Emma,685,686,my dear miss woodhouse i am just run across to entreat the favour of you to come and sit down with us a little while and give us your opinion of our new instrument you and miss smith how do you do miss smith very well i thank you and i begged mrs weston to come with me that i might be sure of succeeding,i hope mrs bates and miss fairfax are,Emma; Harriet Smith; Mrs. Weston,F,intermediate,F,major,1,1,1,1,1,0,1,1,1,0,1,1,0,0,0,1,0,0
00619,Emma,Miss Bates,686,687,i hope mrs bates and miss fairfax are,very well i am much obliged to you my mother is delightfully well and jane caught no cold last night how is mr woodhouse i am so glad to hear such a good account mrs weston told me you were here said i said mr frank churchill said i said he for would you believe it miss woodhouse there he is in the most obliging manner in the world fastening in the rivet of my mother s spectacles the rivet came out you know this morning so very obliging for my mother had no use of her spectacles could not put them on and by the bye every body ought to have two pair of spectacles they should indeed jane said so i meant to take them over to john saunders the first thing i did but something or other hindered me all the morning first one thing then another there is no saying what you know at one time patty came to say she thought the kitchen chimney wanted sweeping said i then the baked apples came home mrs wallis sent them by her boy they are extremely civil and obliging to us the wallises always i have heard some people say that mrs wallis can be uncivil and give a very rude answer but we have never known any thing but the greatest attention from them and it cannot be for the value of our custom now for what is our consumption of bread you know only three of us besides dear jane at present and she really eats nothing makes such a shocking breakfast you would be quite frightened if you saw it i dare not let my mother know how little she eats so i say one thing and then i say another and it passes off but about the middle of the day she gets hungry and there is nothing she likes so well as these baked apples and they are extremely wholesome for i took the opportunity the other day of asking mr perry i happened to meet him in the street not that i had any doubt before i have so often heard mr woodhouse recommend a baked apple i believe it is the only way that mr woodhouse thinks the fruit thoroughly wholesome we have apple dumplings however very often patty makes an excellent apple dumpling well mrs weston you have prevailed i hope and these ladies will oblige us,Harriet Smith; Miss Bates; Mrs. Weston,F,major,F,intermediate,0,1,1,0,0,0,1,0,0,1,1,1,1,1,1,1,1,1
00620,Mr. Frank Churchill,Mrs. Weston,690,691,this is a pleasure coming at least ten minutes earlier than i had calculated you find me trying to be useful tell me if you think i shall succeed,what have not you finished it yet you would not earn a very good livelihood as a working silversmith at this rate,Emma; Harriet Smith; Jane Fairfax; Miss Bates; Mrs. Weston,M,major,F,intermediate,1,1,1,0,1,0,1,1,1,1,1,1,1,1,1,1,1,1
00621,Mrs. Weston,Mr. Frank Churchill,691,692,what have not you finished it yet you would not earn a very good livelihood as a working silversmith at this rate,i have not been working uninterruptedly i have been assisting miss fairfax in trying to make her instrument stand steadily it was not quite firm an unevenness in the floor i believe you see we have been wedging one leg with paper this was very kind of you to be persuaded to come i was almost afraid you would be hurrying home whoever colonel campbell might employ the person has not chosen ill i heard a good deal of colonel campbell s taste at weymouth and the softness of the upper notes i am sure is exactly what he and all that party would particularly prize i dare say miss fairfax that he either gave his friend very minute directions or wrote to broadwood himself do not you think so,Emma; Harriet Smith; Jane Fairfax; Miss Bates; Mr. Frank Churchill,F,intermediate,M,major,1,1,1,1,1,1,1,1,1,1,1,1,1,1,1,1,1,1
00622,Mr. Frank Churchill,Emma,692,693,i have not been working uninterruptedly i have been assisting miss fairfax in trying to make her instrument stand steadily it was not quite firm an unevenness in the floor i believe you see we have been wedging one leg with paper this was very kind of you to be persuaded to come i was almost afraid you would be hurrying home whoever colonel campbell might employ the person has not chosen ill i heard a good deal of colonel campbell s taste at weymouth and the softness of the upper notes i am sure is exactly what he and all that party would particularly prize i dare say miss fairfax that he either gave his friend very minute directions or wrote to broadwood himself do not you think so,it is not fair mine was a random guess do not distress her,Emma; Harriet Smith; Jane Fairfax; Miss Bates; Mrs. Weston,M,major,F,major,1,1,1,1,1,1,1,1,1,1,1,0,0,1,1,1,0,0
00623,Emma,Mr. Frank Churchill,693,694,it is not fair mine was a random guess do not distress her,how much your friends in ireland must be enjoying your pleasure on this occasion miss fairfax i dare say they often think of you and wonder which will be the day the precise day of the instrument s coming to hand do you imagine colonel campbell knows the business to be going forward just at this time do you imagine it to be the consequence of an immediate commission from him or that he may have sent only a general direction an order indefinite as to time to depend upon contingencies and conveniences,Mr. Frank Churchill,F,major,M,major,1,1,0,0,1,1,1,0,0,1,1,1,1,1,0,1,1,1
00624,Mr. Frank Churchill,Jane Fairfax,694,695,how much your friends in ireland must be enjoying your pleasure on this occasion miss fairfax i dare say they often think of you and wonder which will be the day the precise day of the instrument s coming to hand do you imagine colonel campbell knows the business to be going forward just at this time do you imagine it to be the consequence of an immediate commission from him or that he may have sent only a general direction an order indefinite as to time to depend upon contingencies and conveniences,till i have a letter from colonel campbell i can imagine nothing with any confidence it must be all conjecture,Emma; Harriet Smith; Jane Fairfax; Miss Bates; Mrs. Weston,M,major,F,intermediate,1,1,1,1,1,0,1,1,1,1,1,1,0,1,1,1,1,1
00625,Jane Fairfax,Mr. Frank Churchill,695,696,till i have a letter from colonel campbell i can imagine nothing with any confidence it must be all conjecture,conjecture aye sometimes one conjectures right and sometimes one conjectures wrong i wish i could conjecture how soon i shall make this rivet quite firm what nonsense one talks miss woodhouse when hard at work if one talks at all your real workmen i suppose hold their tongues but we gentlemen labourers if we get hold of a word miss fairfax said something about conjecturing there it is done i have the pleasure madam of restoring your spectacles healed for the present if you are very kind it will be one of the waltzes we danced last night let me live them over again you did not enjoy them as i did you appeared tired the whole time i believe you were glad we danced no longer but i would have given worlds all the worlds one ever has to give for another half hour what felicity it is to hear a tune again which has made one happy if i mistake not that was danced at weymouth here is something quite new to me do you know it cramer and here are a new set of irish melodies that from such a quarter one might expect this was all sent with the instrument very thoughtful of colonel campbell was not it he knew miss fairfax could have no music here i honour that part of the attention particularly it shews it to have been so thoroughly from the heart nothing hastily done nothing incomplete true affection only could have prompted it,Emma; Harriet Smith; Miss Bates; Mr. Frank Churchill; Mrs. Weston,F,intermediate,M,major,1,1,1,0,1,1,1,1,1,1,1,1,1,1,1,1,1,1
00626,Mr. Frank Churchill,Emma,696,697,conjecture aye sometimes one conjectures right and sometimes one conjectures wrong i wish i could conjecture how soon i shall make this rivet quite firm what nonsense one talks miss woodhouse when hard at work if one talks at all your real workmen i suppose hold their tongues but we gentlemen labourers if we get hold of a word miss fairfax said something about conjecturing there it is done i have the pleasure madam of restoring your spectacles healed for the present if you are very kind it will be one of the waltzes we danced last night let me live them over again you did not enjoy them as i did you appeared tired the whole time i believe you were glad we danced no longer but i would have given worlds all the worlds one ever has to give for another half hour what felicity it is to hear a tune again which has made one happy if i mistake not that was danced at weymouth here is something quite new to me do you know it cramer and here are a new set of irish melodies that from such a quarter one might expect this was all sent with the instrument very thoughtful of colonel campbell was not it he knew miss fairfax could have no music here i honour that part of the attention particularly it shews it to have been so thoroughly from the heart nothing hastily done nothing incomplete true affection only could have prompted it,you speak too plain she must understand you,Emma; Harriet Smith; Jane Fairfax; Miss Bates; Mrs. Bates; Mrs. Weston,M,major,F,major,1,1,1,1,1,1,1,1,1,0,1,0,1,0,0,1,0,0
00627,Emma,Mr. Frank Churchill,697,698,you speak too plain she must understand you,i hope she does i would have her understand me i am not in the least ashamed of my meaning,Mr. Frank Churchill,F,major,M,major,0,1,0,1,0,0,1,0,0,1,1,0,0,0,1,1,1,1
00628,Mr. Frank Churchill,Emma,698,699,i hope she does i would have her understand me i am not in the least ashamed of my meaning,but really i am half ashamed and wish i had never taken up the idea,Emma,M,major,F,major,1,1,0,0,0,1,1,1,1,1,1,1,1,0,1,1,1,1
00629,Emma,Mr. Frank Churchill,699,700,but really i am half ashamed and wish i had never taken up the idea,i am very glad you did and that you communicated it to me i have now a key to all her odd looks and ways leave shame to her if she does wrong she ought to feel it,Mr. Frank Churchill,F,major,M,major,1,1,1,1,0,1,1,1,1,1,1,1,1,1,0,1,1,1
00630,Mr. Frank Churchill,Emma,700,701,i am very glad you did and that you communicated it to me i have now a key to all her odd looks and ways leave shame to her if she does wrong she ought to feel it,she is not entirely without it i think,Emma,M,major,F,major,1,1,1,1,1,0,1,1,1,0,1,0,1,1,1,1,1,1
00631,Emma,Mr. Frank Churchill,701,702,she is not entirely without it i think,i do not see much sign of it she is playing robin adair at this moment his favourite,Mr. Frank Churchill,F,major,M,major,0,1,0,1,1,1,1,1,1,0,1,0,0,1,1,1,1,1
00632,Miss Bates,Mr. Knightley,704,705,how d ye do how d ye do very well i thank you so obliged to you for the carriage last night we were just in time my mother just ready for us pray come in do come in you will find some friends here,how is your niece miss bates i want to inquire after you all but particularly your niece how is miss fairfax i hope she caught no cold last night how is she to day tell me how miss fairfax is,Mr. Knightley,F,intermediate,M,major,1,1,1,1,0,0,1,1,1,0,1,1,1,0,1,1,1,1
00633,Mr. Knightley,Miss Bates,705,706,how is your niece miss bates i want to inquire after you all but particularly your niece how is miss fairfax i hope she caught no cold last night how is she to day tell me how miss fairfax is,so obliged to you so very much obliged to you for the carriage,Jane Fairfax; Miss Bates; Mrs. Bates,M,major,F,intermediate,0,1,1,1,0,1,1,1,1,1,0,1,1,0,0,1,1,1
00634,Miss Bates,Mr. Knightley,706,707,so obliged to you so very much obliged to you for the carriage,i am going to kingston can i do any thing for you,Mr. Knightley,F,intermediate,M,major,1,0,1,1,0,0,1,1,1,0,1,0,0,1,0,1,1,0
00635,Mr. Knightley,Miss Bates,707,708,i am going to kingston can i do any thing for you,oh dear kingston are you mrs cole was saying the other day she wanted something from kingston,Jane Fairfax; Miss Bates; Mrs. Bates,M,major,F,intermediate,0,1,0,0,1,0,1,1,0,1,1,0,0,1,0,1,1,1
00636,Miss Bates,Mr. Knightley,708,709,oh dear kingston are you mrs cole was saying the other day she wanted something from kingston,mrs cole has servants to send can i do any thing for you,Mr. Knightley,F,intermediate,M,major,1,1,0,0,1,0,1,1,1,0,1,0,0,1,0,1,1,0
00637,Mr. Knightley,Miss Bates,709,710,mrs cole has servants to send can i do any thing for you,no i thank you but do come in who do you think is here miss woodhouse and miss smith so kind as to call to hear the new pianoforte do put up your horse at the crown and come in,Emma; Harriet Smith; Jane Fairfax; Miss Bates; Mr. Frank Churchill; Mrs. Bates; Mrs. Weston,M,major,F,intermediate,0,1,0,0,1,0,1,1,0,1,1,1,1,0,1,1,1,0
00638,Miss Bates,Mr. Knightley,710,711,no i thank you but do come in who do you think is here miss woodhouse and miss smith so kind as to call to hear the new pianoforte do put up your horse at the crown and come in,well for five minutes perhaps,Mr. Knightley,F,intermediate,M,major,1,1,1,1,0,1,1,1,0,0,0,0,1,0,0,0,1,1
00639,Mr. Knightley,Miss Bates,711,712,well for five minutes perhaps,and here is mrs weston and mr frank churchill too quite delightful so many friends,Emma; Harriet Smith; Jane Fairfax; Miss Bates; Mrs. Bates,M,major,F,intermediate,0,0,0,1,0,0,0,1,1,0,1,1,1,0,0,0,0,1
