pair_id,a_speaker,b_speaker,i_merge_id,j_merge_id,i_text,j_text,i_addressees,A_gender,A_category,B_gender,B_category,a_articles,a_auxiliary_verbs,a_conjunctions,a_adverbs,a_impersonal_pronouns,a_negations,a_personal_pronouns,a_prepositions,a_quantifiers,b_articles,b_auxiliary_verbs,b_conjunctions,b_adverbs,b_impersonal_pronouns,b_negations,b_personal_pronouns,b_prepositions,b_quantifiers
00296,Mr. Woodhouse,Isabella,316,317,why pretty well but not quite well poor perry is bilious and he has not time to take care of himself he tells me he has not time to take care of himself which is very sad but he is always wanted all round the country i suppose there is not a man in such practice anywhere but then there is not so clever a man any where,and mrs perry and the children how are they do the children grow i have a great regard for mr perry i hope he will be calling soon he will be so pleased to see my little ones,Emma; Isabella,M,intermediate,F,intermediate,1,1,1,1,1,1,1,1,1,1,1,1,1,0,0,1,1,1
00297,Isabella,Mr. Woodhouse,317,318,and mrs perry and the children how are they do the children grow i have a great regard for mr perry i hope he will be calling soon he will be so pleased to see my little ones,i hope he will be here to morrow for i have a question or two to ask him about myself of some consequence and my dear whenever he comes you had better let him look at little bella s throat,Emma; Mr. Woodhouse,F,intermediate,M,intermediate,1,1,1,1,0,0,1,1,1,1,1,1,1,0,0,1,1,1
00298,Mr. Woodhouse,Isabella,318,319,i hope he will be here to morrow for i have a question or two to ask him about myself of some consequence and my dear whenever he comes you had better let him look at little bella s throat,oh my dear sir her throat is so much better that i have hardly any uneasiness about it either bathing has been of the greatest service to her or else it is to be attributed to an excellent embrocation of mr wingfield s which we have been applying at times ever since august,Emma; Isabella,M,intermediate,F,intermediate,1,1,1,1,0,0,1,1,1,1,1,1,1,1,0,1,1,1
00299,Isabella,Mr. Woodhouse,319,320,oh my dear sir her throat is so much better that i have hardly any uneasiness about it either bathing has been of the greatest service to her or else it is to be attributed to an excellent embrocation of mr wingfield s which we have been applying at times ever since august,it is not very likely my dear that bathing should have been of use to her and if i had known you were wanting an embrocation i would have spoken to,Emma; Mr. Woodhouse,F,intermediate,M,intermediate,1,1,1,1,1,0,1,1,1,1,1,1,1,1,1,1,1,0
00300,Mr. Woodhouse,Emma,320,321,it is not very likely my dear that bathing should have been of use to her and if i had known you were wanting an embrocation i would have spoken to,you seem to me to have forgotten mrs and miss bates i have not heard one inquiry after them,Emma; Isabella,M,intermediate,F,major,1,1,1,1,1,1,1,1,0,0,1,1,0,0,1,1,1,1
00301,Emma,Isabella,321,322,you seem to me to have forgotten mrs and miss bates i have not heard one inquiry after them,oh the good bateses i am quite ashamed of myself but you mention them in most of your letters i hope they are quite well good old mrs bates i will call upon her to morrow and take my children they are always so pleased to see my children and that excellent miss bates such thorough worthy people how are they sir,Isabella; Mr. Woodhouse,F,major,F,intermediate,0,1,1,0,0,1,1,1,1,1,1,1,1,1,0,1,1,1
00302,Isabella,Mr. Woodhouse,322,323,oh the good bateses i am quite ashamed of myself but you mention them in most of your letters i hope they are quite well good old mrs bates i will call upon her to morrow and take my children they are always so pleased to see my children and that excellent miss bates such thorough worthy people how are they sir,why pretty well my dear upon the whole but poor mrs bates had a bad cold about a month ago,Emma; Mr. Woodhouse,F,intermediate,M,intermediate,1,1,1,1,1,0,1,1,1,1,1,1,1,0,0,1,1,1
00303,Mr. Woodhouse,Isabella,323,324,why pretty well my dear upon the whole but poor mrs bates had a bad cold about a month ago,how sorry i am but colds were never so prevalent as they have been this autumn mr wingfield told me that he has never known them more general or heavy except when it has been quite an influenza,Emma; Isabella,M,intermediate,F,intermediate,1,1,1,1,0,0,1,1,1,1,1,1,1,1,1,1,1,1
00304,Isabella,Mr. Woodhouse,324,325,how sorry i am but colds were never so prevalent as they have been this autumn mr wingfield told me that he has never known them more general or heavy except when it has been quite an influenza,that has been a good deal the case my dear but not to the degree you mention perry says that colds have been very general but not so heavy as he has very often known them in november perry does not call it altogether a sickly season,Emma; Mr. Woodhouse,F,intermediate,M,intermediate,1,1,1,1,1,1,1,1,1,1,1,1,1,1,1,1,1,1
00305,Mr. Woodhouse,Isabella,325,326,that has been a good deal the case my dear but not to the degree you mention perry says that colds have been very general but not so heavy as he has very often known them in november perry does not call it altogether a sickly season,no i do not know that mr wingfield considers it very sickly except,Emma; Isabella,M,intermediate,F,intermediate,1,1,1,1,1,1,1,1,1,0,1,0,1,1,1,1,1,0
00306,Isabella,Mr. Woodhouse,326,327,no i do not know that mr wingfield considers it very sickly except,ah my poor dear child the truth is that in london it is always a sickly season nobody is healthy in london nobody can be it is a dreadful thing to have you forced to live there so far off and the air so bad,Emma; Mr. Woodhouse,F,intermediate,M,intermediate,0,1,0,1,1,1,1,1,0,1,1,1,1,1,1,1,1,0
00307,Mr. Woodhouse,Isabella,327,328,ah my poor dear child the truth is that in london it is always a sickly season nobody is healthy in london nobody can be it is a dreadful thing to have you forced to live there so far off and the air so bad,no indeed we are not at all in a bad air our part of london is very superior to most others you must not confound us with london in general my dear sir the neighbourhood of brunswick square is very different from almost all the rest we are so very airy i should be unwilling i own to live in any other part of the town there is hardly any other that i could be satisfied to have my children in but we are so remarkably airy mr wingfield thinks the vicinity of brunswick square decidedly the most favourable as to air,Emma; Isabella,M,intermediate,F,intermediate,1,1,1,1,1,1,1,1,0,1,1,1,1,1,1,1,1,1
00308,Isabella,Mr. Woodhouse,328,329,no indeed we are not at all in a bad air our part of london is very superior to most others you must not confound us with london in general my dear sir the neighbourhood of brunswick square is very different from almost all the rest we are so very airy i should be unwilling i own to live in any other part of the town there is hardly any other that i could be satisfied to have my children in but we are so remarkably airy mr wingfield thinks the vicinity of brunswick square decidedly the most favourable as to air,ah my dear it is not like hartfield you make the best of it but after you have been a week at hartfield you are all of you different creatures you do not look like the same now i cannot say that i think you are any of you looking well at present,Emma; Mr. Woodhouse,F,intermediate,M,intermediate,1,1,1,1,1,1,1,1,1,1,1,1,1,1,1,1,1,1
00309,Mr. Woodhouse,Isabella,329,330,ah my dear it is not like hartfield you make the best of it but after you have been a week at hartfield you are all of you different creatures you do not look like the same now i cannot say that i think you are any of you looking well at present,i am sorry to hear you say so sir but i assure you excepting those little nervous head aches and palpitations which i am never entirely free from anywhere i am quite well myself and if the children were rather pale before they went to bed it was only because they were a little more tired than usual from their journey and the happiness of coming i hope you will think better of their looks to morrow for i assure you mr wingfield told me that he did not believe he had ever sent us off altogether in such good case i trust at least that you do not think mr knightley looking ill,Emma; Isabella,M,intermediate,F,intermediate,1,1,1,1,1,1,1,1,1,1,1,1,1,1,1,1,1,1
00310,Isabella,Mr. Woodhouse,330,331,i am sorry to hear you say so sir but i assure you excepting those little nervous head aches and palpitations which i am never entirely free from anywhere i am quite well myself and if the children were rather pale before they went to bed it was only because they were a little more tired than usual from their journey and the happiness of coming i hope you will think better of their looks to morrow for i assure you mr wingfield told me that he did not believe he had ever sent us off altogether in such good case i trust at least that you do not think mr knightley looking ill,middling my dear i cannot compliment you i think mr john knightley very far from looking well,Emma; Mr. Woodhouse,F,intermediate,M,intermediate,1,1,1,1,1,1,1,1,1,0,1,0,1,0,1,1,1,0
00311,Mr. John Knightley,Isabella,332,333,what is the matter sir did you speak to me,i am sorry to find my love that my father does not think you looking well but i hope it is only from being a little fatigued i could have wished however as you know that you had seen mr wingfield before you left home,Emma; Isabella; Mr. Knightley; Mr. Woodhouse,M,intermediate,F,intermediate,1,1,0,0,1,0,1,1,0,1,1,1,1,1,1,1,1,1
00312,Isabella,Mr. John Knightley,333,334,i am sorry to find my love that my father does not think you looking well but i hope it is only from being a little fatigued i could have wished however as you know that you had seen mr wingfield before you left home,my dear isabella pray do not concern yourself about my looks be satisfied with doctoring and coddling yourself and the children and let me look as i chuse,Emma; Mr. John Knightley; Mr. Knightley; Mr. Woodhouse,F,intermediate,M,intermediate,1,1,1,1,1,1,1,1,1,1,1,1,1,0,1,1,1,0
00313,Mr. John Knightley,Emma,334,335,my dear isabella pray do not concern yourself about my looks be satisfied with doctoring and coddling yourself and the children and let me look as i chuse,i did not thoroughly understand what you were telling your brother about your friend mr graham s intending to have a bailiff from scotland to look after his new estate what will it answer will not the old prejudice be too strong,Emma; Isabella; Mr. Knightley; Mr. Woodhouse,M,intermediate,F,major,1,1,1,1,0,1,1,1,0,1,1,1,1,1,1,1,1,0
00314,Emma,Isabella,335,336,i did not thoroughly understand what you were telling your brother about your friend mr graham s intending to have a bailiff from scotland to look after his new estate what will it answer will not the old prejudice be too strong,that sweet amiable jane fairfax it is so long since i have seen her except now and then for a moment accidentally in town what happiness it must be to her good old grandmother and excellent aunt when she comes to visit them i always regret excessively on dear emma s account that she cannot be more at highbury but now their daughter is married i suppose colonel and mrs campbell will not be able to part with her at all she would be such a delightful companion for emma,Isabella; Mr. John Knightley; Mr. Knightley; Mr. Woodhouse,F,major,F,intermediate,1,1,1,1,1,1,1,1,0,1,1,1,1,1,1,1,1,1
00315,Isabella,Mr. Woodhouse,336,337,that sweet amiable jane fairfax it is so long since i have seen her except now and then for a moment accidentally in town what happiness it must be to her good old grandmother and excellent aunt when she comes to visit them i always regret excessively on dear emma s account that she cannot be more at highbury but now their daughter is married i suppose colonel and mrs campbell will not be able to part with her at all she would be such a delightful companion for emma,our little friend harriet smith however is just such another pretty kind of young person you will like harriet emma could not have a better companion than harriet,Emma; Mr. John Knightley; Mr. Knightley; Mr. Woodhouse,F,intermediate,M,intermediate,1,1,1,1,1,1,1,1,1,1,1,1,1,1,1,1,1,1
00316,Mr. Woodhouse,Isabella,337,338,our little friend harriet smith however is just such another pretty kind of young person you will like harriet emma could not have a better companion than harriet,i am most happy to hear it but only jane fairfax one knows to be so very accomplished and superior and exactly emma s age,Emma; Isabella; Mr. John Knightley; Mr. Knightley,M,intermediate,F,intermediate,1,1,1,1,1,1,1,1,1,0,1,1,1,1,0,1,1,1
00317,Isabella,Mr. Woodhouse,338,339,i am most happy to hear it but only jane fairfax one knows to be so very accomplished and superior and exactly emma s age,ah i shall always be very sorry that you went to the sea this autumn instead of coming here,Emma; Mr. John Knightley; Mr. Knightley; Mr. Woodhouse,F,intermediate,M,intermediate,0,1,1,1,1,0,1,1,1,1,1,0,1,1,0,1,1,0
00318,Mr. Woodhouse,Isabella,339,340,ah i shall always be very sorry that you went to the sea this autumn instead of coming here,but why should you be sorry sir i assure you it did the children a great deal of good,Emma; Isabella; Mr. John Knightley; Mr. Knightley,M,intermediate,F,intermediate,1,1,0,1,1,0,1,1,0,1,1,1,1,1,0,1,1,0
00319,Isabella,Mr. Woodhouse,340,341,but why should you be sorry sir i assure you it did the children a great deal of good,and moreover if you must go to the sea it had better not have been to south end south end is an unhealthy place perry was surprized to hear you had fixed upon south end,Emma; Mr. John Knightley; Mr. Knightley; Mr. Woodhouse,F,intermediate,M,intermediate,1,1,1,1,1,0,1,1,0,1,1,1,1,1,1,1,1,0
00320,Mr. Woodhouse,Isabella,341,342,and moreover if you must go to the sea it had better not have been to south end south end is an unhealthy place perry was surprized to hear you had fixed upon south end,i know there is such an idea with many people but indeed it is quite a mistake sir we all had our health perfectly well there never found the least inconvenience from the mud and mr wingfield says it is entirely a mistake to suppose the place unhealthy and i am sure he may be depended on for he thoroughly understands the nature of the air and his own brother and family have been there repeatedly,Emma; Isabella; Mr. John Knightley; Mr. Knightley,M,intermediate,F,intermediate,1,1,1,1,1,1,1,1,0,1,1,1,1,1,1,1,1,1
00321,Isabella,Mr. Woodhouse,342,343,i know there is such an idea with many people but indeed it is quite a mistake sir we all had our health perfectly well there never found the least inconvenience from the mud and mr wingfield says it is entirely a mistake to suppose the place unhealthy and i am sure he may be depended on for he thoroughly understands the nature of the air and his own brother and family have been there repeatedly,you should have gone to cromer my dear if you went anywhere perry was a week at cromer once and he holds it to be the best of all the sea bathing places a fine open sea he says and very pure air and by what i understand you might have had lodgings there quite away from the sea a quarter of a mile off very comfortable you should have consulted perry,Emma; Mr. John Knightley; Mr. Knightley; Mr. Woodhouse,F,intermediate,M,intermediate,1,1,1,1,1,1,1,1,1,1,1,1,1,1,0,1,1,1
00322,Mr. Woodhouse,Isabella,343,344,you should have gone to cromer my dear if you went anywhere perry was a week at cromer once and he holds it to be the best of all the sea bathing places a fine open sea he says and very pure air and by what i understand you might have had lodgings there quite away from the sea a quarter of a mile off very comfortable you should have consulted perry,but my dear sir the difference of the journey only consider how great it would have been an hundred miles perhaps instead of forty,Emma; Isabella; Mr. John Knightley; Mr. Knightley,M,intermediate,F,intermediate,1,1,1,1,1,0,1,1,1,1,1,1,1,1,0,1,1,1
00323,Isabella,Mr. Woodhouse,344,345,but my dear sir the difference of the journey only consider how great it would have been an hundred miles perhaps instead of forty,ah my dear as perry says where health is at stake nothing else should be considered and if one is to travel there is not much to chuse between forty miles and an hundred better not move at all better stay in london altogether than travel forty miles to get into a worse air this is just what perry said it seemed to him a very ill judged measure,Emma; Mr. John Knightley; Mr. Knightley; Mr. Woodhouse,F,intermediate,M,intermediate,1,1,1,1,1,0,1,1,1,1,1,1,1,1,1,1,1,1
00324,Mr. Woodhouse,Mr. John Knightley,345,346,ah my dear as perry says where health is at stake nothing else should be considered and if one is to travel there is not much to chuse between forty miles and an hundred better not move at all better stay in london altogether than travel forty miles to get into a worse air this is just what perry said it seemed to him a very ill judged measure,mr perry would do as well to keep his opinion till it is asked for why does he make it any business of his to wonder at what i do at my taking my family to one part of the coast or another i may be allowed i hope the use of my judgment as well as mr perry i want his directions no more than his drugs if mr perry can tell me how to convey a wife and five children a distance of an hundred and thirty miles with no greater expense or inconvenience than a distance of forty i should be as willing to prefer cromer to south end as he could himself,Emma; Isabella; Mr. John Knightley; Mr. Knightley,M,intermediate,M,intermediate,1,1,1,1,1,1,1,1,1,1,1,1,1,1,1,1,1,1
00325,Mr. John Knightley,Mr. Knightley,346,347,mr perry would do as well to keep his opinion till it is asked for why does he make it any business of his to wonder at what i do at my taking my family to one part of the coast or another i may be allowed i hope the use of my judgment as well as mr perry i want his directions no more than his drugs if mr perry can tell me how to convey a wife and five children a distance of an hundred and thirty miles with no greater expense or inconvenience than a distance of forty i should be as willing to prefer cromer to south end as he could himself,true true very true that s a consideration indeed but john as to what i was telling you of my idea of moving the path to langham of turning it more to the right that it may not cut through the home meadows i cannot conceive any difficulty i should not attempt it if it were to be the means of inconvenience to the highbury people but if you call to mind exactly the present line of the path the only way of proving it however will be to turn to our maps i shall see you at the abbey to morrow morning i hope and then we will look them over and you shall give me your opinion,Emma; Isabella; Mr. Knightley; Mr. Woodhouse,M,intermediate,M,major,1,1,1,1,1,1,1,1,1,1,1,1,1,1,1,1,1,1
00326,Mr. Elton,Emma,348,349,a sore throat i hope not infectious i hope not of a putrid infectious sort has perry seen her indeed you should take care of yourself as well as of your friend let me entreat you to run no risks why does not perry see her,it is so cold so very cold and looks and feels so very much like snow that if it were to any other place or with any other party i should really try not to go out to day and dissuade my father from venturing but as he has made up his mind and does not seem to feel the cold himself i do not like to interfere as i know it would be so great a disappointment to mr and mrs weston but upon my word mr elton in your case i should certainly excuse myself you appear to me a little hoarse already and when you consider what demand of voice and what fatigues to morrow will bring i think it would be no more than common prudence to stay at home and take care of yourself to night,Emma; Mr. John Knightley,M,intermediate,F,major,1,1,1,1,0,1,1,1,0,1,1,1,1,1,1,1,1,1
00327,Emma,Mr. Elton,349,350,it is so cold so very cold and looks and feels so very much like snow that if it were to any other place or with any other party i should really try not to go out to day and dissuade my father from venturing but as he has made up his mind and does not seem to feel the cold himself i do not like to interfere as i know it would be so great a disappointment to mr and mrs weston but upon my word mr elton in your case i should certainly excuse myself you appear to me a little hoarse already and when you consider what demand of voice and what fatigues to morrow will bring i think it would be no more than common prudence to stay at home and take care of yourself to night,very cold certainly very cold,Mr. Elton; Mr. John Knightley,F,major,M,intermediate,1,1,1,1,1,1,1,1,1,0,0,0,1,0,0,0,0,0
00328,Mr. Elton,Emma,350,351,very cold certainly very cold,you do quite right we will make your apologies to mr and mrs weston,Emma; Mr. John Knightley,M,intermediate,F,major,0,0,0,1,0,0,0,0,0,0,1,1,1,0,0,1,1,0
00329,Mr. John Knightley,Emma,353,354,i never in my life saw a man more intent on being agreeable than mr elton it is downright labour to him where ladies are concerned with men he can be rational and unaffected but when he has ladies to please every feature works,mr elton s manners are not perfect but where there is a wish to please one ought to overlook and one does overlook a great deal where a man does his best with only moderate powers he will have the advantage over negligent superiority there is such perfect good temper and good will in mr elton as one cannot but value,Emma,M,intermediate,F,major,1,1,1,1,1,1,1,1,1,1,1,1,1,0,1,1,1,1
00330,Emma,Mr. John Knightley,354,355,mr elton s manners are not perfect but where there is a wish to please one ought to overlook and one does overlook a great deal where a man does his best with only moderate powers he will have the advantage over negligent superiority there is such perfect good temper and good will in mr elton as one cannot but value,yes he seems to have a great deal of good will towards you,Mr. John Knightley,F,major,M,intermediate,1,1,1,1,0,1,1,1,1,1,1,0,0,0,0,1,1,0
00331,Mr. John Knightley,Emma,355,356,yes he seems to have a great deal of good will towards you,me are you imagining me to be mr elton s object,Emma,M,intermediate,F,major,1,1,0,0,0,0,1,1,0,0,1,0,0,0,0,1,1,0
00332,Emma,Mr. John Knightley,356,357,me are you imagining me to be mr elton s object,such an imagination has crossed me i own emma and if it never occurred to you before you may as well take it into consideration now,Mr. John Knightley,F,major,M,intermediate,0,1,0,0,0,0,1,1,0,1,1,1,1,1,1,1,1,0
00333,Mr. John Knightley,Emma,357,358,such an imagination has crossed me i own emma and if it never occurred to you before you may as well take it into consideration now,mr elton in love with me what an idea,Emma,M,intermediate,F,major,1,1,1,1,1,1,1,1,0,1,0,0,0,1,0,1,1,0
00334,Emma,Mr. John Knightley,358,359,mr elton in love with me what an idea,i do not say it is so but you will do well to consider whether it is so or not and to regulate your behaviour accordingly i think your manners to him encouraging i speak as a friend emma you had better look about you and ascertain what you do and what you mean to do,Mr. John Knightley,F,major,M,intermediate,1,0,0,0,1,0,1,1,0,1,1,1,1,1,1,1,1,0
00335,Mr. John Knightley,Emma,359,360,i do not say it is so but you will do well to consider whether it is so or not and to regulate your behaviour accordingly i think your manners to him encouraging i speak as a friend emma you had better look about you and ascertain what you do and what you mean to do,i thank you but i assure you you are quite mistaken mr elton and i are very good friends and nothing more,Emma,M,intermediate,F,major,1,1,1,1,1,1,1,1,0,0,1,1,1,0,1,1,0,1
00336,Emma,Mr. John Knightley,360,361,i thank you but i assure you you are quite mistaken mr elton and i are very good friends and nothing more,a man must have a very good opinion of himself when he asks people to leave their own fireside and encounter such a day as this for the sake of coming to see him he must think himself a most agreeable fellow i could not do such a thing it is the greatest absurdity actually snowing at this moment the folly of not allowing people to be comfortable at home and the folly of people s not staying comfortably at home when they can if we were obliged to go out such an evening as this by any call of duty or business what a hardship we should deem it and here are we probably with rather thinner clothing than usual setting forward voluntarily without excuse in defiance of the voice of nature which tells man in every thing given to his view or his feelings to stay at home himself and keep all under shelter that he can here are we setting forward to spend five dull hours in another man s house with nothing to say or to hear that was not said and heard yesterday and may not be said and heard again to morrow going in dismal weather to return probably in worse four horses and four servants taken out for nothing but to convey five idle shivering creatures into colder rooms and worse company than they might have had at home,Mr. John Knightley,F,major,M,intermediate,0,1,1,1,0,1,1,0,1,1,1,1,1,1,1,1,1,1
