pair_id,a_speaker,b_speaker,i_merge_id,j_merge_id,i_text,j_text,i_addressees,A_gender,A_category,B_gender,B_category,a_articles,a_auxiliary_verbs,a_conjunctions,a_adverbs,a_impersonal_pronouns,a_negations,a_personal_pronouns,a_prepositions,a_quantifiers,b_articles,b_auxiliary_verbs,b_conjunctions,b_adverbs,b_impersonal_pronouns,b_negations,b_personal_pronouns,b_prepositions,b_quantifiers
00000,Mr. Woodhouse,Emma,0,1,poor miss taylor i wish she were here again what a pity it is that mr weston ever thought of her,i cannot agree with you papa you know i cannot mr weston is such a good humoured pleasant excellent man that he thoroughly deserves a good wife and you would not have had miss taylor live with us for ever and bear all my odd humours when she might have a house of her own,Emma,M,intermediate,F,major,1,1,0,1,1,0,1,1,0,1,1,1,1,1,1,1,1,1
00001,Emma,Mr. Woodhouse,1,2,i cannot agree with you papa you know i cannot mr weston is such a good humoured pleasant excellent man that he thoroughly deserves a good wife and you would not have had miss taylor live with us for ever and bear all my odd humours when she might have a house of her own,a house of her own but where is the advantage of a house of her own this is three times as large and you have never any odd humours my dear,Mr. Woodhouse,F,major,M,intermediate,1,1,1,1,1,1,1,1,1,1,1,1,1,1,1,1,1,1
00002,Mr. Woodhouse,Emma,2,3,a house of her own but where is the advantage of a house of her own this is three times as large and you have never any odd humours my dear,how often we shall be going to see them and they coming to see us we shall be always meeting we must begin we must go and pay wedding visit very soon,Emma,M,intermediate,F,major,1,1,1,1,1,1,1,1,1,0,1,1,1,0,0,1,1,0
00003,Emma,Mr. Woodhouse,3,4,how often we shall be going to see them and they coming to see us we shall be always meeting we must begin we must go and pay wedding visit very soon,my dear how am i to get so far randalls is such a distance i could not walk half so far,Mr. Woodhouse,F,major,M,intermediate,0,1,1,1,0,0,1,1,0,1,1,1,1,0,1,1,1,1
00004,Mr. Woodhouse,Emma,4,5,my dear how am i to get so far randalls is such a distance i could not walk half so far,no papa nobody thought of your walking we must go in the carriage to be sure,Emma,M,intermediate,F,major,1,1,1,1,0,1,1,1,1,1,1,0,0,1,1,1,1,0
00005,Emma,Mr. Woodhouse,5,6,no papa nobody thought of your walking we must go in the carriage to be sure,the carriage but james will not like to put the horses to for such a little way and where are the poor horses to be while we are paying our visit,Mr. Woodhouse,F,major,M,intermediate,1,1,0,0,1,1,1,1,0,1,1,1,1,0,1,1,1,1
00006,Mr. Woodhouse,Emma,6,7,the carriage but james will not like to put the horses to for such a little way and where are the poor horses to be while we are paying our visit,they are to be put into mr weston s stable papa you know we have settled all that already we talked it all over with mr weston last night and as for james you may be very sure he will always like going to randalls because of his daughter s being housemaid there i only doubt whether he will ever take us anywhere else that was your doing papa you got hannah that good place nobody thought of hannah till you mentioned her james is so obliged to you,Emma,M,intermediate,F,major,1,1,1,1,0,1,1,1,1,0,1,1,1,1,1,1,1,1
00007,Emma,Mr. Woodhouse,7,8,they are to be put into mr weston s stable papa you know we have settled all that already we talked it all over with mr weston last night and as for james you may be very sure he will always like going to randalls because of his daughter s being housemaid there i only doubt whether he will ever take us anywhere else that was your doing papa you got hannah that good place nobody thought of hannah till you mentioned her james is so obliged to you,i am very glad i did think of her it was very lucky for i would not have had poor james think himself slighted upon any account and i am sure she will make a very good servant she is a civil pretty spoken girl i have a great opinion of her whenever i see her she always curtseys and asks me how i do in a very pretty manner and when you have had her here to do needlework i observe she always turns the lock of the door the right way and never bangs it i am sure she will be an excellent servant and it will be a great comfort to poor miss taylor to have somebody about her that she is used to see whenever james goes over to see his daughter you know she will be hearing of us he will be able to tell her how we all are,Mr. Woodhouse,F,major,M,intermediate,0,1,1,1,1,1,1,1,1,1,1,1,1,1,1,1,1,1
00008,Mr. Woodhouse,Mr. Knightley,9,10,it is very kind of you mr knightley to come out at this late hour to call upon us i am afraid you must have had a shocking walk,not at all sir it is a beautiful moonlight night and so mild that i must draw back from your great fire,Emma; Mr. Knightley,M,intermediate,M,major,1,1,0,1,1,0,1,1,1,1,1,1,1,1,1,1,1,1
00009,Mr. Knightley,Mr. Woodhouse,10,11,not at all sir it is a beautiful moonlight night and so mild that i must draw back from your great fire,but you must have found it very damp and dirty i wish you may not catch cold,Emma; Mr. Woodhouse,M,major,M,intermediate,1,1,1,1,1,1,1,1,1,0,1,1,1,1,1,1,0,0
00010,Mr. Woodhouse,Mr. Knightley,11,12,but you must have found it very damp and dirty i wish you may not catch cold,dirty sir look at my shoes not a speck on them,Emma; Mr. Knightley,M,intermediate,M,major,0,1,1,1,1,1,1,0,0,1,0,0,0,0,1,1,1,0
00011,Mr. Knightley,Mr. Woodhouse,12,13,dirty sir look at my shoes not a speck on them,well that is quite surprising for we have had a vast deal of rain here it rained dreadfully hard for half an hour while we were at breakfast i wanted them to put off the wedding,Emma; Mr. Woodhouse,M,major,M,intermediate,1,0,0,0,0,1,1,1,0,1,1,1,1,1,0,1,1,1
00012,Mr. Woodhouse,Mr. Knightley,13,14,well that is quite surprising for we have had a vast deal of rain here it rained dreadfully hard for half an hour while we were at breakfast i wanted them to put off the wedding,by the bye i have not wished you joy being pretty well aware of what sort of joy you must both be feeling i have been in no hurry with my congratulations but i hope it all went off tolerably well how did you all behave who cried most,Emma; Mr. Knightley,M,intermediate,M,major,1,1,1,1,1,0,1,1,1,1,1,1,1,1,1,1,1,1
00013,Mr. Knightley,Mr. Woodhouse,14,15,by the bye i have not wished you joy being pretty well aware of what sort of joy you must both be feeling i have been in no hurry with my congratulations but i hope it all went off tolerably well how did you all behave who cried most,ah poor miss taylor tis a sad business,Emma; Mr. Woodhouse,M,major,M,intermediate,1,1,1,1,1,1,1,1,1,1,0,0,0,0,0,0,0,0
00014,Mr. Woodhouse,Mr. Knightley,15,16,ah poor miss taylor tis a sad business,poor mr and miss woodhouse if you please but i cannot possibly say i have a great regard for you and emma but when it comes to the question of dependence or independence at any rate it must be better to have only one to please than two,Emma; Mr. Knightley,M,intermediate,M,major,1,0,0,0,0,0,0,0,0,1,1,1,1,1,1,1,1,1
00015,Mr. Knightley,Emma,16,17,poor mr and miss woodhouse if you please but i cannot possibly say i have a great regard for you and emma but when it comes to the question of dependence or independence at any rate it must be better to have only one to please than two,especially when one of those two is such a fanciful troublesome creature that is what you have in your head i know and what you would certainly say if my father were not by,Emma; Mr. Woodhouse,M,major,F,major,1,1,1,1,1,1,1,1,1,1,1,1,1,1,1,1,1,1
00016,Emma,Mr. Woodhouse,17,18,especially when one of those two is such a fanciful troublesome creature that is what you have in your head i know and what you would certainly say if my father were not by,i believe it is very true my dear indeed i am afraid i am sometimes very fanciful and troublesome,Mr. Knightley; Mr. Woodhouse,F,major,M,intermediate,1,1,1,1,1,1,1,1,1,0,1,1,1,1,0,1,0,0
00017,Mr. Woodhouse,Emma,18,19,i believe it is very true my dear indeed i am afraid i am sometimes very fanciful and troublesome,my dearest papa you do not think i could mean you or suppose mr knightley to mean you what a horrible idea oh no i meant only myself mr knightley loves to find fault with me you know in a joke it is all a joke we always say what we like to one another,Emma; Mr. Knightley,M,intermediate,F,major,0,1,1,1,1,0,1,0,0,1,1,1,1,1,1,1,1,1
00018,Emma,Mr. Knightley,19,20,my dearest papa you do not think i could mean you or suppose mr knightley to mean you what a horrible idea oh no i meant only myself mr knightley loves to find fault with me you know in a joke it is all a joke we always say what we like to one another,emma knows i never flatter her but i meant no reflection on any body miss taylor has been used to have two persons to please she will now have but one the chances are that she must be a gainer,Mr. Knightley; Mr. Woodhouse,F,major,M,major,1,1,1,1,1,1,1,1,1,1,1,1,1,1,1,1,1,1
00019,Mr. Knightley,Emma,20,21,emma knows i never flatter her but i meant no reflection on any body miss taylor has been used to have two persons to please she will now have but one the chances are that she must be a gainer,well you want to hear about the wedding and i shall be happy to tell you for we all behaved charmingly every body was punctual every body in their best looks not a tear and hardly a long face to be seen oh no we all felt that we were going to be only half a mile apart and were sure of meeting every day,Emma; Mr. Woodhouse,M,major,F,major,1,1,1,1,1,1,1,1,1,1,1,1,1,1,1,1,1,1
00020,Emma,Mr. Woodhouse,21,22,well you want to hear about the wedding and i shall be happy to tell you for we all behaved charmingly every body was punctual every body in their best looks not a tear and hardly a long face to be seen oh no we all felt that we were going to be only half a mile apart and were sure of meeting every day,dear emma bears every thing so well but mr knightley she is really very sorry to lose poor miss taylor and i am sure she will miss her more than she thinks for,Mr. Knightley; Mr. Woodhouse,F,major,M,intermediate,1,1,1,1,1,1,1,1,1,0,1,1,1,1,0,1,1,1
00021,Mr. Woodhouse,Mr. Knightley,22,23,dear emma bears every thing so well but mr knightley she is really very sorry to lose poor miss taylor and i am sure she will miss her more than she thinks for,it is impossible that emma should not miss such a companion we should not like her so well as we do sir if we could suppose it but she knows how much the marriage is to miss taylor s advantage she knows how very acceptable it must be at miss taylor s time of life to be settled in a home of her own and how important to her to be secure of a comfortable provision and therefore cannot allow herself to feel so much pain as pleasure every friend of miss taylor must be glad to have her so happily married,Emma; Mr. Knightley,M,intermediate,M,major,0,1,1,1,1,0,1,1,1,1,1,1,1,1,1,1,1,1
00022,Mr. Knightley,Emma,23,24,it is impossible that emma should not miss such a companion we should not like her so well as we do sir if we could suppose it but she knows how much the marriage is to miss taylor s advantage she knows how very acceptable it must be at miss taylor s time of life to be settled in a home of her own and how important to her to be secure of a comfortable provision and therefore cannot allow herself to feel so much pain as pleasure every friend of miss taylor must be glad to have her so happily married,and you have forgotten one matter of joy to me and a very considerable one that i made the match myself i made the match you know four years ago and to have it take place and be proved in the right when so many people said mr weston would never marry again may comfort me for any thing,Emma; Mr. Woodhouse,M,major,F,major,1,1,1,1,1,1,1,1,1,1,1,1,1,1,1,1,1,1
00023,Emma,Mr. Woodhouse,24,25,and you have forgotten one matter of joy to me and a very considerable one that i made the match myself i made the match you know four years ago and to have it take place and be proved in the right when so many people said mr weston would never marry again may comfort me for any thing,ah my dear i wish you would not make matches and foretell things for whatever you say always comes to pass pray do not make any more matches,Mr. Knightley; Mr. Woodhouse,F,major,M,intermediate,1,1,1,1,1,1,1,1,1,0,1,1,1,1,1,1,1,1
00024,Mr. Woodhouse,Emma,25,26,ah my dear i wish you would not make matches and foretell things for whatever you say always comes to pass pray do not make any more matches,i promise you to make none for myself papa but i must indeed for other people it is the greatest amusement in the world and after such success you know every body said that mr weston would never marry again oh dear no mr weston who had been a widower so long and who seemed so perfectly comfortable without a wife so constantly occupied either in his business in town or among his friends here always acceptable wherever he went always cheerful mr weston need not spend a single evening in the year alone if he did not like it oh no mr weston certainly would never marry again some people even talked of a promise to his wife on her deathbed and others of the son and the uncle not letting him all manner of solemn nonsense was talked on the subject but i believed none of it ever since the day about four years ago that miss taylor and i met with him in broadway lane when because it began to drizzle he darted away with so much gallantry and borrowed two umbrellas for us from farmer mitchell s i made up my mind on the subject i planned the match from that hour and when such success has blessed me in this instance dear papa you cannot think that i shall leave off match making,Emma; Mr. Knightley,M,intermediate,F,major,0,1,1,1,1,1,1,1,1,1,1,1,1,1,1,1,1,1
00025,Emma,Mr. Knightley,26,27,i promise you to make none for myself papa but i must indeed for other people it is the greatest amusement in the world and after such success you know every body said that mr weston would never marry again oh dear no mr weston who had been a widower so long and who seemed so perfectly comfortable without a wife so constantly occupied either in his business in town or among his friends here always acceptable wherever he went always cheerful mr weston need not spend a single evening in the year alone if he did not like it oh no mr weston certainly would never marry again some people even talked of a promise to his wife on her deathbed and others of the son and the uncle not letting him all manner of solemn nonsense was talked on the subject but i believed none of it ever since the day about four years ago that miss taylor and i met with him in broadway lane when because it began to drizzle he darted away with so much gallantry and borrowed two umbrellas for us from farmer mitchell s i made up my mind on the subject i planned the match from that hour and when such success has blessed me in this instance dear papa you cannot think that i shall leave off match making,i do not understand what you mean by success success supposes endeavour your time has been properly and delicately spent if you have been endeavouring for the last four years to bring about this marriage a worthy employment for a young lady s mind but if which i rather imagine your making the match as you call it means only your planning it your saying to yourself one idle day i think it would be a very good thing for miss taylor if mr weston were to marry her and saying it again to yourself every now and then afterwards why do you talk of success where is your merit what are you proud of you made a lucky guess and that is all that can be said,Mr. Knightley; Mr. Woodhouse,F,major,M,major,1,1,1,1,1,1,1,1,1,1,1,1,1,1,1,1,1,1
00026,Mr. Knightley,Emma,27,28,i do not understand what you mean by success success supposes endeavour your time has been properly and delicately spent if you have been endeavouring for the last four years to bring about this marriage a worthy employment for a young lady s mind but if which i rather imagine your making the match as you call it means only your planning it your saying to yourself one idle day i think it would be a very good thing for miss taylor if mr weston were to marry her and saying it again to yourself every now and then afterwards why do you talk of success where is your merit what are you proud of you made a lucky guess and that is all that can be said,and have you never known the pleasure and triumph of a lucky guess i pity you i thought you cleverer for depend upon it a lucky guess is never merely luck there is always some talent in it and as to my poor word success which you quarrel with i do not know that i am so entirely without any claim to it you have drawn two pretty pictures but i think there may be a third a something between the do nothing and the do all if i had not promoted mr weston s visits here and given many little encouragements and smoothed many little matters it might not have come to any thing after all i think you must know hartfield enough to comprehend that,Emma; Mr. Woodhouse,M,major,F,major,1,1,1,1,1,1,1,1,1,1,1,1,1,1,1,1,1,1
00027,Emma,Mr. Knightley,28,29,and have you never known the pleasure and triumph of a lucky guess i pity you i thought you cleverer for depend upon it a lucky guess is never merely luck there is always some talent in it and as to my poor word success which you quarrel with i do not know that i am so entirely without any claim to it you have drawn two pretty pictures but i think there may be a third a something between the do nothing and the do all if i had not promoted mr weston s visits here and given many little encouragements and smoothed many little matters it might not have come to any thing after all i think you must know hartfield enough to comprehend that,a straightforward open hearted man like weston and a rational unaffected woman like miss taylor may be safely left to manage their own concerns you are more likely to have done harm to yourself than good to them by interference,Mr. Knightley; Mr. Woodhouse,F,major,M,major,1,1,1,1,1,1,1,1,1,1,1,1,0,0,0,1,1,1
00028,Mr. Knightley,Mr. Woodhouse,29,30,a straightforward open hearted man like weston and a rational unaffected woman like miss taylor may be safely left to manage their own concerns you are more likely to have done harm to yourself than good to them by interference,emma never thinks of herself if she can do good to others but my dear pray do not make any more matches they are silly things and break up one s family circle grievously,Emma; Mr. Woodhouse,M,major,M,intermediate,1,1,1,0,0,0,1,1,1,0,1,1,1,1,1,1,1,1
00029,Mr. Woodhouse,Emma,30,31,emma never thinks of herself if she can do good to others but my dear pray do not make any more matches they are silly things and break up one s family circle grievously,only one more papa only for mr elton poor mr elton you like mr elton papa i must look about for a wife for him there is nobody in highbury who deserves him and he has been here a whole year and has fitted up his house so comfortably that it would be a shame to have him single any longer and i thought when he was joining their hands to day he looked so very much as if he would like to have the same kind office done for him i think very well of mr elton and this is the only way i have of doing him a service,Emma; Mr. Knightley,M,intermediate,F,major,0,1,1,1,1,1,1,1,1,1,1,1,1,1,1,1,1,1
00030,Emma,Mr. Woodhouse,31,32,only one more papa only for mr elton poor mr elton you like mr elton papa i must look about for a wife for him there is nobody in highbury who deserves him and he has been here a whole year and has fitted up his house so comfortably that it would be a shame to have him single any longer and i thought when he was joining their hands to day he looked so very much as if he would like to have the same kind office done for him i think very well of mr elton and this is the only way i have of doing him a service,mr elton is a very pretty young man to be sure and a very good young man and i have a great regard for him but if you want to shew him any attention my dear ask him to come and dine with us some day that will be a much better thing i dare say mr knightley will be so kind as to meet him,Mr. Knightley; Mr. Woodhouse,F,major,M,intermediate,1,1,1,1,1,1,1,1,1,1,1,1,1,1,0,1,1,1
00031,Mr. Woodhouse,Mr. Knightley,32,33,mr elton is a very pretty young man to be sure and a very good young man and i have a great regard for him but if you want to shew him any attention my dear ask him to come and dine with us some day that will be a much better thing i dare say mr knightley will be so kind as to meet him,with a great deal of pleasure sir at any time and i agree with you entirely that it will be a much better thing invite him to dinner emma and help him to the best of the fish and the chicken but leave him to chuse his own wife depend upon it a man of six or seven and twenty can take care of himself,Emma; Mr. Knightley,M,intermediate,M,major,1,1,1,1,1,0,1,1,1,1,1,1,1,1,0,1,1,1
00032,Mr. Knightley,Mr. Woodhouse,33,34,with a great deal of pleasure sir at any time and i agree with you entirely that it will be a much better thing invite him to dinner emma and help him to the best of the fish and the chicken but leave him to chuse his own wife depend upon it a man of six or seven and twenty can take care of himself,ah poor miss taylor she would be very glad to stay,Emma; Mr. Woodhouse,M,major,M,intermediate,1,1,1,1,1,0,1,1,1,0,1,0,1,0,0,1,1,0
00033,Mr. Woodhouse,Harriet Smith,35,36,mrs bates let me propose your venturing on one of these eggs an egg boiled very soft is not unwholesome serle understands boiling an egg better than any body i would not recommend an egg boiled by any body else but you need not be afraid they are very small you see one of our small eggs will not hurt you miss bates let emma help you to a little bit of tart a very little bit ours are all apple tarts you need not be afraid of unwholesome preserves here i do not advise the custard mrs goddard what say you to half a glass of wine a small half glass put into a tumbler of water i do not think it could disagree with you,two parlours two very good parlours indeed one of them quite as large as mrs goddard s drawing room and of her having an upper maid who had lived five and twenty years with her and of their having eight cows two of them alderneys and one a little welch cow a very pretty little welch cow indeed and of mrs martin s saying as she was so fond of it it should be called her cow and of their having a very handsome summer house in their garden where some day next year they were all to drink tea a very handsome summer house large enough to hold a dozen people,Emma; Harriet Smith; Miss Bates; Mrs. Bates,M,intermediate,F,major,1,1,1,1,1,1,1,1,1,1,1,1,1,1,0,1,1,1
00034,Harriet Smith,Emma,36,37,two parlours two very good parlours indeed one of them quite as large as mrs goddard s drawing room and of her having an upper maid who had lived five and twenty years with her and of their having eight cows two of them alderneys and one a little welch cow a very pretty little welch cow indeed and of mrs martin s saying as she was so fond of it it should be called her cow and of their having a very handsome summer house in their garden where some day next year they were all to drink tea a very handsome summer house large enough to hold a dozen people,well done mrs martin you know what you are about,Emma,F,major,F,major,1,1,1,1,1,0,1,1,1,0,1,0,1,1,0,1,1,0
00035,Harriet Smith,Emma,38,39,and when she had come away mrs martin was so very kind as to send mrs goddard a beautiful goose the finest goose mrs goddard had ever seen mrs goddard had dressed it on a sunday and asked all the three teachers miss nash and miss prince and miss richardson to sup with her,mr martin i suppose is not a man of information beyond the line of his own business he does not read,Emma,F,major,F,major,1,1,1,1,1,0,1,1,1,1,1,0,1,0,1,1,1,0
00036,Emma,Harriet Smith,39,40,mr martin i suppose is not a man of information beyond the line of his own business he does not read,oh yes that is no i do not know but i believe he has read a good deal but not what you would think any thing of he reads the agricultural reports and some other books that lay in one of the window seats but he reads all them to himself but sometimes of an evening before we went to cards he would read something aloud out of the elegant extracts very entertaining and i know he has read the vicar of wakefield he never read the romance of the forest nor the children of the abbey he had never heard of such books before i mentioned them but he is determined to get them now as soon as ever he can,Harriet Smith,F,major,F,major,1,1,0,1,0,1,1,1,0,1,1,1,1,1,1,1,1,1
00037,Harriet Smith,Emma,40,41,oh yes that is no i do not know but i believe he has read a good deal but not what you would think any thing of he reads the agricultural reports and some other books that lay in one of the window seats but he reads all them to himself but sometimes of an evening before we went to cards he would read something aloud out of the elegant extracts very entertaining and i know he has read the vicar of wakefield he never read the romance of the forest nor the children of the abbey he had never heard of such books before i mentioned them but he is determined to get them now as soon as ever he can,what sort of looking man is mr martin,Emma,F,major,F,major,1,1,1,1,1,1,1,1,1,0,1,0,0,1,0,0,1,0
