pair_id,a_speaker,b_speaker,i_merge_id,j_merge_id,i_text,j_text,i_addressees,A_gender,A_category,B_gender,B_category,a_articles,a_auxiliary_verbs,a_conjunctions,a_adverbs,a_impersonal_pronouns,a_negations,a_personal_pronouns,a_prepositions,a_quantifiers,b_articles,b_auxiliary_verbs,b_conjunctions,b_adverbs,b_impersonal_pronouns,b_negations,b_personal_pronouns,b_prepositions,b_quantifiers
00867,Emma,Harriet Smith,982,983,yes i hope i do,how i could so long a time be fancying myself it seems like madness i can see nothing at all extraordinary in him now i do not care whether i meet him or not except that of the two i had rather not see him and indeed i would go any distance round to avoid him but i do not envy his wife in the least i neither admire her nor envy her as i have done she is very charming i dare say and all that but i think her very ill tempered and disagreeable i shall never forget her look the other night however i assure you miss woodhouse i wish her no evil no let them be ever so happy together it will not give me another moment s pang and to convince you that i have been speaking truth i am now going to destroy what i ought to have destroyed long ago what i ought never to have kept i know that very well however now i will destroy it all and it is my particular wish to do it in your presence that you may see how rational i am grown cannot you guess what this parcel holds,Harriet Smith,F,major,F,major,0,1,0,0,0,0,1,0,0,1,1,1,1,1,1,1,1,1
00868,Harriet Smith,Emma,983,984,how i could so long a time be fancying myself it seems like madness i can see nothing at all extraordinary in him now i do not care whether i meet him or not except that of the two i had rather not see him and indeed i would go any distance round to avoid him but i do not envy his wife in the least i neither admire her nor envy her as i have done she is very charming i dare say and all that but i think her very ill tempered and disagreeable i shall never forget her look the other night however i assure you miss woodhouse i wish her no evil no let them be ever so happy together it will not give me another moment s pang and to convince you that i have been speaking truth i am now going to destroy what i ought to have destroyed long ago what i ought never to have kept i know that very well however now i will destroy it all and it is my particular wish to do it in your presence that you may see how rational i am grown cannot you guess what this parcel holds,not the least in the world did he ever give you any thing,Emma,F,major,F,major,1,1,1,1,1,1,1,1,1,1,1,0,1,1,1,1,1,1
00869,Emma,Harriet Smith,984,985,not the least in the world did he ever give you any thing,no i cannot call them gifts but they are things that i have valued very much now you must recollect,Harriet Smith,F,major,F,major,1,1,0,1,1,1,1,1,1,0,1,1,1,1,1,1,0,1
00870,Harriet Smith,Emma,985,986,no i cannot call them gifts but they are things that i have valued very much now you must recollect,no indeed i do not,Emma,F,major,F,major,0,1,1,1,1,1,1,0,1,0,1,0,1,0,1,1,0,0
00871,Emma,Harriet Smith,986,987,no indeed i do not,dear me i should not have thought it possible you could forget what passed in this very room about court plaister one of the very last times we ever met in it it was but a very few days before i had my sore throat just before mr and mrs john knightley came i think the very evening do not you remember his cutting his finger with your new penknife and your recommending court plaister but as you had none about you and knew i had you desired me to supply him and so i took mine out and cut him a piece but it was a great deal too large and he cut it smaller and kept playing some time with what was left before he gave it back to me and so then in my nonsense i could not help making a treasure of it so i put it by never to be used and looked at it now and then as a great treat,Harriet Smith,F,major,F,major,0,1,0,1,0,1,1,0,0,1,1,1,1,1,1,1,1,1
00872,Harriet Smith,Emma,987,988,dear me i should not have thought it possible you could forget what passed in this very room about court plaister one of the very last times we ever met in it it was but a very few days before i had my sore throat just before mr and mrs john knightley came i think the very evening do not you remember his cutting his finger with your new penknife and your recommending court plaister but as you had none about you and knew i had you desired me to supply him and so i took mine out and cut him a piece but it was a great deal too large and he cut it smaller and kept playing some time with what was left before he gave it back to me and so then in my nonsense i could not help making a treasure of it so i put it by never to be used and looked at it now and then as a great treat,my dearest harriet you make me more ashamed of myself than i can bear remember it aye i remember it all now all except your saving this relic i knew nothing of that till this moment but the cutting the finger and my recommending court plaister and saying i had none about me oh my sins my sins and i had plenty all the while in my pocket one of my senseless tricks i deserve to be under a continual blush all the rest of my life well go on what else,Emma,F,major,F,major,1,1,1,1,1,1,1,1,1,1,1,1,1,1,1,1,1,1
00873,Emma,Harriet Smith,988,989,my dearest harriet you make me more ashamed of myself than i can bear remember it aye i remember it all now all except your saving this relic i knew nothing of that till this moment but the cutting the finger and my recommending court plaister and saying i had none about me oh my sins my sins and i had plenty all the while in my pocket one of my senseless tricks i deserve to be under a continual blush all the rest of my life well go on what else,and had you really some at hand yourself i am sure i never suspected it you did it so naturally,Harriet Smith,F,major,F,major,1,1,1,1,1,1,1,1,1,0,1,1,1,1,1,1,1,1
00874,Harriet Smith,Emma,989,990,and had you really some at hand yourself i am sure i never suspected it you did it so naturally,and so you actually put this piece of court plaister by for his sake,Emma,F,major,F,major,0,1,1,1,1,1,1,1,1,0,0,1,1,1,0,1,1,1
00875,Harriet Smith,Emma,992,993,here here is something still more valuable i mean that has been more valuable because this is what did really once belong to him which the court plaister never did this was really his do not you remember one morning no i dare say you do not but one morning i forget exactly the day but perhaps it was the tuesday or wednesday before that evening he wanted to make a memorandum in his pocket book it was about spruce beer mr knightley had been telling him something about brewing spruce beer and he wanted to put it down but when he took out his pencil there was so little lead that he soon cut it all away and it would not do so you lent him another and this was left upon the table as good for nothing but i kept my eye on it and as soon as i dared caught it up and never parted with it again from that moment,i do remember it i perfectly remember it talking about spruce beer oh yes mr knightley and i both saying we liked it and mr elton s seeming resolved to learn to like it too i perfectly remember it stop mr knightley was standing just here was not he i have an idea he was standing just here,Emma,F,major,F,major,1,1,1,1,1,1,1,1,1,1,1,1,1,1,1,1,1,1
00876,Emma,Harriet Smith,993,994,i do remember it i perfectly remember it talking about spruce beer oh yes mr knightley and i both saying we liked it and mr elton s seeming resolved to learn to like it too i perfectly remember it stop mr knightley was standing just here was not he i have an idea he was standing just here,ah i do not know i cannot recollect it is very odd but i cannot recollect mr elton was sitting here i remember much about where i am now,Harriet Smith,F,major,F,major,1,1,1,1,1,1,1,1,1,0,1,1,1,1,1,1,1,1
00877,Harriet Smith,Emma,994,995,ah i do not know i cannot recollect it is very odd but i cannot recollect mr elton was sitting here i remember much about where i am now,well go on,Emma,F,major,F,major,0,1,1,1,1,1,1,1,1,0,0,0,1,0,0,0,1,0
00878,Emma,Harriet Smith,995,996,well go on,oh that s all i have nothing more to shew you or to say except that i am now going to throw them both behind the fire and i wish you to see me do it,Harriet Smith,F,major,F,major,0,0,0,1,0,0,0,1,0,1,1,1,1,1,1,1,1,1
00879,Harriet Smith,Emma,996,997,oh that s all i have nothing more to shew you or to say except that i am now going to throw them both behind the fire and i wish you to see me do it,my poor dear harriet and have you actually found happiness in treasuring up these things,Emma,F,major,F,major,1,1,1,1,1,1,1,1,1,0,1,1,1,1,0,1,1,0
00880,Emma,Harriet Smith,997,998,my poor dear harriet and have you actually found happiness in treasuring up these things,yes simpleton as i was but i am quite ashamed of it now and wish i could forget as easily as i can burn them it was very wrong of me you know to keep any remembrances after he was married i knew it was but had not resolution enough to part with them,Harriet Smith,F,major,F,major,0,1,1,1,1,0,1,1,0,0,1,1,1,1,1,1,1,1
00881,Harriet Smith,Emma,998,999,yes simpleton as i was but i am quite ashamed of it now and wish i could forget as easily as i can burn them it was very wrong of me you know to keep any remembrances after he was married i knew it was but had not resolution enough to part with them,but harriet is it necessary to burn the court plaister i have not a word to say for the bit of old pencil but the court plaister might be useful,Emma,F,major,F,major,0,1,1,1,1,1,1,1,1,1,1,1,0,1,1,1,1,1
00882,Emma,Harriet Smith,999,1000,but harriet is it necessary to burn the court plaister i have not a word to say for the bit of old pencil but the court plaister might be useful,i shall be happier to burn it it has a disagreeable look to me i must get rid of every thing there it goes and there is an end thank heaven of mr elton,Harriet Smith,F,major,F,major,1,1,1,0,1,1,1,1,1,1,1,1,1,1,0,1,1,1
00883,Harriet Smith,Emma,1000,1001,i shall be happier to burn it it has a disagreeable look to me i must get rid of every thing there it goes and there is an end thank heaven of mr elton,and when will there be a beginning of mr churchill,Emma,F,major,F,major,1,1,1,1,1,0,1,1,1,1,1,1,1,0,0,0,1,0
00884,Harriet Smith,Emma,1002,1003,i shall never marry,never marry this is a new resolution,Emma,F,major,F,major,0,1,0,1,0,1,1,0,0,1,1,0,1,1,1,0,0,0
00885,Emma,Harriet Smith,1003,1004,never marry this is a new resolution,it is one that i shall never change however,Harriet Smith,F,major,F,major,1,1,0,1,1,1,0,0,0,0,1,1,1,1,1,1,0,1
00886,Harriet Smith,Emma,1004,1005,it is one that i shall never change however,i hope it does not proceed from i hope it is not in compliment to mr elton,Emma,F,major,F,major,0,1,1,1,1,1,1,0,1,0,1,0,0,1,1,1,1,0
00887,Emma,Harriet Smith,1005,1006,i hope it does not proceed from i hope it is not in compliment to mr elton,mr elton indeed oh no so superior to mr elton,Harriet Smith,F,major,F,major,0,1,0,0,1,1,1,1,0,0,0,1,1,0,1,0,1,0
00888,Harriet Smith,Emma,1006,1007,mr elton indeed oh no so superior to mr elton,harriet i will not affect to be in doubt of your meaning your resolution or rather your expectation of never marrying results from an idea that the person whom you might prefer would be too greatly your superior in situation to think of you is not it so,Emma,F,major,F,major,0,0,1,1,0,1,0,1,0,1,1,1,1,1,1,1,1,0
00889,Emma,Harriet Smith,1007,1008,harriet i will not affect to be in doubt of your meaning your resolution or rather your expectation of never marrying results from an idea that the person whom you might prefer would be too greatly your superior in situation to think of you is not it so,oh miss woodhouse believe me i have not the presumption to suppose indeed i am not so mad but it is a pleasure to me to admire him at a distance and to think of his infinite superiority to all the rest of the world with the gratitude wonder and veneration which are so proper in me especially,Harriet Smith,F,major,F,major,1,1,1,1,1,1,1,1,0,1,1,1,1,1,1,1,1,1
00890,Harriet Smith,Emma,1008,1009,oh miss woodhouse believe me i have not the presumption to suppose indeed i am not so mad but it is a pleasure to me to admire him at a distance and to think of his infinite superiority to all the rest of the world with the gratitude wonder and veneration which are so proper in me especially,i am not at all surprized at you harriet the service he rendered you was enough to warm your heart,Emma,F,major,F,major,1,1,1,1,1,1,1,1,1,1,1,0,0,0,1,1,1,1
00891,Emma,Harriet Smith,1009,1010,i am not at all surprized at you harriet the service he rendered you was enough to warm your heart,service oh it was such an inexpressible obligation the very recollection of it and all that i felt at the time when i saw him coming his noble look and my wretchedness before such a change in one moment such a change from perfect misery to perfect happiness,Harriet Smith,F,major,F,major,1,1,0,0,0,1,1,1,1,1,1,1,1,1,0,1,1,1
00892,Harriet Smith,Emma,1010,1011,service oh it was such an inexpressible obligation the very recollection of it and all that i felt at the time when i saw him coming his noble look and my wretchedness before such a change in one moment such a change from perfect misery to perfect happiness,it is very natural it is natural and it is honourable yes honourable i think to chuse so well and so gratefully but that it will be a fortunate preference is more than i can promise i do not advise you to give way to it harriet i do not by any means engage for its being returned consider what you are about perhaps it will be wisest in you to check your feelings while you can at any rate do not let them carry you far unless you are persuaded of his liking you be observant of him let his behaviour be the guide of your sensations i give you this caution now because i shall never speak to you again on the subject i am determined against all interference henceforward i know nothing of the matter let no name ever pass our lips we were very wrong before we will be cautious now he is your superior no doubt and there do seem objections and obstacles of a very serious nature but yet harriet more wonderful things have taken place there have been matches of greater disparity but take care of yourself i would not have you too sanguine though however it may end be assured your raising your thoughts to him is a mark of good taste which i shall always know how to value,Emma,F,major,F,major,1,1,1,1,1,0,1,1,1,1,1,1,1,1,1,1,1,1
00893,Mr. Frank Churchill,Mrs. Weston,1012,1013,by the bye what became of mr perry s plan of setting up his carriage,i did not know that he ever had any such plan,Emma; Harriet Smith; Jane Fairfax; Miss Bates; Mr. Knightley; Mr. Weston; Mrs. Weston,M,major,F,intermediate,1,0,0,0,1,0,1,1,0,0,1,0,1,1,1,1,0,0
00894,Mrs. Weston,Mr. Frank Churchill,1013,1014,i did not know that he ever had any such plan,nay i had it from you you wrote me word of it three months ago,Emma; Harriet Smith; Jane Fairfax; Miss Bates; Mr. Frank Churchill; Mr. Knightley; Mr. Weston,F,intermediate,M,major,0,1,0,1,1,1,1,0,0,0,1,0,1,1,0,1,1,1
00895,Mr. Frank Churchill,Mrs. Weston,1014,1015,nay i had it from you you wrote me word of it three months ago,me impossible,Emma; Harriet Smith; Jane Fairfax; Miss Bates; Mr. Knightley; Mr. Weston; Mrs. Weston,M,major,F,intermediate,0,1,0,1,1,0,1,1,1,0,0,0,0,0,0,1,0,0
00896,Mrs. Weston,Mr. Frank Churchill,1015,1016,me impossible,indeed you did i remember it perfectly you mentioned it as what was certainly to be very soon mrs perry had told somebody and was extremely happy about it it was owing to her persuasion as she thought his being out in bad weather did him a great deal of harm you must remember it now,Emma; Harriet Smith; Jane Fairfax; Miss Bates; Mr. Frank Churchill; Mr. Knightley; Mr. Weston,F,intermediate,M,major,0,0,0,0,0,0,1,0,0,1,1,1,1,1,0,1,1,0
00897,Mr. Frank Churchill,Mrs. Weston,1016,1017,indeed you did i remember it perfectly you mentioned it as what was certainly to be very soon mrs perry had told somebody and was extremely happy about it it was owing to her persuasion as she thought his being out in bad weather did him a great deal of harm you must remember it now,upon my word i never heard of it till this moment,Emma; Harriet Smith; Jane Fairfax; Miss Bates; Mr. Knightley; Mr. Weston; Mrs. Weston,M,major,F,intermediate,1,1,1,1,1,0,1,1,0,0,0,1,1,1,1,1,1,0
00898,Mrs. Weston,Mr. Frank Churchill,1017,1018,upon my word i never heard of it till this moment,never really never bless me how could it be then i must have dreamt it but i was completely persuaded miss smith you walk as if you were tired you will not be sorry to find yourself at home,Emma; Harriet Smith; Jane Fairfax; Miss Bates; Mr. Frank Churchill; Mr. Knightley; Mr. Weston,F,intermediate,M,major,0,0,1,1,1,1,1,1,0,0,1,1,1,1,1,1,1,0
00899,Mr. Frank Churchill,Mr. Weston,1018,1019,never really never bless me how could it be then i must have dreamt it but i was completely persuaded miss smith you walk as if you were tired you will not be sorry to find yourself at home,what is this what is this about perry and a carriage is perry going to set up his carriage frank i am glad he can afford it you had it from himself had you,Emma; Harriet Smith; Jane Fairfax; Miss Bates; Mr. Knightley; Mr. Weston; Mrs. Weston,M,major,M,intermediate,0,1,1,1,1,1,1,1,0,1,1,1,1,1,0,1,1,0
00900,Mr. Weston,Mr. Frank Churchill,1019,1020,what is this what is this about perry and a carriage is perry going to set up his carriage frank i am glad he can afford it you had it from himself had you,no sir i seem to have had it from nobody very odd i really was persuaded of mrs weston s having mentioned it in one of her letters to enscombe many weeks ago with all these particulars but as she declares she never heard a syllable of it before of course it must have been a dream i am a great dreamer i dream of every body at highbury when i am away and when i have gone through my particular friends then i begin dreaming of mr and mrs perry,Emma; Harriet Smith; Jane Fairfax; Miss Bates; Mr. Frank Churchill; Mr. Knightley; Mrs. Weston,M,intermediate,M,major,1,1,1,1,1,0,1,1,0,1,1,1,1,1,1,1,1,1
00901,Mr. Frank Churchill,Mr. Weston,1020,1021,no sir i seem to have had it from nobody very odd i really was persuaded of mrs weston s having mentioned it in one of her letters to enscombe many weeks ago with all these particulars but as she declares she never heard a syllable of it before of course it must have been a dream i am a great dreamer i dream of every body at highbury when i am away and when i have gone through my particular friends then i begin dreaming of mr and mrs perry,it is odd though that you should have had such a regular connected dream about people whom it was not very likely you should be thinking of at enscombe perry s setting up his carriage and his wife s persuading him to it out of care for his health just what will happen i have no doubt some time or other only a little premature what an air of probability sometimes runs through a dream and at others what a heap of absurdities it is well frank your dream certainly shews that highbury is in your thoughts when you are absent emma you are a great dreamer i think,Emma; Harriet Smith; Jane Fairfax; Miss Bates; Mr. Knightley; Mr. Weston; Mrs. Weston,M,major,M,intermediate,1,1,1,1,1,1,1,1,1,1,1,1,1,1,1,1,1,1
00902,Mr. Weston,Miss Bates,1021,1022,it is odd though that you should have had such a regular connected dream about people whom it was not very likely you should be thinking of at enscombe perry s setting up his carriage and his wife s persuading him to it out of care for his health just what will happen i have no doubt some time or other only a little premature what an air of probability sometimes runs through a dream and at others what a heap of absurdities it is well frank your dream certainly shews that highbury is in your thoughts when you are absent emma you are a great dreamer i think,why to own the truth if i must speak on this subject there is no denying that mr frank churchill might have i do not mean to say that he did not dream it i am sure i have sometimes the oddest dreams in the world but if i am questioned about it i must acknowledge that there was such an idea last spring for mrs perry herself mentioned it to my mother and the coles knew of it as well as ourselves but it was quite a secret known to nobody else and only thought of about three days mrs perry was very anxious that he should have a carriage and came to my mother in great spirits one morning because she thought she had prevailed jane don t you remember grandmama s telling us of it when we got home i forget where we had been walking to very likely to randalls yes i think it was to randalls mrs perry was always particularly fond of my mother indeed i do not know who is not and she had mentioned it to her in confidence she had no objection to her telling us of course but it was not to go beyond and from that day to this i never mentioned it to a soul that i know of at the same time i will not positively answer for my having never dropt a hint because i know i do sometimes pop out a thing before i am aware i am a talker you know i am rather a talker and now and then i have let a thing escape me which i should not i am not like jane i wish i were i will answer for it she never betrayed the least thing in the world where is she oh just behind perfectly remember mrs perry s coming extraordinary dream indeed,Emma; Harriet Smith; Jane Fairfax; Miss Bates; Mr. Frank Churchill; Mr. Knightley; Mrs. Weston,M,intermediate,F,intermediate,1,1,1,1,1,1,1,1,1,1,1,1,1,1,1,1,1,1
00903,Miss Bates,Mr. Frank Churchill,1022,1023,why to own the truth if i must speak on this subject there is no denying that mr frank churchill might have i do not mean to say that he did not dream it i am sure i have sometimes the oddest dreams in the world but if i am questioned about it i must acknowledge that there was such an idea last spring for mrs perry herself mentioned it to my mother and the coles knew of it as well as ourselves but it was quite a secret known to nobody else and only thought of about three days mrs perry was very anxious that he should have a carriage and came to my mother in great spirits one morning because she thought she had prevailed jane don t you remember grandmama s telling us of it when we got home i forget where we had been walking to very likely to randalls yes i think it was to randalls mrs perry was always particularly fond of my mother indeed i do not know who is not and she had mentioned it to her in confidence she had no objection to her telling us of course but it was not to go beyond and from that day to this i never mentioned it to a soul that i know of at the same time i will not positively answer for my having never dropt a hint because i know i do sometimes pop out a thing before i am aware i am a talker you know i am rather a talker and now and then i have let a thing escape me which i should not i am not like jane i wish i were i will answer for it she never betrayed the least thing in the world where is she oh just behind perfectly remember mrs perry s coming extraordinary dream indeed,miss woodhouse have your nephews taken away their alphabets their box of letters it used to stand here where is it this is a sort of dull looking evening that ought to be treated rather as winter than summer we had great amusement with those letters one morning i want to puzzle you again,Harriet Smith; Jane Fairfax; Mr. Frank Churchill; Mr. Knightley; Mr. Weston; Mrs. Weston,F,intermediate,M,major,1,1,1,1,1,1,1,1,1,1,1,1,1,1,0,1,1,1
00904,Mr. Frank Churchill,Emma,1023,1024,miss woodhouse have your nephews taken away their alphabets their box of letters it used to stand here where is it this is a sort of dull looking evening that ought to be treated rather as winter than summer we had great amusement with those letters one morning i want to puzzle you again,nonsense for shame,Emma; Harriet Smith; Jane Fairfax; Miss Bates; Mr. Knightley; Mr. Weston; Mr. Woodhouse; Mrs. Weston,M,major,F,major,1,1,1,1,1,0,1,1,1,0,0,0,0,0,0,0,1,0
00905,Emma,Mr. Frank Churchill,1024,1025,nonsense for shame,i will give it to her shall i,Mr. Frank Churchill,F,major,M,major,0,0,0,0,0,0,0,1,0,0,1,0,0,1,0,1,1,0
00906,Mr. Frank Churchill,Emma,1025,1026,i will give it to her shall i,no no you must not you shall not indeed,Emma,M,major,F,major,0,1,0,0,1,0,1,1,0,0,1,0,1,0,1,1,0,0
00907,Jane Fairfax,Miss Bates,1027,1028,i did not know that proper names were allowed,aye very true my dear i was just going to say the same thing it is time for us to be going indeed the evening is closing in and grandmama will be looking for us my dear sir you are too obliging we really must wish you good night,Emma; Harriet Smith; Miss Bates; Mr. Frank Churchill; Mr. Knightley; Mr. Weston; Mr. Woodhouse; Mrs. Weston,F,intermediate,F,intermediate,0,1,0,0,1,1,1,0,0,1,1,1,1,1,0,1,1,0
00908,Miss Bates,Mr. Knightley,1028,1029,aye very true my dear i was just going to say the same thing it is time for us to be going indeed the evening is closing in and grandmama will be looking for us my dear sir you are too obliging we really must wish you good night,pray emma may i ask in what lay the great amusement the poignant sting of the last word given to you and miss fairfax i saw the word and am curious to know how it could be so very entertaining to the one and so very distressing to the other,Emma; Harriet Smith; Jane Fairfax; Mr. Frank Churchill; Mr. Knightley; Mr. Weston; Mr. Woodhouse; Mrs. Weston,F,intermediate,M,major,1,1,1,1,1,0,1,1,0,1,1,1,1,1,0,1,1,0
