uid,pair_id,side,text
p00000_A,00000,A,poor miss taylor i wish she were here again what a pity it is that mr weston ever thought of her
p00001_A,00001,A,i cannot agree with you papa you know i cannot mr weston is such a good humoured pleasant excellent man that he thoroughly deserves a good wife and you would not have had miss taylor live with us for ever and bear all my odd humours when she might have a house of her own
p00002_A,00002,A,a house of her own but where is the advantage of a house of her own this is three times as large and you have never any odd humours my dear
p00003_A,00003,A,how often we shall be going to see them and they coming to see us we shall be always meeting we must begin we must go and pay wedding visit very soon
p00004_A,00004,A,my dear how am i to get so far randalls is such a distance i could not walk half so far
p00005_A,00005,A,no papa nobody thought of your walking we must go in the carriage to be sure
p00006_A,00006,A,the carriage but james will not like to put the horses to for such a little way and where are the poor horses to be while we are paying our visit
p00007_A,00007,A,they are to be put into mr weston s stable papa you know we have settled all that already we talked it all over with mr weston last night and as for james you may be very sure he will always like going to randalls because of his daughter s being housemaid there i only doubt whether he will ever take us anywhere else that was your doing papa you got hannah that good place nobody thought of hannah till you mentioned her james is so obliged to you
p00008_A,00008,A,it is very kind of you mr knightley to come out at this late hour to call upon us i am afraid you must have had a shocking walk
p00009_A,00009,A,not at all sir it is a beautiful moonlight night and so mild that i must draw back from your great fire
p00010_A,00010,A,but you must have found it very damp and dirty i wish you may not catch cold
p00011_A,00011,A,dirty sir look at my shoes not a speck on them
p00012_A,00012,A,well that is quite surprising for we have had a vast deal of rain here it rained dreadfully hard for half an hour while we were at breakfast i wanted them to put off the wedding
p00013_A,00013,A,by the bye i have not wished you joy being pretty well aware of what sort of joy you must both be feeling i have been in no hurry with my congratulations but i hope it all went off tolerably well how did you all behave who cried most
p00014_A,00014,A,ah poor miss taylor tis a sad business
p00015_A,00015,A,poor mr and miss woodhouse if you please but i cannot possibly say i have a great regard for you and emma but when it comes to the question of dependence or independence at any rate it must be better to have only one to please than two
p00016_A,00016,A,especially when one of those two is such a fanciful troublesome creature that is what you have in your head i know and what you would certainly say if my father were not by
p00017_A,00017,A,i believe it is very true my dear indeed i am afraid i am sometimes very fanciful and troublesome
p00018_A,00018,A,my dearest papa you do not think i could mean you or suppose mr knightley to mean you what a horrible idea oh no i meant only myself mr knightley loves to find fault with me you know in a joke it is all a joke we always say what we like to one another
p00019_A,00019,A,emma knows i never flatter her but i meant no reflection on any body miss taylor has been used to have two persons to please she will now have but one the chances are that she must be a gainer
p00020_A,00020,A,well you want to hear about the wedding and i shall be happy to tell you for we all behaved charmingly every body was punctual every body in their best looks not a tear and hardly a long face to be seen oh no we all felt that we were going to be only half a mile apart and were sure of meeting every day
p00021_A,00021,A,dear emma bears every thing so well but mr knightley she is really very sorry to lose poor miss taylor and i am sure she will miss her more than she thinks for
p00022_A,00022,A,it is impossible that emma should not miss such a companion we should not like her so well as we do sir if we could suppose it but she knows how much the marriage is to miss taylor s advantage she knows how very acceptable it must be at miss taylor s time of life to be settled in a home of her own and how important to her to be secure of a comfortable provision and therefore cannot allow herself to feel so much pain as pleasure every friend of miss taylor must be glad to have her so happily married
p00023_A,00023,A,and you have forgotten one matter of joy to me and a very considerable one that i made the match myself i made the match you know four years ago and to have it take place and be proved in the right when so many people said mr weston would never marry again may comfort me for any thing
p00024_A,00024,A,ah my dear i wish you would not make matches and foretell things for whatever you say always comes to pass pray do not make any more matches
p00025_A,00025,A,i promise you to make none for myself papa but i must indeed for other people it is the greatest amusement in the world and after such success you know every body said that mr weston would never marry again oh dear no mr weston who had been a widower so long and who seemed so perfectly comfortable without a wife so constantly occupied either in his business in town or among his friends here always acceptable wherever he went always cheerful mr weston need not spend a single evening in the year alone if he did not like it oh no mr weston certainly would never marry again some people even talked of a promise to his wife on her deathbed and others of the son and the uncle not letting him all manner of solemn nonsense was talked on the subject but i believed none of it ever since the day about four years ago that miss taylor and i met with him in broadway lane when because it began to drizzle he darted away with so much gallantry and borrowed two umbrellas for us from farmer mitchell s i made up my mind on the subject i planned the match from that hour and when such success has blessed me in this instance dear papa you cannot think that i shall leave off match making
p00026_A,00026,A,i do not understand what you mean by success success supposes endeavour your time has been properly and delicately spent if you have been endeavouring for the last four years to bring about this marriage a worthy employment for a young lady s mind but if which i rather imagine your making the match as you call it means only your planning it your saying to yourself one idle day i think it would be a very good thing for miss taylor if mr weston were to marry her and saying it again to yourself every now and then afterwards why do you talk of success where is your merit what are you proud of you made a lucky guess and that is all that can be said
p00027_A,00027,A,and have you never known the pleasure and triumph of a lucky guess i pity you i thought you cleverer for depend upon it a lucky guess is never merely luck there is always some talent in it and as to my poor word success which you quarrel with i do not know that i am so entirely without any claim to it you have drawn two pretty pictures but i think there may be a third a something between the do nothing and the do all if i had not promoted mr weston s visits here and given many little encouragements and smoothed many little matters it might not have come to any thing after all i think you must know hartfield enough to comprehend that
p00028_A,00028,A,a straightforward open hearted man like weston and a rational unaffected woman like miss taylor may be safely left to manage their own concerns you are more likely to have done harm to yourself than good to them by interference
p00029_A,00029,A,emma never thinks of herself if she can do good to others but my dear pray do not make any more matches they are silly things and break up one s family circle grievously
p00030_A,00030,A,only one more papa only for mr elton poor mr elton you like mr elton papa i must look about for a wife for him there is nobody in highbury who deserves him and he has been here a whole year and has fitted up his house so comfortably that it would be a shame to have him single any longer and i thought when he was joining their hands to day he looked so very much as if he would like to have the same kind office done for him i think very well of mr elton and this is the only way i have of doing him a service
p00031_A,00031,A,mr elton is a very pretty young man to be sure and a very good young man and i have a great regard for him but if you want to shew him any attention my dear ask him to come and dine with us some day that will be a much better thing i dare say mr knightley will be so kind as to meet him
p00032_A,00032,A,with a great deal of pleasure sir at any time and i agree with you entirely that it will be a much better thing invite him to dinner emma and help him to the best of the fish and the chicken but leave him to chuse his own wife depend upon it a man of six or seven and twenty can take care of himself
p00033_A,00033,A,mrs bates let me propose your venturing on one of these eggs an egg boiled very soft is not unwholesome serle understands boiling an egg better than any body i would not recommend an egg boiled by any body else but you need not be afraid they are very small you see one of our small eggs will not hurt you miss bates let emma help you to a little bit of tart a very little bit ours are all apple tarts you need not be afraid of unwholesome preserves here i do not advise the custard mrs goddard what say you to half a glass of wine a small half glass put into a tumbler of water i do not think it could disagree with you
p00034_A,00034,A,two parlours two very good parlours indeed one of them quite as large as mrs goddard s drawing room and of her having an upper maid who had lived five and twenty years with her and of their having eight cows two of them alderneys and one a little welch cow a very pretty little welch cow indeed and of mrs martin s saying as she was so fond of it it should be called her cow and of their having a very handsome summer house in their garden where some day next year they were all to drink tea a very handsome summer house large enough to hold a dozen people
p00035_A,00035,A,and when she had come away mrs martin was so very kind as to send mrs goddard a beautiful goose the finest goose mrs goddard had ever seen mrs goddard had dressed it on a sunday and asked all the three teachers miss nash and miss prince and miss richardson to sup with her
p00036_A,00036,A,mr martin i suppose is not a man of information beyond the line of his own business he does not read
p00037_A,00037,A,oh yes that is no i do not know but i believe he has read a good deal but not what you would think any thing of he reads the agricultural reports and some other books that lay in one of the window seats but he reads all them to himself but sometimes of an evening before we went to cards he would read something aloud out of the elegant extracts very entertaining and i know he has read the vicar of wakefield he never read the romance of the forest nor the children of the abbey he had never heard of such books before i mentioned them but he is determined to get them now as soon as ever he can
p00038_A,00038,A,what sort of looking man is mr martin
p00039_A,00039,A,oh not handsome not at all handsome i thought him very plain at first but i do not think him so plain now one does not you know after a time but did you never see him he is in highbury every now and then and he is sure to ride through every week in his way to kingston he has passed you very often
p00040_A,00040,A,that may be and i may have seen him fifty times but without having any idea of his name a young farmer whether on horseback or on foot is the very last sort of person to raise my curiosity the yeomanry are precisely the order of people with whom i feel i can have nothing to do a degree or two lower and a creditable appearance might interest me i might hope to be useful to their families in some way or other but a farmer can need none of my help and is therefore in one sense as much above my notice as in every other he is below it
p00041_A,00041,A,to be sure oh yes it is not likely you should ever have observed him but he knows you very well indeed i mean by sight
p00042_A,00042,A,i have no doubt of his being a very respectable young man i know indeed that he is so and as such wish him well what do you imagine his age to be
p00043_A,00043,A,he was four and twenty the 8th of last june and my birthday is the 23rd just a fortnight and a day s difference which is very odd
p00044_A,00044,A,only four and twenty that is too young to settle his mother is perfectly right not to be in a hurry they seem very comfortable as they are and if she were to take any pains to marry him she would probably repent it six years hence if he could meet with a good sort of young woman in the same rank as his own with a little money it might be very desirable
p00045_A,00045,A,six years hence dear miss woodhouse he would be thirty years old
p00046_A,00046,A,well and that is as early as most men can afford to marry who are not born to an independence mr martin i imagine has his fortune entirely to make cannot be at all beforehand with the world whatever money he might come into when his father died whatever his share of the family property it is i dare say all afloat all employed in his stock and so forth and though with diligence and good luck he may be rich in time it is next to impossible that he should have realised any thing yet
p00047_A,00047,A,to be sure so it is but they live very comfortably they have no indoors man else they do not want for any thing and mrs martin talks of taking a boy another year
p00048_A,00048,A,i wish you may not get into a scrape harriet whenever he does marry i mean as to being acquainted with his wife for though his sisters from a superior education are not to be altogether objected to it does not follow that he might marry any body at all fit for you to notice the misfortune of your birth ought to make you particularly careful as to your associates there can be no doubt of your being a gentleman s daughter and you must support your claim to that station by every thing within your own power or there will be plenty of people who would take pleasure in degrading you
p00049_A,00049,A,yes to be sure i suppose there are but while i visit at hartfield and you are so kind to me miss woodhouse i am not afraid of what any body can do
p00050_A,00050,A,you understand the force of influence pretty well harriet but i would have you so firmly established in good society as to be independent even of hartfield and miss woodhouse i want to see you permanently well connected and to that end it will be advisable to have as few odd acquaintance as may be and therefore i say that if you should still be in this country when mr martin marries i wish you may not be drawn in by your intimacy with the sisters to be acquainted with the wife who will probably be some mere farmer s daughter without education
p00051_A,00051,A,to be sure yes not that i think mr martin would ever marry any body but what had had some education and been very well brought up however i do not mean to set up my opinion against yours and i am sure i shall not wish for the acquaintance of his wife i shall always have a great regard for the miss martins especially elizabeth and should be very sorry to give them up for they are quite as well educated as me but if he marries a very ignorant vulgar woman certainly i had better not visit her if i can help it only think of our happening to meet him how very odd it was quite a chance he said that he had not gone round by randalls he did not think we ever walked this road he thought we walked towards randalls most days he has not been able to get the romance of the forest yet he was so busy the last time he was at kingston that he quite forgot it but he goes again to morrow so very odd we should happen to meet well miss woodhouse is he like what you expected what do you think of him do you think him so very plain
p00052_A,00052,A,he is very plain undoubtedly remarkably plain but that is nothing compared with his entire want of gentility i had no right to expect much and i did not expect much but i had no idea that he could be so very clownish so totally without air i had imagined him i confess a degree or two nearer gentility
p00053_A,00053,A,to be sure he is not so genteel as real gentlemen
p00054_A,00054,A,i think harriet since your acquaintance with us you have been repeatedly in the company of some such very real gentlemen that you must yourself be struck with the difference in mr martin at hartfield you have had very good specimens of well educated well bred men i should be surprized if after seeing them you could be in company with mr martin again without perceiving him to be a very inferior creature and rather wondering at yourself for having ever thought him at all agreeable before do not you begin to feel that now were not you struck i am sure you must have been struck by his awkward look and abrupt manner and the uncouthness of a voice which i heard to be wholly unmodulated as i stood here
p00055_A,00055,A,certainly he is not like mr knightley he has not such a fine air and way of walking as mr knightley i see the difference plain enough but mr knightley is so very fine a man
p00056_A,00056,A,mr knightley s air is so remarkably good that it is not fair to compare mr martin with him you might not see one in a hundred with gentleman so plainly written as in mr knightley but he is not the only gentleman you have been lately used to what say you to mr weston and mr elton compare mr martin with either of them compare their manner of carrying themselves of walking of speaking of being silent you must see the difference
p00057_A,00057,A,oh yes there is a great difference but mr weston is almost an old man mr weston must be between forty and fifty
p00058_A,00058,A,which makes his good manners the more valuable the older a person grows harriet the more important it is that their manners should not be bad the more glaring and disgusting any loudness or coarseness or awkwardness becomes what is passable in youth is detestable in later age mr martin is now awkward and abrupt what will he be at mr weston s time of life
p00059_A,00059,A,there is no saying indeed
p00060_A,00060,A,but there may be pretty good guessing he will be a completely gross vulgar farmer totally inattentive to appearances and thinking of nothing but profit and loss
p00061_A,00061,A,will he indeed that will be very bad
p00062_A,00062,A,how much his business engrosses him already is very plain from the circumstance of his forgetting to inquire for the book you recommended he was a great deal too full of the market to think of any thing else which is just as it should be for a thriving man what has he to do with books and i have no doubt that he will thrive and be a very rich man in time and his being illiterate and coarse need not disturb us
p00063_A,00063,A,i wonder he did not remember the book
p00064_A,00064,A,i do not know what your opinion may be mrs weston of this great intimacy between emma and harriet smith but i think it a bad thing
p00065_A,00065,A,a bad thing do you really think it a bad thing why so
p00066_A,00066,A,i think they will neither of them do the other any good
p00067_A,00067,A,you surprize me emma must do harriet good and by supplying her with a new object of interest harriet may be said to do emma good i have been seeing their intimacy with the greatest pleasure how very differently we feel not think they will do each other any good this will certainly be the beginning of one of our quarrels about emma mr knightley
p00068_A,00068,A,perhaps you think i am come on purpose to quarrel with you knowing weston to be out and that you must still fight your own battle
p00069_A,00069,A,mr weston would undoubtedly support me if he were here for he thinks exactly as i do on the subject we were speaking of it only yesterday and agreeing how fortunate it was for emma that there should be such a girl in highbury for her to associate with mr knightley i shall not allow you to be a fair judge in this case you are so much used to live alone that you do not know the value of a companion and perhaps no man can be a good judge of the comfort a woman feels in the society of one of her own sex after being used to it all her life i can imagine your objection to harriet smith she is not the superior young woman which emma s friend ought to be but on the other hand as emma wants to see her better informed it will be an inducement to her to read more herself they will read together she means it i know
p00070_A,00070,A,emma has been meaning to read more ever since she was twelve years old i have seen a great many lists of her drawing up at various times of books that she meant to read regularly through and very good lists they were very well chosen and very neatly arranged sometimes alphabetically and sometimes by some other rule the list she drew up when only fourteen i remember thinking it did her judgment so much credit that i preserved it some time and i dare say she may have made out a very good list now but i have done with expecting any course of steady reading from emma she will never submit to any thing requiring industry and patience and a subjection of the fancy to the understanding where miss taylor failed to stimulate i may safely affirm that harriet smith will do nothing you never could persuade her to read half so much as you wished you know you could not
p00071_A,00071,A,i dare say that i thought so then but since we have parted i can never remember emma s omitting to do any thing i wished
p00072_A,00072,A,there is hardly any desiring to refresh such a memory as that but i who have had no such charm thrown over my senses must still see hear and remember emma is spoiled by being the cleverest of her family at ten years old she had the misfortune of being able to answer questions which puzzled her sister at seventeen she was always quick and assured isabella slow and diffident and ever since she was twelve emma has been mistress of the house and of you all in her mother she lost the only person able to cope with her she inherits her mother s talents and must have been under subjection to her
p00073_A,00073,A,i should have been sorry mr knightley to be dependent on your recommendation had i quitted mr woodhouse s family and wanted another situation i do not think you would have spoken a good word for me to any body i am sure you always thought me unfit for the office i held
p00074_A,00074,A,yes you are better placed here very fit for a wife but not at all for a governess but you were preparing yourself to be an excellent wife all the time you were at hartfield you might not give emma such a complete education as your powers would seem to promise but you were receiving a very good education from her on the very material matrimonial point of submitting your own will and doing as you were bid and if weston had asked me to recommend him a wife i should certainly have named miss taylor
p00075_A,00075,A,thank you there will be very little merit in making a good wife to such a man as mr weston
p00076_A,00076,A,why to own the truth i am afraid you are rather thrown away and that with every disposition to bear there will be nothing to be borne we will not despair however weston may grow cross from the wantonness of comfort or his son may plague him
p00077_A,00077,A,i hope not that it is not likely no mr knightley do not foretell vexation from that quarter
p00078_A,00078,A,not i indeed i only name possibilities i do not pretend to emma s genius for foretelling and guessing i hope with all my heart the young man may be a weston in merit and a churchill in fortune but harriet smith i have not half done about harriet smith i think her the very worst sort of companion that emma could possibly have she knows nothing herself and looks upon emma as knowing every thing she is a flatterer in all her ways and so much the worse because undesigned her ignorance is hourly flattery how can emma imagine she has any thing to learn herself while harriet is presenting such a delightful inferiority and as for harriet i will venture to say that she cannot gain by the acquaintance hartfield will only put her out of conceit with all the other places she belongs to she will grow just refined enough to be uncomfortable with those among whom birth and circumstances have placed her home i am much mistaken if emma s doctrines give any strength of mind or tend at all to make a girl adapt herself rationally to the varieties of her situation in life they only give a little polish
p00079_A,00079,A,i either depend more upon emma s good sense than you do or am more anxious for her present comfort for i cannot lament the acquaintance how well she looked last night
p00080_A,00080,A,oh you would rather talk of her person than her mind would you very well i shall not attempt to deny emma s being pretty
p00081_A,00081,A,pretty say beautiful rather can you imagine any thing nearer perfect beauty than emma altogether face and figure
p00082_A,00082,A,i do not know what i could imagine but i confess that i have seldom seen a face or figure more pleasing to me than hers but i am a partial old friend
