uid,pair_id,side,text
p00000_A,00000,A,they are to be put into mr weston s stable papa you know we have settled all that already we talked it all over with mr weston last night and as for james you may be very sure he will always like going to randalls because of his daughter s being housemaid there i only doubt whether he will ever take us anywhere else that was your doing papa you got hannah that good place nobody thought of hannah till you mentioned her james is so obliged to you
p00001_A,00001,A,ah poor miss taylor tis a sad business
p00002_A,00002,A,poor mr and miss woodhouse if you please but i cannot possibly say i have a great regard for you and emma but when it comes to the question of dependence or independence at any rate it must be better to have only one to please than two
p00003_A,00003,A,i believe it is very true my dear indeed i am afraid i am sometimes very fanciful and troublesome
p00004_A,00004,A,emma knows i never flatter her but i meant no reflection on any body miss taylor has been used to have two persons to please she will now have but one the chances are that she must be a gainer
p00005_A,00005,A,well you want to hear about the wedding and i shall be happy to tell you for we all behaved charmingly every body was punctual every body in their best looks not a tear and hardly a long face to be seen oh no we all felt that we were going to be only half a mile apart and were sure of meeting every day
p00006_A,00006,A,dear emma bears every thing so well but mr knightley she is really very sorry to lose poor miss taylor and i am sure she will miss her more than she thinks for
p00007_A,00007,A,it is impossible that emma should not miss such a companion we should not like her so well as we do sir if we could suppose it but she knows how much the marriage is to miss taylor s advantage she knows how very acceptable it must be at miss taylor s time of life to be settled in a home of her own and how important to her to be secure of a comfortable provision and therefore cannot allow herself to feel so much pain as pleasure every friend of miss taylor must be glad to have her so happily married
p00008_A,00008,A,ah my dear i wish you would not make matches and foretell things for whatever you say always comes to pass pray do not make any more matches
p00009_A,00009,A,and have you never known the pleasure and triumph of a lucky guess i pity you i thought you cleverer for depend upon it a lucky guess is never merely luck there is always some talent in it and as to my poor word success which you quarrel with i do not know that i am so entirely without any claim to it you have drawn two pretty pictures but i think there may be a third a something between the do nothing and the do all if i had not promoted mr weston s visits here and given many little encouragements and smoothed many little matters it might not have come to any thing after all i think you must know hartfield enough to comprehend that
p00010_A,00010,A,a straightforward open hearted man like weston and a rational unaffected woman like miss taylor may be safely left to manage their own concerns you are more likely to have done harm to yourself than good to them by interference
p00011_A,00011,A,only one more papa only for mr elton poor mr elton you like mr elton papa i must look about for a wife for him there is nobody in highbury who deserves him and he has been here a whole year and has fitted up his house so comfortably that it would be a shame to have him single any longer and i thought when he was joining their hands to day he looked so very much as if he would like to have the same kind office done for him i think very well of mr elton and this is the only way i have of doing him a service
p00012_A,00012,A,with a great deal of pleasure sir at any time and i agree with you entirely that it will be a much better thing invite him to dinner emma and help him to the best of the fish and the chicken but leave him to chuse his own wife depend upon it a man of six or seven and twenty can take care of himself
p00013_A,00013,A,mrs bates let me propose your venturing on one of these eggs an egg boiled very soft is not unwholesome serle understands boiling an egg better than any body i would not recommend an egg boiled by any body else but you need not be afraid they are very small you see one of our small eggs will not hurt you miss bates let emma help you to a little bit of tart a very little bit ours are all apple tarts you need not be afraid of unwholesome preserves here i do not advise the custard mrs goddard what say you to half a glass of wine a small half glass put into a tumbler of water i do not think it could disagree with you
p00014_A,00014,A,oh dear no never
p00015_A,00015,A,by all means we shall be most happy to consider you as one of the party
p00016_A,00016,A,miss woodhouse has given her friend the only beauty she wanted the expression of the eye is most correct but miss smith has not those eyebrows and eyelashes it is the fault of her face that she has them not
p00017_A,00017,A,you have made her too tall emma
p00018_A,00018,A,oh no certainly not too tall not in the least too tall consider she is sitting down which naturally presents a different which in short gives exactly the idea and the proportions must be preserved you know proportions fore shortening oh no it gives one exactly the idea of such a height as miss smith s exactly so indeed
p00019_A,00019,A,but my dear papa it is supposed to be summer a warm day in summer look at the tree
p00020_A,00020,A,but it is never safe to sit out of doors my dear
p00021_A,00021,A,you sir may say any thing but i must confess that i regard it as a most happy thought the placing of miss smith out of doors and the tree is touched with such inimitable spirit any other situation would have been much less in character the naivete of miss smith s manners and altogether oh it is most admirable i cannot keep my eyes from it i never saw such a likeness
p00022_A,00022,A,i would ask for the pleasure of your company mr knightley but i am a very slow walker and my pace would be tedious to you and besides you have another long walk before you to donwell abbey
p00023_A,00023,A,thank you sir thank you i am going this moment myself and i think the sooner you go the better i will fetch your greatcoat and open the garden door for you
p00024_A,00024,A,i do not offer it for miss smith s collection being my friend s i have no right to expose it in any degree to the public eye but perhaps you may not dislike looking at it
p00025_A,00025,A,take it it is for you take your own
p00026_A,00026,A,oh no i hope i shall not be ridiculous about it do as you please
p00027_A,00027,A,ah papa that is what you never have been able to accomplish and i do not think you ever will isabella cannot bear to stay behind her husband harriet must give us as much of her company as she can while my brother and sister are here i am sure she will be pleased with the children we are very proud of the children are not we papa i wonder which she will think the handsomest henry or john
p00028_A,00028,A,i dare say they are sir i am sure i do not know who is not
p00029_A,00029,A,well i cannot understand it
p00030_A,00030,A,i have no hesitation in saying i have no hesitation in saying at least if my friend feels at all as i do i have not the smallest doubt that could he see his little effusion honoured as i see it he would consider it as the proudest moment of his life
p00031_A,00031,A,oh dear yes
p00032_A,00032,A,oh yes sir how you must miss her and dear emma too what a dreadful loss to you both i have been so grieved for you i could not imagine how you could possibly do without her it is a sad change indeed but i hope she is pretty well sir
p00033_A,00033,A,pretty well my dear i hope pretty well i do not know but that the place agrees with her tolerably
p00034_A,00034,A,oh no none in the least i never saw mrs weston better in my life never looking so well papa is only speaking his own regret
p00035_A,00035,A,very much to the honour of both
p00036_A,00036,A,and do you see her sir tolerably often
p00037_A,00037,A,not near so often my dear as i could wish
p00038_A,00038,A,oh papa we have missed seeing them but one entire day since they married either in the morning or evening of every day excepting one have we seen either mr weston or mrs weston and generally both either at randalls or here and as you may suppose isabella most frequently here they are very very kind in their visits mr weston is really as kind as herself papa if you speak in that melancholy way you will be giving isabella a false idea of us all every body must be aware that miss taylor must be missed but every body ought also to be assured that mr and mrs weston do really prevent our missing her by any means to the extent we ourselves anticipated which is the exact truth
p00039_A,00039,A,just as it should be and just as i hoped it was from your letters her wish of shewing you attention could not be doubted and his being a disengaged and social man makes it all easy i have been always telling you my love that i had no idea of the change being so very material to hartfield as you apprehended and now you have emma s account i hope you will be satisfied
p00040_A,00040,A,why to be sure yes certainly i cannot deny that mrs weston poor mrs weston does come and see us pretty often but then she is always obliged to go away again
p00041_A,00041,A,it would be very hard upon mr weston if she did not papa you quite forget poor mr weston
p00042_A,00042,A,me my love are you talking about me i am sure nobody ought to be or can be a greater advocate for matrimony than i am and if it had not been for the misery of her leaving hartfield i should never have thought of miss taylor but as the most fortunate woman in the world and as to slighting mr weston that excellent mr weston i think there is nothing he does not deserve i believe he is one of the very best tempered men that ever existed excepting yourself and your brother i do not know his equal for temper i shall never forget his flying henry s kite for him that very windy day last easter and ever since his particular kindness last september twelvemonth in writing that note at twelve o clock at night on purpose to assure me that there was no scarlet fever at cobham i have been convinced there could not be a more feeling heart nor a better man in existence if any body can deserve him it must be miss taylor
p00043_A,00043,A,where is the young man has he been here on this occasion or has he not
p00044_A,00044,A,my dear papa he is three and twenty you forget how time passes
p00045_A,00045,A,three and twenty is he indeed well i could not have thought it and he was but two years old when he lost his poor mother well time does fly indeed and my memory is very bad however it was an exceeding good pretty letter and gave mr and mrs weston a great deal of pleasure i remember it was written from weymouth and dated sept 28th and began but i forget how it went on and it was signed f c weston churchill i remember that perfectly
p00046_A,00046,A,how very pleasing and proper of him i have no doubt of his being a most amiable young man but how sad it is that he should not live at home with his father there is something so shocking in a child s being taken away from his parents and natural home i never could comprehend how mr weston could part with him to give up one s child i really never could think well of any body who proposed such a thing to any body else
p00047_A,00047,A,ah indeed i am very sorry come shake hands with me
p00048_A,00048,A,mr wingfield most strenuously recommended it sir or we should not have gone he recommended it for all the children but particularly for the weakness in little bella s throat both sea air and bathing
p00049_A,00049,A,ah my dear but perry had many doubts about the sea doing her any good and as to myself i have been long perfectly convinced though perhaps i never told you so before that the sea is very rarely of use to any body i am sure it almost killed me once
p00050_A,00050,A,come come i must beg you not to talk of the sea it makes me envious and miserable i who have never seen it south end is prohibited if you please my dear isabella i have not heard you make one inquiry about mr perry yet and he never forgets you
p00051_A,00051,A,oh my dear sir her throat is so much better that i have hardly any uneasiness about it either bathing has been of the greatest service to her or else it is to be attributed to an excellent embrocation of mr wingfield s which we have been applying at times ever since august
p00052_A,00052,A,it is not very likely my dear that bathing should have been of use to her and if i had known you were wanting an embrocation i would have spoken to
p00053_A,00053,A,you seem to me to have forgotten mrs and miss bates i have not heard one inquiry after them
p00054_A,00054,A,middling my dear i cannot compliment you i think mr john knightley very far from looking well
p00055_A,00055,A,i am sorry to find my love that my father does not think you looking well but i hope it is only from being a little fatigued i could have wished however as you know that you had seen mr wingfield before you left home
p00056_A,00056,A,my dear isabella pray do not concern yourself about my looks be satisfied with doctoring and coddling yourself and the children and let me look as i chuse
p00057_A,00057,A,i did not thoroughly understand what you were telling your brother about your friend mr graham s intending to have a bailiff from scotland to look after his new estate what will it answer will not the old prejudice be too strong
p00058_A,00058,A,but my dear sir the difference of the journey only consider how great it would have been an hundred miles perhaps instead of forty
p00059_A,00059,A,ah my dear as perry says where health is at stake nothing else should be considered and if one is to travel there is not much to chuse between forty miles and an hundred better not move at all better stay in london altogether than travel forty miles to get into a worse air this is just what perry said it seemed to him a very ill judged measure
p00060_A,00060,A,true true very true that s a consideration indeed but john as to what i was telling you of my idea of moving the path to langham of turning it more to the right that it may not cut through the home meadows i cannot conceive any difficulty i should not attempt it if it were to be the means of inconvenience to the highbury people but if you call to mind exactly the present line of the path the only way of proving it however will be to turn to our maps i shall see you at the abbey to morrow morning i hope and then we will look them over and you shall give me your opinion
p00061_A,00061,A,very cold certainly very cold
p00062_A,00062,A,you do quite right we will make your apologies to mr and mrs weston
p00063_A,00063,A,he has been used to her in these complaints and i hope to morrow morning will bring us both a more comfortable report but it is impossible not to feel uneasiness such a sad loss to our party to day
p00064_A,00064,A,indeed i had no idea that the law had been so great a slavery well sir the time must come when you will be paid for all this when you will have little labour and great enjoyment
p00065_A,00065,A,my son frank my son
p00066_A,00066,A,yes i have some right to that knowledge though i have never been at the place in my life she is an odd woman but i never allow myself to speak ill of her on frank s account for i do believe her to be very fond of him i used to think she was not capable of being fond of any body except herself but she has always been kind to him in her way allowing for little whims and caprices and expecting every thing to be as she likes and it is no small credit in my opinion to him that he should excite such an affection for though i would not say it to any body else she has no more heart than a stone to people in general and the devil of a temper
p00067_A,00067,A,yes it seems to depend upon nothing but the ill humour of mrs churchill which i imagine to be the most certain thing in the world
p00068_A,00068,A,you must know my dear mrs knightley that we are by no means so sure of seeing mr frank churchill in my opinion as his father thinks it depends entirely upon his aunt s spirits and pleasure in short upon her temper to you to my two daughters i may venture on the truth mrs churchill rules at enscombe and is a very odd tempered woman and his coming now depends upon her being willing to spare him
p00069_A,00069,A,oh mrs churchill every body knows mrs churchill and i am sure i never think of that poor young man without the greatest compassion to be constantly living with an ill tempered person must be dreadful it is what we happily have never known any thing of but it must be a life of misery what a blessing that she never had any children poor little creatures how unhappy she would have made them
p00070_A,00070,A,this will prove a spirited beginning of your winter engagements sir something new for your coachman and horses to be making their way through a storm of snow
p00071_A,00071,A,i admired your resolution very much sir in venturing out in such weather for of course you saw there would be snow very soon every body must have seen the snow coming on i admired your spirit and i dare say we shall get home very well another hour or two s snow can hardly make the road impassable and we are two carriages if one is blown over in the bleak part of the common field there will be the other at hand i dare say we shall be all safe at hartfield before midnight
p00072_A,00072,A,what is to be done my dear emma what is to be done
p00073_A,00073,A,indeed then my dear isabella it is the most extraordinary sort of thing in the world for in general every thing does give you cold walk home you are prettily shod for walking home i dare say it will be bad enough for the horses
p00074_A,00074,A,shall i ring the bell
p00075_A,00075,A,never madam never i assure you i think seriously of miss smith miss smith is a very good sort of girl and i should be happy to see her respectably settled i wish her extremely well and no doubt there are men who might not object to every body has their level but as for myself i am not i think quite so much at a loss i need not so totally despair of an equal alliance as to be addressing myself to miss smith no madam my visits to hartfield have been for yourself only and the encouragement i received
p00076_A,00076,A,mr elton is so good to the poor
p00077_A,00077,A,have you heard from miss fairfax so lately i am extremely happy i hope she is well
p00078_A,00078,A,thank you you are so kind oh here it is i was sure it could not be far off but i had put my huswife upon it you see without being aware and so it was quite hid but i had it in my hand so very lately that i was almost sure it must be on the table i was reading it to mrs cole and since she went away i was reading it again to my mother for it is such a pleasure to her a letter from jane that she can never hear it often enough so i knew it could not be far off and here it is only just under my huswife and since you are so kind as to wish to hear what she says but first of all i really must in justice to jane apologise for her writing so short a letter only two pages you see hardly two and in general she fills the whole paper and crosses half my mother often wonders that i can make it out so well she often says when the letter is first opened don t you ma am and then i tell her i am sure she would contrive to make it out herself if she had nobody to do it for her every word of it i am sure she would pore over it till she had made out every word and indeed though my mother s eyes are not so good as they were she can see amazingly well still thank god with the help of spectacles it is such a blessing my mother s are really very good indeed jane often says when she is here you are extremely kind you who are such a judge and write so beautifully yourself i am sure there is nobody s praise that could give us so much pleasure as miss woodhouse s my mother does not hear she is a little deaf you know ma am do you hear what miss woodhouse is so obliging to say about jane s handwriting
p00079_A,00079,A,and so she is to come to us next friday or saturday and the campbells leave town in their way to holyhead the monday following as you will find from jane s letter so sudden you may guess dear miss woodhouse what a flurry it has thrown me in if it was not for the drawback of her illness but i am afraid we must expect to see her grown thin and looking very poorly i must tell you what an unlucky thing happened to me as to that i always make a point of reading jane s letters through to myself first before i read them aloud to my mother you know for fear of there being any thing in them to distress her jane desired me to do it so i always do and so i began to day with my usual caution but no sooner did i come to the mention of her being unwell than i burst out quite frightened with which my mother being on the watch heard distinctly and was sadly alarmed at however when i read on i found it was not near so bad as i had fancied at first and i make so light of it now to her that she does not think much about it but i cannot imagine how i could be so off my guard if jane does not get well soon we will call in mr perry the expense shall not be thought of and though he is so liberal and so fond of jane that i dare say he would not mean to charge any thing for attendance we could not suffer it to be so you know he has a wife and family to maintain and is not to be giving away his time well now i have just given you a hint of what jane writes about we will turn to her letter and i am sure she tells her own story a great deal better than i can tell it for her
p00080_A,00080,A,a very pleasant evening particularly pleasant you and miss fairfax gave us some very good music i do not know a more luxurious state sir than sitting at one s ease to be entertained a whole evening by two such young women sometimes with music and sometimes with conversation i am sure miss fairfax must have found the evening pleasant emma you left nothing undone i was glad you made her play so much for having no instrument at her grandmother s it must have been a real indulgence
p00081_A,00081,A,i am happy you approved but i hope i am not often deficient in what is due to guests at hartfield
p00082_A,00082,A,no my dear that i am sure you are not there is nobody half so attentive and civil as you are if any thing you are too attentive the muffin last night if it had been handed round once i think it would have been enough
p00083_A,00083,A,oh no i was pleased with my own perseverance in asking questions and amused to think how little information i obtained
p00084_A,00084,A,i hope every body had a pleasant evening i had once i felt the fire rather too much but then i moved back my chair a little a very little and it did not disturb me miss bates was very chatty and good humoured as she always is though she speaks rather too quick however she is very agreeable and mrs bates too in a different way i like old friends and miss jane fairfax is a very pretty sort of young lady a very pretty and a very well behaved young lady indeed she must have found the evening agreeable mr knightley because she had emma
p00085_A,00085,A,true sir and emma because she had miss fairfax
p00086_A,00086,A,my dear papa i sent the whole hind quarter i knew you would wish it there will be the leg to be salted you know which is so very nice and the loin to be dressed directly in any manner they like
p00087_A,00087,A,that s right my dear very right i had not thought of it before but that is the best way they must not over salt the leg and then if it is not over salted and if it is very thoroughly boiled just as serle boils ours and eaten very moderately of with a boiled turnip and a little carrot or parsnip i do not consider it unwholesome
p00088_A,00088,A,i was with mr cole on business an hour and a half ago he had just read elton s letter as i was shewn in and handed it to me directly
p00089_A,00089,A,we consider our hartfield pork indeed it certainly is so very superior to all other pork that emma and i cannot have a greater pleasure than
p00090_A,00090,A,oh my dear sir as my mother says our friends are only too good to us if ever there were people who without having great wealth themselves had every thing they could wish for i am sure it is us we may well say that well mr knightley and so you actually saw the letter well
p00091_A,00091,A,it was short merely to announce but cheerful exulting of course he had been so fortunate as to i forget the precise words one has no business to remember them the information was as you state that he was going to be married to a miss hawkins by his style i should imagine it just settled
p00092_A,00092,A,mr elton going to be married he will have every body s wishes for his happiness
p00093_A,00093,A,he is very young to settle he had better not be in a hurry he seemed to me very well off as he was we were always glad to see him at hartfield
p00094_A,00094,A,a new neighbour for us all miss woodhouse my mother is so pleased she says she cannot bear to have the poor old vicarage without a mistress this is great news indeed jane you have never seen mr elton no wonder that you have such a curiosity to see him
p00095_A,00095,A,no i have never seen mr elton is he is he a tall man
