uid,pair_id,side,text
p00042_B,00042,B,he was four and twenty the 8th of last june and my birthday is the 23rd just a fortnight and a day s difference which is very odd
p00043_B,00043,B,only four and twenty that is too young to settle his mother is perfectly right not to be in a hurry they seem very comfortable as they are and if she were to take any pains to marry him she would probably repent it six years hence if he could meet with a good sort of young woman in the same rank as his own with a little money it might be very desirable
p00044_B,00044,B,six years hence dear miss woodhouse he would be thirty years old
p00045_B,00045,B,well and that is as early as most men can afford to marry who are not born to an independence mr martin i imagine has his fortune entirely to make cannot be at all beforehand with the world whatever money he might come into when his father died whatever his share of the family property it is i dare say all afloat all employed in his stock and so forth and though with diligence and good luck he may be rich in time it is next to impossible that he should have realised any thing yet
p00046_B,00046,B,to be sure so it is but they live very comfortably they have no indoors man else they do not want for any thing and mrs martin talks of taking a boy another year
p00047_B,00047,B,i wish you may not get into a scrape harriet whenever he does marry i mean as to being acquainted with his wife for though his sisters from a superior education are not to be altogether objected to it does not follow that he might marry any body at all fit for you to notice the misfortune of your birth ought to make you particularly careful as to your associates there can be no doubt of your being a gentleman s daughter and you must support your claim to that station by every thing within your own power or there will be plenty of people who would take pleasure in degrading you
p00048_B,00048,B,yes to be sure i suppose there are but while i visit at hartfield and you are so kind to me miss woodhouse i am not afraid of what any body can do
p00049_B,00049,B,you understand the force of influence pretty well harriet but i would have you so firmly established in good society as to be independent even of hartfield and miss woodhouse i want to see you permanently well connected and to that end it will be advisable to have as few odd acquaintance as may be and therefore i say that if you should still be in this country when mr martin marries i wish you may not be drawn in by your intimacy with the sisters to be acquainted with the wife who will probably be some mere farmer s daughter without education
p00050_B,00050,B,to be sure yes not that i think mr martin would ever marry any body but what had had some education and been very well brought up however i do not mean to set up my opinion against yours and i am sure i shall not wish for the acquaintance of his wife i shall always have a great regard for the miss martins especially elizabeth and should be very sorry to give them up for they are quite as well educated as me but if he marries a very ignorant vulgar woman certainly i had better not visit her if i can help it only think of our happening to meet him how very odd it was quite a chance he said that he had not gone round by randalls he did not think we ever walked this road he thought we walked towards randalls most days he has not been able to get the romance of the forest yet he was so busy the last time he was at kingston that he quite forgot it but he goes again to morrow so very odd we should happen to meet well miss woodhouse is he like what you expected what do you think of him do you think him so very plain
p00051_B,00051,B,he is very plain undoubtedly remarkably plain but that is nothing compared with his entire want of gentility i had no right to expect much and i did not expect much but i had no idea that he could be so very clownish so totally without air i had imagined him i confess a degree or two nearer gentility
p00052_B,00052,B,to be sure he is not so genteel as real gentlemen
p00053_B,00053,B,i think harriet since your acquaintance with us you have been repeatedly in the company of some such very real gentlemen that you must yourself be struck with the difference in mr martin at hartfield you have had very good specimens of well educated well bred men i should be surprized if after seeing them you could be in company with mr martin again without perceiving him to be a very inferior creature and rather wondering at yourself for having ever thought him at all agreeable before do not you begin to feel that now were not you struck i am sure you must have been struck by his awkward look and abrupt manner and the uncouthness of a voice which i heard to be wholly unmodulated as i stood here
p00054_B,00054,B,certainly he is not like mr knightley he has not such a fine air and way of walking as mr knightley i see the difference plain enough but mr knightley is so very fine a man
p00055_B,00055,B,mr knightley s air is so remarkably good that it is not fair to compare mr martin with him you might not see one in a hundred with gentleman so plainly written as in mr knightley but he is not the only gentleman you have been lately used to what say you to mr weston and mr elton compare mr martin with either of them compare their manner of carrying themselves of walking of speaking of being silent you must see the difference
p00056_B,00056,B,oh yes there is a great difference but mr weston is almost an old man mr weston must be between forty and fifty
p00057_B,00057,B,which makes his good manners the more valuable the older a person grows harriet the more important it is that their manners should not be bad the more glaring and disgusting any loudness or coarseness or awkwardness becomes what is passable in youth is detestable in later age mr martin is now awkward and abrupt what will he be at mr weston s time of life
p00058_B,00058,B,there is no saying indeed
p00059_B,00059,B,but there may be pretty good guessing he will be a completely gross vulgar farmer totally inattentive to appearances and thinking of nothing but profit and loss
p00060_B,00060,B,will he indeed that will be very bad
p00061_B,00061,B,how much his business engrosses him already is very plain from the circumstance of his forgetting to inquire for the book you recommended he was a great deal too full of the market to think of any thing else which is just as it should be for a thriving man what has he to do with books and i have no doubt that he will thrive and be a very rich man in time and his being illiterate and coarse need not disturb us
p00062_B,00062,B,i wonder he did not remember the book
p00063_B,00063,B,in one respect perhaps mr elton s manners are superior to mr knightley s or mr weston s they have more gentleness they might be more safely held up as a pattern there is an openness a quickness almost a bluntness in mr weston which every body likes in him because there is so much good humour with it but that would not do to be copied neither would mr knightley s downright decided commanding sort of manner though it suits him very well his figure and look and situation in life seem to allow it but if any young man were to set about copying him he would not be sufferable on the contrary i think a young man might be very safely recommended to take mr elton as a model mr elton is good humoured cheerful obliging and gentle he seems to me to be grown particularly gentle of late i do not know whether he has any design of ingratiating himself with either of us harriet by additional softness but it strikes me that his manners are softer than they used to be if he means any thing it must be to please you did not i tell you what he said of you the other day
p00064_B,00064,B,a bad thing do you really think it a bad thing why so
p00065_B,00065,B,i think they will neither of them do the other any good
p00066_B,00066,B,you surprize me emma must do harriet good and by supplying her with a new object of interest harriet may be said to do emma good i have been seeing their intimacy with the greatest pleasure how very differently we feel not think they will do each other any good this will certainly be the beginning of one of our quarrels about emma mr knightley
p00067_B,00067,B,perhaps you think i am come on purpose to quarrel with you knowing weston to be out and that you must still fight your own battle
p00068_B,00068,B,mr weston would undoubtedly support me if he were here for he thinks exactly as i do on the subject we were speaking of it only yesterday and agreeing how fortunate it was for emma that there should be such a girl in highbury for her to associate with mr knightley i shall not allow you to be a fair judge in this case you are so much used to live alone that you do not know the value of a companion and perhaps no man can be a good judge of the comfort a woman feels in the society of one of her own sex after being used to it all her life i can imagine your objection to harriet smith she is not the superior young woman which emma s friend ought to be but on the other hand as emma wants to see her better informed it will be an inducement to her to read more herself they will read together she means it i know
p00069_B,00069,B,emma has been meaning to read more ever since she was twelve years old i have seen a great many lists of her drawing up at various times of books that she meant to read regularly through and very good lists they were very well chosen and very neatly arranged sometimes alphabetically and sometimes by some other rule the list she drew up when only fourteen i remember thinking it did her judgment so much credit that i preserved it some time and i dare say she may have made out a very good list now but i have done with expecting any course of steady reading from emma she will never submit to any thing requiring industry and patience and a subjection of the fancy to the understanding where miss taylor failed to stimulate i may safely affirm that harriet smith will do nothing you never could persuade her to read half so much as you wished you know you could not
p00070_B,00070,B,i dare say that i thought so then but since we have parted i can never remember emma s omitting to do any thing i wished
p00071_B,00071,B,there is hardly any desiring to refresh such a memory as that but i who have had no such charm thrown over my senses must still see hear and remember emma is spoiled by being the cleverest of her family at ten years old she had the misfortune of being able to answer questions which puzzled her sister at seventeen she was always quick and assured isabella slow and diffident and ever since she was twelve emma has been mistress of the house and of you all in her mother she lost the only person able to cope with her she inherits her mother s talents and must have been under subjection to her
p00072_B,00072,B,i should have been sorry mr knightley to be dependent on your recommendation had i quitted mr woodhouse s family and wanted another situation i do not think you would have spoken a good word for me to any body i am sure you always thought me unfit for the office i held
p00073_B,00073,B,yes you are better placed here very fit for a wife but not at all for a governess but you were preparing yourself to be an excellent wife all the time you were at hartfield you might not give emma such a complete education as your powers would seem to promise but you were receiving a very good education from her on the very material matrimonial point of submitting your own will and doing as you were bid and if weston had asked me to recommend him a wife i should certainly have named miss taylor
p00074_B,00074,B,thank you there will be very little merit in making a good wife to such a man as mr weston
p00075_B,00075,B,why to own the truth i am afraid you are rather thrown away and that with every disposition to bear there will be nothing to be borne we will not despair however weston may grow cross from the wantonness of comfort or his son may plague him
p00076_B,00076,B,i hope not that it is not likely no mr knightley do not foretell vexation from that quarter
p00077_B,00077,B,not i indeed i only name possibilities i do not pretend to emma s genius for foretelling and guessing i hope with all my heart the young man may be a weston in merit and a churchill in fortune but harriet smith i have not half done about harriet smith i think her the very worst sort of companion that emma could possibly have she knows nothing herself and looks upon emma as knowing every thing she is a flatterer in all her ways and so much the worse because undesigned her ignorance is hourly flattery how can emma imagine she has any thing to learn herself while harriet is presenting such a delightful inferiority and as for harriet i will venture to say that she cannot gain by the acquaintance hartfield will only put her out of conceit with all the other places she belongs to she will grow just refined enough to be uncomfortable with those among whom birth and circumstances have placed her home i am much mistaken if emma s doctrines give any strength of mind or tend at all to make a girl adapt herself rationally to the varieties of her situation in life they only give a little polish
p00078_B,00078,B,i either depend more upon emma s good sense than you do or am more anxious for her present comfort for i cannot lament the acquaintance how well she looked last night
p00079_B,00079,B,oh you would rather talk of her person than her mind would you very well i shall not attempt to deny emma s being pretty
p00080_B,00080,B,pretty say beautiful rather can you imagine any thing nearer perfect beauty than emma altogether face and figure
p00081_B,00081,B,i do not know what i could imagine but i confess that i have seldom seen a face or figure more pleasing to me than hers but i am a partial old friend
p00082_B,00082,B,such an eye the true hazle eye and so brilliant regular features open countenance with a complexion oh what a bloom of full health and such a pretty height and size such a firm and upright figure there is health not merely in her bloom but in her air her head her glance one hears sometimes of a child being the picture of health now emma always gives me the idea of being the complete picture of grown up health she is loveliness itself mr knightley is not she
p00083_B,00083,B,i have not a fault to find with her person i think her all you describe i love to look at her and i will add this praise that i do not think her personally vain considering how very handsome she is she appears to be little occupied with it her vanity lies another way mrs weston i am not to be talked out of my dislike of harriet smith or my dread of its doing them both harm
p00084_B,00084,B,and i mr knightley am equally stout in my confidence of its not doing them any harm with all dear emma s little faults she is an excellent creature where shall we see a better daughter or a kinder sister or a truer friend no no she has qualities which may be trusted she will never lead any one really wrong she will make no lasting blunder where emma errs once she is in the right a hundred times
p00085_B,00085,B,very well i will not plague you any more emma shall be an angel and i will keep my spleen to myself till christmas brings john and isabella john loves emma with a reasonable and therefore not a blind affection and isabella always thinks as he does except when he is not quite frightened enough about the children i am sure of having their opinions with me
p00086_B,00086,B,i know that you all love her really too well to be unjust or unkind but excuse me mr knightley if i take the liberty i consider myself you know as having somewhat of the privilege of speech that emma s mother might have had the liberty of hinting that i do not think any possible good can arise from harriet smith s intimacy being made a matter of much discussion among you pray excuse me but supposing any little inconvenience may be apprehended from the intimacy it cannot be expected that emma accountable to nobody but her father who perfectly approves the acquaintance should put an end to it so long as it is a source of pleasure to herself it has been so many years my province to give advice that you cannot be surprized mr knightley at this little remains of office
p00087_B,00087,B,not at all i am much obliged to you for it it is very good advice and it shall have a better fate than your advice has often found for it shall be attended to
p00088_B,00088,B,mrs john knightley is easily alarmed and might be made unhappy about her sister
p00089_B,00089,B,be satisfied i will not raise any outcry i will keep my ill humour to myself i have a very sincere interest in emma isabella does not seem more my sister has never excited a greater interest perhaps hardly so great there is an anxiety a curiosity in what one feels for emma i wonder what will become of her
p00090_B,00090,B,so do i very much
p00091_B,00091,B,she always declares she will never marry which of course means just nothing at all but i have no idea that she has yet ever seen a man she cared for it would not be a bad thing for her to be very much in love with a proper object i should like to see emma in love and in some doubt of a return it would do her good but there is nobody hereabouts to attach her and she goes so seldom from home
p00092_B,00092,B,there does indeed seem as little to tempt her to break her resolution at present as can well be and while she is so happy at hartfield i cannot wish her to be forming any attachment which would be creating such difficulties on poor mr woodhouse s account i do not recommend matrimony at present to emma though i mean no slight to the state i assure you
p00093_B,00093,B,what does weston think of the weather shall we have rain
p00094_B,00094,B,i am glad you think i have been useful to her but harriet only wanted drawing out and receiving a few very few hints she had all the natural grace of sweetness of temper and artlessness in herself i have done very little
p00095_B,00095,B,if it were admissible to contradict a lady
p00096_B,00096,B,i have perhaps given her a little more decision of character have taught her to think on points which had not fallen in her way before
p00097_B,00097,B,exactly so that is what principally strikes me so much superadded decision of character skilful has been the hand
p00098_B,00098,B,great has been the pleasure i am sure i never met with a disposition more truly amiable
p00099_B,00099,B,i have no doubt of it
p00100_B,00100,B,did you ever have your likeness taken harriet did you ever sit for your picture
p00101_B,00101,B,oh dear no never
p00102_B,00102,B,what an exquisite possession a good picture of her would be i would give any money for it i almost long to attempt her likeness myself you do not know it i dare say but two or three years ago i had a great passion for taking likenesses and attempted several of my friends and was thought to have a tolerable eye in general but from one cause or another i gave it up in disgust but really i could almost venture if harriet would sit to me it would be such a delight to have her picture
p00103_B,00103,B,let me entreat you it would indeed be a delight let me entreat you miss woodhouse to exercise so charming a talent in favour of your friend i know what your drawings are how could you suppose me ignorant is not this room rich in specimens of your landscapes and flowers and has not mrs weston some inimitable figure pieces in her drawing room at randalls
p00104_B,00104,B,well if you give me such kind encouragement mr elton i believe i shall try what i can do harriet s features are very delicate which makes a likeness difficult and yet there is a peculiarity in the shape of the eye and the lines about the mouth which one ought to catch
p00105_B,00105,B,exactly so the shape of the eye and the lines about the mouth i have not a doubt of your success pray pray attempt it as you will do it it will indeed to use your own words be an exquisite possession
p00106_B,00106,B,but i am afraid mr elton harriet will not like to sit she thinks so little of her own beauty did not you observe her manner of answering me how completely it meant why should my picture be drawn
p00107_B,00107,B,oh yes i observed it i assure you it was not lost on me but still i cannot imagine she would not be persuaded
p00108_B,00108,B,no great variety of faces for you i had only my own family to study from there is my father another of my father but the idea of sitting for his picture made him so nervous that i could only take him by stealth neither of them very like therefore mrs weston again and again and again you see dear mrs weston always my kindest friend on every occasion she would sit whenever i asked her there is my sister and really quite her own little elegant figure and the face not unlike i should have made a good likeness of her if she would have sat longer but she was in such a hurry to have me draw her four children that she would not be quiet then here come all my attempts at three of those four children there they are henry and john and bella from one end of the sheet to the other and any one of them might do for any one of the rest she was so eager to have them drawn that i could not refuse but there is no making children of three or four years old stand still you know nor can it be very easy to take any likeness of them beyond the air and complexion unless they are coarser featured than any of mama s children ever were here is my sketch of the fourth who was a baby i took him as he was sleeping on the sofa and it is as strong a likeness of his cockade as you would wish to see he had nestled down his head most conveniently that s very like i am rather proud of little george the corner of the sofa is very good then here is my last my last and my best my brother mr john knightley this did not want much of being finished when i put it away in a pet and vowed i would never take another likeness i could not help being provoked for after all my pains and when i had really made a very good likeness of it mrs weston and i were quite agreed in thinking it very like only too handsome too flattering but that was a fault on the right side yes it was a little like but to be sure it did not do him justice we had had a great deal of trouble in persuading him to sit at all it was made a great favour of and altogether it was more than i could bear and so i never would finish it to have it apologised over as an unfavourable likeness to every morning visitor in brunswick square and as i said i did then forswear ever drawing any body again but for harriet s sake or rather for my own and as there are no husbands and wives in the case at present i will break my resolution now
p00109_B,00109,B,no husbands and wives in the case at present indeed as you observe exactly so no husbands and wives
p00110_B,00110,B,by all means we shall be most happy to consider you as one of the party
p00111_B,00111,B,do you think so i cannot agree with you it appears to me a most perfect resemblance in every feature i never saw such a likeness in my life we must allow for the effect of shade you know
p00112_B,00112,B,you have made her too tall emma
p00113_B,00113,B,oh no certainly not too tall not in the least too tall consider she is sitting down which naturally presents a different which in short gives exactly the idea and the proportions must be preserved you know proportions fore shortening oh no it gives one exactly the idea of such a height as miss smith s exactly so indeed
p00114_B,00114,B,it is very pretty so prettily done just as your drawings always are my dear i do not know any body who draws so well as you do the only thing i do not thoroughly like is that she seems to be sitting out of doors with only a little shawl over her shoulders and it makes one think she must catch cold
p00115_B,00115,B,but my dear papa it is supposed to be summer a warm day in summer look at the tree
p00116_B,00116,B,but it is never safe to sit out of doors my dear
p00117_B,00117,B,you sir may say any thing but i must confess that i regard it as a most happy thought the placing of miss smith out of doors and the tree is touched with such inimitable spirit any other situation would have been much less in character the naivete of miss smith s manners and altogether oh it is most admirable i cannot keep my eyes from it i never saw such a likeness
p00118_B,00118,B,upon my word the young man is determined not to lose any thing for want of asking he will connect himself well if he can
p00119_B,00119,B,will you read the letter pray do i d rather you would well well is it a good letter or is it too short
p00120_B,00120,B,yes indeed a very good letter so good a letter harriet that every thing considered i think one of his sisters must have helped him i can hardly imagine the young man whom i saw talking with you the other day could express himself so well if left quite to his own powers and yet it is not the style of a woman no certainly it is too strong and concise not diffuse enough for a woman no doubt he is a sensible man and i suppose may have a natural talent for thinks strongly and clearly and when he takes a pen in hand his thoughts naturally find proper words it is so with some men yes i understand the sort of mind vigorous decided with sentiments to a certain point not coarse a better written letter harriet than i had expected
p00121_B,00121,B,well well and and what shall i do
p00122_B,00122,B,what shall you do in what respect do you mean with regard to this letter
p00123_B,00123,B,yes but what shall i say dear miss woodhouse do advise me
