uid,pair_id,side,text
p00592_A,00592,A,i think you could manage this without effort the first part is so very trifling the strength of the song falls on the second
p00593_A,00593,A,oh if i could but play as well as you and miss fairfax
p00594_A,00594,A,don t class us together harriet my playing is no more like her s than a lamp is like sunshine
p00595_A,00595,A,oh dear i think you play the best of the two i think you play quite as well as she does i am sure i had much rather hear you every body last night said how well you played
p00596_A,00596,A,those who knew any thing about it must have felt the difference the truth is harriet that my playing is just good enough to be praised but jane fairfax s is much beyond it
p00597_A,00597,A,well i always shall think that you play quite as well as she does or that if there is any difference nobody would ever find it out mr cole said how much taste you had and mr frank churchill talked a great deal about your taste and that he valued taste much more than execution
p00598_A,00598,A,ah but jane fairfax has them both harriet
p00599_A,00599,A,are you sure i saw she had execution but i did not know she had any taste nobody talked about it and i hate italian singing there is no understanding a word of it besides if she does play so very well you know it is no more than she is obliged to do because she will have to teach the coxes were wondering last night whether she would get into any great family how did you think the coxes looked
p00600_A,00600,A,just as they always do very vulgar
p00601_A,00601,A,they talked a great deal about him especially anne cox i do not know what she meant but she asked me if i thought i should go and stay there again next summer
p00602_A,00602,A,she meant to be impertinently curious just as such an anne cox should be
p00603_A,00603,A,she said he was very agreeable the day he dined there he sat by her at dinner miss nash thinks either of the coxes would be very glad to marry him
p00604_A,00604,A,for my companion tells me that i absolutely promised miss bates last night that i would come this morning i was not aware of it myself i did not know that i had fixed a day but as he says i did i am going now
p00605_A,00605,A,and while mrs weston pays her visit i may be allowed i hope to join your party and wait for her at hartfield if you are going home
p00606_A,00606,A,i thought you meant to go with me they would be very much pleased
p00607_A,00607,A,me i should be quite in the way but perhaps i may be equally in the way here miss woodhouse looks as if she did not want me my aunt always sends me off when she is shopping she says i fidget her to death and miss woodhouse looks as if she could almost say the same what am i to do
p00608_A,00608,A,i am here on no business of my own i am only waiting for my friend she will probably have soon done and then we shall go home but you had better go with mrs weston and hear the instrument
p00609_A,00609,A,well if you advise it but if colonel campbell should have employed a careless friend and if it should prove to have an indifferent tone what shall i say i shall be no support to mrs weston she might do very well by herself a disagreeable truth would be palatable through her lips but i am the wretchedest being in the world at a civil falsehood
p00610_A,00610,A,i do not believe any such thing i am persuaded that you can be as insincere as your neighbours when it is necessary but there is no reason to suppose the instrument is indifferent quite otherwise indeed if i understood miss fairfax s opinion last night
p00611_A,00611,A,should i send it to mrs goddard s ma am
p00612_A,00612,A,yes no yes to mrs goddard s only my pattern gown is at hartfield no you shall send it to hartfield if you please but then mrs goddard will want to see it and i could take the pattern gown home any day but i shall want the ribbon directly so it had better go to hartfield at least the ribbon you could make it into two parcels mrs ford could not you
p00613_A,00613,A,it is not worth while harriet to give mrs ford the trouble of two parcels
p00614_A,00614,A,no more it is
p00615_A,00615,A,no trouble in the world ma am
p00616_A,00616,A,oh but indeed i would much rather have it only in one then if you please you shall send it all to mrs goddard s i do not know no i think miss woodhouse i may just as well have it sent to hartfield and take it home with me at night what do you advise
p00617_A,00617,A,that you do not give another half second to the subject to hartfield if you please mrs ford
p00618_A,00618,A,my dear miss woodhouse i am just run across to entreat the favour of you to come and sit down with us a little while and give us your opinion of our new instrument you and miss smith how do you do miss smith very well i thank you and i begged mrs weston to come with me that i might be sure of succeeding
p00619_A,00619,A,i hope mrs bates and miss fairfax are
p00620_A,00620,A,this is a pleasure coming at least ten minutes earlier than i had calculated you find me trying to be useful tell me if you think i shall succeed
p00621_A,00621,A,what have not you finished it yet you would not earn a very good livelihood as a working silversmith at this rate
p00622_A,00622,A,i have not been working uninterruptedly i have been assisting miss fairfax in trying to make her instrument stand steadily it was not quite firm an unevenness in the floor i believe you see we have been wedging one leg with paper this was very kind of you to be persuaded to come i was almost afraid you would be hurrying home whoever colonel campbell might employ the person has not chosen ill i heard a good deal of colonel campbell s taste at weymouth and the softness of the upper notes i am sure is exactly what he and all that party would particularly prize i dare say miss fairfax that he either gave his friend very minute directions or wrote to broadwood himself do not you think so
p00623_A,00623,A,it is not fair mine was a random guess do not distress her
p00624_A,00624,A,how much your friends in ireland must be enjoying your pleasure on this occasion miss fairfax i dare say they often think of you and wonder which will be the day the precise day of the instrument s coming to hand do you imagine colonel campbell knows the business to be going forward just at this time do you imagine it to be the consequence of an immediate commission from him or that he may have sent only a general direction an order indefinite as to time to depend upon contingencies and conveniences
p00625_A,00625,A,till i have a letter from colonel campbell i can imagine nothing with any confidence it must be all conjecture
p00626_A,00626,A,conjecture aye sometimes one conjectures right and sometimes one conjectures wrong i wish i could conjecture how soon i shall make this rivet quite firm what nonsense one talks miss woodhouse when hard at work if one talks at all your real workmen i suppose hold their tongues but we gentlemen labourers if we get hold of a word miss fairfax said something about conjecturing there it is done i have the pleasure madam of restoring your spectacles healed for the present if you are very kind it will be one of the waltzes we danced last night let me live them over again you did not enjoy them as i did you appeared tired the whole time i believe you were glad we danced no longer but i would have given worlds all the worlds one ever has to give for another half hour what felicity it is to hear a tune again which has made one happy if i mistake not that was danced at weymouth here is something quite new to me do you know it cramer and here are a new set of irish melodies that from such a quarter one might expect this was all sent with the instrument very thoughtful of colonel campbell was not it he knew miss fairfax could have no music here i honour that part of the attention particularly it shews it to have been so thoroughly from the heart nothing hastily done nothing incomplete true affection only could have prompted it
p00627_A,00627,A,you speak too plain she must understand you
p00628_A,00628,A,i hope she does i would have her understand me i am not in the least ashamed of my meaning
p00629_A,00629,A,but really i am half ashamed and wish i had never taken up the idea
p00630_A,00630,A,i am very glad you did and that you communicated it to me i have now a key to all her odd looks and ways leave shame to her if she does wrong she ought to feel it
p00631_A,00631,A,she is not entirely without it i think
p00632_A,00632,A,how d ye do how d ye do very well i thank you so obliged to you for the carriage last night we were just in time my mother just ready for us pray come in do come in you will find some friends here
p00633_A,00633,A,how is your niece miss bates i want to inquire after you all but particularly your niece how is miss fairfax i hope she caught no cold last night how is she to day tell me how miss fairfax is
p00634_A,00634,A,so obliged to you so very much obliged to you for the carriage
p00635_A,00635,A,i am going to kingston can i do any thing for you
p00636_A,00636,A,oh dear kingston are you mrs cole was saying the other day she wanted something from kingston
p00637_A,00637,A,mrs cole has servants to send can i do any thing for you
p00638_A,00638,A,no i thank you but do come in who do you think is here miss woodhouse and miss smith so kind as to call to hear the new pianoforte do put up your horse at the crown and come in
p00639_A,00639,A,well for five minutes perhaps
p00640_A,00640,A,and here is mrs weston and mr frank churchill too quite delightful so many friends
p00641_A,00641,A,no not now i thank you i could not stay two minutes i must get on to kingston as fast as i can
p00642_A,00642,A,oh do come in they will be so very happy to see you
p00643_A,00643,A,no no your room is full enough i will call another day and hear the pianoforte
p00644_A,00644,A,well i am so sorry oh mr knightley what a delightful party last night how extremely pleasant did you ever see such dancing was not it delightful miss woodhouse and mr frank churchill i never saw any thing equal to it
p00645_A,00645,A,oh very delightful indeed i can say nothing less for i suppose miss woodhouse and mr frank churchill are hearing every thing that passes and i do not see why miss fairfax should not be mentioned too i think miss fairfax dances very well and mrs weston is the very best country dance player without exception in england now if your friends have any gratitude they will say something pretty loud about you and me in return but i cannot stay to hear it
p00646_A,00646,A,oh mr knightley one moment more something of consequence so shocked jane and i are both so shocked about the apples
p00647_A,00647,A,what is the matter now
p00648_A,00648,A,i have not been able to succeed mr knightley cannot stop he is going to kingston he asked me if he could do any thing
p00649_A,00649,A,yes we heard his kind offers we heard every thing
p00650_A,00650,A,oh yes my dear i dare say you might because you know the door was open and the window was open and mr knightley spoke loud you must have heard every thing to be sure said he so i just mentioned oh miss woodhouse must you be going you seem but just come so very obliging of you
p00651_A,00651,A,you and miss smith and miss fairfax will be three and the two miss coxes five and there will be the two gilberts young cox my father and myself besides mr knightley yes that will be quite enough for pleasure you and miss smith and miss fairfax will be three and the two miss coxes five and for five couple there will be plenty of room
p00652_A,00652,A,we were too magnificent we allowed unnecessary room ten couple may stand here very well
p00653_A,00653,A,it would be a crowd a sad crowd and what could be worse than dancing without space to turn in
p00654_A,00654,A,very true it was very bad i think there will be very tolerable room for ten couple
p00655_A,00655,A,no no you are quite unreasonable it would be dreadful to be standing so close nothing can be farther from pleasure than to be dancing in a crowd and a crowd in a little room
p00656_A,00656,A,well miss woodhouse your inclination for dancing has not been quite frightened away i hope by the terrors of my father s little rooms i bring a new proposal on the subject a thought of my father s which waits only your approbation to be acted upon may i hope for the honour of your hand for the two first dances of this little projected ball to be given not at randalls but at the crown inn
p00657_A,00657,A,the crown
p00658_A,00658,A,yes if you and mr woodhouse see no objection and i trust you cannot my father hopes his friends will be so kind as to visit him there better accommodations he can promise them and not a less grateful welcome than at randalls it is his own idea mrs weston sees no objection to it provided you are satisfied this is what we all feel oh you were perfectly right ten couple in either of the randalls rooms would have been insufferable dreadful i felt how right you were the whole time but was too anxious for securing any thing to like to yield is not it a good exchange you consent i hope you consent
p00659_A,00659,A,it appears to me a plan that nobody can object to if mr and mrs weston do not i think it admirable and as far as i can answer for myself shall be most happy it seems the only improvement that could be papa do you not think it an excellent improvement
p00660_A,00660,A,i was going to observe sir that one of the great recommendations of this change would be the very little danger of any body s catching cold so much less danger at the crown than at randalls mr perry might have reason to regret the alteration but nobody else could
p00661_A,00661,A,sir you are very much mistaken if you suppose mr perry to be that sort of character mr perry is extremely concerned when any of us are ill but i do not understand how the room at the crown can be safer for you than your father s house
p00662_A,00662,A,from the very circumstance of its being larger sir we shall have no occasion to open the windows at all not once the whole evening and it is that dreadful habit of opening the windows letting in cold air upon heated bodies which as you well know sir does the mischief
p00663_A,00663,A,open the windows but surely mr churchill nobody would think of opening the windows at randalls nobody could be so imprudent i never heard of such a thing dancing with open windows i am sure neither your father nor mrs weston poor miss taylor that was would suffer it
p00664_A,00664,A,ah sir but a thoughtless young person will sometimes step behind a window curtain and throw up a sash without its being suspected i have often known it done myself
p00665_A,00665,A,have you indeed sir bless me i never could have supposed it but i live out of the world and am often astonished at what i hear however this does make a difference and perhaps when we come to talk it over but these sort of things require a good deal of consideration one cannot resolve upon them in a hurry if mr and mrs weston will be so obliging as to call here one morning we may talk it over and see what can be done
p00666_A,00666,A,but unfortunately sir my time is so limited
p00667_A,00667,A,oh there will be plenty of time for talking every thing over there is no hurry at all if it can be contrived to be at the crown papa it will be very convenient for the horses they will be so near their own stable
p00668_A,00668,A,so they will my dear that is a great thing not that james ever complains but it is right to spare our horses when we can if i could be sure of the rooms being thoroughly aired but is mrs stokes to be trusted i doubt it i do not know her even by sight
p00669_A,00669,A,i can answer for every thing of that nature sir because it will be under mrs weston s care mrs weston undertakes to direct the whole
p00670_A,00670,A,there papa now you must be satisfied our own dear mrs weston who is carefulness itself do not you remember what mr perry said so many years ago when i had the measles how often have i heard you speak of it as such a compliment to her
p00671_A,00671,A,aye very true mr perry did say so i shall never forget it poor little emma you were very bad with the measles that is you would have been very bad but for perry s great attention he came four times a day for a week he said from the first it was a very good sort which was our great comfort but the measles are a dreadful complaint i hope whenever poor isabella s little ones have the measles she will send for perry
p00672_A,00672,A,emma this paper is worse than i expected look in places you see it is dreadfully dirty and the wainscot is more yellow and forlorn than any thing i could have imagined
p00673_A,00673,A,my dear you are too particular what does all that signify you will see nothing of it by candlelight it will be as clean as randalls by candlelight we never see any thing of it on our club nights
p00674_A,00674,A,i do not think it is so very small we shall not be many you know
p00675_A,00675,A,you talk a great deal of the length of this passage my dear it is a mere nothing after all and not the least draught from the stairs
p00676_A,00676,A,i wish one could know which arrangement our guests in general would like best to do what would be most generally pleasing must be our object if one could but tell what that would be
p00677_A,00677,A,yes very true very true you want your neighbours opinions i do not wonder at you if one could ascertain what the chief of them the coles for instance they are not far off shall i call upon them or miss bates she is still nearer and i do not know whether miss bates is not as likely to understand the inclinations of the rest of the people as any body i think we do want a larger council suppose i go and invite miss bates to join us
p00678_A,00678,A,well if you please if you think she will be of any use
p00679_A,00679,A,you will get nothing to the purpose from miss bates she will be all delight and gratitude but she will tell you nothing she will not even listen to your questions i see no advantage in consulting miss bates
p00680_A,00680,A,aye do frank go and fetch miss bates and let us end the matter at once she will enjoy the scheme i am sure and i do not know a properer person for shewing us how to do away difficulties fetch miss bates we are growing a little too nice she is a standing lesson of how to be happy but fetch them both invite them both
p00681_A,00681,A,both sir can the old lady
p00682_A,00682,A,the old lady no the young lady to be sure i shall think you a great blockhead frank if you bring the aunt without the niece
p00683_A,00683,A,oh i beg your pardon sir i did not immediately recollect undoubtedly if you wish it i will endeavour to persuade them both
p00684_A,00684,A,of all horrid things leave taking is the worst
p00685_A,00685,A,but you will come again this will not be your only visit to randalls
p00686_A,00686,A,ah the uncertainty of when i may be able to return i shall try for it with a zeal it will be the object of all my thoughts and cares and if my uncle and aunt go to town this spring but i am afraid they did not stir last spring i am afraid it is a custom gone for ever
p00687_A,00687,A,our poor ball must be quite given up
p00688_A,00688,A,ah that ball why did we wait for any thing why not seize the pleasure at once how often is happiness destroyed by preparation foolish preparation you told us it would be so oh miss woodhouse why are you always so right
p00689_A,00689,A,indeed i am very sorry to be right in this instance i would much rather have been merry than wise
p00690_A,00690,A,if i can come again we are still to have our ball my father depends on it do not forget your engagement such a fortnight as it has been every day more precious and more delightful than the day before every day making me less fit to bear any other place happy those who can remain at highbury
p00691_A,00691,A,as you do us such ample justice now i will venture to ask whether you did not come a little doubtfully at first do not we rather surpass your expectations i am sure we do i am sure you did not much expect to like us you would not have been so long in coming if you had had a pleasant idea of highbury and you must be off this very morning
p00692_A,00692,A,yes my father is to join me here we shall walk back together and i must be off immediately i am almost afraid that every moment will bring him
p00693_A,00693,A,not five minutes to spare even for your friends miss fairfax and miss bates how unlucky miss bates s powerful argumentative mind might have strengthened yours
p00694_A,00694,A,yes i have called there passing the door i thought it better it was a right thing to do i went in for three minutes and was detained by miss bates s being absent she was out and i felt it impossible not to wait till she came in she is a woman that one may that one must laugh at but that one would not wish to slight it was better to pay my visit then in short perhaps miss woodhouse i think you can hardly be quite without suspicion
p00695_A,00695,A,you are quite in the right it was most natural to pay your visit then
p00696_A,00696,A,it was time to go
p00697_A,00697,A,i shall hear about you all that is my chief consolation i shall hear of every thing that is going on among you i have engaged mrs weston to correspond with me she has been so kind as to promise it oh the blessing of a female correspondent when one is really interested in the absent she will tell me every thing in her letters i shall be at dear highbury again
p00698_A,00698,A,you emma who have so few opportunities of dancing you are really out of luck you are very much out of luck
p00699_A,00699,A,your allowing yourself to be so occupied and so unhappy about mr elton s marrying harriet is the strongest reproach you can make me you could not give me a greater reproof for the mistake i fell into it was all my doing i know i have not forgotten it i assure you deceived myself i did very miserably deceive you and it will be a painful reflection to me for ever do not imagine me in danger of forgetting it i have not said exert yourself harriet for my sake think less talk less of mr elton for my sake because for your own sake rather i would wish it to be done for the sake of what is more important than my comfort a habit of self command in you a consideration of what is your duty an attention to propriety an endeavour to avoid the suspicions of others to save your health and credit and restore your tranquillity these are the motives which i have been pressing on you they are very important and sorry i am that you cannot feel them sufficiently to act upon them my being saved from pain is a very secondary consideration i want you to save yourself from greater pain perhaps i may sometimes have felt that harriet would not forget what was due or rather what would be kind by me
p00700_A,00700,A,you who have been the best friend i ever had in my life want gratitude to you nobody is equal to you i care for nobody as i do for you oh miss woodhouse how ungrateful i have been
p00701_A,00701,A,well miss woodhouse well miss woodhouse what do you think of her is not she very charming
p00702_A,00702,A,oh yes very a very pleasing young woman
p00703_A,00703,A,i think her beautiful quite beautiful
p00704_A,00704,A,very nicely dressed indeed a remarkably elegant gown
p00705_A,00705,A,i am not at all surprized that he should have fallen in love
p00706_A,00706,A,oh no there is nothing to surprize one at all a pretty fortune and she came in his way
p00707_A,00707,A,i dare say i dare say she was very much attached to him
p00708_A,00708,A,perhaps she might but it is not every man s fate to marry the woman who loves him best miss hawkins perhaps wanted a home and thought this the best offer she was likely to have
p00709_A,00709,A,my brother mr suckling s seat and the staircase you know as i came in i observed how very like the staircase was placed exactly in the same part of the house i really could not help exclaiming i assure you miss woodhouse it is very delightful to me to be reminded of a place i am so extremely partial to as maple grove i have spent so many happy months there a charming place undoubtedly every body who sees it is struck by its beauty but to me it has been quite a home whenever you are transplanted like me miss woodhouse you will understand how very delightful it is to meet with any thing at all like what one has left behind i always say this is quite one of the evils of matrimony so extremely like maple grove and it is not merely the house the grounds i assure you as far as i could observe are strikingly like the laurels at maple grove are in the same profusion as here and stand very much in the same way just across the lawn and i had a glimpse of a fine large tree with a bench round it which put me so exactly in mind my brother and sister will be enchanted with this place people who have extensive grounds themselves are always pleased with any thing in the same style
p00710_A,00710,A,when you have seen more of this country i am afraid you will think you have overrated hartfield surry is full of beauties
p00711_A,00711,A,oh yes i am quite aware of that it is the garden of england you know surry is the garden of england
p00712_A,00712,A,yes but we must not rest our claims on that distinction many counties i believe are called the garden of england as well as surry
