uid,pair_id,side,text
p00000_A,00000,A,hamidullah hamidullah am i late
p00001_A,00001,A,does there happen to be such a thing as a hookah in that happier world of yours
p00002_A,00002,A,oh not yet hookah is so jolly now
p00003_A,00003,A,why talk about the english brrrr why be either friends with the fellows or not friends let us shut them out and be jolly queen victoria and mrs bannister were the only exceptions and they re dead
p00004_A,00004,A,once is enough
p00005_A,00005,A,aunt they live most comfortably with my wife s mother where she was living when she died i can see them whenever i like they are such very very small children
p00006_A,00006,A,perhaps but later
p00007_A,00007,A,old callendar wants to see me at his bungalow he might have the politeness to say why
p00008_A,00008,A,i daresay not i daresay nothing he has found out our dinner hour that s all and chooses to interrupt us every time in order to show his power
p00009_A,00009,A,if my teeth are to be cleaned i don t go at all i am an indian it is an indian habit to take pan the civil surgeon must put up with it mohammed latif my bike please
p00010_A,00010,A,thank you mr syed mohammed i will
p00011_A,00011,A,why no there are six people present in my small room already please remain seated if you will excuse the informality
p00012_A,00012,A,cyril again you desert
p00013_A,00013,A,my great mistake has been taking our rulers as a joke
p00014_A,00014,A,i cannot endure committees i shall go right away
p00015_A,00015,A,but not in an indian state
p00016_A,00016,A,i do want to get away from british india even to a poor job i think i could write poetry there i wish i had lived in babur s time and fought and written for him gone gone and not even any use to say for it weakens us while we say it we need a king hamidullah it would make our lives easier as it is we must try to appreciate these quaint hindus my notion now is to try for some post as doctor in one of their states
p00017_A,00017,A,it is not going as far as mr ram chand
p00018_A,00018,A,i shall never be rich anywhere it is outside my character
p00019_A,00019,A,i chose not to discussion of the past is useless i have allowed her to keep her fortune and buy herself a husband in england for which it will be very necessary don t mention the matter again
p00020_A,00020,A,we are not in the law courts there are many ways of being a man mine is to express what is deepest in my heart
p00021_A,00021,A,a pleasant change for her if he did
p00022_A,00022,A,just still your meaning doesn t help me out of my difficulties i am determined to leave chandrapore the problem is for where i am determined to write poetry the problem is about what you give me no assistance but who does give me assistance no one is my friend all are traitors even my own children i have had enough of friends
p00023_A,00023,A,i am sorry it is ever since i was in prison my temper is strange take me forgive me
p00024_A,00024,A,they come before me separately but not so far together you had better prepare them for the united shock of my face
p00025_A,00025,A,do not apologize you are always late
p00026_A,00026,A,yes that is so imagine us both as addressing you from another and a happier world
p00027_A,00027,A,we all admire them aziz please pass me the hookah
p00028_A,00028,A,i learn now that this boy is in business as a leather merchant at cawnpore imagine how i long to see him and to pay his fare that this house may be his home but it is useless the other anglo indians will have got hold of him long ago he will probably think that i want something and i cannot face that from the son of my old friends oh what in this country has gone wrong with everything vakil sahib i ask you
p00029_A,00029,A,come and see my wife a little then
p00030_A,00030,A,yes he has done his duty do not tease him so he carries on his family two boys and their sister
p00031_A,00031,A,you mustn t put off what you think right that is why india is in such a plight because we put off things
p00032_A,00032,A,some case i daresay
p00033_A,00033,A,on the one hand he always does this on the other it may be a serious case and you cannot know had you not better clean your teeth after pan
p00034_A,00034,A,aziz aziz imprudent boy
p00035_A,00035,A,aziz he is trying to pull your leg don t believe him the villain
p00036_A,00036,A,it is far the wisest way to take them but not possible in the long run sooner or later a disaster such as yours occurs and reveals their secret thoughts about our character if god himself descended from heaven into their club and said you were innocent they would disbelieve him now you see why mahmoud ali and self waste so much time over intrigues and associate with creatures like ram chand
p00037_A,00037,A,where to turtons and burtons all are the same
p00038_A,00038,A,i believe the politicals are obliged to have better manners it amounts to no more
p00039_A,00039,A,oh that is going much too far
p00040_A,00040,A,but the money the money they will never pay an adequate salary those savage rajahs
p00041_A,00041,A,if you had been sensible and made miss quested pay
p00042_A,00042,A,very well but your life must continue a poor man s no holidays in kashmir for you yet you must stick to your profession and rise to a highly paid post not retire to a jungle state and write poems educate your children read the latest scientific periodicals compel european doctors to respect you accept the consequences of your own actions like a man
p00043_A,00043,A,when miss quested stopped in the college fielding used to visit her rather too late in the evening the servants say
p00044_A,00044,A,but you understand my meaning
p00045_A,00045,A,i was going to suggest we go behind the purdah but your three treacherous children are there so you will not want to
p00046_A,00046,A,nureddin s mother is visiting my wife now that is all right i think
p00047_A,00047,A,no let us surprise them without warning far too much nonsense still goes on among our ladies they pretended at the time of your trial they would give up purdah indeed those of them who can write composed a document to that effect and now it ends in humbug you know how deeply they all respect fielding but not one of them has seen him my wife says she will but always when he calls there is some excuse she is not feeling well she is ashamed of the room she has no nice sweets to offer him only elephants ears and if i say elephants ears are mr fielding s favourite sweet she replies that he will know how badly hers are made so she cannot see him on their account for fifteen years my dear boy have i argued with my begum for fifteen years and never gained a point yet the missionaries inform us our women are down trodden if you want a subject for a poem take this the indian lady as she is and not as she is supposed to be
p00048_A,00048,A,kindly answer my question am i late has mahmoud ali eaten all the food if so i go elsewhere mr mahmoud ali how are you
p00049_A,00049,A,dying before your dinner oh poor mahmoud ali
p00050_A,00050,A,why isn t cyril following let us turn back
p00051_A,00051,A,oh my god my god he called him a nigger did he
p00052_A,00052,A,thank you dr aziz i am dying
p00053_A,00053,A,they are torturing him
p00054_A,00054,A,they are callendar boasted so before the trial i heard through the tatties he said
p00055_A,00055,A,hamidullah here is actually dead he passed away just as you rode up on your bike
p00056_A,00056,A,well look at my own experience this morning
p00057_A,00057,A,it is impossible here aziz the red nosed boy has again insulted me in court i do not blame him he was told that he ought to insult me until lately he was quite a nice boy but the others have got hold of him
p00058_A,00058,A,he would expect you to steal it now turton but red nosed boy will be far worse than turton
p00059_A,00059,A,did you not know that when they were lent to central india over a canal scheme some rajah or other gave her a sewing machine in solid gold so that the water should run through his state
p00060_A,00060,A,no that is where mrs turton is so skilful when we poor blacks take bribes we perform what we are bribed to perform and the law discovers us in consequence the english take and do nothing i admire them
p00061_A,00061,A,queen victoria was different
p00062_A,00062,A,but of course all this is exceptional the exception does not prove the rule the average woman is like mrs turton and aziz you know what she is
p00063_A,00063,A,aziz don t chatter we are having a very sad talk
p00064_A,00064,A,i only contend that it is possible in england
p00065_A,00065,A,yes they have no chance here that is my point they come out intending to be gentlemen and are told it will not do look at lesley look at blakiston now it is your red nosed boy and fielding will go next why i remember when turton came out first it was in another part of the province you fellows will not believe me but i have driven with turton in his carriage turton oh yes we were once quite intimate he has shown me his stamp collection
p00066_A,00066,A,i do not think so they all become exactly the same not worse not better i give any englishman two years be he turton or burton it is only the difference of a letter and i give any englishwoman six months all are exactly alike do you not agree with me
p00067_A,00067,A,and does it
p00068_A,00068,A,you are a very selfish boy but take my case the case of young hugh bannister here is the son of my dear my dead friends the reverend and mrs bannister whose goodness to me in england i shall never forget or describe they were father and mother to me i talked to them as i do now in the vacations their rectory became my home they entrusted all their children to me i often carried little hugh about i took him up to the funeral of queen victoria and held him in my arms above the crowd
p00069_A,00069,A,no no i do not admit that i have met others
p00070_A,00070,A,yet some orderly demonstration is necessary otherwise they will still think we are afraid
p00071_A,00071,A,she said in the most natural way she offered me a lozenge when the dust irritated my throat
p00072_A,00072,A,and he sends them the whole of his salary and lives like a low grade clerk and tells no one the reason what more do you require him to do
p00073_A,00073,A,what is to become of all our daughters if men refuse to marry they will marry beneath them or
p00074_A,00074,A,mrs lesley it is a tonga
p00075_A,00075,A,o tonga wallah club club why doesn t the fool go
p00076_A,00076,A,i say is he ill or isn t he ill
p00077_A,00077,A,saying nothing then i will write him a letter tell him i have called that is sufficient here is my card call me a tonga
p00078_A,00078,A,huzoor all are at the club
p00079_A,00079,A,madam madam madam
p00080_A,00080,A,madam this is a mosque you have no right here at all you should have taken off your shoes this is a holy place for moslems
p00081_A,00081,A,you have
p00082_A,00082,A,then i ask your pardon i am truly sorry for speaking
p00083_A,00083,A,of course but so few ladies take the trouble especially if thinking no one is there to see
p00084_A,00084,A,oh can i do you some service now or at any time
p00085_A,00085,A,may i know your name
p00086_A,00086,A,mrs mrs moore i am afraid i startled you i shall tell my community our friends about you that god is here very good very fine indeed i think you are newly arrived in india
p00087_A,00087,A,by the way you address me no but can i call you a carriage
p00088_A,00088,A,what was the name of the play
p00089_A,00089,A,i think you ought not to walk at night alone mrs moore there are bad characters about and leopards may come across from the marabar hills snakes also for example a six spot beetle you pick it up it bites you die
p00090_A,00090,A,oh i am used to it
p00091_A,00091,A,i m a doctor snakes don t dare bite me please may i ask you a question now why do you come to india at this time of year just as the cold weather is ending
p00092_A,00092,A,it will soon be so unhealthy for you and why ever do you come to chandrapore
p00093_A,00093,A,oh no excuse me that is quite impossible our city magistrate s name is mr heaslop i know him intimately
p00094_A,00094,A,but mrs moore how can he be
p00095_A,00095,A,yes now i see and your first husband died
p00096_A,00096,A,then we are in the same box then is the city magistrate the entire of your family now
p00097_A,00097,A,and the gentleman here is he ralph and stella s half brother
p00098_A,00098,A,mrs moore this is all extremely strange because like yourself i have also two sons and a daughter is not this the same box with a vengeance
p00099_A,00099,A,no indeed how funny it sounds their names are quite different and will surprise you listen please i am about to tell you my children s names the first is called ahmed the second is called karim the third she is the eldest jamila three children are enough do not you agree with me
p00100_A,00100,A,would you care to see over the minto hospital one morning i have nothing else to offer at chandrapore
p00101_A,00101,A,i suppose the civil surgeon took you
p00102_A,00102,A,ah a very charming lady
p00103_A,00103,A,what what you didn t like her
p00104_A,00104,A,she has just taken my tonga without my permission do you call that being charming and major callendar interrupts me night after night from where i am dining with my friends and i go at once breaking up a most pleasant entertainment and he is not there and not even a message is this charming pray but what does it matter i can do nothing and he knows it i am just a subordinate my time is of no value the verandah is good enough for an indian yes yes let him stand and mrs callendar takes my carriage and cuts me dead you understand me you know what others feel oh if others resembled you
p00105_A,00105,A,there honestly is none we are by nature a most informal people
p00106_A,00106,A,that is even more impossible but may i know the facts
p00107_A,00107,A,there ll be no muddle when you come to see me mrs moore and everyone i invite you all oh please oh but we will talk of something else now i wish i lived here see this beautiful room let us admire it together for a little see those curves at the bottom of the arches what delicacy it is the architecture of question and answer mrs moore you are in india i am not joking i am doing justice here a poor widow who has been robbed comes along and i give her fifty rupees to another a hundred and so on and so on i should like that
p00108_A,00108,A,mrs moore miss quested our expedition is a ruin
p00109_A,00109,A,how is that oh explain to me
p00110_A,00110,A,do you ever remember our mosque mrs moore
p00111_A,00111,A,and how rough and rude i was and how good you were
p00112_A,00112,A,certainly miss quested so you and i will go together and leave mrs moore here and we will not be long yet we will not hurry because we know that will be her wish
p00113_A,00113,A,dear mrs moore what does anything matter so long as you are my guests i am very glad you are not coming which sounds strange but you are treating me with true frankness as a friend yes i am your friend so may i make another suggestion don t let so many people come with you this time i think you may find it more convenient exactly exactly is that all right
p00114_A,00114,A,oh oh
p00115_A,00115,A,i have taken them off
p00116_A,00116,A,i left them at the entrance
p00117_A,00117,A,yes i was right was i not if i remove my shoes i am allowed
p00118_A,00118,A,please let me go
p00119_A,00119,A,no thank you really none good night
p00120_A,00120,A,mrs moore
p00121_A,00121,A,yes how did you know
p00122_A,00122,A,i have only come from the club they are doing a play that i have seen in london and it was so hot
p00123_A,00123,A,cousin kate
p00124_A,00124,A,but you walk about yourself
p00125_A,00125,A,used to snakes
p00126_A,00126,A,i intended to start earlier but there was an unavoidable delay
p00127_A,00127,A,to visit my son he is the city magistrate here
p00128_A,00128,A,he s my son all the same
p00129_A,00129,A,i was married twice
p00130_A,00130,A,he did and so did my second husband
p00131_A,00131,A,no there are the younger ones ralph and stella in england
p00132_A,00132,A,quite right
p00133_A,00133,A,what are their names not also ronny ralph and stella surely
p00134_A,00134,A,i do
p00135_A,00135,A,thank you i have seen it already or i should have liked to come with you very much
p00136_A,00136,A,yes and mrs callendar
p00137_A,00137,A,possibly when one knows her better
p00138_A,00138,A,she was certainly intending to be kind but i did not find her exactly charming
p00139_A,00139,A,i don t think i understand people very well i only know whether i like or dislike them
p00140_A,00140,A,i am afraid we must have made some blunder and given offence
p00141_A,00141,A,india s oh what an alarming idea
p00142_A,00142,A,rupees don t last for ever i m afraid
p00143_A,00143,A,good bye dr aziz
p00144_A,00144,A,get in get in you ll kill yourself as well as mr fielding i see no ruin
p00145_A,00145,A,i do i do
p00146_A,00146,A,and how happy we both were
p00147_A,00147,A,quite right i m sorry not to come too but i m a poor walker
p00148_A,00148,A,aziz where have you put miss quested to
p00149_A,00149,A,i want to see the real india
p00150_A,00150,A,it ll end in an elephant ride it always does look at this evening cousin kate imagine cousin kate but where have you been off to did you succeed in catching the moon in the ganges
p00151_A,00151,A,the angle would have altered she rises later
p00152_A,00152,A,this sounds very romantic you meet a young man in a mosque and then never let me know
p00153_A,00153,A,was he nice
p00154_A,00154,A,i dislike them not because i m english but from my own personal point of view
p00155_A,00155,A,and nasty
p00156_A,00156,A,i should like to i don t feel a bit excited i m just glad it s settled up at last but i m not conscious of vast changes we are all three the same people still
p00157_A,00157,A,i suppose so
p00158_A,00158,A,you heard me tell aziz and godbole i wasn t stopping in their country i didn t mean it so why did i say it i feel i haven t been frank enough attentive enough or something it s as if i got everything out of proportion you have been so very good to me and i meant to be good when i sailed but somehow i haven t been mrs moore if one isn t absolutely honest what is the use of existing
p00159_A,00159,A,you mean that my bothers are mixed up with india
p00160_A,00160,A,what made you call it a ghost
p00161_A,00161,A,the animal thing that hit us didn t you say oh a ghost in passing
p00162_A,00162,A,it was probably a hyena as a matter of fact
p00163_A,00163,A,what a nice cheerful servant what a relief after antony
p00164_A,00164,A,i want to sack antony his behaviour on the platform has decided me anyhow we must get a second servant because at simla you will be at the hotel and i don t think ronny s baldeo
p00165_A,00165,A,i don t believe in the hot weather people like major callendar who always talk about it it s in the hope of making one feel inexperienced and small like their everlasting i ve been twenty years in this country
p00166_A,00166,A,i won t be bottled up i ve no patience with these women here who leave their husbands grilling in the plains mrs mcbryde hasn t stopped down once since she married she leaves her quite intelligent husband alone half the year and then s surprised she s out of touch with him
p00167_A,00167,A,oh yes that s true
p00168_A,00168,A,oh yes you re perfectly right i never thought it out
p00169_A,00169,A,my idea now is that my cousins shall find me a servant in simla at all events to see me through the wedding after which ronny means to reorganize his staff entirely he does it very well for a bachelor still when he is married no doubt various changes will have to be made his old servants won t want to take their orders from me and i don t blame them anything to be seen of the hills
p00170_A,00170,A,we can t be far from the place where my hyena was perhaps this is mine anyhow the road runs parallel with the railway i will fetch you from simla when it s cool enough i will unbottle you in fact we then see some of the mogul stuff how appalling if we let you miss the taj and then i will see you off at bombay your last glimpse of this country really shall be interesting they re rather wonderful i ld not have missed this for anything look the sun s rising this ll be absolutely magnificent come quickly look i wouldn t have missed this for anything we should never have seen it if we d stuck to the turtons and their eternal elephants ah that must be the false dawn isn t it caused by dust in the upper layers of the atmosphere that couldn t fall down during the night i think mr mcbryde said so well i must admit that england has it as regards sunrises do you remember grasmere
p00171_A,00171,A,a snake it isn t a snake
p00172_A,00172,A,mrs moore may i put our difficulty to dr aziz i mean our anglo indian one
p00173_A,00173,A,but he says this isn t a good cave the best are on the kawa dol
p00174_A,00174,A,very well let s sit down again in the shade until breakfast s ready
p00175_A,00175,A,i am counting on you to help me through it is such a blessing to be with you again everyone else is a stranger i know it s all nothing i must be sensible i do try
p00176_A,00176,A,yes i mean that at least not exactly but there is this echo that i keep on hearing
p00177_A,00177,A,i can t get rid of it
p00178_A,00178,A,mrs moore what is this echo
p00179_A,00179,A,no what is it oh do say i felt you would be able to explain it this will comfort me so
p00180_A,00180,A,i think you re rather unkind not to say
p00181_A,00181,A,i ll not have you worry her whether she s well or ill
p00182_A,00182,A,i thought you said but it was in mr fielding s letter
p00183_A,00183,A,i know but
p00184_A,00184,A,i don t hear it so much you send it away you do nothing but good you are so good
p00185_A,00185,A,i want to see it too and i only wish we could apparently the turtons will arrange something for next tuesday
p00186_A,00186,A,i went to the mosque but i did not catch the moon
p00187_A,00187,A,ah yes so the young man there said
p00188_A,00188,A,i was going to tell you adela but something changed the conversation and i forgot my memory grows deplorable
p00189_A,00189,A,i believe that you have oh please it distresses me beyond words
p00190_A,00190,A,don t you come too adela you dislike institutions
p00191_A,00191,A,mother is pledged to nothing certainly not to this polo will you drive up to the bungalow first and drop me there please i prefer to rest
p00192_A,00192,A,i ve never heard of these caves i don t know what or where they are but i really can t have so much quarrelling and tiresomeness
p00193_A,00193,A,will you play patience with your future mother in law dear adela or does it seem too tame
p00194_A,00194,A,that s much the best feeling to have
p00195_A,00195,A,i feared at mr fielding s that it might be settled the other way black knave on a red queen
p00196_A,00196,A,i wouldn t worry it s partly the odd surroundings you and i keep on attending to trifles instead of what s important we are what the people here call new
p00197_A,00197,A,india s
p00198_A,00198,A,call what a ghost
p00199_A,00199,A,i couldn t have been thinking of what i was saying
p00200_A,00200,A,we shall be all moslems together now as you promised
p00201_A,00201,A,they startle one rather a strange place to make tea in
p00202_A,00202,A,very well you get another servant and i ll keep antony with me i am used to his unappetizing ways he will see me through the hot weather
p00203_A,00203,A,i believe in the hot weather but never did i suppose it would bottle me up as it will
p00204_A,00204,A,she has children you see
p00205_A,00205,A,it is the children who are the first consideration until they are grown up and married off when that happens one has again the right to live for oneself in the plains or the hills as suits
p00206_A,00206,A,if one has not become too stupid and old
p00207_A,00207,A,only various shades of the dark
p00208_A,00208,A,it is your difficulty not mine my dear
p00209_A,00209,A,i forget
p00210_A,00210,A,i don t think i shall go on to there i dislike climbing
p00211_A,00211,A,ah but that ll disappoint him so he has taken such trouble you should go on you don t mind
p00212_A,00212,A,i shouldn t mind if it had happened anywhere else at least i really don t know where it did happen
p00213_A,00213,A,oh what of the echo
p00214_A,00214,A,i don t suppose you ever will
p00215_A,00215,A,don t you know
p00216_A,00216,A,if you don t know you don t know i can t tell you
p00217_A,00217,A,i have nothing to do with your ludicrous law courts i will not be dragged in at all
p00218_A,00218,A,i never said his name
p00219_A,00219,A,of course he is innocent
p00220_A,00220,A,oh how tedious trivial oh why is everything still my duty when shall i be free from your fuss was he in the cave and were you in the cave and on and on and unto us a son is born unto us a child is given and am i good and is he bad and are we saved and ending everything the echo
p00221_A,00221,A,come india s not as bad as all that other side of the earth if you like but we stick to the same old moon
p00222_A,00222,A,listen mohammed latif says good morning next
p00223_A,00223,A,fielding how s one to see the real india
p00224_A,00224,A,i say old man do excuse me but i think perhaps you oughtn t to have left miss quested alone
p00225_A,00225,A,well i m the sun dried bureaucrat no doubt still i don t like to see an english girl left smoking with two indians
p00226_A,00226,A,yes that s all right in england
p00227_A,00227,A,if you can t see you can t see can t you see that fellow s a bounder
p00228_A,00228,A,what should have upset his precious nerves
p00229_A,00229,A,well it s nothing i ve said i never even spoke to him
p00230_A,00230,A,fielding don t think i m taking it badly or anything of that sort i suppose you won t come on to the polo with us we should all be delighted
