uid,pair_id,side,text
p00635_B,00635,B,you are very kind i should have said yes i think but i agree with mr hamidullah i must give no more trouble to you i believe my best plan is to return to the turtons and see if they will allow me to sleep and if they turn me away i must go to the dak the collector would take me in i know but mrs turton said this morning that she would never see me again
p00636_B,00636,B,perhaps it was the guide
p00637_B,00637,B,exorcise in that sense i thought you meant i d seen a ghost
p00638_B,00638,B,very very much indeed it s what i long for this party to day makes me so angry and miserable i think my countrymen out here must be mad fancy inviting guests and not treating them properly you and mr turton and perhaps mr mcbryde are the only people who showed any common politeness the rest make me perfectly ashamed and it s got worse and worse oh just what we wanted to hear and do you know doctor aziz
p00639_B,00639,B,i am not this false start has been all my own fault i was bringing to ronny nothing that ought to be brought that was why he rejected me really i entered that cave thinking am i fond of him i have not yet told you that mr fielding i didn t feel justified tenderness respect personal intercourse i tried to make them take the place of
p00640_B,00640,B,oh nancy how topping oh nancy how killing i wish i could look at things like that
p00641_B,00641,B,mother s looking forward to seeing you but of course she s old one mustn t forget that old people never take things as one expects in my opinion
p00642_B,00642,B,does adela talk to you much i m so driven with work i don t see her as much as i hoped but i hope she finds things comfortable
p00643_B,00643,B,sir excuse me i did i mounted my bike and it bust in front of the cow hospital so i had to find a tonga
p00644_B,00644,B,i beg your pardon
p00645_B,00645,B,i must tell that to mahmoud ali it ll make him laugh
p00646_B,00646,B,oh lord oh lord when i live here and you live there not ten minutes from me and the cow hospital is right ever so far away the other side of you there then how did you come to be passing the cow hospital on the way to me now do some work for a change
p00647_B,00647,B,bust in front of the cow hospital did it and how did you come to be there
p00648_B,00648,B,dr lal
p00649_B,00649,B,how unhappy i am how unhappy i am
p00650_B,00650,B,i go or not as i please
p00651_B,00651,B,and so much my dear rafi for your cholera
p00652_B,00652,B,but dr lal consider how could i send my servant when you were coming you come we go my house is left alone my servant comes back perhaps and all my portable property has been carried away by bad characters in the meantime would you have that the cook is deaf i can never count on my cook and the boy is only a little boy never never do i and hassan leave the house at the same time together it is my fixed rule
p00653_B,00653,B,i am so awfully sorry i was compelled to go to the post office
p00654_B,00654,B,you sit on my leg
p00655_B,00655,B,they can damn well comment
p00656_B,00656,B,i have so few my scale is very small
p00657_B,00657,B,oh god don t you ever fall off
p00658_B,00658,B,all right
p00659_B,00659,B,often play
p00660_B,00660,B,post office do you not send your servants
p00661_B,00661,B,your servant spoke to me i saw your servant
p00662_B,00662,B,it is fine to be young damn well oh very fine damn whom
p00663_B,00663,B,i beg pardon but some might say your leg kicks
p00664_B,00664,B,yet you promise me and then fabricate this tale of a telegram go forward dapple
p00665_B,00665,B,even if this so what prevents leaving a chit saying where you go farther away or mine will start out of sympathy it has been so rough and wild this afternoon it spoiled some most valuable blossoms in the club garden and had to be dragged back by four men english ladies and gentlemen looking on and the collector sahib himself taking a note but dr aziz i ll not take up your valuable time this will not interest you who have so many engagements and telegrams i am just a poor old doctor who thought right to pay my respects when i was asked and where i was asked your absence i may remark drew commentaries
p00666_B,00666,B,cholera cholera what next what now who spreads such untrue reports about my patients i hear cholera i hear bubonic plague i hear every species of lie where will it end i ask myself sometimes this city is full of misstatements and the originators of them ought to be discovered and punished authoritatively
p00667_B,00667,B,dr aziz
p00668_B,00668,B,i don t know
p00669_B,00669,B,the fault is entirely mine but i believe you i believe mohammed latif shall be severely punished for inventing this
p00670_B,00670,B,tell him also i have nothing to say to him but he is indeed a wise boy and has always one indian friend i partly love him because he brought me back to you to say good bye for this is good bye cyril though to think about it will spoil our ride and make us sad
p00671_B,00671,B,just as i have two boys and a girl so has mrs moore she told me in the mosque
p00672_B,00672,B,hamidullah liked them in england here we never look at them oh no much too careful let s talk of something else
p00673_B,00673,B,don t trouble i ll bike
p00674_B,00674,B,cyril i have had an idea which will satisfy your tender mind i shall consult mrs moore her opinion will solve everything i can trust her so absolutely if she advises me to pardon this girl i shall do so she will counsel me nothing against my real and true honour as you might
p00675_B,00675,B,in my usual health
p00676_B,00676,B,i can rest the whole day thanks to worthy dr lal major callendar s spy i suppose you know but this time it didn t work i am allowed to have a slight temperature
p00677_B,00677,B,of course not but the word exists and is convenient all men are my brothers and as soon as one behaves as such he may see my wife
p00678_B,00678,B,i thought you might end in england
p00679_B,00679,B,mrs moore miss quested our expedition is a ruin
p00680_B,00680,B,but you haven t children
p00681_B,00681,B,i have seen her but three times but i know she is an oriental
p00682_B,00682,B,sh my dear chap don t mention that part hundreds and hundreds of rupees the completed account will be too awful my friends servants have robbed me right and left and as for an elephant she apparently eats gold i can trust you not to repeat this and m l please employ initials he listens is far the worst of all
p00683_B,00683,B,i don t want to hear your long talks
p00684_B,00684,B,millions of paths my dear fellow
p00685_B,00685,B,clear out all you turtons and burtons we wanted to know you ten years back now it s too late if we see you and sit on your committees it s for political reasons don t you make any mistake clear out clear out i say why are we put to so much suffering we used to blame you now we blame ourselves we grow wiser until england is in difficulties we keep silent but in the next european war aha aha then is our time
p00686_B,00686,B,but i always thought that englishmen kept their rooms so tidy it seems that this is not so i need not be so ashamed everything ranged coldly on shelves was what i thought i say mr fielding is the stud going to go in
p00687_B,00687,B,mrs moore did not mention that to me among her plans
p00688_B,00688,B,is she wealthy i depute you to find out
p00689_B,00689,B,why don t you marry miss quested
p00690_B,00690,B,no doubt major callendar has told you that i am shamming
p00691_B,00691,B,caring has nothing to do with it
p00692_B,00692,B,oh yes i remember an excessively aged lady but will you please repeat the name of her companion
p00693_B,00693,B,exactly got a cigarette
p00694_B,00694,B,before you go for you are evidently in a great hurry will you please unlock that drawer do you see a piece of brown paper at the top
p00695_B,00695,B,and pray what is wrong with my attitude
p00696_B,00696,B,has she indeed i am so glad
p00697_B,00697,B,yes yes she and miss derek and go off in the car
p00698_B,00698,B,do i mispronounce that well known name is he not your wife s brother
p00699_B,00699,B,he is a most powerful man
p00700_B,00700,B,dinner this is most unlucky i forgot i have promised to dine with das
p00701_B,00701,B,how much do you make out of yours
p00702_B,00702,B,i know nothing at all about the religion here i should never think of watching it myself
p00703_B,00703,B,one minute again
p00704_B,00704,B,cyril that boastfulness about travelling light will be your ruin it is raising up enemies against you on all sides and makes me feel excessively uneasy
p00705_B,00705,B,take mine take mine
p00706_B,00706,B,perhaps some day just now i see mrs moore and what s her name coming
p00707_B,00707,B,she would have wanted me if she was ill to attend her
p00708_B,00708,B,it is because you can say and feel such a remark as that that i show you the photograph it is beyond the power of most men it is because you behave well while i behave badly that i show it you i never expected you to come back just now when i called you i thought mr fielding no one can ever realize how much kindness we indians need we do not even realize it ourselves but we know when it has been given we do not forget though we may seem to kindness more kindness and even after that more kindness i assure you it is the only hope we can t build up india except on what we feel what is the use of all these reforms and conciliation committees for mohurram and shall we cut the tazia short or shall we carry it another route and councils of notables and official parties where the english sneer at our skins
p00709_B,00709,B,to those other children
p00710_B,00710,B,may i really mr fielding it s very good of you i like unconventional behaviour so extremely the fact is i have long wanted to meet you i have heard so much about your warm heart from the nawab bahadur but where is one to meet in a wretched hole like chandrapore when i was greener here i ll tell you what i used to wish you to fall ill so that we could meet that way i said to myself how does mr fielding look this morning perhaps pale and the civil surgeon is pale too he will not be able to attend upon him when the shivering commences i should have been sent for instead then we would have had jolly talks for you are a celebrated student of persian poetry
p00711_B,00711,B,is it not strange i keep on forgetting she has left india during the shouting of her name in court i fancied she was present i had shut my eyes i confused myself on purpose to deaden the pain now this very instant i forgot again i shall be obliged to write she is now far away well on her way towards ralph and stella
p00712_B,00712,B,explain in detail
p00713_B,00713,B,do you contradict my last remark
p00714_B,00714,B,oh rather most helpful
p00715_B,00715,B,yes yes but you didn t contradict what i said so i thought it was true oh dear east and west most misleading will you please put your little rotter down at his hospital
p00716_B,00716,B,poetry let us discuss why poetry has lost the power of making men brave my mother s father was also a poet and fought against you in the mutiny i might equal him if there was another mutiny as it is i am a doctor who has won a case and has three children to support and whose chief subject of conversation is official plans
p00717_B,00717,B,i expected you to make such a reply you are a faithful friend shall we now talk about something else
p00718_B,00718,B,yes yes one minute
p00719_B,00719,B,i do not consider mrs moore my friend i only met her accidentally in my mosque a single meeting is too short to make a friend
p00720_B,00720,B,that s all very well but you spoke against morality also and you said you had come to take other people s jobs all that was very unwise this is an awful place for scandal why actually one of your own pupils was listening
p00721_B,00721,B,not the least i ll send an embrocation over to the guest house i heard you were settled in there
p00722_B,00722,B,let them sing it
p00723_B,00723,B,it is useless discussing hindus with me living with them teaches me no more when i think i annoy them i do not when i think i don t annoy them i do perhaps they will sack me for tumbling on to their dolls house on the other hand perhaps they will double my salary time will prove why so curious about them
p00724_B,00724,B,i ve not don t be ridiculous
p00725_B,00725,B,well this indifference is what the oriental will never understand
p00726_B,00726,B,most certainly i am not
p00727_B,00727,B,but speaking out may get you into trouble
p00728_B,00728,B,jolly good poems i m getting published bombay side
p00729_B,00729,B,prig prig kindly explain isn t that a bad word
p00730_B,00730,B,what is hampstead
p00731_B,00731,B,i see anything further to complain of because it is far better you put all your difficulties before me if we are to be friends for ever you do not like mrs moore and are annoyed because i do however you will like her in time
p00732_B,00732,B,not even mogul emperors showed mercy until they received an apology
p00733_B,00733,B,this evening will do for schoolmastery i should go straight to the minto now the cholera looks bad we begin to have local cases as well as imported in fact the whole of life is somewhat sad the new civil surgeon is the same as the last but does not yet dare to be that is all any administrative change amounts to all my suffering has won nothing for us but look here cyril while i remember it there s gossip about you as well as mcbryde they say that you and miss quested became also rather too intimate friends to speak perfectly frankly they say you and she have been guilty of impropriety
p00734_B,00734,B,what s that last sentence please will you teach me some new words and so improve my english let me put in your stud i see the shirt back s hole is rather small and to rip it wider a pity
p00735_B,00735,B,perhaps your letter never reached the minister in question
p00736_B,00736,B,when you called me a little rotter
p00737_B,00737,B,no so let us have a talk let us dream plans for the future
p00738_B,00738,B,except that i ate too much i say panna lal and callendar ll get the sack
p00739_B,00739,B,enquire from dr panna lal
p00740_B,00740,B,if i m biking in english dress starch collar hat with ditch they take no notice when i wear a fez they cry your lamp s out lord curzon did not consider this when he urged natives of india to retain their picturesque costumes hooray stud s gone in sometimes i shut my eyes and dream i have splendid clothes again and am riding into battle behind alamgir mr fielding must not india have been beautiful then with the mogul empire at its height and alamgir reigning at delhi upon the peacock throne
p00741_B,00741,B,i am delighted with him really he has made my guests comfortable besides it is my duty to employ him he is my cousin if money goes money comes if money stays death comes did you ever hear that useful urdu proverb probably not for i have just invented it
p00742_B,00742,B,what is the nature of the business will it leave you much spare time
p00743_B,00743,B,you should never have left them
p00744_B,00744,B,oh presumably
p00745_B,00745,B,travel light you are a most extraordinary race is it your climate or what
p00746_B,00746,B,i will not really and besides your position makes it dangerous for you you can t be too careful in every way mr fielding whatever you say or do in this damned country there is always some envious fellow on the look out you may be surprised to know that there were at least three spies sitting here when you came to enquire i was really a good deal upset that you talked in that fashion about god they will certainly report it
p00747_B,00747,B,there goes a queer chap i trust he won t come to grief
p00748_B,00748,B,is emotion a sack of potatoes so much the pound to be measured out am i a machine i shall be told i can use up my emotions by using them next
p00749_B,00749,B,that is nothing of course we all of us make mistakes in a friendship such as ours a few slips are of no consequence
p00750_B,00750,B,meet me i know no ladies
p00751_B,00751,B,colonel maggs broke the oars when here last
p00752_B,00752,B,oh no why
p00753_B,00753,B,yes that way
p00754_B,00754,B,do you promise to come at once to us when you are in trouble
p00755_B,00755,B,she was my wife you are the first englishman she has ever come before now put her photograph away
p00756_B,00756,B,there are two boats
p00757_B,00757,B,old story of we will rob every man and rape every woman from peshawar to calcutta i suppose which you get some nobody to repeat and then quote every week in the pioneer in order to frighten us into retaining you we know india shall be a nation no foreigners of any sort hindu and moslem and sikh and all shall be one hurrah hurrah for india hurrah hurrah down with the english anyhow that s certain clear out you fellows double quick i say we may hate one another but we hate you most if i don t make you go ahmed will karim will if it s fifty five hundred years we shall get rid of you yes we shall drive every blasted englishman into the sea and then and then you and i shall be friends
p00758_B,00758,B,yes you re out of it my poor chap no miss quested for mr fielding however she was not beautiful she has practically no breasts if you come to think of it for the city magistrate they shall be sufficient perhaps and he for her for you i shall arrange a lady with breasts like mangoes
p00759_B,00759,B,of course of course you know me
p00760_B,00760,B,cyril cyril don t leave me
p00761_B,00761,B,certainly not
p00762_B,00762,B,jump in mr quested and mr fielding
p00763_B,00763,B,just as you wish
p00764_B,00764,B,no no one in my pocket here it is
p00765_B,00765,B,i am looking though it gets a bit dark i see cyril fielding to be a very nice chap indeed and my best friend but in some ways a fool you think that by letting miss quested off easily i shall make a better reputation for myself and indians generally no no it will be put down to weakness and the attempt to gain promotion officially i have decided to have nothing more to do with british india as a matter of fact i shall seek service in some moslem state such as hyderabad bhopal where englishmen cannot insult me any more don t counsel me otherwise
p00766_B,00766,B,oh it s nothing she was not a highly educated woman or even beautiful but put it away you would have seen her so why should you not see her photograph
p00767_B,00767,B,my children and my name
p00768_B,00768,B,so she is and here is heaslop s brother and you his brother in law and good bye what does it matter to me who you marry don t trouble me here at mau is all i ask i do not want you i do not want one of you in my private life with my dying breath i say it yes yes i made a foolish blunder despise me and feel cold i thought you married my enemy i never read your letter mahmoud ali deceived me i thought you d stolen my money but it s as if you stole it i forgive mahmoud ali all things because he loved me my heart is for my own people henceforward please do not follow us whomever you marry i wish no englishman or englishwoman to be my friend
p00769_B,00769,B,put her away she is of no importance she is dead i showed her to you because i have nothing else to show you may look round the whole of my bungalow now and empty everything i have no other secrets my three children live away with their grandmamma and that is all
p00770_B,00770,B,why when you yourself are an atheist
p00771_B,00771,B,is she a post impressionist
p00772_B,00772,B,you mind for miss quested s sake though i can see from your face
p00773_B,00773,B,i should think not do you know what deccani brahmans say that england conquered india from them from them mind and not from the moguls is not that like their cheek they have even bribed it to appear in text books for they are so subtle and immensely rich professor godbole must be quite unlike all other deccani brahmans from all i can hear say a most sincere chap
p00774_B,00774,B,i know my dear chap i know your voice need not become so solemn and anxious i know what you are going to say next let oh let miss quested off paying so that the english may say the approval of your compatriots no longer interests me i have become anti british and ought to have done so sooner it would have saved me numerous misfortunes
p00775_B,00775,B,why no there are six people present in my small room already please remain seated if you will excuse the informality
p00776_B,00776,B,we wear them to pass the police
p00777_B,00777,B,up there
p00778_B,00778,B,i was a child when you knew me first everyone was my friend then the friend a persian expression for god but i do not want to be a religious poet either
p00779_B,00779,B,and you ll get promotion
p00780_B,00780,B,i see you re worrying let s talk of other things miss quested was always to do what she wished it was our arrangement i see you are worrying on my account but really i don t mind i never notice trifles
p00781_B,00781,B,this picnic is nothing to do with english or indian it is an expedition of friends
p00782_B,00782,B,oh shut up don t spoil our last hour with foolish questions leave krishna alone and talk about something sensible
p00783_B,00783,B,jolly good what next have i not a venerable white beard
p00784_B,00784,B,i thought her so nice and sincere
p00785_B,00785,B,in any case we spend our holidays together and visit kashmir possibly persia for i shall have plenty of money paid to me on account of the injury sustained by my character while with me you shall never spend a single pie this is what i have always wished and as the result of my misfortunes it has come
p00786_B,00786,B,sound reasoning i have not got my bicycle but i am seen too often in your carriage i am thought to take advantage of your generosity by mr ram chand
p00787_B,00787,B,then your name will entirely die out
p00788_B,00788,B,why not i believe in the purdah but i should have told her you were my brother and she would have seen you hamidullah saw her and several others
p00789_B,00789,B,i see your trick i want revenge on them why should i be insulted and suffer and the contents of my pockets read and my wife s photograph taken to the police station also i want the money to educate my little boys as i explained to her
p00790_B,00790,B,i like this conversation it may lead to something interesting
p00791_B,00791,B,i put up with all things in you so what is to be done
p00792_B,00792,B,it is those who stop in the country not those who leave it whom such a story injures imagine my dismay and anxiety i could scarcely get a wink of sleep first my name was coupled with her and now it is yours
p00793_B,00793,B,i have given you list after list of the people who cannot be trusted in this city in your position i should have the sense to know i was surrounded by enemies you observe i speak in a low voice it is because i see your sais is new how do i know he isn t a spy every third servant is a spy
p00794_B,00794,B,jump on i must have you
p00795_B,00795,B,if you are right there is no point in any friendship it all comes down to give and take or give and return which is disgusting and we had better all leap over this parapet and kill ourselves is anything wrong with you this evening that you grow so materialistic
p00796_B,00796,B,i suppose you will visit miss quested
p00797_B,00797,B,have i not lived all my life in india do i not know what produces a bad impression here
p00798_B,00798,B,so you and madamsell adela used to amuse one another in the evening naughty boy
p00799_B,00799,B,this is a very useless conversation i consider
p00800_B,00800,B,his highness s private secretary probably
p00801_B,00801,B,no the afghans my own ancestors
p00802_B,00802,B,but prig mr fielding how s that
p00803_B,00803,B,good night i suppose it is
p00804_B,00804,B,i have been here such a short time and always in the bazaar no wonder you have never seen me and i wonder you know my name i say mr fielding
p00805_B,00805,B,here s luck and here s to england oh yes that s quite likely i knew they d gone for a spin
p00806_B,00806,B,i know i gave him orders not to such are the tricks we play on unfortunate englishmen poor mr fielding but i will release you now oh dear with the exception of yourself and hamidullah i have no one to talk to in this place you like hamidullah don t you
p00807_B,00807,B,oh kick you out why should i trouble over that dirty job leave it to the politicians no when i was a student i got excited over your damned countrymen certainly but if they ll let me get on with my profession and not be too rude to me officially i really don t ask for more
p00808_B,00808,B,my dear chap officially they call it gokul ashtami all the state offices are closed but how else should it concern you and me
p00809_B,00809,B,i say shall we go and pour water on to mohammed latif s face he is so funny when this is done to him asleep
p00810_B,00810,B,very well and we have no use for you
p00811_B,00811,B,mohammed latif has taken to intriguing we are already much displeased with him will it satisfy you if we send him back to his family without a present
p00812_B,00812,B,why are you not married
p00813_B,00813,B,good night then dear fellow are you content with our day s work cyril
p00814_B,00814,B,there listen to that but the end of it might be that you lost your job
p00815_B,00815,B,it will be arranged a conference of oriental statesmen
p00816_B,00816,B,he will have invited other friends
p00817_B,00817,B,it s all over the town and may injure your reputation you know everyone is by no means your supporter i have tried all i could to silence such a story
p00818_B,00818,B,it is quite natural about miss quested we were having an interesting talk with our guide then the car was seen so she decided to go down to her friend she ran to her friend i to mine and now i am with my friends and they are with me and each other which is happiness
