uid,pair_id,side,text
p00914_A,00914,A,just as i have two boys and a girl so has mrs moore she told me in the mosque
p00915_A,00915,A,i have seen her but three times but i know she is an oriental
p00916_A,00916,A,is emotion a sack of potatoes so much the pound to be measured out am i a machine i shall be told i can use up my emotions by using them next
p00917_A,00917,A,if you are right there is no point in any friendship it all comes down to give and take or give and return which is disgusting and we had better all leap over this parapet and kill ourselves is anything wrong with you this evening that you grow so materialistic
p00918_A,00918,A,i see anything further to complain of because it is far better you put all your difficulties before me if we are to be friends for ever you do not like mrs moore and are annoyed because i do however you will like her in time
p00919_A,00919,A,i do not believe him
p00920_A,00920,A,give in to the east you can trust me cyril can t you see that i m grateful to you for your help and want to reward you
p00921_A,00921,A,that pure minded fellow however he will blame the indian climate everything is our fault really now have i not discovered an important piece of news for you cyril
p00922_A,00922,A,this evening will do for schoolmastery i should go straight to the minto now the cholera looks bad we begin to have local cases as well as imported in fact the whole of life is somewhat sad the new civil surgeon is the same as the last but does not yet dare to be that is all any administrative change amounts to all my suffering has won nothing for us but look here cyril while i remember it there s gossip about you as well as mcbryde they say that you and miss quested became also rather too intimate friends to speak perfectly frankly they say you and she have been guilty of impropriety
p00923_A,00923,A,it s all over the town and may injure your reputation you know everyone is by no means your supporter i have tried all i could to silence such a story
p00924_A,00924,A,it is those who stop in the country not those who leave it whom such a story injures imagine my dismay and anxiety i could scarcely get a wink of sleep first my name was coupled with her and now it is yours
p00925_A,00925,A,as what
p00926_A,00926,A,have i not lived all my life in india do i not know what produces a bad impression here
p00927_A,00927,A,you mind for miss quested s sake though i can see from your face
p00928_A,00928,A,cyril that boastfulness about travelling light will be your ruin it is raising up enemies against you on all sides and makes me feel excessively uneasy
p00929_A,00929,A,i have given you list after list of the people who cannot be trusted in this city in your position i should have the sense to know i was surrounded by enemies you observe i speak in a low voice it is because i see your sais is new how do i know he isn t a spy every third servant is a spy
p00930_A,00930,A,do you contradict my last remark
p00931_A,00931,A,i ve not don t be ridiculous
p00932_A,00932,A,so you and madamsell adela used to amuse one another in the evening naughty boy
p00933_A,00933,A,oh i beg your pardon i m sure the licentious oriental imagination was at work
p00934_A,00934,A,yes yes but you didn t contradict what i said so i thought it was true oh dear east and west most misleading will you please put your little rotter down at his hospital
p00935_A,00935,A,most certainly i am not
p00936_A,00936,A,it has been i believe absolutely what you say and of that there need be no further question
p00937_A,00937,A,the fault is entirely mine but i believe you i believe mohammed latif shall be severely punished for inventing this
p00938_A,00938,A,mohammed latif has taken to intriguing we are already much displeased with him will it satisfy you if we send him back to his family without a present
p00939_A,00939,A,dinner this is most unlucky i forgot i have promised to dine with das
p00940_A,00940,A,he will have invited other friends
p00941_A,00941,A,i thought you might end in england
p00942_A,00942,A,what is the nature of the business will it leave you much spare time
p00943_A,00943,A,i expected you to make such a reply you are a faithful friend shall we now talk about something else
p00944_A,00944,A,poetry let us discuss why poetry has lost the power of making men brave my mother s father was also a poet and fought against you in the mutiny i might equal him if there was another mutiny as it is i am a doctor who has won a case and has three children to support and whose chief subject of conversation is official plans
p00945_A,00945,A,i like this conversation it may lead to something interesting
p00946_A,00946,A,i was a child when you knew me first everyone was my friend then the friend a persian expression for god but i do not want to be a religious poet either
p00947_A,00947,A,why when you yourself are an atheist
p00948_A,00948,A,explain in detail
p00949_A,00949,A,let them sing it
p00950_A,00950,A,cyril you sometimes make a sensible remark that will do for poetry for the present let us now return to your english visit
p00951_A,00951,A,i suppose you will visit miss quested
p00952_A,00952,A,what is hampstead
p00953_A,00953,A,and there she lives in comfort you will enjoy seeing her dear me i ve got a headache this evening perhaps i am going to have cholera with your permission i ll leave early
p00954_A,00954,A,don t trouble i ll bike
p00955_A,00955,A,sound reasoning i have not got my bicycle but i am seen too often in your carriage i am thought to take advantage of your generosity by mr ram chand
p00956_A,00956,A,when you called me a little rotter
p00957_A,00957,A,hullo gentlemen are you in trouble lie down in a pool of water my dear sir here are plenty don t come near me i cannot control them they are state bees complain to his highness of their behaviour come pull yourself together and be a man
p00958_A,00958,A,not the least i ll send an embrocation over to the guest house i heard you were settled in there
p00959_A,00959,A,yes that way
p00960_A,00960,A,in my usual health
p00961_A,00961,A,how much do you make out of yours
p00962_A,00962,A,his highness s private secretary probably
p00963_A,00963,A,i don t know
p00964_A,00964,A,there are two boats
p00965_A,00965,A,colonel maggs broke the oars when here last
p00966_A,00966,A,he is a most powerful man
p00967_A,00967,A,perhaps your letter never reached the minister in question
p00968_A,00968,A,i know nothing at all about the religion here i should never think of watching it myself
p00969_A,00969,A,you should never have left them
p00970_A,00970,A,jump in mr quested and mr fielding
p00971_A,00971,A,do i mispronounce that well known name is he not your wife s brother
p00972_A,00972,A,and pray what is wrong with my attitude
p00973_A,00973,A,this is a very useless conversation i consider
p00974_A,00974,A,as i fell into our largest mau tank under circumstances our other friends will relate i thought how brave miss quested was and decided to tell her so despite my imperfect english through you i am happy here with my children instead of in a prison of that i make no doubt my children shall be taught to speak of you with the greatest affection and respect
p00975_A,00975,A,i want to do kind actions all round and wipe out the wretched business of the marabar for ever i have been so disgracefully hasty thinking you meant to get hold of my money as bad a mistake as the cave itself
p00976_A,00976,A,how so
p00977_A,00977,A,what are you meaning is stella not faithful to you cyril this fills me with great concern
p00978_A,00978,A,tell him also i have nothing to say to him but he is indeed a wise boy and has always one indian friend i partly love him because he brought me back to you to say good bye for this is good bye cyril though to think about it will spoil our ride and make us sad
p00979_A,00979,A,my dear chap officially they call it gokul ashtami all the state offices are closed but how else should it concern you and me
p00980_A,00980,A,it is useless discussing hindus with me living with them teaches me no more when i think i annoy them i do not when i think i don t annoy them i do perhaps they will sack me for tumbling on to their dolls house on the other hand perhaps they will double my salary time will prove why so curious about them
p00981_A,00981,A,oh presumably
p00982_A,00982,A,oh shut up don t spoil our last hour with foolish questions leave krishna alone and talk about something sensible
p00983_A,00983,A,very well and we have no use for you
p00984_A,00984,A,jolly good poems i m getting published bombay side
p00985_A,00985,A,clear out all you turtons and burtons we wanted to know you ten years back now it s too late if we see you and sit on your committees it s for political reasons don t you make any mistake clear out clear out i say why are we put to so much suffering we used to blame you now we blame ourselves we grow wiser until england is in difficulties we keep silent but in the next european war aha aha then is our time
p00986_A,00986,A,no the afghans my own ancestors
p00987_A,00987,A,it will be arranged a conference of oriental statesmen
p00988_A,00988,A,old story of we will rob every man and rape every woman from peshawar to calcutta i suppose which you get some nobody to repeat and then quote every week in the pioneer in order to frighten us into retaining you we know india shall be a nation no foreigners of any sort hindu and moslem and sikh and all shall be one hurrah hurrah for india hurrah hurrah down with the english anyhow that s certain clear out you fellows double quick i say we may hate one another but we hate you most if i don t make you go ahmed will karim will if it s fifty five hundred years we shall get rid of you yes we shall drive every blasted englishman into the sea and then and then you and i shall be friends
p00989_A,00989,A,i want to ask you something dr aziz i heard from mrs moore how helpful you were to her in the mosque and how interesting she learnt more about india in those few minutes talk with you than in the three weeks since we landed
p00990_A,00990,A,i want you to explain a disappointment we had this morning it must be some point of indian etiquette
p00991_A,00991,A,exactly what mr heaslop tells me if one doesn t worry how s one to understand
p00992_A,00992,A,i m afraid i can t do that
p00993_A,00993,A,yes that is so
p00994_A,00994,A,i don t know why you say that when you have so kindly asked us to your house
p00995_A,00995,A,we hear nothing interesting up at the club only tennis and ridiculous gossip
p00996_A,00996,A,good bye dr aziz
p00997_A,00997,A,thank you
p00998_A,00998,A,well your ladies won t have you do get rid of him dr aziz
p00999_A,00999,A,get in dr aziz you make us giddy if they re so foolish as to miss the train that s their loss not ours
p01000_A,01000,A,nonsense go to your carriage we re going to have a delightful time without them
p01001_A,01001,A,good morning good morning put on your own
p01002_A,01002,A,dr aziz what s happened to your hills the train has forgotten to stop
p01003_A,01003,A,how quick your servants are
p01004_A,01004,A,isn t this breakfast
p01005_A,01005,A,how very well it is all arranged
p01006_A,01006,A,do you know about the others she will never talk about them to me
p01007_A,01007,A,why like him
p01008_A,01008,A,i thought another emperor is your favourite i forget the name you mentioned him at mr fielding s what my book calls aurangzebe
p01009_A,01009,A,not at all we enjoy talk like this very much
p01010_A,01010,A,tell us something about akbar
p01011_A,01011,A,but wasn t akbar s new religion very fine it was to embrace the whole of india
p01012_A,01012,A,oh do you feel that dr aziz i hope you re not right there will have to be something universal in this country i don t say religion for i m not religious but something or how else are barriers to be broken down take my own case i don t know whether you happen to have heard but i m going to marry mr heaslop
p01013_A,01013,A,ah that s true well by marrying mr heaslop i shall become what is known as an anglo indian
p01014_A,01014,A,but i shall it s inevitable i can t avoid the label what i do hope to avoid is the mentality women like some women are so well ungenerous and snobby about indians and i should feel too ashamed for words if i turned like them but and here s my difficulty there s nothing special about me nothing specially good or strong which will help me to resist my environment and avoid becoming like them i ve most lamentable defects that s why i want akbar s universal religion or the equivalent to keep me decent and sensible do you see what i mean
p01015_A,01015,A,oh my happiness that s quite another problem i want to consult you about this anglo indian difficulty can you give me any advice
p01016_A,01016,A,i am told we all get rude after a year
p01017_A,01017,A,no i m all right thanks are you married dr aziz
p01018_A,01018,A,thank you
p01019_A,01019,A,and have you children
p01020_A,01020,A,are they a great pleasure to you
p01021_A,01021,A,have you one wife or more than one
p01022_A,01022,A,oh please do not mention a little thing like that is there anything else i may tell you about my country
p01023_A,01023,A,then back with water streaming over you and perhaps rather a pain inside but i did not mind all my friends were paining with me we have a proverb in urdu what does unhappiness matter when we are all unhappy together which comes in conveniently after mangoes miss quested do wait for mangoes why not settle altogether in india
p01024_A,01024,A,miss quested professor godbole s sweets are delicious they will give you a real indian treat ah in my poor position i can give you nothing
p01025_A,01025,A,yes all that is settled i invite you all to see me in the marabar caves
p01026_A,01026,A,i know
p01027_A,01027,A,good bye mrs moore
p01028_A,01028,A,good bye miss quested you ll jolly jolly well not forget those caves won t you i ll fix the whole show up in a jiffy
p01029_A,01029,A,what a shame you leave india so soon oh do reconsider your decision do stay
p01030_A,01030,A,send back your servant he is unnecessary then we shall all be moslems together
p01031_A,01031,A,i am to blame i am the host
p01032_A,01032,A,mohammed latif by the way what is in these caves brother why are we all going to see them
p01033_A,01033,A,good morning good morning put on your topis put on your topis at once the early sun is highly dangerous for heads i speak as a doctor
p01034_A,01034,A,not for my thick head
p01035_A,01035,A,it takes an hour to get there an hour to get back and two hours for the caves which we will call three the train back is at eleven thirty and you will be sitting down to your tiffin in chandrapore with mr heaslop at exactly your usual hour namely one fifteen i know everything about you four hours quite a small expedition and an hour extra for misfortunes which occur somewhat frequently among my people my idea is to plan everything without consulting you but you mrs moore or miss quested you are at any moment to make alterations if you wish even if it means giving up the caves do you agree then mount this wild animal
p01036_A,01036,A,i thought we would eat this before our caves and breakfast after
p01037_A,01037,A,this breakfast did you think i should treat you so strangely
p01038_A,01038,A,friendships last longest that begin like that i think shall i ever entertain your other children
p01039_A,01039,A,ralph and stella yes i know everything about them but we must not forget to visit our caves one of the dreams of my life is accomplished in having you both here as my guests you cannot imagine how you have honoured me i feel like the emperor babur
p01040_A,01040,A,because my ancestors came down with him from afghanistan they joined him at herat he also had often no more elephants than one none sometimes but he never ceased showing hospitality when he fought or hunted or ran away he would always stop for a time among hills just like us he would never let go of hospitality and pleasure and if there was only a little food he would have it arranged nicely and if only one musical instrument he would compel it to play a beautiful tune i take him as my ideal he is the poor gentleman and he became a great king
p01041_A,01041,A,alamgir oh yes he was of course the more pious but babur never in his whole life did he betray a friend so i can only think of him this morning and you know how he died he laid down his life for his son a death far more difficult than battle they were caught in the heat they should have gone back to kabul for the bad weather but could not for reasons of state and at agra humayun fell sick babur walked round the bed three times and said and he did bear it away the fever left his son and came to him instead and he died that is why i prefer babur to alamgir i ought not to do so but i do however i mustn t delay you i see you are ready to start
p01042_A,01042,A,i always enjoy conversing about the moguls it is the chief pleasure i know you see those first six emperors were all most wonderful men and as soon as one of them is mentioned no matter which i forget everything else in the world except the other five you could not find six such kings in all the countries of the earth not i mean coming one after the other father son
p01043_A,01043,A,ah you have heard the name of akbar good hamidullah whom you shall meet will tell you that akbar is the greatest of all i say which makes hamidullah cry but babur always repented afterwards which makes the entire difference and akbar never repented of the new religion he invented instead of the holy koran
p01044_A,01044,A,miss quested fine but foolish you keep your religion i mine that is the best nothing embraces the whole of india nothing nothing and that was akbar s mistake
p01045_A,01045,A,on which my heartiest congratulations
p01046_A,01046,A,impossible take back such a terrible remark
p01047_A,01047,A,you are certain to be happy with any relative of mrs moore s
p01048_A,01048,A,you are absolutely unlike the others i assure you you will never be rude to my people
p01049_A,01049,A,then you are told a lie come along
p01050_A,01050,A,pretty sure they should come on some interesting old carvings soon
p01051_A,01051,A,do i take you too fast
p01052_A,01052,A,yes indeed do come and see my wife
p01053_A,01053,A,she is not in chandrapore just now
p01054_A,01054,A,yes indeed three
p01055_A,01055,A,why naturally i adore them i suppose so
p01056_A,01056,A,an indian lady and gentleman were to send their carriage for us this morning at nine it has never come we waited and waited and waited we can t think what happened
p01057_A,01057,A,i like mysteries but i rather dislike muddles
p01058_A,01058,A,oh do you think so mr fielding
p01059_A,01059,A,good bye mr fielding and thank you so much what lovely college buildings
p01060_A,01060,A,he s not to he ll kill himself
p01061_A,01061,A,mr fielding
p01062_A,01062,A,mr fielding have you seen miss quested
p01063_A,01063,A,miss derek is most unsatisfactory and restless always in a hurry always wanting something new she will do anything in the world except go back to the indian lady who pays her
p01064_A,01064,A,adela she s never been in a hurry in her life
p01065_A,01065,A,i know
p01066_A,01066,A,a mystery is a muddle
p01067_A,01067,A,a mystery is only a high sounding term for a muddle no advantage in stirring it up in either case aziz and i know well that india s a muddle
p01068_A,01068,A,good bye miss quested
p01069_A,01069,A,right give a hand
p01070_A,01070,A,good morning again
p01071_A,01071,A,but i ve only just arrived where is she
p01072_A,01072,A,what s happened
p01073_A,01073,A,she wasn t in a hurry when i left her there was no question of returning to chandrapore it looks to me as if miss quested s in the hurry
p01074_A,01074,A,i say it ll prove to be miss quested s wish in fact i know it is aziz is a charming fellow
p01075_A,01075,A,visitors like you are too rare
p01076_A,01076,A,i speak now as a doctor no
p01077_A,01077,A,they are immensely holy no doubt
p01078_A,01078,A,still they are ornamented in some way
p01079_A,01079,A,well why are they so famous we all talk of the famous marabar caves perhaps that is our empty brag
p01080_A,01080,A,describe them to this lady then
p01081_A,01081,A,hullo sorry
p01082_A,01082,A,did he since when
p01083_A,01083,A,why did you not tell me your silence plunged me into a pretty pickle
p01084_A,01084,A,they are indeed such affability is seldom seen but what can we offer to detain them
p01085_A,01085,A,but i will send you up a few healthy sweets i will give myself that pleasure
p01086_A,01086,A,oh no not at all at elephanta there are sculptures of siva and parvati there are no sculptures at marabar
p01087_A,01087,A,oh no oh no
p01088_A,01088,A,oh no
p01089_A,01089,A,no i should not quite say that
p01090_A,01090,A,your mother will return shortly sir there is but little to see at our poor college
p01091_A,01091,A,he arrived at the european guest house perhaps at least possibly
p01092_A,01092,A,ah no he married the sister of mr heaslop ah exactly i have known that for over a year
p01093_A,01093,A,i shall be delighted
p01094_A,01094,A,then tell me everything you will or i shall never understand india are they the hills i sometimes see in the evening what are these caves
p01095_A,01095,A,are they large caves
p01096_A,01096,A,do describe them professor godbole
p01097_A,01097,A,something like the caves at elephanta
p01098_A,01098,A,good bye professor godbole it s a shame we never heard you sing
p01099_A,01099,A,oh that is a most magnificent entertainment compared to my poor sweets but has not miss quested visited our caves already
p01100_A,01100,A,my dear young sir the pot and the kettle have you ever heard of that useful proverb
p01101_A,01101,A,no not large
p01102_A,01102,A,it will be a great honour there is an entrance in the rock which you enter and through the entrance is the cave
p01103_A,01103,A,not heard of them the marabar caves in the marabar hills
p01104_A,01104,A,everything s altered some soldier men have come in come along and i ll tell you about it
p01105_A,01105,A,come along up and join us mr heaslop sit down till your mother turns up he may not understand that allow me
p01106_A,01106,A,i m sorry what s up
p01107_A,01107,A,he isn t a bounder his nerves are on edge that s all
p01108_A,01108,A,i want to leave the room but cannot while this gentleman prevents me
p01109_A,01109,A,i may sing now
p01110_A,01110,A,may i now take my leave now i take my leave i must tell you how glad i am to hear that after all you succeeded in reaching the marabar i feared my unpunctuality had prevented you but you went a far pleasanter method in miss derek s car i hope the expedition was a successful one
p01111_A,01111,A,oh yes
p01112_A,01112,A,oh yes that is all round the college
p01113_A,01113,A,i cannot say i was not present
p01114_A,01114,A,so i saw at once on entering your office i must not detain you but i have a small private difficulty on which i want your help i am leaving your service shortly as you know
p01115_A,01115,A,and am returning to my birthplace in central india to take charge of education there i want to start a high school there on sound english lines that shall be as like government college as possible well at present there is only vernacular education at mau i shall feel it my duty to change all that i shall advise his highness to sanction at least a high school in the capital and if possible another in each pargana the point the point on which i desire your help is this what name should be given to the school
p01116_A,01116,A,yes a name a suitable title by which it can be called by which it may be generally known
p01117_A,01117,A,oh yes oh no i do not expect an answer to my question now i only meant that when you are at leisure you might think the matter over and suggest two or three alternative titles for schools i had thought of the mr fielding high school but failing that the king emperor george the fifth
p01118_A,01118,A,that is for the court to decide the verdict will be in strict accordance with the evidence i make no doubt
p01119_A,01119,A,ah that is rather a different question from your previous one and also more difficult i mean difficult in our philosophy dr aziz is a most worthy young man i have a great regard for him but i think you are asking me whether the individual can commit good actions or evil actions and that is rather difficult for us
p01120_A,01120,A,no not exactly please according to our philosophy because nothing can be performed in isolation all perform a good action when one is performed and when an evil action is performed all perform it to illustrate my meaning let me take the case in point as an example i am informed that an evil action was performed in the marabar hills and that a highly esteemed english lady is now seriously ill in consequence my answer to that is this that action was performed by dr aziz it was performed by the guide it was performed by you it was performed by me and by my students it was even performed by the lady herself when evil occurs it expresses the whole of the universe similarly when good occurs
p01121_A,01121,A,excuse me you are now again changing the basis of our discussion we were discussing good and evil suffering is merely a matter for the individual if a young lady has sunstroke that is a matter of no significance to the universe oh no not at all oh no not the least it is an isolated matter it only concerns herself if she thought her head did not ache she would not be ill and that would end it but it is far otherwise in the case of good and evil they are not what we think them they are what they are and each of us has contributed to both
