uid,pair_id,side,text
p00226_A,00226,A,here we all are
p00227_A,00227,A,here we are good morning helen
p00228_A,00228,A,good morning mr wilcox
p00229_A,00229,A,not a bad business
p00230_A,00230,A,no my letter s about howards end bryce has been ordered abroad and wants to sublet it i am far from sure that i shall give him permission there was no clause in the agreement in my opinion subletting is a mistake if he can find me another tenant whom i consider suitable i may cancel the agreement morning schlegel don t you think that s better than subletting
p00231_A,00231,A,it s all right dempster s bank s better
p00232_A,00232,A,no the fellow needn t
p00233_A,00233,A,he only says reduced
p00234_A,00234,A,with a man so poor every reduction must be great i consider it a deplorable misfortune
p00235_A,00235,A,you re ridiculous helen
p00236_A,00236,A,owing to god i suppose you grab the dollars god does the rest
p00237_A,00237,A,because i m an old maid i can t think why i go on like this myself
p00238_A,00238,A,but going away without taking the weymouth trip or even the lulworth without going once more up nine barrows down
p00239_A,00239,A,good i did the breaking of the ice
p00240_A,00240,A,one minute
p00241_A,00241,A,i shall enjoy seeing it
p00242_A,00242,A,you ll see it at its worst for bryce decamped abroad last monday without even arranging for a charwoman to clear up after him i never saw such a disgraceful mess it s unbelievable he wasn t in the house a month
p00243_A,00243,A,i ve more than a little bone to pick with bryce
p00244_A,00244,A,invalid type couldn t sleep
p00245_A,00245,A,poor fellow
p00246_A,00246,A,quite right
p00247_A,00247,A,dolly would have taken them but i was in fortunately
p00248_A,00248,A,what s mr bryce like
p00249_A,00249,A,now we ll be off
p00250_A,00250,A,yes but while they re learning
p00251_A,00251,A,the motor s come to stay one must get about there s a pretty church oh you aren t sharp enough well look out if the road worries you right outward at the scenery
p00252_A,00252,A,in fancy of course in fancy you had her way of walking good day
p00253_A,00253,A,it gave her quite a turn none of you girls have any nerves really of course a word from me put it all right but silly old miss avery she frightened you didn t she margaret there you stood clutching a bunch of weeds she might have said something instead of coming down the stairs with that alarming bonnet on i passed her as i came in enough to make the car shy i believe miss avery goes in for being a character some old maids do it is their last resource heaven knows what she was doing in the place but that s bryce s business not mine
p00254_A,00254,A,did you take her for a spook
p00255_A,00255,A,she s just one of the crew at the farm people like that always assume things she assumed you d know who she was she left all the howards end keys in the front lobby and assumed that you d seen them as you came in that you d lock up the house when you d done and would bring them on down to her and there was her niece hunting for them down at the farm lack of education makes people very casual hilton was full of women like miss avery once
p00256_A,00256,A,i shouldn t have disliked it perhaps
p00257_A,00257,A,i say howards end howards ended i m rather on the spot this evening eh
p00258_A,00258,A,oh mr wilcox how can you
p00259_A,00259,A,curious mounds but in with you now another time
p00260_A,00260,A,get the women out at once
p00261_A,00261,A,but stop
p00262_A,00262,A,didn t really hurt him
p00263_A,00263,A,do please stop i want to go back please
p00264_A,00264,A,i expect a little of will be more to the point than one of us
p00265_A,00265,A,you should have thought of that sooner charles
p00266_A,00266,A,there it s only a rotten cat
p00267_A,00267,A,yes madam the girl will receive compensation for it
p00268_A,00268,A,she was a very ruda girla
p00269_A,00269,A,wouldn t you have been rude
p00270_A,00270,A,oh henry i have been so naughty we ran over a cat charles told me not to jump out but i would and look your poor meg went such a flop
p00271_A,00271,A,thinking it was a dog
p00272_A,00272,A,ah a dog s a companion a dog ll remember you
p00273_A,00273,A,not to speak about and it s my left hand
p00274_A,00274,A,well hurry up and change
p00275_A,00275,A,why not
p00276_A,00276,A,by your leave let me pass please
p00277_A,00277,A,i m not at home yet to townees
p00278_A,00278,A,how do you do mr bast this is an odd business what view do you take of it
p00279_A,00279,A,there is mrs bast too
p00280_A,00280,A,i m sure i don t want to intrude but you have been so kind to me in the past in warning me about the porphyrion that i wondered why i wondered whether
p00281_A,00281,A,whether we could get him back into the porphyrion again meg this has been a cheerful business a bright evening s work that was on chelsea embankment
p00282_A,00282,A,that s right
p00283_A,00283,A,and went into a bank instead
p00284_A,00284,A,i told you all that and they reduced their staff after he had been in a month and now he s penniless and i consider that we and our informant are directly to blame
p00285_A,00285,A,i hate all this
p00286_A,00286,A,i brought them i did it all
p00287_A,00287,A,i can only advise you to go at once my sister has put you in a false position and it is kindest to tell you so it s too late to get to town but you ll find a comfortable hotel in oniton where mrs bast can rest and i hope you ll be my guests there
p00288_A,00288,A,it s work he wants can t you see
p00289_A,00289,A,you don t know what you re talking about i shall never get work now if rich people fail at one profession they can try another not i i had my groove and i ve got out of it i could do one particular branch of insurance in one particular office well enough to command a salary but that s all poetry s nothing miss schlegel one s thoughts about this and that are nothing your money too is nothing if you ll understand me i mean if a man over twenty once loses his own particular job it s all over with him i have seen it happen to others their friends gave them money for a little but in the end they fall over the edge it s no good it s the whole world pulling there always will be rich and poor
p00290_A,00290,A,won t you have something to eat i don t know what to do it isn t my house and though mr wilcox would have been glad to see you at any other time as i say i don t know what to do but i undertake to do what i can for you helen offer them something do try a sandwich mrs bast
p00291_A,00291,A,all right i ll see him
p00292_A,00292,A,madam you will be more comfortable at the hotel
p00293_A,00293,A,ne crois pas que le mari lui ressemble il est tout fait diff rent
p00294_A,00294,A,i congratulate you on your proteges
p00295_A,00295,A,you re a nice boy you are there now i love you
p00296_A,00296,A,pray don t apologise
p00297_A,00297,A,why does she call you hen has she ever seen you before
p00298_A,00298,A,seen hen before who hasn t seen hen he s serving you like me my boys you wait still we love em
p00299_A,00299,A,no let me do that
p00300_A,00300,A,i don t expect there s much to forgive
p00301_A,00301,A,but she s only a farm woman
p00302_A,00302,A,yes mrs wilcox no mrs wilcox oh yes mrs wilcox auntie received your letter quite duly auntie has gone up to your little place at the present moment shall i send the servant to direct you of course auntie does not generally look after your place she only does it to oblige a neighbour as something exceptional it gives her something to do she spends quite a lot of her time there my husband says to me sometimes i say yes mrs wilcox mrs wilcox could i prevail upon you to accept a piece of cake not if i cut it for you i cannot let you go on alone now don t you really mustn t i will direct you myself if it comes to that i must get my hat now mrs wilcox don t you move while i m gone
p00303_A,00303,A,madge go away
p00304_A,00304,A,auntie it s mrs wilcox
p00305_A,00305,A,your niece and i have come together
p00306_A,00306,A,madge go away this is no moment for your hat
p00307_A,00307,A,auntie gets more eccentric lately
p00308_A,00308,A,yes mrs wilcox of course
p00309_A,00309,A,i hope miss avery is not ill
p00310_A,00310,A,well if you ll excuse me perhaps i ought to be leaving you now the servants need seeing to at the farm auntie is so odd at times
p00311_A,00311,A,certainly mrs wilcox
p00312_A,00312,A,that is what we all say but why should it be just like helen why should she be allowed to be so queer and to grow queerer
p00313_A,00313,A,i don t suppose i ever shall
p00314_A,00314,A,come in charles could you help us at all we are again in trouble
p00315_A,00315,A,i m afraid i cannot what are the facts we are all mad more or less you know in these days
p00316_A,00316,A,the facts are as follows the facts are that she has been in england for three days and will not see us she has forbidden the bankers to give us her address she refuses to answer questions margaret finds her letters colourless there are other facts but these are the most striking
p00317_A,00317,A,it s quite impossible
p00318_A,00318,A,but helen doesn t talk that s our whole difficulty she won t talk your particular language and on that account you think she s ill
p00319_A,00319,A,not in that way
p00320_A,00320,A,i cannot make it out
p00321_A,00321,A,yes margaret you know you must take plenty
p00322_A,00322,A,have i time
p00323_A,00323,A,yes plenty
p00324_A,00324,A,i was just saying to my wife mansbridge that our main object is not to frighten miss schlegel the house as you know is my property so it should seem quite natural for us to be there the trouble is evidently nervous wouldn t you say so margaret
p00325_A,00325,A,she always was highly strung a tendency to spiritualism and those things though nothing serious musical literary artistic but i should say normal a very charming girl
p00326_A,00326,A,i can diagnose the case more bluntly if you wish
p00327_A,00327,A,forgive me but i will not
p00328_A,00328,A,this business is as broad as it s long we had better all work together you need us mrs wilcox and we need you
p00329_A,00329,A,please lady a message
p00330_A,00330,A,yes please
p00331_A,00331,A,but i like milk why send it away
p00332_A,00332,A,in the morning would i bring eggs too
p00333_A,00333,A,mine are lop eareds
p00334_A,00334,A,but the diddums can t listen he isn t nine months old
p00335_A,00335,A,that s not what i was saying
p00336_A,00336,A,good night mrs wilcox
p00337_A,00337,A,mr schlegel doesn t know we can t know everything can we
p00338_A,00338,A,mrs wilcox i have done wrong
p00339_A,00339,A,bring me a stick get some water he s shamming of course i only used the blade here carry him out into the air
p00340_A,00340,A,i think i ll go round to the police station
p00341_A,00341,A,what for
p00342_A,00342,A,no one ever told the lad he ll have a child
p00343_A,00343,A,he didn t say madam
p00344_A,00344,A,no my dear manslaughter manslaughter charles may go to prison i dare not tell him i don t know what to do what to do i m broken i m ended
p00345_A,00345,A,yes please
p00346_A,00346,A,the conclave s breaking at last i ll go
p00347_A,00347,A,yes i did
p00348_A,00348,A,as i ve given up the outdoor life that suited me and i have come home to look after the business it s no good my settling down here it s not really the country and it s not the town
p00349_A,00349,A,of course father
p00350_A,00350,A,perfectly splendidly i thought charles wanted it for the boys but last time i saw him he said no because we cannot possibly live in this part of england again charles says we ought to change our name but i cannot think what to for wilcox just suits charles and me and i can t think of any other name
p00351_A,00351,A,then i leave howards end to my wife absolutely and let everyone understand that and after i am dead let there be no jealousy and no surprise in consequence i leave my wife no money that is her own wish all that she would have had will be divided among you i am also giving you a great deal in my lifetime so that you may be independent of me that is her wish too she also is giving away a great deal of money she intends to diminish her income by half during the next ten years she intends when she dies to leave the house to her nephew down in the field is all that clear does everyone understand
p00352_A,00352,A,down in the field oh come i think we might have had the whole establishment piccaninnies included
p00353_A,00353,A,good bye old girl don t you worry about me
p00354_A,00354,A,good bye mr wilcox it does seem curious that mrs wilcox should have left margaret howards end and yet she get it after all
p00355_A,00355,A,good bye
p00356_A,00356,A,good bye my boy always take care of yourself
p00357_A,00357,A,good bye mrs wilcox
p00358_A,00358,A,good bye
p00000_B,00000,B,the younger can i do anything for you
p00001_B,00001,B,i am miss schlegel s aunt i ought to introduce myself oughtn t i my name is mrs munt
p00002_B,00002,B,oh rather miss schlegel is stopping with us did you want to see her
p00003_B,00003,B,hi i say parcel parcel for howards end bring it out hi sign must i why the should i sign after all this bother not even got a pencil on you remember next time i report you to the station master my time s of value though yours mayn t be here
p00004_B,00004,B,not at all mr wilcox
p00005_B,00005,B,paul paul paul is there any truth in this
p00006_B,00006,B,why be so polite to servants they don t understand it
p00007_B,00007,B,it was over at once
p00008_B,00008,B,papa why will they not discuss this most clear question to me one of two things is very clear either god does not know his own mind about england and germany or else these do not know the mind of god
p00009_B,00009,B,now comes the wonderful movement first of all the goblins and then a trio of elephants dancing
p00010_B,00010,B,on the drum aunt juley
p00011_B,00011,B,no look out for the part where you think you have done with the goblins and they come back
p00012_B,00012,B,margaret is helen all right
p00013_B,00013,B,she is always going away in the middle of a programme
p00014_B,00014,B,the music has evidently moved her deeply
p00015_B,00015,B,excuse me but that lady has quite inadvertently taken my umbrella
p00016_B,00016,B,oh good gracious me i am so sorry tibby run after helen
p00017_B,00017,B,i shall miss the four serious songs if i do
p00018_B,00018,B,it isn t of any consequence
p00019_B,00019,B,my sister is so careless
p00020_B,00020,B,not at all
p00021_B,00021,B,for my part i have heard the composition at stettin on two occasions it is dramatic a little
p00022_B,00022,B,we have this call to pay in finsbury circus it is true
p00023_B,00023,B,oh what a bother what a family we are fr frieda but it s the number they want in finsbury circus
p00024_B,00024,B,might i couldn t i
p00025_B,00025,B,we live quite near i am going there now could you walk round with me and we ll find your umbrella
p00026_B,00026,B,thank you
p00027_B,00027,B,do you agree do you think music is so different from pictures
p00028_B,00028,B,i i should have thought so kind of
p00029_B,00029,B,don t you talk meg you stole an old gentleman s silk top hat yes she did aunt juley it is a positive fact she thought it was a muff oh heavens i ve knocked the in and out card down where s frieda tibby why don t you ever no i can t remember what i was going to say that wasn t it but do tell the maids to hurry tea up what about this umbrella no it s all gone along the seams it s an appalling umbrella it must be mine
p00030_B,00030,B,but if you will stop now helen how stupid you ve been
p00031_B,00031,B,i dare say it is all for the best we know nothing about the young man margaret and your drawing room is full of very tempting little things
p00032_B,00032,B,yes i think the apostle spoons could have gone as rent you remember rent it was one of father s words rent to the ideal to his own faith in human nature you remember how he would trust strangers and if they fooled him he would say it s better to be fooled than to be suspicious that the confidence trick is the work of man but the want of confidence trick is the work of the devil
p00033_B,00033,B,i remember something of the sort now
p00034_B,00034,B,it was lucky that your father married a wife with money
p00035_B,00035,B,no i agree with aunt juley i d rather mistrust people than lose my little ricketts there are limits
p00036_B,00036,B,why didn t you make that young man welcome tibby you must do the host a little you know you ought to have taken his hat and coaxed him into stopping instead of letting him be swamped by screaming women
p00037_B,00037,B,leave tibby alone
p00038_B,00038,B,here s the house a regular hen coop
p00039_B,00039,B,oh my dear how can you say such dreadful things the number of men you get here has always astonished me if there is any danger it s the other way round
p00040_B,00040,B,yes but it s the wrong sort of men helen means
p00041_B,00041,B,no i don t we get the right sort of man but the wrong side of him and i say that s tibby s fault there ought to be a something about the house an i don t know what
p00042_B,00042,B,who are the w s
p00043_B,00043,B,the w s are things i and meg and aunt juley know about and you don t so there
p00044_B,00044,B,i suppose that ours is a female house and one must just accept it no aunt juley i don t mean that this house is full of women i am trying to say something much more clever i mean that it was irrevocably feminine even in father s time now i m sure you understand well i ll give you another example it ll shock you but i don t care suppose queen victoria gave a dinner party and that the guests had been leighton millais swinburne rossetti meredith fitzgerald etc do you suppose that the atmosphere of that dinner would have been artistic heavens no the very chairs on which they sat would have seen to that so with our house it must be feminine and all we can do is to see that it isn t effeminate just as another house that i can mention but won t sounded irrevocably masculine and all its inmates can do is to see that it isn t brutal
p00045_B,00045,B,that house being the w s house i presume
p00046_B,00046,B,you re not going to be told about the w s my child so don t you think it and on the other hand i don t the least mind if you find out so don t you think you ve done anything clever in either case give me a cigarette
p00047_B,00047,B,you do what you can for the house the drawing room reeks of smoke
p00048_B,00048,B,what ho
p00049_B,00049,B,oh but helen isn t a girl with no interests she has plenty of other things and other people to think about she made a false start with the wilcoxes and she ll be as willing as we are to have nothing more to do with them
p00050_B,00050,B,i m not grave
p00051_B,00051,B,no she does not feel grave i can bear witness to that she disagrees
p00052_B,00052,B,hark i hear bruno entering the hall
p00053_B,00053,B,did you say the mathesons flat aunt juley how wonderful you are i never knew that the name of the woman who laced too tightly was matheson
p00054_B,00054,B,go helen
p00055_B,00055,B,helen cannot deceive me she does mind
p00056_B,00056,B,oh hush frieda ll hear you and she can be so tiresome
p00057_B,00057,B,i don t know what i shall do with meg she s got wilcox and box upon the brain meg meg i don t love the young gentleman i don t love the young gentleman meg meg can a body speak plainer
p00058_B,00058,B,most certainly her love has died
p00059_B,00059,B,most certainly it has frieda but that will not prevent me from being bored with the wilcoxes if i return the call
p00060_B,00060,B,oh boo hoo boo hoo hoo meg s going to return the call and i can t cos why cos i m going to german eye
p00061_B,00061,B,it is all right she does not love the young man he has not been worthy of her
p00062_B,00062,B,yes i know thanks very much
p00063_B,00063,B,i hope that your sister is safe in germany by now
p00064_B,00064,B,yes thank you i heard on tuesday only on tuesday for they live right away at stettin did you ever know any one living at stettin
p00065_B,00065,B,what do the overhanging warehouses make of that
p00066_B,00066,B,i think miss schlegel puts everything splendidly
p00067_B,00067,B,oh mrs wilcox say something nicer than that it s such a snub to be told you put things splendidly
p00068_B,00068,B,you will admit though that the continent it seems silly to speak of the continent but really it is all more like itself than any part of it is like england england is unique do have another jelly first i was going to say that the continent for good or for evil is interested in ideas its literature and art have what one might call the kink of the unseen about them and this persists even through decadence and affectation there is more liberty of action in england but for liberty of thought go to bureaucratic prussia people will there discuss with humility vital questions that we here think ourselves too good to touch with tongs
p00069_B,00069,B,i do not want to go to prussia not even to see that interesting view that you were describing and for discussing with humility i am too old we never discuss anything at howards end
p00070_B,00070,B,one admits that the arguments against the suffrage are extraordinarily strong
p00071_B,00071,B,we didn t mean the vote though did we aren t we differing on something much wider mrs wilcox whether women are to remain what they have been since the dawn of history or whether since men have moved forward so far they too may move forward a little now i say they may i would even admit a biological change
p00072_B,00072,B,i must be getting back to my overhanging warehouse they ve turned disgracefully strict
p00073_B,00073,B,oh but come upstairs for a little miss quested plays do you like macdowell do you mind his only having two noises if you must really go i ll see you out won t you even have coffee
p00074_B,00074,B,what an interesting life you all lead in london
p00075_B,00075,B,but couldn t you get it renewed
p00076_B,00076,B,i beg your pardon
p00077_B,00077,B,a thousand thanks miss schlegel for all your help
p00078_B,00078,B,not at all
p00079_B,00079,B,oh henry dear here s a lovely surprise but let me introduce but i think you know miss schlegel
p00080_B,00080,B,another day mrs wilcox of course
p00081_B,00081,B,cart and car being practically at right angles
p00082_B,00082,B,henry why do people who have enough money try to get more money i am sure that if the mothers of various nations could meet there would be no more wars a more inward light not so much for myself as for baby
p00083_B,00083,B,why didn t you tell me you knew of it
p00084_B,00084,B,thanks put it down
p00085_B,00085,B,he s going to read his letters first i think i dare say he will go on with his breakfast afterwards they had no business to be pollarding those elms yesterday
p00086_B,00086,B,yes dear
p00087_B,00087,B,yes rather you must complain to chalkeley
p00088_B,00088,B,charles your father s down something s happened he wants you in the house at once oh charles
p00089_B,00089,B,wait dear wait a minute who had the key of the garage while you were away crane
p00090_B,00090,B,the gardener sir
p00091_B,00091,B,she wants howards end
p00092_B,00092,B,no sir
p00093_B,00093,B,but you haven t listened charles
p00094_B,00094,B,schlegels again
p00095_B,00095,B,oh no the matron of the nursing home has written instead of her
p00096_B,00096,B,i suppose we re going to have a talk about this
p00097_B,00097,B,but i say that note isn t legal houses ought to be done by a lawyer charles surely
p00098_B,00098,B,give it her
p00099_B,00099,B,the question is the question is whether miss schlegel during the fortnight we were all away whether she unduly
p00100_B,00100,B,why you just said it was
p00101_B,00101,B,ah well i shouldn t have thought it possible
p00102_B,00102,B,mother couldn t have meant it
p00103_B,00103,B,that time may prove
p00104_B,00104,B,why she may be coming down to turn us out now
p00105_B,00105,B,i wish she would i could then deal with her
p00106_B,00106,B,so could i i could deal with her if she comes but she won t come you re all a bit hard on miss schlegel
p00107_B,00107,B,but those chrysanthemums
p00108_B,00108,B,or coming down to the funeral at all
p00109_B,00109,B,why shouldn t she come down she had the right to and she stood far back among the hilton women the flowers certainly we should not have sent such flowers but they may have seemed the right thing to her evie and for all you know they may be the custom in germany
p00110_B,00110,B,oh i forget she isn t really english that would explain a lot
p00111_B,00111,B,she s a cosmopolitan i admit i m rather down on cosmopolitans my fault doubtless i cannot stand them and a german cosmopolitan is the limit i think that s about all isn t it i want to run down and see chalkeley a bicycle will do and by the way i wish you d speak to crane some time i m certain he s had my new car out
p00112_B,00112,B,has he done it any harm
p00113_B,00113,B,i was thinking of mr vyse he never strikes me as particularly happy
p00114_B,00114,B,ye es
p00115_B,00115,B,i hope you were pleased
p00116_B,00116,B,but how on earth
p00117_B,00117,B,no i can t say i do
p00118_B,00118,B,was it the time the sandy cat walked round the balustrade then i don t remember that s the only beethoven i ever remember specially
p00119_B,00119,B,and you if i may say so took away my umbrella inadvertently of course
p00120_B,00120,B,the mistake arose out of my card did it
p00121_B,00121,B,then why
p00122_B,00122,B,saturday afternoon or sunday afternoon
p00123_B,00123,B,really and you were still calling on sunday when your wife came here a long visit
p00124_B,00124,B,oh don t let us mind
p00125_B,00125,B,no doubt it s another beautiful book but i d rather hear about your road
p00126_B,00126,B,where did you start from do tell us more
p00127_B,00127,B,yes go on
