uid,pair_id,side,text
p00000_A,00000,A,mr wilcox she s wanting howards end
p00001_A,00001,A,the younger can i do anything for you
p00002_A,00002,A,oh well really are you i
p00003_A,00003,A,you see we heard from helen this morning
p00004_A,00004,A,hi i say parcel parcel for howards end bring it out hi sign must i why the should i sign after all this bother not even got a pencil on you remember next time i report you to the station master my time s of value though yours mayn t be here
p00005_A,00005,A,don t let them know they are never to know
p00006_A,00006,A,they do not love any longer if you prefer it put that way
p00007_A,00007,A,i love you
p00008_A,00008,A,do you imply that we germans are stupid uncle ernst
p00009_A,00009,A,you girls are so wonderful in always having oh dear one mustn t talk
p00010_A,00010,A,now comes the wonderful movement first of all the goblins and then a trio of elephants dancing
p00011_A,00011,A,on the what dear
p00012_A,00012,A,on the drum aunt juley
p00013_A,00013,A,margaret is helen all right
p00014_A,00014,A,oh yes
p00015_A,00015,A,she is always going away in the middle of a programme
p00016_A,00016,A,the music has evidently moved her deeply
p00017_A,00017,A,excuse me but that lady has quite inadvertently taken my umbrella
p00018_A,00018,A,i shall miss the four serious songs if i do
p00019_A,00019,A,it isn t of any consequence
p00020_A,00020,A,but of course it is tibby tibby
p00021_A,00021,A,what what the pomp and circumstance will not be fine
p00022_A,00022,A,for my part i have heard the composition at stettin on two occasions it is dramatic a little
p00023_A,00023,A,we have this call to pay in finsbury circus it is true
p00024_A,00024,A,margaret margaret margaret fraulein mosebach has left her beautiful little bag behind her on the seat
p00025_A,00025,A,might i couldn t i
p00026_A,00026,A,oh i would be so grateful
p00027_A,00027,A,but surely you haven t forgotten the drum steadily beating on the low c aunt juley no one could it s unmistakable
p00028_A,00028,A,a specially loud part of course i do not go in for being musical i only care for music a very different thing but still i will say this for myself i do know when i like a thing and when i don t some people are the same about pictures they can go into a picture gallery miss conder can and say straight off what they feel all round the wall i never could do that but music is so different from pictures to my mind when it comes to music i am as safe as houses and i assure you tibby i am by no means pleased by everything there was a thing something about a faun in french which helen went into ecstasies over but i thought it most tinkling and superficial and said so and i held to my opinion too
p00029_A,00029,A,helen you must not be so ramshackly you took this gentleman s umbrella away from queen s hall and he has had the trouble of coming round for it
p00030_A,00030,A,oh i am so sorry i do nothing but steal umbrellas i am so very sorry do come in and choose one is yours a hooky or a nobbly mine s a nobbly at least i think it is
p00031_A,00031,A,don t you see that you ve frightened him away i meant him to stop to tea you oughtn t to talk about stealing or holes in an umbrella i saw his nice eyes getting so miserable no it s not a bit of good now
p00032_A,00032,A,i dare say it is all for the best we know nothing about the young man margaret and your drawing room is full of very tempting little things
p00033_A,00033,A,aunt juley how can you you make me more and more ashamed i d rather he had been a thief and taken all the apostle spoons than that i well i must shut the front door i suppose one more failure for helen
p00034_A,00034,A,yes i think the apostle spoons could have gone as rent you remember rent it was one of father s words rent to the ideal to his own faith in human nature you remember how he would trust strangers and if they fooled him he would say it s better to be fooled than to be suspicious that the confidence trick is the work of man but the want of confidence trick is the work of the devil
p00035_A,00035,A,why he might have stolen the little ricketts picture as well
p00036_A,00036,A,in a way i wish we had a real boy in the house the kind of boy who cares for men it would make entertaining so much easier
p00037_A,00037,A,why didn t you make that young man welcome tibby you must do the host a little you know you ought to have taken his hat and coaxed him into stopping instead of letting him be swamped by screaming women
p00038_A,00038,A,oh it s no good looking superior i mean what i say
p00039_A,00039,A,leave tibby alone
p00040_A,00040,A,here s the house a regular hen coop
p00041_A,00041,A,oh my dear how can you say such dreadful things the number of men you get here has always astonished me if there is any danger it s the other way round
p00042_A,00042,A,no i don t we get the right sort of man but the wrong side of him and i say that s tibby s fault there ought to be a something about the house an i don t know what
p00043_A,00043,A,a touch of the w s perhaps
p00044_A,00044,A,who are the w s
p00045_A,00045,A,the w s are things i and meg and aunt juley know about and you don t so there
p00046_A,00046,A,i suppose that ours is a female house and one must just accept it no aunt juley i don t mean that this house is full of women i am trying to say something much more clever i mean that it was irrevocably feminine even in father s time now i m sure you understand well i ll give you another example it ll shock you but i don t care suppose queen victoria gave a dinner party and that the guests had been leighton millais swinburne rossetti meredith fitzgerald etc do you suppose that the atmosphere of that dinner would have been artistic heavens no the very chairs on which they sat would have seen to that so with our house it must be feminine and all we can do is to see that it isn t effeminate just as another house that i can mention but won t sounded irrevocably masculine and all its inmates can do is to see that it isn t brutal
p00047_A,00047,A,that house being the w s house i presume
p00048_A,00048,A,good evening mr bast
p00049_A,00049,A,oh margaret such a most unfortunate thing has happened i could not get you alone coming up no doubt in the hope of getting into london society
p00050_A,00050,A,it is only that a certain family whom we know by name but do not mention as you said yourself last night after the concert have taken the flat opposite from the mathesons where the plants are in the balcony what helen you don t mind them coming do you
p00051_A,00051,A,well you look grave doesn t she frieda
p00052_A,00052,A,i don t feel grave that s all i can say you re going quite on the wrong tack
p00053_A,00053,A,no she does not feel grave i can bear witness to that she disagrees
p00054_A,00054,A,did you say the mathesons flat aunt juley how wonderful you are i never knew that the name of the woman who laced too tightly was matheson
p00055_A,00055,A,come helen
p00056_A,00056,A,go helen
p00057_A,00057,A,helen his mother has forgiven you
p00058_A,00058,A,bother the whole family helen stop giggling and pirouetting and go and finish your packing why can t the woman leave us alone
p00059_A,00059,A,i don t know what i shall do with meg she s got wilcox and box upon the brain meg meg i don t love the young gentleman i don t love the young gentleman meg meg can a body speak plainer
p00060_A,00060,A,most certainly her love has died
p00061_A,00061,A,if you are going to germany go and pack if you aren t go and call on the wilcoxes instead of me
p00062_A,00062,A,but meg meg i don t love the young gentleman i don t love the young o lud who s that coming down the stairs i vow tis my brother o crimini
p00063_A,00063,A,inexperience of course i have everything to learn absolutely everything just as much as helen life s very difficult and full of surprises at all events i ve got as far as that to be humble and kind to go straight ahead to love people rather than pity them to remember the submerged well one can t do all these things at once worse luck because they re so contradictory it s then that proportion comes in to live by proportion don t begin with proportion only prigs do that let proportion come in as a last resource when the better things have failed and a deadlock gracious me i ve started preaching
p00064_A,00064,A,indeed you put the difficulties of life splendidly it is just what i should have liked to say about them myself
p00065_A,00065,A,indeed that sounds like a most beautiful view miss schlegel
p00066_A,00066,A,yes yes the german is always on the lookout for beauty he may miss it through stupidity or misinterpret it but he is always asking beauty to enter his life and i believe that in the end it will come at heidelberg i met a fat veterinary surgeon whose voice broke with sobs as he repeated some mawkish poetry so easy for me to laugh i who never repeat poetry good or bad and cannot remember one fragment of verse to thrill myself with my blood boils well i m half german so put it down to patriotism when i listen to the tasteful contempt of the average islander for things teutonic whether they re bocklin or my veterinary surgeon oh bocklin they say he strains after beauty he peoples nature with gods too consciously of course bocklin strains because he wants something beauty and all the other intangible gifts that are floating about the world so his landscapes don t come off and leader s do
p00067_A,00067,A,i am not sure that i agree do you
p00068_A,00068,A,i have no side but my husband has very little faith in the continent and our children have all taken after him
p00069_A,00069,A,on what grounds do they feel that the continent is in bad form
p00070_A,00070,A,never mind us or her do say
p00071_A,00071,A,one admits that the arguments against the suffrage are extraordinarily strong
p00072_A,00072,A,we didn t mean the vote though did we aren t we differing on something much wider mrs wilcox whether women are to remain what they have been since the dawn of history or whether since men have moved forward so far they too may move forward a little now i say they may i would even admit a biological change
p00073_A,00073,A,i don t know i don t know
p00074_A,00074,A,i must be getting back to my overhanging warehouse they ve turned disgracefully strict
p00075_A,00075,A,my husband and our daughter are motoring
p00076_A,00076,A,bertha too oh fancy what a coincidence do you know i ll wait on second thoughts i ll wait there s plenty of time still isn t there and i shall be able to get evie s opinion
p00077_A,00077,A,later on i should love it but it s hardly the weather for such an expedition and we ought to start when we re fresh isn t the house shut up too might i come some other day
p00078_A,00078,A,back to wickham place please
p00079_A,00079,A,no motor smash changed plans father s coming
p00080_A,00080,A,miss schlegel our little outing must be for another day
p00081_A,00081,A,another day mrs wilcox of course
p00082_A,00082,A,but as we ve insured against third party risks it won t so much matter
p00083_A,00083,A,cart and car being practically at right angles
p00084_A,00084,A,i didn t want to henry i might have been wrong and every one hates illnesses
p00085_A,00085,A,father s eaten nothing
p00086_A,00086,A,butter dolly
p00087_A,00087,A,then why oughtn t the elms in the churchyard to be pollarded
p00088_A,00088,A,one minute i m busy well crane who s been driving it do you suppose
p00089_A,00089,A,don t know i m sure sir no one s driven it since i ve been back but of course there s the fortnight i ve been away with the other car in yorkshire
p00090_A,00090,A,charles your father s down something s happened he wants you in the house at once oh charles
p00091_A,00091,A,i can t of course say for the time i ve been in yorkshire no more mud now sir
p00092_A,00092,A,she wants howards end
p00093_A,00093,A,no sir
p00094_A,00094,A,howards end
p00095_A,00095,A,dolly go back at once my father s much annoyed with you charles come in at once to father he s had a letter that s too awful
p00096_A,00096,A,oh mr wilcox
p00097_A,00097,A,come evie don t waste time sit down
p00098_A,00098,A,a note in my mother s handwriting in an envelope addressed to my father sealed inside no date no signature forwarded through the matron of that nursing home now the question is
p00099_A,00099,A,why it s only in pencil i said so pencil never counts
p00100_A,00100,A,that she would have that it is a case of undue influence no to my mind the question is the the invalid s condition at the time she wrote
p00101_A,00101,A,why you just said it was
p00102_A,00102,A,never mind if i did and hold your tongue
p00103_A,00103,A,mother believed so in ancestors too it isn t like her to leave anything to an outsider who d never appreciate
p00104_A,00104,A,presumably she knows mother will have told her she got twice or three times into the nursing home presumably she is awaiting developments
p00105_A,00105,A,what a horrid woman
p00106_A,00106,A,why she may be coming down to turn us out now
p00107_A,00107,A,that paul business was pretty scandalous though
p00108_A,00108,A,i want no more of the paul business charles as i said at the time and besides it is quite apart from this business margaret schlegel has been officious and tiresome during this terrible week and we have all suffered under her but upon my soul she s honest she s not in collusion with the matron i m absolutely certain of it nor was she with the doctor i m equally certain of that she did not hide anything from us for up to that very afternoon she was as ignorant as we are she like ourselves was a dupe you see charles in her terrible pain your mother put us all in false positions paul would not have left england you would not have gone to italy nor evie and i into yorkshire if only we had known well miss schlegel s position has been equally false take all in all she has not come out of it badly
p00109_A,00109,A,but those chrysanthemums
p00110_A,00110,A,or coming down to the funeral at all
p00111_A,00111,A,why shouldn t she come down she had the right to and she stood far back among the hilton women the flowers certainly we should not have sent such flowers but they may have seemed the right thing to her evie and for all you know they may be the custom in germany
p00112_A,00112,A,oh i forget she isn t really english that would explain a lot
p00113_A,00113,A,i hope charles took the hint
p00114_A,00114,A,yes that is to say her husband wrote later on and thanked me for being a little kind to her and actually gave me her silver vinaigrette don t you think that is extraordinarily generous it has made me like him very much he hopes that this will not be the end of our acquaintance but that you and i will go and stop with evie some time in the future i like mr wilcox he is taking up his work rubber it is a big business i gather he is launching out rather charles is in it too charles is married a pretty little creature but she doesn t seem wise they took on the flat but now they have gone off to a house of their own
p00115_A,00115,A,but what an extraordinary
p00116_A,00116,A,i hope you were pleased
p00117_A,00117,A,tibby had better first wonder what he ll do cheers children it s mrs lanoline
p00118_A,00118,A,it was a concert at the queen s hall i think you will recollect when i tell you that it included a performance of the fifth symphony of beethoven
p00119_A,00119,A,we hear the fifth practically every time it s done so i m not sure do you remember helen
p00120_A,00120,A,likely enough for i steal umbrellas even oftener than i hear beethoven did you get it back
p00121_A,00121,A,the lady who called here yesterday thought that you were calling too and that she could find you
p00122_A,00122,A,this afternoon call
p00123_A,00123,A,saturday afternoon or sunday afternoon
p00124_A,00124,A,really and you were still calling on sunday when your wife came here a long visit
p00125_A,00125,A,it was good of you to come and explain the rest is naturally no concern of ours
p00126_A,00126,A,don t talk to me about the pole star i know its little ways it goes round and round and you go round after it
p00127_A,00127,A,but not good country there is it
p00128_A,00128,A,did you actually go off the roads
p00129_A,00129,A,oh yes i always meant to go off the roads but the worst of it is that it s more difficult to find one s way
p00130_A,00130,A,mr bast you re a born adventurer no professional athlete would have attempted what you ve done it s a wonder your walk didn t end in a broken neck whatever did your wife say
p00131_A,00131,A,excuse me mr bast but you re wrong there it didn t it came from something far greater
p00132_A,00132,A,then you don t think i was foolish
p00133_A,00133,A,heavens no
p00134_A,00134,A,i m very glad you say that now my wife would never understand not if i explained for days
p00135_A,00135,A,oh bother not to say dash i had forgotten we were dining out but do do come round again and have a talk
p00136_A,00136,A,why better
p00137_A,00137,A,i know but people don t go then perhaps you know best but never forget you re better than jefferies
p00138_A,00138,A,len who s miss schlegel
p00139_A,00139,A,have i i thought i had a million
p00140_A,00140,A,oh we ve had a splendid evening we belong to a kind of club that reads papers margaret and i all women but there is a discussion after this evening it was on how one ought to leave one s money whether to one s family or to the poor and if so how oh most interesting
p00141_A,00141,A,sounds a most original entertainment i wish evie would go to that sort of thing but she hasn t the time she s taken to breeding aberdeen terriers jolly little dogs
p00142_A,00142,A,i expect we d better be doing the same really
p00143_A,00143,A,yes quickness in argument time after time i ve missed scoring a point because the other man has had the gift of the gab and i haven t oh i believe in these discussions oh yes it doesn t much matter what subject you take
p00144_A,00144,A,about mr bast yes do he ll be more lenient to a special case
p00145_A,00145,A,what in
p00146_A,00146,A,porphyrion fire insurance company
p00147_A,00147,A,naturally the man who s in a situation when he applies stands a better chance is in a stronger position that the man who isn t it looks as if he s worth something i know by myself this is letting you into the state secrets it affects an employer greatly human nature i m afraid
p00148_A,00148,A,i hadn t thought of that
p00149_A,00149,A,our human nature appears to be the other way round we employ people because they re unemployed the boot man for instance
p00150_A,00150,A,i advise nothing i oughtn t to have spoken but i happen to know being more or less behind the scenes the porphyrion s a bad bad concern now don t say i said so it s outside the tariff ring
p00151_A,00151,A,certainly i won t say in fact i don t know what that means
p00152_A,00152,A,human nature i suppose
p00153_A,00153,A,oh we ve got a splendid tenant hamar bryce an invalid if charles ever wanted it but he won t dolly is so dependent on modern conveniences no we have all decided against howards end we like it in a way but now we feel that it is neither one thing nor the other one must have one thing or the other
p00154_A,00154,A,and mine
p00155_A,00155,A,next september
p00156_A,00156,A,every one moving good bye
p00157_A,00157,A,do yes that s worth doing let us
p00158_A,00158,A,ladies brighten
p00159_A,00159,A,yes i know the darlings are regular sunbeams let me give you a plate
p00160_A,00160,A,your company is the porphyrion isn t it
p00161_A,00161,A,yes that s so it s funny how things get round
p00162_A,00162,A,why funny it was written as large as life on your card and considering we wrote to you there and that you replied on the stamped paper
p00163_A,00163,A,i couldn t say some would tell you one thing and others another for my own part i only believe half i hear not that even it s safer those clever ones come to the worse grief i ve often noticed ah you can t be too careful
p00164_A,00164,A,we were told the porphyrion s no go we wanted to tell you that s why we wrote
p00165_A,00165,A,i mean i wouldn t say he s right altogether
p00166_A,00166,A,then he is right partly mr bast i don t understand business and i dare say my questions are stupid but can you tell me what makes a concern right or wrong our friend who is also a business man was so positive he said before christmas
p00167_A,00167,A,and advised you to clear out of it but i don t see why he should know better than you do
p00168_A,00168,A,one can but see as ibsen says things happen
p00169_A,00169,A,oh the dears oh evie how too impossibly sweet
p00170_A,00170,A,we brought the little fellows round
p00171_A,00171,A,i bred em myself
p00172_A,00172,A,i ve got to be going now
p00173_A,00173,A,but play with puppies a little first
p00174_A,00174,A,this is ahab that s jezebel
p00175_A,00175,A,i ve got to be going
p00176_A,00176,A,mr wilcox mr ba must you be really good bye
p00177_A,00177,A,to help you you silly boy and don t shout
p00178_A,00178,A,highly unfair
p00179_A,00179,A,so do i you were that last sunday you are this to day mr bast i and my sister have talked you over we wanted to help you we also supposed you might help us we did not have you here out of charity which bores us but because we hoped there would be a connection between last sunday and other days what is the good of your stars and trees your sunrise and the wind if they do not enter into our daily lives they have never entered into mine but into yours we thought haven t we all to struggle against life s daily greyness against pettiness against mechanical cheerfulness against suspicion i struggle by remembering my friends others i have known by remembering some place some beloved place or tree we thought you one of these
p00180_A,00180,A,of course if there s been any misunderstanding all i can do is to go but i beg to state you were picking my brain for official information i can prove it i
p00181_A,00181,A,helen go after him do anything anything to make the noodle understand
p00182_A,00182,A,but really ought she to
p00183_A,00183,A,i would have chimed in but i felt that you could polish him off for yourselves i didn t interfere you were splendid miss schlegel absolutely splendid you can take my word for it but there are very few women who could have managed him
p00184_A,00184,A,oh yes
p00185_A,00185,A,bowling him over with those long sentences was what fetched me
p00186_A,00186,A,yes indeed
p00187_A,00187,A,with you
p00188_A,00188,A,naughty young man
p00189_A,00189,A,naughty when you re married miss wilcox won t you want outside interests
p00190_A,00190,A,he has apparently got them
p00191_A,00191,A,oh i dare say
p00192_A,00192,A,surely he has some opinion
p00193_A,00193,A,he s very clever isn t he
p00194_A,00194,A,he s gone with my blessing and now for puppies
p00195_A,00195,A,helen s right enough but i can t stand the toothy one and i shouldn t have called either of them girls
p00196_A,00196,A,evie i like that miss schlegel expects me to turn house agent for her
p00197_A,00197,A,i want a new home in september and some one must find it i can t
p00198_A,00198,A,never any good just listen to her never any good oh come
p00199_A,00199,A,well you aren t miss schlegel is he
p00200_A,00200,A,i don t care you ve made two damaging admissions and i m heartily with you in both
p00201_A,00201,A,you needn t go though
p00202_A,00202,A,no we have no real ties
p00203_A,00203,A,but you won t do anything rash margaret
p00204_A,00204,A,there s nothing rash to do
p00205_A,00205,A,who are the wilcoxes
p00206_A,00206,A,i don t manage the wilcoxes i don t see where they come in
p00207_A,00207,A,it will be as easy as eating
p00208_A,00208,A,i was thinking of father how could he settle to leave germany as he did when he had fought for it as a young man and all his feelings and friends were prussian how could he break loose with patriotism and begin aiming at something else it would have killed me when he was nearly forty he could change countries and ideals and we at our age can t change houses it s humiliating
p00209_A,00209,A,bungle my dear you are too little to recollect in fact you weren t there but the furniture was actually in the vans and on the move before the lease for wickham place was signed and emily took train with baby who was margaret then and the smaller luggage for london without so much as knowing where her new home would be getting away from that house may be hard but it is nothing to the misery that we all went through getting you into it
p00210_A,00210,A,and that s the man who beat the austrians and the danes and the french and who beat the germans that were inside himself and we re like him
p00211_A,00211,A,speak for yourself remember that i am cosmopolitan please
p00212_A,00212,A,no frau liesecke but that is because they are fresh water and different salt water ought to have tides and go up and down a great deal or else it smells look for instance at an aquarium
p00213_A,00213,A,you are not to say stink at least you may say it but you must pretend you are being funny while you say it
p00214_A,00214,A,yes that is so
p00215_A,00215,A,i hope she hasn t been hasty
p00216_A,00216,A,but sister to that paul
p00217_A,00217,A,i had too much to do dear to look at it i had everything to settle and explain and charles wilcox to keep in his place besides it isn t likely i should remember much i just remember having lunch in your bedroom
p00218_A,00218,A,the great wilcox peril will never return if i m certain of anything it s of that
p00219_A,00219,A,one is certain of nothing but the truth of one s own emotions
p00220_A,00220,A,have you got the house oh what a nuisance so we re as we were
p00221_A,00221,A,not exactly
p00222_A,00222,A,some mystery we are to be enlightened presently
p00223_A,00223,A,wait one minute
p00224_A,00224,A,but you ve never conceivably you ve never
p00225_A,00225,A,panic and emptiness don t
