uid,pair_id,side,text
p00000_A,00000,A,i presume to observe sir walter that in the way of business gentlemen of the navy are well to deal with i have had a little knowledge of their methods of doing business and i am free to confess that they have very liberal notions and are as likely to make desirable tenants as any set of people one should meet with therefore sir walter what i would take leave to suggest is that if in consequence of any rumours getting abroad of your intention which must be contemplated as a possible thing because we know how difficult it is to keep the actions and designs of one part of the world from the notice and curiosity of the other consequence has its tax i john shepherd might conceal any family matters that i chose for nobody would think it worth their while to observe me but sir walter elliot has eyes upon him which it may be very difficult to elude and therefore thus much i venture upon that it will not greatly surprise me if with all our caution some rumour of the truth should get abroad in the supposition of which as i was going to observe since applications will unquestionably follow i should think any from our wealthy naval commanders particularly worth attending to and beg leave to add that two hours will bring me over at any time to save you the trouble of replying
p00001_A,00001,A,they would look around them no doubt and bless their good fortune but i quite agree with my father in thinking a sailor might be a very desirable tenant i have known a good deal of the profession and besides their liberality they are so neat and careful in all their ways these valuable pictures of yours sir walter if you chose to leave them would be perfectly safe everything in and about the house would be taken such excellent care of the gardens and shrubberies would be kept in almost as high order as they are now you need not be afraid miss elliot of your own sweet flower gardens being neglected
p00002_A,00002,A,as to all that supposing i were induced to let my house i have by no means made up my mind as to the privileges to be annexed to it i am not particularly disposed to favour a tenant the park would be open to him of course and few navy officers or men of any other description can have had such a range but what restrictions i might impose on the use of the pleasure grounds is another thing i am not fond of the idea of my shrubberies being always approachable and i should recommend miss elliot to be on her guard with respect to her flower garden i am very little disposed to grant a tenant of kellynch hall any extraordinary favour i assure you be he sailor or soldier
p00003_A,00003,A,very true very true what miss anne says is very true
p00004_A,00004,A,nay sir walter this is being severe indeed have a little mercy on the poor men we are not all born to be handsome the sea is no beautifier certainly sailors do grow old betimes i have observed it they soon lose the look of youth but then is not it the same with many other professions perhaps most other soldiers in active service are not at all better off and even in the quieter professions there is a toil and a labour of the mind if not of the body which seldom leaves a man s looks to the natural effect of time the lawyer plods quite care worn the physician is up at all hours and travelling in all weather and even the clergyman and even the clergyman you know is obliged to go into infected rooms and expose his health and looks to all the injury of a poisonous atmosphere in fact as i have long been convinced though every profession is necessary and honourable in its turn it is only the lot of those who are not obliged to follow any who can live in a regular way in the country choosing their own hours following their own pursuits and living on their own property without the torment of trying for more it is only their lot i say to hold the blessings of health and a good appearance to the utmost i know no other set of men but what lose something of their personableness when they cease to be quite young
p00005_A,00005,A,he is a rear admiral of the white he was in the trafalgar action and has been in the east indies since he was stationed there i believe several years
p00006_A,00006,A,then i take it for granted that his face is about as orange as the cuffs and capes of my livery
p00007_A,00007,A,i have no conception whom you can mean shepherd i remember no gentleman resident at monkford since the time of old governor trent
p00008_A,00008,A,you mean mr wentworth i suppose
p00009_A,00009,A,wentworth was the very name mr wentworth was the very man he had the curacy of monkford you know sir walter some time back for two or three years came there about the year 5 i take it you remember him i am sure
p00010_A,00010,A,i cannot possibly do without anne
p00011_A,00011,A,i think very differently an agreeable manner may set off handsome features but can never alter plain ones however at any rate as i have a great deal more at stake on this point than anybody else can have i think it rather unnecessary in you to be advising me
p00012_A,00012,A,and i will tell you our reason and all about it i am come on to give you notice that papa and mamma are out of spirits this evening especially mamma she is thinking so much of poor richard and we agreed it would be best to have the harp for it seems to amuse her more than the piano forte i will tell you why she is out of spirits when the crofts called this morning they called here afterwards did not they they happened to say that her brother captain wentworth is just returned to england or paid off or something and is coming to see them almost directly and most unluckily it came into mamma s head when they were gone that wentworth or something very like it was the name of poor richard s captain at one time i do not know when or where but a great while before he died poor fellow and upon looking over his letters and things she found it was so and is perfectly sure that this must be the very man and her head is quite full of it and of poor richard so we must be as merry as we can that she may not be dwelling upon such gloomy things
p00013_A,00013,A,nothing can be going on better than the child so i told my father just now that i would come and he thought me quite right your sister being with you my love i have no scruple at all you would not like to leave him yourself but you see i can be of no use anne will send for me if anything is the matter
p00014_A,00014,A,well if you do not think it too late to give notice for yourself suppose you were to go as well as your husband leave little charles to my care mr and mrs musgrove cannot think it wrong while i remain with him
p00015_A,00015,A,this is very kind of anne and i should be very glad to have you go but it seems rather hard that she should be left at home by herself to nurse our sick child
p00016_A,00016,A,i felt my luck admiral i assure you i was as well satisfied with my appointment as you can desire it was a great object with me at that time to be at sea a very great object i wanted to be doing something
p00017_A,00017,A,to be sure you did what should a young fellow like you do ashore for half a year together if a man had not a wife he soon wants to be afloat again
p00018_A,00018,A,but captain wentworth how vexed you must have been when you came to the asp to see what an old thing they had given you
p00019_A,00019,A,i knew pretty well what she was before that day i had no more discoveries to make than you would have as to the fashion and strength of any old pelisse which you had seen lent about among half your acquaintance ever since you could remember and which at last on some very wet day is lent to yourself ah she was a dear old asp to me she did all that i wanted i knew she would i knew that we should either go to the bottom together or that she would be the making of me and i never had two days of foul weather all the time i was at sea in her and after taking privateers enough to be very entertaining i had the good luck in my passage home the next autumn to fall in with the very french frigate i wanted i brought her into plymouth and here another instance of luck we had not been six hours in the sound when a gale came on which lasted four days and nights and which would have done for poor old asp in half the time our touch with the great nation not having much improved our condition four and twenty hours later and i should only have been a gallant captain wentworth in a small paragraph at one corner of the newspapers and being lost in only a sloop nobody would have thought about me
p00020_A,00020,A,it was at gibraltar mother i know dick had been left ill at gibraltar with a recommendation from his former captain to captain wentworth
p00021_A,00021,A,ah those were pleasant days when i had the laconia how fast i made money in her a friend of mine and i had such a lovely cruise together off the western islands poor harville sister you know how much he wanted money worse than myself he had a wife excellent fellow i shall never forget his happiness he felt it all so much for her sake i wished for him again the next summer when i had still the same luck in the mediterranean
p00022_A,00022,A,and i am sure sir it was a lucky day for us when you were put captain into that ship we shall never forget what you did poor dear fellow he was grown so steady and such an excellent correspondent while he was under your care ah it would have been a happy thing if he had never left you i assure you captain wentworth we are very sorry he ever left you
p00023_A,00023,A,if you had been a week later at lisbon last spring frederick you would have been asked to give a passage to lady mary grierson and her daughters
p00024_A,00024,A,my feelings you see did not prevent my taking mrs harville and all her family to plymouth
p00025_A,00025,A,ah my dear when he had got a wife he will sing a different tune when he is married if we have the good luck to live to another war we shall see him do as you and i and a great many others have done we shall have him very thankful to anybody that will bring him his wife
p00026_A,00026,A,ay that we shall
p00027_A,00027,A,when once married people begin to attack me with oh you will think very differently when you are married i can only say no i shall not and then they say again yes you will and there is an end of it
p00028_A,00028,A,what a great traveller you must have been ma am
p00029_A,00029,A,pretty well ma am in the fifteen years of my marriage though many women have done more i have crossed the atlantic four times and have been once to the east indies and back again and only once besides being in different places about home cork and lisbon and gibraltar but i never went beyond the streights and never was in the west indies we do not call bermuda or bahama you know the west indies
p00030_A,00030,A,aye to be sure yes indeed oh yes i am quite of your opinion mrs croft there is nothing so bad as a separation i am quite of your opinion i know what it is for mr musgrove always attends the assizes and i am so glad when they are over and he is safe back again
p00031_A,00031,A,i hope the little boy is better
p00032_A,00032,A,how do you do will you not sit down the others will be here presently
p00033_A,00033,A,ah you make the most of it i know but if it were really so i should do just the same in her place if i loved a man as she loves the admiral i would always be with him nothing should ever separate us and i would rather be overturned by him than driven safely by anybody else
p00034_A,00034,A,had you i honour you
p00035_A,00035,A,bless me here is winthrop i declare i had no idea well now i think we had better turn back i am excessively tired
p00036_A,00036,A,no no
p00037_A,00037,A,oh no indeed walking up that hill again would do her more harm than any sitting down could do her good
p00038_A,00038,A,it is very unpleasant having such connexions but i assure you i have never been in the house above twice in my life
p00039_A,00039,A,pray can you tell us the name of the gentleman who is just gone away
p00040_A,00040,A,no ma am he did not mention no particular family but he said his master was a very rich gentleman and would be a baronight some day
p00041_A,00041,A,of course you will mention our seeing mr elliot the next time you write to bath i think my father certainly ought to hear of it do mention all about him
p00042_A,00042,A,i am determined i will
p00043_A,00043,A,she is dead she is dead
p00044_A,00044,A,true true a surgeon this instant
p00045_A,00045,A,anne anne what is to be done next what in heaven s name is to be done next
p00046_A,00046,A,had not she better be carried to the inn yes i am sure carry her gently to the inn
p00047_A,00047,A,i have been considering what we had best do she must not appear at first she could not stand it i have been thinking whether you had not better remain in the carriage with her while i go in and break it to mr and mrs musgrove do you think this is a good plan
p00048_A,00048,A,no i do not know that he ever does in a general way but however it is a very clear thing that he admires you exceedingly his head is full of some books that he is reading upon your recommendation and he wants to talk to you about them he has found out something or other in one of them which he thinks oh i cannot pretend to remember it but it was something very fine i overheard him telling henrietta all about it and then miss elliot was spoken of in the highest terms now mary i declare it was so i heard it myself and you were in the other room elegance sweetness beauty oh there was no end of miss elliot s charms
p00049_A,00049,A,and i am sure it was a very little to his credit if he did miss harville only died last june such a heart is very little worth having is it lady russell i am sure you will agree with me
p00050_A,00050,A,and that you are very likely to do very soon i can tell you ma am though he had not nerves for coming away with us and setting off again afterwards to pay a formal visit here he will make his way over to kellynch one day by himself you may depend on it i told him the distance and the road and i told him of the church s being so very well worth seeing for as he has a taste for those sort of things i thought that would be a good excuse and he listened with all his understanding and soul and i am sure from his manner that you will have him calling here soon so i give you notice lady russell
p00051_A,00051,A,well as your joint acquaintance then i shall be very happy to see captain benwick
p00052_A,00052,A,you will not find anything very agreeable in him i assure you ma am he is one of the dullest young men that ever lived he has walked with me sometimes from one end of the sands to the other without saying a word he is not at all a well bred young man i am sure you will not like him
p00053_A,00053,A,there we differ mary i think lady russell would like him i think she would be so much pleased with his mind that she would very soon see no deficiency in his manner
p00054_A,00054,A,so do i anne i am sure lady russell would like him he is just lady russell s sort give him a book and he will read all day long
p00055_A,00055,A,you will not like him i will answer for it
p00056_A,00056,A,he is a man whom i have no wish to see his declining to be on cordial terms with the head of his family has left a very strong impression in his disfavour with me
p00057_A,00057,A,if i thought it would not tempt her to go out in sharp winds and grow coarse i would send her a new hat and pelisse
p00058_A,00058,A,the notions of a young man of one or two and twenty as to what is necessary in manners to make him quite the thing are more absurd i believe than those of any other set of beings in the world the folly of the means they often employ is only to be equalled by the folly of what they have in view
p00059_A,00059,A,elizabeth very well time will explain
p00060_A,00060,A,it was an acquaintance worth having
p00061_A,00061,A,i love your indignation it is very natural but here you are in bath and the object is to be established here with all the credit and dignity which ought to belong to sir walter elliot you talk of being proud i am called proud i know and i shall not wish to believe myself otherwise for our pride if investigated would have the same object i have no doubt though the kind may seem a little different in one point i am sure my dear cousin in one point i am sure we must feel alike we must feel that every addition to your father s society among his equals or superiors may be of use in diverting his thoughts from those who are beneath him
p00062_A,00062,A,yes sometimes it may though i fear its lessons are not often in the elevated style you describe here and there human nature may be great in times of trial but generally speaking it is its weakness and not its strength that appears in a sick chamber it is selfishness and impatience rather than generosity and fortitude that one hears of there is so little real friendship in the world and unfortunately there are so many who forget to think seriously till it is almost too late i do not suppose the situation my friend mrs rooke is in at present will furnish much either to interest or edify me she is only nursing mrs wallis of marlborough buildings a mere pretty silly expensive fashionable woman i believe and of course will have nothing to report but of lace and finery i mean to make my profit of mrs wallis however she has plenty of money and i intend she shall buy all the high priced things i have in hand now
p00063_A,00063,A,westgate buildings and who is miss anne elliot to be visiting in westgate buildings a mrs smith a widow mrs smith and who was her husband one of five thousand mr smiths whose names are to be met with everywhere and what is her attraction that she is old and sickly upon my word miss anne elliot you have the most extraordinary taste everything that revolts other people low company paltry rooms foul air disgusting associations are inviting to you but surely you may put off this old lady till to morrow she is not so near her end i presume but that she may hope to see another day what is her age forty
p00064_A,00064,A,but what does lady russell think of this acquaintance
p00065_A,00065,A,westgate buildings must have been rather surprised by the appearance of a carriage drawn up near its pavement sir henry russell s widow indeed has no honours to distinguish her arms but still it is a handsome equipage and no doubt is well known to convey a miss elliot a widow mrs smith lodging in westgate buildings a poor widow barely able to live between thirty and forty a mere mrs smith an every day mrs smith of all people and all names in the world to be the chosen friend of miss anne elliot and to be preferred by her to her own family connections among the nobility of england and ireland mrs smith such a name
p00066_A,00066,A,what is this the crofts have arrived in bath the crofts who rent kellynch what have they brought you oh those letters are convenient passports they secure an introduction i should have visited admiral croft however at any rate i know what is due to my tenant
p00067_A,00067,A,how is mary and pray what brings the crofts to bath
p00068_A,00068,A,they come on the admiral s account he is thought to be gouty
p00069_A,00069,A,gout and decrepitude poor old gentleman
p00070_A,00070,A,have they any acquaintance here
p00071_A,00071,A,i do not know but i can hardly suppose that at admiral croft s time of life and in his profession he should not have many acquaintance in such a place as this
p00072_A,00072,A,oh no i think not situated as we are with lady dalrymple cousins we ought to be very careful not to embarrass her with acquaintance she might not approve if we were not related it would not signify but as cousins she would feel scrupulous as to any proposal of ours we had better leave the crofts to find their own level there are several odd looking men walking about here who i am told are sailors the crofts will associate with them
p00073_A,00073,A,you will wonder what has been fixing my eye so long but i was looking after some window curtains which lady alicia and mrs frankland were telling me of last night they described the drawing room window curtains of one of the houses on this side of the way and this part of the street as being the handsomest and best hung of any in bath but could not recollect the exact number and i have been trying to find out which it could be but i confess i can see no curtains hereabouts that answer their description
p00074_A,00074,A,indeed i should not have supposed that you could have found anything in lyme to inspire such a feeling the horror and distress you were involved in the stretch of mind the wear of spirits i should have thought your last impressions of lyme must have been strong disgust
p00075_A,00075,A,a very fine young man indeed more air than one often sees in bath irish i dare say
p00076_A,00076,A,my dear miss elliot
p00077_A,00077,A,and mine kindest regards and you may say that i mean to call upon her soon make a civil message but i shall only leave my card morning visits are never fair by women at her time of life who make themselves up so little if she would only wear rouge she would not be afraid of being seen but last time i called i observed the blinds were let down immediately
p00078_A,00078,A,to be sure he is nobody doubts it and i hope you do not think i am so illiberal as to want every man to have the same objects and pleasures as myself i have a great value for benwick and when one can but get him to talk he has plenty to say his reading has done him no harm for he has fought as well as read he is a brave fellow i got more acquainted with him last monday than ever i did before we had a famous set to at rat hunting all the morning in my father s great barns and he played his part so well that i have liked him the better ever since
p00079_A,00079,A,do come anne come and look yourself you will be too late if you do not make haste they are parting they are shaking hands he is turning away not know mr elliot indeed you seem to have forgot all about lyme
p00080_A,00080,A,yes it is mr elliot certainly he has changed his hour of going i suppose that is all or i may be mistaken i might not attend
p00081_A,00081,A,but you must go charles it would be unpardonable to fail we were asked on purpose to be introduced there was always such a great connexion between the dalrymples and ourselves nothing ever happened on either side that was not announced immediately we are quite near relations you know and mr elliot too whom you ought so particularly to be acquainted with every attention is due to mr elliot consider my father s heir the future representative of the family
p00082_A,00082,A,don t talk to me about heirs and representatives i am not one of those who neglect the reigning power to bow to the rising sun if i would not go for the sake of your father i should think it scandalous to go for the sake of his heir what is mr elliot to me
p00083_A,00083,A,we will write the letter we were talking of harville now if you will give me materials
p00084_A,00084,A,your feelings may be the strongest but the same spirit of analogy will authorise me to assert that ours are the most tender man is more robust than woman but he is not longer lived which exactly explains my view of the nature of their attachments nay it would be too hard upon you if it were otherwise you have difficulties and privations and dangers enough to struggle with you are always labouring and toiling exposed to every risk and hardship your home country friends all quitted neither time nor health nor life to be called your own it would be hard indeed if woman s feelings were to be added to all this
p00085_A,00085,A,not quite a few lines more i shall have done in five minutes
p00086_A,00086,A,you are a good soul there is no quarrelling with you and when i think of benwick my tongue is tied
p00087_A,00087,A,here frederick you and i part company i believe i am going home and you have an engagement with your friend to night we may have the pleasure of all meeting again at your party we had your sister s card yesterday and i understood frederick had a card too though i did not see it and you are disengaged frederick are you not as well as ourselves
p00088_A,00088,A,yes very true here we separate but harville and i shall soon be after you that is harville if you are ready i am in half a minute i know you will not be sorry to be off i shall be at your service in half a minute
p00089_A,00089,A,good morning god bless you
p00090_A,00090,A,do you think so but i am afraid and i should be so very sorry will you promise me to mention it when you see them again you will see them both this morning i dare say do promise me
p00091_A,00091,A,are you going as high as belmont are you going near camden place because if you are i shall have no scruple in asking you to take my place and give anne your arm to her father s door she is rather done for this morning and must not go so far without help and i ought to be at that fellow s in the market place he promised me the sight of a capital gun he is just going to send off said he would keep it unpacked to the last possible moment that i might see it and if i do not turn back now i have no chance by his description a good deal like the second size double barrel of mine which you shot with one day round winthrop
