uid,pair_id,side,text
p00108_B,00108,B,just wait a moment loo before we go i should like to speak to him a moment something comes into my head if you ll step out on the stairs blackpool i ll mention it never mind a light man it don t want a light
p00109_B,00109,B,i say i think i can do you a good turn don t ask me what it is because it may not come to anything but there s no harm in my trying that was our light porter at the bank who brought you the message to night i call him our light porter because i belong to the bank too
p00110_B,00110,B,what a hurry he is in
p00111_B,00111,B,i shall strive t see thee agen rachael afore i go but if not
p00112_B,00112,B,thou wilt not stephen i know tis better that we make up our minds to be open wi one another
p00113_B,00113,B,i never in my life saw anything so remarkable and so captivating as the lighting of those features
p00114_B,00114,B,have you so proved it to be a failing of mine tom
p00115_B,00115,B,tom is misanthropical to day as all bored people are now and then don t believe him mrs bounderby he knows much better i shall disclose some of his opinions of you privately expressed to me unless he relents a little
p00116_B,00116,B,here s tom gradgrind s daughter knows pretty well what it might have been if you don t dropped sir as if she was shot when i told her never knew her do such a thing before does her credit under the circumstances in my opinion why i am going to tell you if you hadn t been so mighty particular about the sum i should have begun to tell you before you know this lady for she is a lady mrs sparsit
p00117_B,00117,B,very well and this young man bitzer you saw him too on the same occasion
p00118_B,00118,B,a hundred and fifty four seven one
p00119_B,00119,B,come let s have none of your interruptions it s enough to be robbed while you re snoring because you re too comfortable without being put right with your four seven ones i didn t snore myself when i was your age let me tell you i hadn t victuals enough to snore and i didn t four seven one not if i knew it a hundred and fifty odd pound that sum of money young tom locked in his safe not a very strong safe but that s no matter now everything was left all right some time in the night while this young fellow snored mrs sparsit ma am you say you have heard him snore
p00120_B,00120,B,sir i cannot say that i have heard him precisely snore and therefore must not make that statement but on winter evenings when he has fallen asleep at his table i have heard him what i should prefer to describe as partially choke i have heard him on such occasions produce sounds of a nature similar to what may be sometimes heard in dutch clocks not that i would convey any imputation on his moral character far from it i have always considered bitzer a young man of the most upright principle and to that i beg to bear my testimony
p00121_B,00121,B,where is tom by the by
p00122_B,00122,B,assuredly sir you did in a highly impressive manner give him such an admonition
p00123_B,00123,B,suspicious certainly
p00124_B,00124,B,thank you very much sir but pray do not let my comfort be a consideration anything will do for me
p00125_B,00125,B,but it is my duty to remember that what i was i am no longer indeed if i could altogether cancel the remembrance that mr sparsit was a powler or that i myself am related to the scadgers family or if i could even revoke the fact and make myself a person of common descent and ordinary connexions i would gladly do so i should think it under existing circumstances right to do so
p00126_B,00126,B,indeed you are very good sir wait for the simple mutton
p00127_B,00127,B,your health ma am
p00128_B,00128,B,tom have you anything to tell me if ever you loved me in your life and have anything concealed from every one besides tell it to me
p00129_B,00129,B,there stop where you are ma am stop where you are mrs bounderby will be very glad to be relieved of the trouble i believe
p00130_B,00130,B,don t say that sir because that is very unkind to mrs bounderby and to be unkind is not to be you sir
p00131_B,00131,B,of course it is of no moment why should it be of any importance to me
p00132_B,00132,B,my benefactor
p00133_B,00133,B,serve you right you noodle and i am glad of it
p00134_B,00134,B,bitzer present my compliments to young mr thomas and ask him if he would step up and partake of a lamb chop and walnut ketchup with a glass of india ale mr thomas these plain viands being on table i thought you might be tempted
p00135_B,00135,B,when was i brought to this room
p00136_B,00136,B,i am well assured of what you say father i know i have been your favourite child i know you have intended to make me happy i have never blamed you and i never shall
p00137_B,00137,B,why should you stay with me my sister will miss you you are everything to her
p00138_B,00138,B,to mr harthouse and you speak to him with the most confiding eyes i ever saw and the most earnest voice though so quiet i ever heard
p00139_B,00139,B,i am young as you see i am alone as you see in coming to you sir i have no advice or encouragement beyond my own hope but that is very strong this is a very odd beginning i don t see where we are going
p00140_B,00140,B,i think you have already guessed whom i left just now
p00141_B,00141,B,if i were to do such a very ridiculous thing it could only be in the most inviolable confidence
p00142_B,00142,B,send my fellow here
p00143_B,00143,B,sir my nerves are at present too much shaken and my health is at present too much impaired in your service to admit of my doing more than taking refuge in tears
p00144_B,00144,B,now as you showed me in your face tom gradgrind that you wanted to speak to me here i am but i am not in a very agreeable state i tell you plainly not relishing this business even as it is and not considering that i am at any time as dutifully and submissively treated by your daughter as josiah bounderby of coketown ought to be treated by his wife you have your opinion i dare say and i have mine i know if you mean to say anything to me to night that goes against this candid remark you had better let it alone
p00145_B,00145,B,my dear bounderby
p00146_B,00146,B,i have
p00147_B,00147,B,why couldn t you say so young tom
p00148_B,00148,B,i promised my sister i wouldn t and besides she tells her own story so precious well and so full that what business had i to take it out of her mouth
p00149_B,00149,B,say young lady if you please why in an evil hour you ever came to stephen s that night
p00150_B,00150,B,i felt compassion for him and i wished to know what he was going to do and wished to offer him assistance
p00151_B,00151,B,thank you ma am much flattered and obliged
p00152_B,00152,B,did you offer him a bank note
p00153_B,00153,B,yes but he refused it and would only take two pounds in gold
p00154_B,00154,B,oh certainly if you put the question whether your ridiculous and improbable account was true or not i am bound to say it s confirmed
p00155_B,00155,B,young lady stephen blackpool is now named as a thief in public print all over this town and where else there have been a meeting to night where he have been spoken of in the same shameful way stephen the honestest lad the truest lad the best
p00156_B,00156,B,i am very very sorry
p00157_B,00157,B,you re a pretty article to come here with these precious imputations you ought to be bundled out for not knowing how to behave yourself and you would be by rights
p00158_B,00158,B,come you know what you have engaged to do you had better give your mind to that not this
p00159_B,00159,B,deed i am loath that any here should see me like this but i won t be seen so again young lady when i had read what s put in print of stephen and what has just as much truth in it as if it had been put in print of you i went straight to the bank to say i knew where stephen was and to give a sure and certain promise that he should be here in two days i couldn t meet wi mr bounderby then and your brother sent me away and i tried to find you but you was not to be found and i went back to work soon as i come out of the mill to night i hastened to hear what was said of stephen for i know wi pride he will come back to shame it and then i went again to seek mr bounderby and i found him and i told him every word i knew and he believed no word i said and brought me here
p00160_B,00160,B,indeed indeed i pity him from my heart and i hope that he will clear himself
p00161_B,00161,B,all the surer i suppose for your refusing to tell where he is eh
p00162_B,00162,B,good night father
p00163_B,00163,B,rachael you will not distrust me one day when you know me better
p00164_B,00164,B,it goes against me to mistrust any one but when i am so mistrusted when we all are i cannot keep such things quite out of my mind i ask your pardon for having done you an injury i don t think what i said now yet i might come to think it again wi the poor lad so wronged
p00165_B,00165,B,did you tell him in your letter that suspicion seemed to have fallen upon him because he had been seen about the bank at night he would then know what he would have to explain on coming back and would be ready
p00166_B,00166,B,yes dear but i can t guess what can have ever taken him there he never used to go there it was never in his way his way was the same as mine and not near it
p00167_B,00167,B,i doubt if he can be here till next day
p00168_B,00168,B,then i will come next night too
p00169_B,00169,B,louisa my dear i have never that i know of seen this man do you believe him to be implicated
p00170_B,00170,B,i think i have believed it father though with great difficulty i do not believe it now
p00171_B,00171,B,it s mrs pegler
p00172_B,00172,B,i am surprised madam that in your old age you have the face to claim mr bounderby for your son after your unnatural and inhuman treatment of him
p00173_B,00173,B,i don t exactly know how i come to be favoured with the attendance of the present company but i don t inquire when they re quite satisfied perhaps they ll be so good as to disperse whether they re satisfied or not perhaps they ll be so good as to disperse i m not bound to deliver a lecture on my family affairs i have not undertaken to do it and i m not a going to do it therefore those who expect any explanation whatever upon that branch of the subject will be disappointed particularly tom gradgrind and he can t know it too soon in reference to the bank robbery there has been a mistake made concerning my mother if there hadn t been over officiousness it wouldn t have been made and i hate over officiousness at all times whether or no good evening
p00174_B,00174,B,it is so still here rachael and the way is so untrodden that i think we must be the first who have been here all the summer and yet i don t know this has not been broken very long the wood is quite fresh where it gave way here are footsteps too o rachael
p00175_B,00175,B,what is the matter
p00176_B,00176,B,you ha heard i ha not forgot you ledy
p00177_B,00177,B,often as i coom to myseln and found it shinin on me down there in my trouble i thowt it were the star as guided to our saviour s home i awmust think it be the very star
p00178_B,00178,B,i will hold thy hand and keep beside thee stephen all the way
p00179_B,00179,B,i believe father he will not come back to town to night
p00180_B,00180,B,not now my dears in the evening i am not able yet to morrow
p00181_B,00181,B,we had our fears before yesterday and when i saw you brought to the side of the litter last night and heard what passed being close to rachael all the time i went to him when no one saw and said to him he was in a tremble before i whispered to him and he started and trembled more then and said i thought of father s old circus i have not forgotten where mr sleary goes at this time of year and i read of him in a paper only the other day i told him to hurry there and tell his name and ask mr sleary to hide him till i came he said and i saw him shrink away among the people
p00182_B,00182,B,thethilia it doth me good to thee you you wath alwayth a favourite with uth and you ve done uth credith thinth the old timeth i m thure you mutht thee our people my dear afore we thpeak of bithnith or they ll break their hearth ethpethially the women here th jothphine hath been and got married to e w b childerth and thee hath got a boy and though he th only three yearth old he thtickth on to any pony you can bring againtht him he th named the little wonder of thcolathtic equitation and if you don t hear of that boy at athley th you ll hear of him at parith and you recollect kidderminthter that wath thought to be rather thweet upon yourthelf well he th married too married a widder old enough to be hith mother thee wath tightrope thee wath and now thee th nothing on accounth of fat they ve got two children tho we re thtrong in the fairy bithnith and the nurthery dodge if you wath to thee our children in the wood with their father and mother both a dyin on a horthe their uncle a retheiving of em ath hith wardth upon a horthe themthelvth both a goin a black berryin on a horthe and the robinth a coming in to cover em with leavth upon a horthe you d thay it wath the completetht thing ath ever you thet your eyeth on and you remember emma gordon my dear ath wath a motht a mother to you of courthe you do i needn t athk well emma thee lotht her huthband he wath throw d a heavy back fall off a elephant in a thort of a pagoda thing ath the thultan of the indieth and he never got the better of it and thee married a thecond time married a cheethemonger ath fell in love with her from the front and he th a overtheer and makin a fortun
p00183_B,00183,B,this is his sister yes
p00184_B,00184,B,my father will be here soon is my brother safe
p00185_B,00185,B,but look at him will any coach
p00186_B,00186,B,not you i don t want to have anything to say to you
p00187_B,00187,B,o tom tom do we end so after all my love
p00188_B,00188,B,bitzer have you a heart
p00189_B,00189,B,thquire you know perfectly well and your daughter knowth perfectly well better than you becauthe i thed it to her that i didn t know what your thon had done and that i didn t want to know i thed it wath better not though i only thought then it wath thome thkylarking however thith young man having made it known to be a robbery of a bank why that h a theriouth thing muth too theriouth a thing for me to compound ath thith young man hath very properly called it conthequently thquire you muthn t quarrel with me if i take thith young man th thide and thay he th right and there th no help for it but i tell you what i ll do thquire i ll drive your thon and thith young man over to the rail and prevent expothure here i can t conthent to do more but i ll do that the thquire thtood by you thethilia and i ll thtand by the thquire more than that thith ith a prethiouth rathcal and belongth to that bluthtering cove that my people nearly pitht out o winder it ll be a dark night i ve got a horthe that ll do anything but thpeak i ve got a pony that ll go fifteen mile an hour with childerth driving of him i ve got a dog that ll keep a man to one plathe four and twenty hourth get a word with the young thquire tell him when he theeth our horthe begin to danthe not to be afraid of being thpilt but to look out for a pony gig coming up tell him when he theeth that gig clothe by to jump down and it ll take him off at a rattling pathe if my dog leth thith young man thtir a peg on foot i give him leave to go and if my horthe ever thtirth from that thpot where he beginth a danthing till the morning i don t know him tharp th the word all right thquire your thon may be aboard a thip by thith time childerth took him off an hour and a half after we left there latht night the horthe danthed the polka till he wath dead beat he would have walthed if he hadn t been in harneth and then i gave him the word and he went to thleep comfortable when that prethiouth young rathcal thed he d go for ard afoot the dog hung on to hith neck hankercher with all four legth in the air and pulled him down and rolled him over tho he come back into the drag and there he that till i turned the horthe th head at half patht thixth thith morning i don t want money mythelf thquire but childerth ith a family man and if you wath to like to offer him a five pound note it mightn t be unactheptable likewithe if you wath to thtand a collar for the dog or a thet of bellth for the horthe i thould be very glad to take em brandy and water i alwayth take if you wouldn t think it going too far thquire to make a little thpread for the company at about three and thixth ahead not reckoning luth it would make em happy very well thquire then if you ll only give a horthe riding a bethpeak whenever you can you ll more than balanthe the account now thquire if your daughter will ethcuthe me i thould like one parting word with you thquire you don t need to be told that dogth ith wonderful animalth
p00190_B,00190,B,their instinct is surprising
p00191_B,00191,B,she keeps the bottle that he sent her for to this hour and she will believe in his affection to the last moment of her life
p00192_B,00192,B,lor bless her dear heart no lor bless her dear heart when she has lived as long as i have sir and had thirteen children of her own and all on em dead except two and them in the wurkus with me she ll know better than to take on in that way bless her dear heart think what it is to be a mother there s a dear young lamb do
p00193_B,00193,B,make a bow to the gentleman oliver
p00194_B,00194,B,will you go along with me oliver
p00195_B,00195,B,will she go with me
p00196_B,00196,B,bow to the board
p00197_B,00197,B,what s that sir
p00198_B,00198,B,the boy is a fool i thought he was
p00199_B,00199,B,hush you know you ve got no father or mother and that you were brought up by the parish don t you
p00200_B,00200,B,yes sir
p00201_B,00201,B,what are you crying for
p00202_B,00202,B,yes sir
p00203_B,00203,B,well you have come here to be educated and taught a useful trade
p00204_B,00204,B,so you ll begin to pick oakum to morrow morning at six o clock
p00205_B,00205,B,please sir i want some more
p00206_B,00206,B,that boy will be hung i know that boy will be hung
p00207_B,00207,B,i never was more convinced of anything in my life i never was more convinced of anything in my life than i am that that boy will come to be hung
p00208_B,00208,B,that s acause they damped the straw afore they lit it in the chimbley to make em come down again that s all smoke and no blaze vereas smoke ain t o no use at all in making a boy come down for it only sinds him to sleep and that s wot he likes boys is wery obstinit and wery lazy gen l men and there s nothink like a good hot blaze to make em come down vith a run it s humane too gen l men acause even if they ve stuck in the chimbley roasting their feet makes em struggle to hextricate theirselves
p00209_B,00209,B,we have considered your proposition and we don t approve of it
p00210_B,00210,B,not at all
p00211_B,00211,B,so you won t let me have him gen l men
p00212_B,00212,B,no at least as it s a nasty business we think you ought to take something less than the premium we offered
p00213_B,00213,B,ten shillings too much
p00214_B,00214,B,come say four pound gen l men say four pound and you ve got rid of him for good and all there
p00215_B,00215,B,three pound ten
p00216_B,00216,B,pooh pooh nonsense he d be cheap with nothing at all as a premium take him you silly fellow he s just the boy for you he wants the stick now and then it ll do him good and his board needn t come very expensive for he hasn t been overfed since he was born ha ha ha
p00217_B,00217,B,this is the boy your worship
p00218_B,00218,B,when i says i will i means i will
p00219_B,00219,B,stand a little away from him beadle now boy tell us what s the matter don t be afraid
p00220_B,00220,B,well well of all the artful and designing orphans that ever i see oliver you are one of the most bare facedest
p00221_B,00221,B,we refuse to sanction these indentures
p00222_B,00222,B,i hope i hope the magistrates will not form the opinion that the authorities have been guilty of any improper conduct on the unsupported testimony of a child
p00223_B,00223,B,the magistrates are not called upon to pronounce any opinion on the matter take the boy back to the workhouse and treat him kindly he seems to want it
p00224_B,00224,B,you ll make your fortune mr sowerberry i say you ll make your fortune mr sowerberry
p00225_B,00225,B,no one else mr sowerberry here i ve brought the boy
p00226_B,00226,B,why he is rather small he is small there s no denying it but he ll grow mrs sowerberry he ll grow
p00227_B,00227,B,here charlotte give this boy some of the cold bits that were put by for trip he hasn t come home since the morning so he may go without em i dare say the boy isn t too dainty to eat em are you boy
p00228_B,00228,B,i will directly sir
p00229_B,00229,B,aha an order for a coffin eh
p00230_B,00230,B,she was my daughter lord lord well it is strange that i who gave birth to her and was a woman then should be alive and merry now and she lying there so cold and stiff lord lord to think of it it s as good as a play as good as a play stop stop will she be buried to morrow or next day or to night i laid her out and i must walk you know send me a large cloak a good warm one for it is bitter cold we should have cake and wine too before we go never mind send some bread only a loaf of bread and a cup of water shall we have some bread dear
p00231_B,00231,B,yes yes of course anything you like
p00232_B,00232,B,now you must put your best leg foremost old lady we are rather late and it won t do to keep the clergyman waiting move on my men as quick as you like
p00233_B,00233,B,pretty well thank you sir not very much sir
p00234_B,00234,B,she s dead don t you say anything about her to me
p00235_B,00235,B,he ll murder me charlotte missis here s the new boy a murdering of me help help oliver s gone mad char lotte
p00236_B,00236,B,bless her she s going off a glass of water noah dear make haste
p00237_B,00237,B,oh charlotte oh charlotte what a mercy we have not all been murdered in our beds
p00238_B,00238,B,or the millingtary
p00239_B,00239,B,no no run to mr bumble noah and tell him to come here directly and not to lose a minute never mind your cap make haste you can hold a knife to that black eye as you run along it ll keep the swelling down
p00240_B,00240,B,mr bumble mr bumble oh mr bumble sir oliver sir oliver has
p00241_B,00241,B,and his missis
p00242_B,00242,B,ah said he wanted to did he my boy
p00243_B,00243,B,no i will not sir
p00244_B,00244,B,oliver
p00245_B,00245,B,oh you know mr bumble he must be mad no boy in half his senses could venture to speak so to you
p00246_B,00246,B,it s not madness ma am it s meat
p00247_B,00247,B,well and what if he did you little ungrateful wretch she deserved what he said and worse
p00248_B,00248,B,hush dick is any one up
p00249_B,00249,B,aha clever dogs clever dogs staunch to the last never told the old parson where they were never poached upon old fagin and why should they it wouldn t have loosened the knot or kept the drop up a minute longer no no no fine fellows fine fellows what a fine thing capital punishment is dead men never repent dead men never bring awkward stories to light ah it s a fine thing for the trade five of em strung up in a row and none left to play booty or turn white livered
p00250_B,00250,B,well i hope you ve been at work this morning my dears
p00251_B,00251,B,as nails
p00252_B,00252,B,good boys good boys what have you got dodger
p00253_B,00253,B,a couple of pocket books
p00254_B,00254,B,very indeed sir
p00255_B,00255,B,wipes
p00256_B,00256,B,if you please sir
p00257_B,00257,B,he is so jolly green
p00258_B,00258,B,there my dear that s a pleasant life isn t it they have gone out for the day
p00259_B,00259,B,have they done work sir
p00260_B,00260,B,a prime plant
p00261_B,00261,B,yes i am afraid it is the boy
p00262_B,00262,B,i did that sir and preciously i cut my knuckle agin his mouth i stopped him sir
p00263_B,00263,B,it wasn t me indeed sir indeed indeed it was two other boys they are here somewhere
p00264_B,00264,B,don t hurt him
p00265_B,00265,B,yes i am but i am not sure that this boy actually took the handkerchief i i would rather not press the case
p00266_B,00266,B,that is my name and address sir
p00267_B,00267,B,he s not charged at all your worship he appears against this boy your worship
p00268_B,00268,B,before i am sworn i must beg to say one word and that is that i really never without actual experience could have believed
p00269_B,00269,B,none your worship
p00270_B,00270,B,he has been hurt already and i fear i really fear that he is ill
p00271_B,00271,B,he says his name s tom white your worship
p00272_B,00272,B,take care of him officer he ll fall down
p00273_B,00273,B,i knew he was shamming let him lie there he ll soon be tired of that
p00274_B,00274,B,how do you propose to deal with the case sir
p00275_B,00275,B,he stands committed for three months hard labour of course clear the office
p00276_B,00276,B,dear me i forgot all about it
p00277_B,00277,B,a nice person to prefer a charge against a poor boy i consider sir that you have obtained possession of that book under very suspicious and disreputable circumstances and you may think yourself very fortunate that the owner of the property declines to prosecute let this be a lesson to you my man or the law will overtake you yet the boy is discharged clear the office
p00278_B,00278,B,may i accompany you
p00279_B,00279,B,never mind me my dear i m only having a regular good cry there it s all over now and i m quite comfortable
p00280_B,00280,B,you re very very kind to me ma am
p00281_B,00281,B,come in
p00282_B,00282,B,very happy sir and very grateful indeed sir for your goodness to me
p00283_B,00283,B,he has just had a basin of beautiful strong broth sir
p00284_B,00284,B,my name is oliver sir
p00285_B,00285,B,hush hush mr sikes don t speak so loud
