uid,pair_id,side,text
p00560_A,00560,A,yes noah dear
p00561_A,00561,A,what do you mean by lagging and a lifer what s the good of talking in that way to me why don t yer speak so as i can understand yer
p00562_A,00562,A,mind what should he have to mind
p00563_A,00563,A,really nothing my dear really nothing
p00564_A,00564,A,has the boy ever been here before
p00565_A,00565,A,he ought to have been a many times he has been pretty well everywhere else i know him well your worship
p00566_A,00566,A,now then where are the witnesses
p00567_A,00567,A,i wouldn t abase myself by descending to hold no conversation with him
p00568_A,00568,A,have you anything to say at all
p00569_A,00569,A,i never see such an out and out young wagabond your worship do you mean to say anything you young shaver
p00570_A,00570,A,no not here for this ain t the shop for justice besides which my attorney is a breakfasting this morning with the wice president of the house of commons but i shall have something to say elsewhere and so will he and so will a wery numerous and spectable circle of acquaintance as ll make them beaks wish they d never been born or that they d got their footmen to hang em up to their own hat pegs afore they let em come out this morning to try it on upon me i ll
p00571_A,00571,A,there he s fully committed take him away
p00572_A,00572,A,it make you nervous bill reminds you of being nabbed does it
p00573_A,00573,A,not till you let me go not till you let me go never never
p00574_A,00574,A,why now she s on the other tack light him down it s a pity he should break his neck himself and disappoint the sight seers show him a light
p00575_A,00575,A,i know you well good night
p00576_A,00576,A,there is nothing unusual in that they have passed me often
p00577_A,00577,A,speak to her kindly poor creature she seems to need it
p00578_A,00578,A,then this fagin shall not be brought to justice without your consent in such a case i could show you reasons i think which would induce you to yield it
p00579_A,00579,A,you have my true and faithful pledge
p00580_A,00580,A,how s this you know him
p00581_A,00581,A,nothing sir you can do nothing to help me i am past all hope indeed
p00582_A,00582,A,she will be persuaded now she hesitates i am sure
p00583_A,00583,A,i fear not my dear
p00584_A,00584,A,home
p00585_A,00585,A,it is useless we compromise her safety perhaps by staying here we may have detained her longer than she expected already
p00586_A,00586,A,no i have not done this for money let me have that to think of and yet give me something that you have worn i should like to have something no no not a ring your gloves or handkerchief anything that i can keep as having belonged to you sweet lady there bless you god bless you good night good night
p00587_A,00587,A,wot d ye mean
p00588_A,00588,A,what more of him what more of the man she had told them of before tell him that tell him that
p00589_A,00589,A,why that she couldn t very easily get out of doors unless he knew where she was going to and so the first time she went to see the lady she ha ha ha it made me laugh when she said it that it did she gave him a drink of laudanum
p00590_A,00590,A,and what be that stoof good to eat harry
p00591_A,00591,A,was it sir man or woman pray sir
p00592_A,00592,A,a woman it is supposed
p00593_A,00593,A,when i last heard he had not been taken but he will be or is by this time they re sure of him
p00594_A,00594,A,i wish that you had picked out some other crib when the two old ones got too warm and had not come here my fine feller
p00595_A,00595,A,why didn t you blunder head
p00596_A,00596,A,well i thought you d have been a little more glad to see me than this
p00597_A,00597,A,especially when the exclusive young man has got a friend stopping with him that s arrived sooner than was expected from foreign parts and is too modest to want to be presented to the judges on his return
p00598_A,00598,A,and bet
p00599_A,00599,A,wot s come of young bates
p00600_A,00600,A,he hung about not to come over here afore dark but he ll be here soon there s nowhere else to go to now for the people at the cripples are all in custody and the bar of the ken i went up there and see it with my own eyes is filled with traps
p00601_A,00601,A,this is a smash there s more than one will go with this
p00602_A,00602,A,the sessions are on if they get the inquest over and bolter turns king s evidence as of course he will from what he s said already they can prove fagin an accessory before the fact and get the trial on on friday and he ll swing in six days from this by g
p00603_A,00603,A,you should have heard the people groan the officers fought like devils or they d have torn him away he was down once but they made a ring round him and fought their way along you should have seen how he looked about him all muddy and bleeding and clung to them as if they were his dearest friends i can see em now not able to stand upright with the pressing of the mob and draggin him along amongst em i can see the people jumping up one behind another and snarling with their teeth and making at him i can see the blood upon his hair and beard and hear the cries with which the women worked themselves into the centre of the crowd at the street corner and swore they d tear his heart out
p00604_A,00604,A,what s the meaning of this he can t be coming here i i hope not
p00605_A,00605,A,if he was coming here he d have come with the dog here give us some water for him he has run himself faint
p00606_A,00606,A,where can he have come from he s been to the other kens of course and finding them filled with strangers come on here where he s been many a time and often but where can he have come from first and how comes he here alone without the other
p00607_A,00607,A,he he can t have made away with himself what do you think
p00608_A,00608,A,true
p00609_A,00609,A,break down the door i tell you they ll never open it run straight to the room where the light is break down the door
p00610_A,00610,A,hold your tongue fool
p00611_A,00611,A,come sir suppress your feelings
p00612_A,00612,A,i will do my endeavours sir how do you do sir i hope you are very well
p00613_A,00613,A,no
p00614_A,00614,A,i never saw him in all my life
p00615_A,00615,A,certainly not why are we brought here to answer to such nonsense as this
p00616_A,00616,A,you shut the door the night old sally died but you couldn t shut out the sound nor stop the chinks no no no no no we heard her try to tell you what she d done and saw you take a paper from her hand and watched you too next day to the pawnbroker s shop yes and it was a locket and gold ring we found out that and saw it given you we were by oh we were by and we know more than that for she told us often long ago that the young mother had told her that feeling she should never get over it she was on her way at the time that she was taken ill to die near the grave of the father of the child
p00617_A,00617,A,would you like to see the pawnbroker himself
p00618_A,00618,A,no if he has been coward enough to confess as i see he has and you have sounded all these hags till you have found the right ones i have nothing more to say i did sell them and they re where you ll never get them what then
p00619_A,00619,A,if the law supposes that the law is a ass a idiot if that s the eye of the law the law is a bachelor and the worst i wish the law is that his eye may be opened by experience by experience
p00620_A,00620,A,if they have i do not know how they can but if they have any reference to me pray let me hear them at some other time i have not strength or spirits now
p00621_A,00621,A,nay you have more fortitude than this i am sure do you know this young lady sir
p00622_A,00622,A,i never saw you before
p00623_A,00623,A,do you see her now
p00624_A,00624,A,yes leaning on your arm
p00625_A,00625,A,the only friend i ever had the kindest best of friends my heart will burst i cannot bear all this
p00626_A,00626,A,not aunt i ll never call her aunt sister my own dear sister that something taught my heart to love so dearly from the first rose dear darling rose
p00627_A,00627,A,i mean but this that when i left you last i left you with a firm determination to level all fancied barriers between yourself and me resolved that if my world could not be yours i would make yours mine that no pride of birth should curl the lip at you for i would turn from it this i have done those who have shrunk from me because of this have shrunk from you and proved you so far right such power and patronage such relatives of influence and rank as smiled upon me then look coldly now but there are smiling fields and waving trees in england s richest county and by one village church mine rose my own there stands a rustic dwelling which you can make me prouder of than all the hopes i have renounced measured a thousandfold this is my rank and station now and here i lay it down
p00628_A,00628,A,oliver my child where have you been and why do you look so sad there are tears stealing down your face at this moment what is the matter
p00629_A,00629,A,i shan t be one long strike them all dead what right have they to butcher me
p00630_A,00630,A,steady now sir tell him what you want quick if you please for he grows worse as the time gets on
p00631_A,00631,A,for the love of god do not say that now upon the very verge of death but tell me where they are you know that sikes is dead that monks has confessed that there is no hope of any further gain where are those papers
p00632_A,00632,A,oh god forgive this wretched man
p00633_A,00633,A,that s right that s right that ll help us on this door first if i shake and tremble as we pass the gallows don t you mind but hurry on now now now
p00634_A,00634,A,no other question if i hoped we could recall him to a sense of his position
p00000_B,00000,B,quadruped graminivorous forty teeth namely twenty four grinders four eye teeth and twelve incisive sheds coat in the spring in marshy countries sheds hoofs too hoofs hard but requiring to be shod with iron age known by marks in mouth
p00001_B,00001,B,very well that s a horse now let me ask you girls and boys would you paper a room with representations of horses
p00002_B,00002,B,you must paper it whether you like it or not don t tell us you wouldn t paper it what do you mean boy
p00003_B,00003,B,if you please sir i am very fond of flowers
p00004_B,00004,B,you are not cecilia jupe to do anything of that kind
p00005_B,00005,B,an eminently practical
p00006_B,00006,B,well what s the matter what is young thomas in the dumps about
p00007_B,00007,B,and mrs gradgrind i should as soon have expected to find my children reading poetry
p00008_B,00008,B,dear me how can you louisa and thomas i wonder at you i declare you re enough to make one regret ever having had a family at all i have a great mind to say i wish i hadn t then what would you have done i should like to know as if with my head in its present throbbing state you couldn t go and look at the shells and minerals and things provided for you instead of circuses you know as well as i do no young people have circus masters or keep circuses in cabinets or attend lectures about circuses what can you possibly want to know of circuses then i am sure you have enough to do if that s what you want with my head in its present state i couldn t remember the mere names of half the facts you have got to attend to
p00009_B,00009,B,that s the reason
p00010_B,00010,B,bounderby you are always so interested in my young people particularly in louisa that i make no apology for saying to you i am very much vexed by this discovery i have systematically devoted myself as you know to the education of the reason of my family the reason is as you know the only faculty to which education should be addressed and yet bounderby it would appear from this unexpected circumstance of to day though in itself a trifling one as if something had crept into thomas s and louisa s minds which is or rather which is not i don t know that i can express myself better than by saying which has never been intended to be developed and in which their reason has no part
p00011_B,00011,B,there certainly is no reason in looking with interest at a parcel of vagabonds when i was a vagabond myself nobody looked with any interest at me i know that
p00012_B,00012,B,oh my poor health the girl wanted to come to the school and mr gradgrind wanted girls to come to the school and louisa and thomas both said that the girl wanted to come and that mr gradgrind wanted girls to come and how was it possible to contradict them when such was the fact
p00013_B,00013,B,i am much of your opinion
p00014_B,00014,B,it s all right now louisa it s all right young thomas you won t do so any more i ll answer for it s being all over with father well louisa that s worth a kiss isn t it
p00015_B,00015,B,you can take one mr bounderby
p00016_B,00016,B,what are you about loo you ll rub a hole in your face
p00017_B,00017,B,you may cut the piece out with your penknife if you like tom i wouldn t cry
p00018_B,00018,B,what do you mean boy what are you doing how dare you dash against everybody in this manner was this boy running after you jupe
p00019_B,00019,B,yes sir
p00020_B,00020,B,no i wasn t sir not till she run away from me but the horse riders never mind what they say sir they re famous for it you know the horse riders are famous for never minding what they say it s as well known in the town as please sir as the multiplication table isn t known to the horse riders
p00021_B,00021,B,her calling seems to be pretty well known among em you d have had the whole school peeping in a row in a week
p00022_B,00022,B,truly i think so bitzer turn you about and take yourself home jupe stay here a moment let me hear of your running in this manner any more boy and you will hear of me through the master of the school you understand what i mean go along
p00023_B,00023,B,now girl take this gentleman and me to your father s we are going there what have you got in that bottle you are carrying
p00024_B,00024,B,gin
p00025_B,00025,B,dear no sir it s the nine oils
p00026_B,00026,B,and this is pod s end is it jupe
p00027_B,00027,B,this is it sir and if you wouldn t mind sir this is the house it s only crossing the bar sir and up the stairs if you wouldn t mind and waiting there for a moment till i get a candle if you should hear a dog sir it s only merrylegs and he only barks
p00028_B,00028,B,merrylegs and nine oils eh pretty well this for a self made man
p00029_B,00029,B,what does she mean back in a minute it s more than a mile off
p00030_B,00030,B,it was his daughter has gone to fetch him but i can t wait therefore if you please i will leave a message for him with you
p00031_B,00031,B,you see my friend we are the kind of people who know the value of time and you are the kind of people who don t know the value of time
p00032_B,00032,B,i have not the honour of knowing you but if you mean that you can make more money of your time than i can of mine i should judge from your appearance that you are about right
p00033_B,00033,B,and when you have made it you can keep it too i should think
p00034_B,00034,B,has what has he missed
p00035_B,00035,B,missed his tip
p00036_B,00036,B,offered at the garters four times last night and never done em once missed his tip at the banners too and was loose in his ponging
p00037_B,00037,B,didn t do what he ought to do was short in his leaps and bad in his tumbling
p00038_B,00038,B,oh that is tip is it
p00039_B,00039,B,nine oils merrylegs missing tips garters banners and ponging eh queer sort of company too for a man who has raised himself
p00040_B,00040,B,lower yourself then oh lord if you ve raised yourself so high as all that comes to let yourself down a bit
p00041_B,00041,B,this is a very obtrusive lad
p00042_B,00042,B,there get out get out tight jeff or slack jeff it don t much signify it s only tight rope and slack rope you were going to give me a message for jupe
p00043_B,00043,B,a cackler here we go again
p00044_B,00044,B,pray why will she never believe it of him
p00045_B,00045,B,idleness no by the lord harry nor i
p00046_B,00046,B,her father always had it in his head that she was to be taught the deuce and all of education how it got into his head i can t say i can only say that it never got out he has been picking up a bit of reading for her here and a bit of writing for her there and a bit of ciphering for her somewhere else these seven years when sissy got into the school here her father was as pleased as punch i couldn t altogether make out why myself as we were not stationary here being but comers and goers anywhere i suppose however he had this move in his mind he was always half cracked and then considered her provided for if you should happen to have looked in to night for the purpose of telling him that you were going to do her any little service it would be very fortunate and well timed very fortunate and well timed
p00047_B,00047,B,on the contrary i came to tell him that her connections made her not an object for the school and that she must not attend any more still if her father really has left her without any connivance on her part bounderby let me have a word with you
p00048_B,00048,B,no i say no i advise you not i say by no means
p00049_B,00049,B,now good people all this is wanton waste of time let the girl understand the fact let her take it from me if you like who have been run away from myself here what s your name your father has absconded deserted you and you mustn t expect to see him again as long as you live
p00050_B,00050,B,i tell you what thquire to thpeak plain to you my opinion ith that you had better cut it thort and drop it they re a very good natur d people my people but they re accuthtomed to be quick in their movementh and if you don t act upon my advithe i m damned if i don t believe they ll pith you out o winder
p00051_B,00051,B,it is of no moment whether this person is to be expected back at any time or the contrary he is gone away and there is no present expectation of his return that i believe is agreed on all hands
p00052_B,00052,B,when father comes back how will he ever find me if i go away
p00053_B,00053,B,thleary thath my name thquire not athamed of it known all over england and alwayth paythe ith way
p00054_B,00054,B,oh give me my clothes give me my clothes and let me go away before i break my heart
p00055_B,00055,B,now jupe if you are quite determined come
p00056_B,00056,B,good bye my dear you ll make your fortun i hope and none of our poor folkth will ever trouble you i ll pound it i with your father hadn t taken hith dog with him ith a ill conwenienth to have the dog out of the billth but on thecond thoughth he wouldn t have performed without hith mathter tho ith ath broad ath ith long there the ith thquire and the ll do you juthtithe good bye thethilia
p00057_B,00057,B,and yet sir how does it turn out after all why here she is at a hundred a year i give her a hundred which she is pleased to term handsome keeping the house of josiah bounderby of coketown princes and lords may flourish or may fade a breath can make them as a breath has made
p00058_B,00058,B,now i tell you what my girl the name of that lady by the teapot is mrs sparsit that lady acts as mistress of this house and she is a highly connected lady consequently if ever you come again into any room in this house you will make a short stay in it if you don t behave towards that lady in your most respectful manner now i don t care a button what you do to me because i don t affect to be anybody so far from having high connections i have no connections at all and i come of the scum of the earth but towards that lady i do care what you do and you shall do what is deferential and respectful or you shall not come here
p00059_B,00059,B,you are very good indeed sir it is not worth speaking of
p00060_B,00060,B,jupe i have made up my mind to take you into my house and when you are not in attendance at the school to employ you about mrs gradgrind who is rather an invalid i have explained to miss louisa this is miss louisa the miserable but natural end of your late career and you are to expressly understand that the whole of that subject is past and is not to be referred to any more from this time you begin your history you are at present ignorant i know
p00061_B,00061,B,yes sir very
p00062_B,00062,B,well i have given you my opinion already and i shouldn t do as you do but very well very well since you are bent upon it very well
p00063_B,00063,B,tom i wonder
p00064_B,00064,B,louisa never wonder
p00065_B,00065,B,i am sick of my life loo i hate it altogether and i hate everybody except you
p00066_B,00066,B,you don t hate sissy tom
p00067_B,00067,B,at last poor father said that he had given no satisfaction again and never did give any satisfaction now and that he was a shame and disgrace and i should have done better without him all along i said all the affectionate things to him that came into my heart and presently he was quiet and i sat down by him and told him all about the school and everything that had been said and done there when i had no more left to tell he put his arms round my neck and kissed me a great many times then he asked me to fetch some of the stuff he used for the little hurt he had had and to get it at the best place which was at the other end of town from there and then after kissing me again he let me go when i had gone down stairs i turned back that i might be a little bit more company to him yet and looked in at the door and said father shook his head and said and i left him sitting by the fire then the thought must have come upon him poor poor father of going away to try something for my sake for when i came back he was gone
p00068_B,00068,B,heaven s mercy woman hast thou come back again
p00069_B,00069,B,no sir sure i ha not coom for nowt o th kind
p00070_B,00070,B,i can go mr bounderby if you wish it
p00071_B,00071,B,i ha coom to ask yo yor advice i need t overmuch i were married on eas r monday nineteen year sin long and dree she were a young lass pretty enow wi good accounts of herseln well she went bad soon not along of me gonnows i were not a unkind husband to her
p00072_B,00072,B,was it an unequal marriage sir in point of years
p00073_B,00073,B,not e en so i were one and twenty myseln she were twenty nighbut
p00074_B,00074,B,indeed sir i inferred from its being so miserable a marriage that it was probably an unequal one in point of years
p00075_B,00075,B,well why don t you go on
p00076_B,00076,B,i ha coom to ask yo sir how i am to be ridded o this woman
p00077_B,00077,B,he wishes to be free to marry the female of whom he speaks i fear sir
p00078_B,00078,B,no how
p00079_B,00079,B,quite a young woman dear me
p00080_B,00080,B,dear tom how long it is since you have been to see me
p00081_B,00081,B,i hear you father i am attending i assure you
p00082_B,00082,B,mrs gradgrind allow me to present to you mrs bounderby
p00083_B,00083,B,i beg your pardon pray excuse me
p00084_B,00084,B,please to be seated sir
p00085_B,00085,B,spends a deal of money on his dress ma am
p00086_B,00086,B,you respect mr bounderby very much it is natural that you should
p00087_B,00087,B,charming
p00088_B,00088,B,ay ay this whelp is the only creature she cares for so so
p00089_B,00089,B,mrs bounderby your brother s face is quite familiar to me can i have seen him abroad or at some public school perhaps
p00090_B,00090,B,no he has never been abroad yet and was educated here at home tom love i am telling mr harthouse that he never saw you abroad
p00091_B,00091,B,no such luck sir
p00092_B,00092,B,so much the more is this whelp the only creature she has ever cared for so much the more so much the more
p00093_B,00093,B,do you smoke
p00094_B,00094,B,he don t seem to care about his dress and yet how capitally he does it what an easy swell he is
p00095_B,00095,B,oh my friends and fellow men i do not wonder that you the prostrate sons of labour are incredulous of the existence of such a man but he who sold his birthright for a mess of pottage existed and judas iscariot existed and castlereagh existed and this man exists my friends by virtue o my office as your president i askes o our friend slackbridge who may be a little over hetter in this business to take his seat whiles this man stephen blackpool is heern you all know this man stephen blackpool you know him awlung o his misfort ns and his good name
p00096_B,00096,B,what were it sir as yo were pleased to want wi me
p00097_B,00097,B,ah rachael my dear missus thou wi her
p00098_B,00098,B,have you left his work stephen
p00099_B,00099,B,mrs pegler
p00100_B,00100,B,dead stephen
p00101_B,00101,B,i m sooary i ha spok n on t i ought t hadn in my mind as i might touch a sore place i i blame myseln
p00102_B,00102,B,i had a son and he did well wonderfully well but he is not to be spoken of if you please he is dead i have lost him bounderby oh hide me don t let me be seen for the world don t let him come up till i ve got away pray pray
p00103_B,00103,B,i have heard the end of it young lady
p00104_B,00104,B,no one excepting myseln can ever know what honour an what love an respect i bear to rachael or wi what cause when i passed that promess i towd her true she were th angel o my life twere a solemn promess tis gone fro me for ever
p00105_B,00105,B,what will you do
p00106_B,00106,B,i canna do that young lady bless you for thinking o the poor lad wi such tenderness but tis for him to know his heart and what is right according to it
p00107_B,00107,B,not e en rachael could mak sitch a kind offerin by onny words kinder t show that i m not a man wi out reason and gratitude i ll tak two pound i ll borrow t for t pay t back twill be the sweetest work as ever i ha done that puts it in my power t acknowledge once more my lastin thankfulness for this present action
