uid,pair_id,side,text
p00000_A,00000,A,oh yes sir
p00001_A,00001,A,quadruped graminivorous forty teeth namely twenty four grinders four eye teeth and twelve incisive sheds coat in the spring in marshy countries sheds hoofs too hoofs hard but requiring to be shod with iron age known by marks in mouth
p00002_A,00002,A,yes sir no sir
p00003_A,00003,A,i ll explain to you then why you wouldn t paper a room with representations of horses do you ever see horses walking up and down the sides of rooms in reality in fact do you of course no why then you are not to see anywhere what you don t see in fact you are not to have anywhere what you don t have in fact what is called taste is only another name for fact this is a new principle a discovery a great discovery now i ll try you again suppose you were going to carpet a room would you use a carpet having a representation of flowers upon it girl number twenty so you would carpet your room or your husband s room if you were a grown woman and had a husband with representations of flowers would you why would you
p00004_A,00004,A,it wouldn t hurt them sir they wouldn t crush and wither if you please sir they would be the pictures of what was very pretty and pleasant and i would fancy
p00005_A,00005,A,you are to be in all things regulated and governed by fact we hope to have before long a board of fact composed of commissioners of fact who will force the people to be a people of fact and of nothing but fact you must discard the word fancy altogether you have nothing to do with it you are not to have in any object of use or ornament what would be a contradiction in fact you don t walk upon flowers in fact you cannot be allowed to walk upon flowers in carpets you don t find that foreign birds and butterflies come and perch upon your crockery you cannot be permitted to paint foreign birds and butterflies upon your crockery you never meet with quadrupeds going up and down walls you must not have quadrupeds represented upon walls you must use for all these purposes combinations and modifications in primary colours of mathematical figures which are susceptible of proof and demonstration this is the new discovery this is fact this is taste now if mr m choakumchild will proceed to give his first lesson here mr gradgrind i shall be happy at your request to observe his mode of procedure
p00006_A,00006,A,enough to give a baby cold
p00007_A,00007,A,well what s the matter what is young thomas in the dumps about
p00008_A,00008,A,we were peeping at the circus and father caught us
p00009_A,00009,A,and mrs gradgrind i should as soon have expected to find my children reading poetry
p00010_A,00010,A,that s the reason
p00011_A,00011,A,don t tell me that s the reason because it can t be nothing of the sort go and be somethingological directly
p00012_A,00012,A,louisa certainly did see her for she mentioned the application to me but louisa saw her i have no doubt in mrs gradgrind s presence
p00013_A,00013,A,oh my poor health the girl wanted to come to the school and mr gradgrind wanted girls to come to the school and louisa and thomas both said that the girl wanted to come and that mr gradgrind wanted girls to come and how was it possible to contradict them when such was the fact
p00014_A,00014,A,are you walking i have the father s address perhaps you would not mind walking to town with me
p00015_A,00015,A,not the least in the world as long as you do it at once i never wear gloves i didn t climb up the ladder in them shouldn t be so high up if i had
p00016_A,00016,A,you can take one mr bounderby
p00017_A,00017,A,always my pet ain t you louisa good bye louisa
p00018_A,00018,A,i was i was run after sir and i wanted to get away
p00019_A,00019,A,run after who would run after you
p00020_A,00020,A,what do you mean boy what are you doing how dare you dash against everybody in this manner was this boy running after you jupe
p00021_A,00021,A,he frightened me so with his cruel faces
p00022_A,00022,A,oh oh an t you one of the rest an t you a horse rider i never looked at her sir i asked her if she would know how to define a horse to morrow and offered to tell her again and she ran away and i ran after her sir that she might know how to answer when she was asked you wouldn t have thought of saying such mischief if you hadn t been a horse rider
p00023_A,00023,A,her calling seems to be pretty well known among em you d have had the whole school peeping in a row in a week
p00024_A,00024,A,truly i think so bitzer turn you about and take yourself home jupe stay here a moment let me hear of your running in this manner any more boy and you will hear of me through the master of the school you understand what i mean go along
p00025_A,00025,A,now girl take this gentleman and me to your father s we are going there what have you got in that bottle you are carrying
p00026_A,00026,A,it s what our people aways use sir when they get any hurts in the ring they bruise themselves very bad sometimes
p00027_A,00027,A,serve em right for being idle by george when i was four or five years younger than you i had worse bruises upon me than ten oils twenty oils forty oils would have rubbed off i didn t get em by posture making but by being banged about there was no rope dancing for me i danced on the bare ground and was larruped with the rope
p00028_A,00028,A,and this is pod s end is it jupe
p00029_A,00029,A,merrylegs and nine oils eh pretty well this for a self made man
p00030_A,00030,A,by your leaves gentlemen
p00031_A,00031,A,by your leaves gentlemen it was you i believe that were wishing to see jupe
p00032_A,00032,A,it was his daughter has gone to fetch him but i can t wait therefore if you please i will leave a message for him with you
p00033_A,00033,A,you see my friend we are the kind of people who know the value of time and you are the kind of people who don t know the value of time
p00034_A,00034,A,what does he come here cheeking us for then if you want to cheek us pay your ochre at the doors and take it out
p00035_A,00035,A,kidderminster stow that sir i was addressing myself to you you may or you may not be aware for perhaps you have not been much in the audience that jupe has missed his tip very often lately
p00036_A,00036,A,has what has he missed
p00037_A,00037,A,missed his tip
p00038_A,00038,A,offered at the garters four times last night and never done em once missed his tip at the banners too and was loose in his ponging
p00039_A,00039,A,oh that is tip is it
p00040_A,00040,A,in a general way that s missing his tip
p00041_A,00041,A,nine oils merrylegs missing tips garters banners and ponging eh queer sort of company too for a man who has raised himself
p00042_A,00042,A,we d have had a young gentleman to meet you if we had known you were coming it s a pity you don t have a bespeak being so particular you re on the tight jeff ain t you
p00043_A,00043,A,why has he been so very much goosed
p00044_A,00044,A,perhaps so
p00045_A,00045,A,i never apprenticed i was apprenticed when i was seven year old
p00046_A,00046,A,oh indeed i was not aware of its being the custom to apprentice young persons to
p00047_A,00047,A,idleness no by the lord harry nor i
p00048_A,00048,A,her father always had it in his head that she was to be taught the deuce and all of education how it got into his head i can t say i can only say that it never got out he has been picking up a bit of reading for her here and a bit of writing for her there and a bit of ciphering for her somewhere else these seven years when sissy got into the school here her father was as pleased as punch i couldn t altogether make out why myself as we were not stationary here being but comers and goers anywhere i suppose however he had this move in his mind he was always half cracked and then considered her provided for if you should happen to have looked in to night for the purpose of telling him that you were going to do her any little service it would be very fortunate and well timed very fortunate and well timed
p00049_A,00049,A,ith an internal thame upon my thoul it ith
p00050_A,00050,A,o my dear father my good kind father where are you gone you are gone to try to do me some good i know you are gone away for my sake i am sure and how miserable and helpless you will be without me poor poor father until you come back
p00051_A,00051,A,now good people all this is wanton waste of time let the girl understand the fact let her take it from me if you like who have been run away from myself here what s your name your father has absconded deserted you and you mustn t expect to see him again as long as you live
p00052_A,00052,A,at the thame time i mutht put in my word thquire tho that both thides of the banner may be equally theen if you like thethilia to be prentitht you know the natur of the work and you know your companionth emma gordon in whothe lap you re a lying at prethent would be a mother to you and joth phine would be a thithter to you i don t pretend to be of the angel breed myself and i don t thay but what when you mith d your tip you d find me cut up rough and thwear an oath or two at you but what i thay thquire ith that good tempered or bad tempered i never did a horthe a injury yet no more than thwearing at him went and that i don t expect i thall begin otherwithe at my time of life with a rider i never wath much of a cackler thquire and i have thed my thay
p00053_A,00053,A,when father comes back how will he ever find me if i go away
p00054_A,00054,A,must find out mr sleary who would then let him know where you went i should have no power of keeping you against his wish and he would have no difficulty at any time in finding mr thomas gradgrind of coketown i am well known
p00055_A,00055,A,well known you re one of the thort thquire that keepth a prethiouth thight of money out of the houthe but never mind that at prethent
p00056_A,00056,A,oh give me my clothes give me my clothes and let me go away before i break my heart
p00057_A,00057,A,tho be it my dear you thee how it ith thquire farewell thethilia my latht wordth to you ith thith thtick to the termth of your engagement be obedient to the thquire and forget uth but if when you re grown up and married and well off you come upon any horthe riding ever don t be hard upon it don t be croth with it give it a bethpeak if you can and think you might do wurth people mutht be amuthed thquire thomehow they can t be alwayth a working nor yet they can t be alwayth a learning make the betht of uth not the wurtht i ve got my living out of the horthe riding all my life i know but i conthider that i lay down the philothophy of the thubject when i thay to you thquire make the betht of uth not the wurtht
p00058_A,00058,A,yes sir it is unquestionably true
p00059_A,00059,A,i hope bounderby that this was merely an oversight
p00060_A,00060,A,my friend tom gradgrind suggests mrs sparsit that this was merely an oversight very likely however as you are aware ma am i don t allow of even oversights towards you
p00061_A,00061,A,you are very good indeed sir it is not worth speaking of
p00062_A,00062,A,about the fairies sir and the dwarf and the hunchback and the genies and about
p00063_A,00063,A,hush that is enough never breathe a word of such destructive nonsense any more bounderby this is a case for rigid training and i shall observe it with interest
p00064_A,00064,A,well i have given you my opinion already and i shouldn t do as you do but very well very well since you are bent upon it very well
p00065_A,00065,A,tom i wonder
p00066_A,00066,A,louisa never wonder
p00067_A,00067,A,i ll come directly
p00068_A,00068,A,always a muddle
p00069_A,00069,A,eigh lad what yo r there back agen yes and back agen back agen ever and ever so often back yes back why not i ll sell thee off again and i ll sell thee off again and i ll sell thee off a score of times come awa from th bed come awa from t tis mine and i ve a right to t
p00070_A,00070,A,no sir sure i ha not coom for nowt o th kind
p00071_A,00071,A,sir i hope i never had nowt to say not fitten for a born lady to year sin i were born mysen
p00072_A,00072,A,i were very patient wi her i tried to wean her fra t ower and ower agen i tried this i tried that i tried t other i ha gone home many s the time and found all vanished as i had in the world and her without a sense left to bless herseln lying on bare ground i ha dun t not once not twice twenty time from bad to worse from worse to worsen she left me she disgraced herseln everyways bitter and bad she coom back she coom back she coom back what could i do t hinder her i ha walked the streets nights long ere ever i d go home i ha gone t th brigg minded to fling myseln ower and ha no more on t i ha bore that much that i were owd when i were young i ha paid her to keep awa fra me these five year i ha paid her i ha gotten decent fewtrils about me agen i ha lived hard and sad but not ashamed and fearfo a the minnits o my life last night i went home there she lay upon my har stone there she is
p00073_A,00073,A,was it an unequal marriage sir in point of years
p00074_A,00074,A,you hear what this lady asks was it an unequal marriage in point of years this unlucky job of yours
p00075_A,00075,A,not e en so i were one and twenty myseln she were twenty nighbut
p00076_A,00076,A,indeed sir i inferred from its being so miserable a marriage that it was probably an unequal one in point of years
p00077_A,00077,A,what do you mean what are you talking about you took her for better for worse
p00078_A,00078,A,he wishes to be free to marry the female of whom he speaks i fear sir
p00079_A,00079,A,i should have nothing to wish sir if
p00080_A,00080,A,that s well
p00081_A,00081,A,that s a capital girl good bye loo
p00082_A,00082,A,why father what a strange question to ask me the baby preference that even i have heard of as common among children has never had its innocent resting place in my breast you have been so careful of me that i never had a child s heart you have trained me so well that i never dreamed a child s dream you have dealt so wisely with me father from my cradle to this hour that i never had a child s belief or a child s fear
p00083_A,00083,A,if you please ma am the gentleman would wish to see you
p00084_A,00084,A,i beg your pardon pray excuse me
p00085_A,00085,A,i give you my honour mrs powler that i never was so astonished in my life i assure you mrs powler that the father s manner prepared me for a grim and stony maturity i am obliged to you of all things for correcting so absurd a mistake pray excuse my intrusion many thanks good day
p00086_A,00086,A,this sir is my wife mrs bounderby tom gradgrind s eldest daughter loo mr james harthouse mr harthouse has joined your father s muster roll if he is not tom gradgrind s colleague before long i believe we shall at least hear of him in connexion with one of our neighbouring towns you observe mr harthouse that my wife is my junior i don t know what she saw in me to marry me but she saw something in me i suppose or she wouldn t have married me she has lots of expensive knowledge sir political and otherwise if you want to cram for anything i should be troubled to recommend you to a better adviser than loo bounderby
p00087_A,00087,A,you are a singular politician
p00088_A,00088,A,charming
p00089_A,00089,A,never mind that now
p00090_A,00090,A,well then don t begin with me
p00091_A,00091,A,mrs bounderby your brother s face is quite familiar to me can i have seen him abroad or at some public school perhaps
p00092_A,00092,A,no he has never been abroad yet and was educated here at home tom love i am telling mr harthouse that he never saw you abroad
p00093_A,00093,A,no such luck sir
p00094_A,00094,A,do you smoke
p00095_A,00095,A,be sure you re right slackbridge put him up let s hear him
p00096_A,00096,A,oh really
p00097_A,00097,A,what i know i know and what you know you know i have no more to say about it
p00098_A,00098,A,suppose she be she must be she s your master s wife
p00099_A,00099,A,where will you go stephen
p00100_A,00100,A,twere a bad job too to lose so good a one onny children
p00101_A,00101,A,no not now not now
p00102_A,00102,A,dead stephen
p00103_A,00103,A,well then pray don t speak to me nor yet take any notice of me let me be quite to myself in this corner
p00104_A,00104,A,then by the prejudices of his own class and by the prejudices of the other he is sacrificed alike are the two so deeply separated in this town that there is no place whatever for an honest workman between them he fell into suspicion with his fellow weavers because he had made a promise not to be one of them i think it must have been to you that he made that promise might i ask you why he made it
p00105_A,00105,A,i didn t seek it of him poor lad i prayed him to avoid trouble for his own good little thinking he d come to it through me but i know he d die a hundred deaths ere ever he d break his word i know that of him well
p00106_A,00106,A,afoot my kind ledy afoot
p00107_A,00107,A,rachael will you tell him for you know how without offence that this is freely his to help him on his way will you entreat him to take it
p00108_A,00108,A,i canna do that young lady bless you for thinking o the poor lad wi such tenderness but tis for him to know his heart and what is right according to it
p00109_A,00109,A,not e en rachael could mak sitch a kind offerin by onny words kinder t show that i m not a man wi out reason and gratitude i ll tak two pound i ll borrow t for t pay t back twill be the sweetest work as ever i ha done that puts it in my power t acknowledge once more my lastin thankfulness for this present action
p00110_A,00110,A,just wait a moment loo before we go i should like to speak to him a moment something comes into my head if you ll step out on the stairs blackpool i ll mention it never mind a light man it don t want a light
p00111_A,00111,A,now look here be sure you don t make any mistake then and don t forget i shall tell my sister as we go home what i have in view and she ll approve i know now look here you re all right are you you understand all about it very well then come along loo
p00112_A,00112,A,because she was such a pretty dear
p00113_A,00113,A,harthouse you have a couple of horses down here bring half a dozen more if you like and we ll find room for em there s stabling in this place for a dozen horses and unless nickits is belied he kept the full number a round dozen of em sir when that man was a boy he went to westminster school went to westminster school as a king s scholar when i was principally living on garbage and sleeping in market baskets why if i wanted to keep a dozen horses which i don t for one s enough for me i couldn t bear to see em in their stalls here and think what my own lodging used to be i couldn t look at em sir and not order em out yet so things come round you see this place you know what sort of a place it is you are aware that there s not a completer place of its size in this kingdom or elsewhere i don t care where and here got into the middle of it like a maggot into a nut is josiah bounderby while nickits as a man came into my office and told me yesterday nickits who used to act in latin in the westminster school plays with the chief justices and nobility of this country applauding him till they were black in the face is drivelling at this minute drivelling sir in a fifth floor up a narrow dark back street in antwerp
p00114_A,00114,A,i am afraid you are mercenary tom
p00115_A,00115,A,have you so proved it to be a failing of mine tom
p00116_A,00116,A,i suppose it might
p00117_A,00117,A,here s tom gradgrind s daughter knows pretty well what it might have been if you don t dropped sir as if she was shot when i told her never knew her do such a thing before does her credit under the circumstances in my opinion why i am going to tell you if you hadn t been so mighty particular about the sum i should have begun to tell you before you know this lady for she is a lady mrs sparsit
p00118_A,00118,A,very well and this young man bitzer you saw him too on the same occasion
p00119_A,00119,A,very well they live at the bank you know they live at the bank perhaps very well yesterday afternoon at the close of business hours everything was put away as usual in the iron room that this young fellow sleeps outside of there was never mind how much in the little safe in young tom s closet the safe used for petty purposes there was a hundred and fifty odd pound
p00120_A,00120,A,a hundred and fifty four seven one
p00121_A,00121,A,sir i cannot say that i have heard him precisely snore and therefore must not make that statement but on winter evenings when he has fallen asleep at his table i have heard him what i should prefer to describe as partially choke i have heard him on such occasions produce sounds of a nature similar to what may be sometimes heard in dutch clocks not that i would convey any imputation on his moral character far from it i have always considered bitzer a young man of the most upright principle and to that i beg to bear my testimony
p00122_A,00122,A,i hope not our friend blackpot
p00123_A,00123,A,yes sir he certainly did so though i do not mean to say but that my feelings may be weaker on such points more foolish if the term is preferred than they might have been if i had always occupied my present position
p00124_A,00124,A,of course they will be punished with the utmost rigour of the law as notice boards observe and serve them right fellows who go in for banks must take the consequences if there were no consequences we should all go in for banks
p00125_A,00125,A,for the present loo bounderby here s mrs sparsit to look after mrs sparsit s nerves have been acted upon by this business and she ll stay here a day or two so make her comfortable
p00126_A,00126,A,thank you very much sir but pray do not let my comfort be a consideration anything will do for me
p00127_A,00127,A,the more s the pity sir you are losing all your good old habits cheer up sir if miss gradgrind will permit me i will offer to make it for you as i have often done
p00128_A,00128,A,your health ma am
p00129_A,00129,A,it used to be considered that miss gradgrind was wanting in animation but i confess she appears to me considerably and strikingly improved in that respect ay and indeed here is mr bounderby how do you find yourself this morning sir pray let us see you cheerful sir you want your breakfast sir but i dare say miss gradgrind will soon be here to preside at the table
p00130_A,00130,A,if i waited to be taken care of by my wife ma am i believe you know pretty well i should wait till doomsday so i ll trouble you to take charge of the teapot
p00131_A,00131,A,don t say that sir because that is very unkind to mrs bounderby and to be unkind is not to be you sir
p00132_A,00132,A,have nothing otherwise don t you loo bounderby know thoroughly well that i josiah bounderby of coketown would have it
p00133_A,00133,A,you are incomprehensible this morning pray take no further trouble to explain yourself i am not curious to know your meaning what does it matter
p00134_A,00134,A,what do you mean ma am
p00135_A,00135,A,for you louisa
p00136_A,00136,A,oh no louisa it was done before i came it was
p00137_A,00137,A,o my child my child i am an unhappy man to see you thus what avails it to me that you do not reproach me if i so bitterly reproach myself louisa i have a misgiving that some change may have been slowly working about me in this house by mere love and gratitude that what the head had left undone and could not do the heart may have been doing silently can it be so i am not too proud to believe it louisa how could i be arrogant and you before me can it be so is it so my dear
p00138_A,00138,A,outside this door sir
p00139_A,00139,A,if i do not understand and i do not sir what your honour as a gentleman binds you to in other matters i am sure i may rely upon it to keep my visit secret and to keep secret what i am going to say i will rely upon it if you will tell me i may so far trust
p00140_A,00140,A,you may i assure you
p00141_A,00141,A,i am quite sure that it is the only reparation in your power sir i am quite sure or i would not have come here
p00142_A,00142,A,i am only a poor girl i was separated from my father he was only a stroller and taken pity on by mr gradgrind i have lived in the house ever since
p00143_A,00143,A,my dear bounderby let me beg you to restrain these loud out breaks on all accounts louisa is here the moment she could detach herself from that interview with the person of whom you speak and whom i deeply regret to have been the means of introducing to you louisa hurried here for protection i myself had not been at home many hours when i received her here in this room she hurried by the train to town she ran from town to this house through a raging storm and presented herself before me in a state of distraction of course she has remained here ever since let me entreat you for your own sake and for hers to be more quiet
p00144_A,00144,A,sir my nerves are at present too much shaken and my health is at present too much impaired in your service to admit of my doing more than taking refuge in tears
p00145_A,00145,A,well ma am without making any observation to you that may not be made with propriety to a woman of good family what i have got to add to that is that there is something else in which it appears to me you may take refuge namely a coach and the coach in which we came here being at the door you ll allow me to hand you down to it and pack you home to the bank where the best course for you to pursue will be to put your feet into the hottest water you can bear and take a glass of scalding rum and butter after you get into bed
