uid,pair_id,side,text
p00165_B,00165,B,my dear friend i come to talk to you of my happiness could anything be so flattering as mrs ferrars s way of treating me yesterday so exceeding affable as she was you know how i dreaded the thoughts of seeing her but the very moment i was introduced there was such an affability in her behaviour as really should seem to say she had quite took a fancy to me now was not it so you saw it all and was not you quite struck with it
p00166_B,00166,B,perhaps miss marianne you think young men never stand upon engagements if they have no mind to keep them little as well as great
p00167_B,00167,B,what can bring her here so often could not she see that we wanted her gone how teazing to edward
p00168_B,00168,B,why so we were all his friends and lucy has been the longest known to him of any it is but natural that he should like to see her as well as ourselves
p00169_B,00169,B,i have known it these four months when lucy first came to barton park last november she told me in confidence of her engagement
p00170_B,00170,B,yes ma am
p00171_B,00171,B,then he has acted like an honest man i beg your pardon mr dashwood but if he had done otherwise i should have thought him a rascal i have some little concern in the business as well as yourself for lucy steele is my cousin and i believe there is not a better kind of girl in the world nor one who more deserves a good husband
p00172_B,00172,B,not at all i believe with you
p00173_B,00173,B,you forget that its situation is not that it is not in the neighbourhood of
p00174_B,00174,B,i shall always think myself very much obliged to you
p00175_B,00175,B,thank you ma am it is a matter of great joy to me and i feel the goodness of colonel brandon most sensibly there are not many men who would act as he has done few people who have so compassionate a heart i never was more astonished in my life
p00176_B,00176,B,it is perfectly true colonel brandon has given the living of delaford to edward
p00177_B,00177,B,have you ever seen the lady
p00178_B,00178,B,not yet but she will be here i hope before it is long it is a great way you know from hence to barton
p00179_B,00179,B,no sir i shall not stay your business cannot be with me the servants i suppose forgot to tell you that mr palmer was not in the house
p00180_B,00180,B,colonel brandon s character as an excellent man is well established
p00181_B,00181,B,if you could be assured of that you think you should be easy
p00182_B,00182,B,i wish to assure you both that i see every thing as you can desire me to do it is a great relief to me what elinor told me this morning i have now heard exactly what i wished to hear i am now perfectly satisfied i wish for no change i never could have been happy with him after knowing as sooner or later i must have known all this i should have had no confidence no esteem nothing could have done it away to my feelings
p00183_B,00183,B,you consider the matter exactly as a good mind and a sound understanding must consider it and i dare say you perceive as well as myself not only in this but in many other circumstances reason enough to be convinced that your marriage must have involved you in many certain troubles and disappointments in which you would have been poorly supported by an affection on his side much less certain had you married you must have been always poor his expensiveness is acknowledged even by himself and his whole conduct declares that self denial is a word hardly understood by him his demands and your inexperience together on a small very small income must have brought on distresses which would not be the less grievous to you from having been entirely unknown and unthought of before your sense of honour and honesty would have led you i know when aware of your situation to attempt all the economy that would appear to you possible and perhaps as long as your frugality retrenched only on your own comfort you might have been suffered to practice it but beyond that and how little could the utmost of your single management do to stop the ruin which had begun before your marriage beyond that had you endeavoured however reasonably to abridge his enjoyments is it not to be feared that instead of prevailing on feelings so selfish to consent to it you would have lessened your own influence on his heart and made him regret the connection which had involved him in such difficulties
p00184_B,00184,B,rather say your mother s imprudence my child she must be answerable
p00185_B,00185,B,one observation may i think be fairly drawn from the whole of the story that all willoughby s difficulties have arisen from the first offence against virtue in his behaviour to eliza williams that crime has been the origin of every lesser one and of all his present discontents
p00186_B,00186,B,who told you that mr ferrars was married thomas
p00187_B,00187,B,when do you write to colonel brandon ma am
p00188_B,00188,B,i wrote to him my love last week and rather expect to see than to hear from him again i earnestly pressed his coming to us and should not be surprised to see him walk in today or tomorrow or any day
p00189_B,00189,B,is mrs ferrars at longstaple
p00190_B,00190,B,it was a foolish idle inclination on my side the consequence of ignorance of the world and want of employment had my mother given me some active profession when i was removed at eighteen from the care of mr pratt i think nay i am sure it would never have happened for though i left longstaple with what i thought at the time a most unconquerable preference for his niece yet had i then had any pursuit any object to engage my time and keep me at a distance from her for a few months i should very soon have outgrown the fancied attachment especially by mixing more with the world as in such case i must have done but instead of having any thing to do instead of having any profession chosen for me or being allowed to chuse any myself i returned home to be completely idle and for the first twelvemonth afterwards i had not even the nominal employment which belonging to the university would have given me for i was not entered at oxford till i was nineteen i had therefore nothing in the world to do but to fancy myself in love and as my mother did not make my home in every respect comfortable as i had no friend no companion in my brother and disliked new acquaintance it was not unnatural for me to be very often at longstaple where i always felt myself at home and was always sure of a welcome and accordingly i spent the greatest part of my time there from eighteen to nineteen lucy appeared everything that was amiable and obliging she was pretty too at least i thought so then and i had seen so little of other women that i could make no comparisons and see no defects considering everything therefore i hope foolish as our engagement was foolish as it has since in every way been proved it was not at the time an unnatural or an inexcusable piece of folly that was exactly like robert and that might perhaps be in his head when the acquaintance between them first began and lucy perhaps at first might think only of procuring his good offices in my favour other designs might afterward arise i will not ask your opinion of it as a composition for worlds would not i have had a letter of hers seen by you in former days in a sister it is bad enough but in a wife how i have blushed over the pages of her writing and i believe i may say that since the first half year of our foolish business this is the only letter i ever received from her of which the substance made me any amends for the defect of the style
p00191_B,00191,B,however it may have come about they are certainly married and your mother has brought on herself a most appropriate punishment the independence she settled on robert through resentment against you has put it in his power to make his own choice and she has actually been bribing one son with a thousand a year to do the very deed which she disinherited the other for intending to do she will hardly be less hurt i suppose by robert s marrying lucy than she would have been by your marrying her
p00192_B,00192,B,a letter of proper submission would they have me beg my mother s pardon for robert s ingratitude to her and breach of honour to me i can make no submission i am grown neither humble nor penitent by what has passed i am grown very happy but that would not interest i know of no submission that is proper for me to make
p00193_B,00193,B,you may certainly ask to be forgiven because you have offended and i should think you might now venture so far as to profess some concern for having ever formed the engagement which drew on you your mother s anger and when she has forgiven you perhaps a little humility may be convenient while acknowledging a second engagement almost as imprudent in her eyes as the first
p00194_B,00194,B,and if they really do interest themselves in bringing about a reconciliation i shall think that even john and fanny are not entirely without merit
