uid,pair_id,side,text
p00010_B,00010,B,well marianne for one morning i think you have done pretty well you have already ascertained mr willoughby s opinion in almost every matter of importance you know what he thinks of cowper and scott you are certain of his estimating their beauties as he ought and you have received every assurance of his admiring pope no more than is proper but how is your acquaintance to be long supported under such extraordinary despatch of every subject for discourse you will soon have exhausted each favourite topic another meeting will suffice to explain his sentiments on picturesque beauty and second marriages and then you can have nothing farther to ask
p00011_B,00011,B,elinor is this fair is this just are my ideas so scanty but i see what you mean i have been too much at my ease too happy too frank i have erred against every common place notion of decorum i have been open and sincere where i ought to have been reserved spiritless dull and deceitful had i talked only of the weather and the roads and had i spoken only once in ten minutes this reproach would have been spared
p00012_B,00012,B,my love you must not be offended with elinor she was only in jest i should scold her myself if she were capable of wishing to check the delight of your conversation with our new friend
p00013_B,00013,B,that is exactly what i think of him
p00014_B,00014,B,do not boast of it however for it is injustice in both of you he is highly esteemed by all the family at the park and i never see him myself without taking pains to converse with him
p00015_B,00015,B,that he is patronised by you is certainly in his favour but as for the esteem of the others it is a reproach in itself who would submit to the indignity of being approved by such a woman as lady middleton and mrs jennings that could command the indifference of any body else
p00016_B,00016,B,that is to say he has told you that in the east indies the climate is hot and the mosquitoes are troublesome
p00017_B,00017,B,perhaps his observations may have extended to the existence of nabobs gold mohrs and palanquins
p00018_B,00018,B,add to which that he has neither genius taste nor spirit that his understanding has no brilliancy his feelings no ardour and his voice no expression
p00019_B,00019,B,you decide on his imperfections so much in the mass and so much on the strength of your own imagination that the commendation i am able to give of him is comparatively cold and insipid i can only pronounce him to be a sensible man well bred well informed of gentle address and i believe possessing an amiable heart
p00020_B,00020,B,miss dashwood you are now using me unkindly you are endeavouring to disarm me by reason and to convince me against my will but it will not do you shall find me as stubborn as you can be artful i have three unanswerable reasons for disliking colonel brandon he threatened me with rain when i wanted it to be fine he has found fault with the hanging of my curricle and i cannot persuade him to buy my brown mare if it will be any satisfaction to you however to be told that i believe his character to be in other respects irreproachable i am ready to confess it and in return for an acknowledgment which must give me some pain you cannot deny me the privilege of disliking him as much as ever
p00021_B,00021,B,no her opinions are all romantic
p00022_B,00022,B,i must not tell may i elinor
p00023_B,00023,B,oh pray miss margaret let us know all about it what is the gentleman s name
p00024_B,00024,B,margaret you know that all this is an invention of your own and that there is no such person in existence
p00025_B,00025,B,i hope he has had no bad news it must be something extraordinary that could make colonel brandon leave my breakfast table so suddenly
p00026_B,00026,B,no bad news colonel i hope
p00027_B,00027,B,my dear madam recollect what you are saying
p00028_B,00028,B,no indeed it is not
p00029_B,00029,B,but if you write a note to the housekeeper mr brandon will it not be sufficient
p00030_B,00030,B,we must go it shall not be put off when we are so near it you cannot go to town till tomorrow brandon that is all
p00031_B,00031,B,i wish it could be so easily settled but it is not in my power to delay my journey for one day
p00032_B,00032,B,if you would but let us know what your business is we might see whether it could be put off or not
p00033_B,00033,B,you would not be six hours later if you were to defer your journey till our return
p00034_B,00034,B,i cannot afford to lose one hour
p00035_B,00035,B,i have no doubt of it
p00036_B,00036,B,you are very obliging but it is so uncertain when i may have it in my power to return that i dare not engage for it at all
p00037_B,00037,B,oh he must and shall come back if he is not here by the end of the week i shall go after him
p00038_B,00038,B,ay so do sir john and then perhaps you may find out what his business is
p00039_B,00039,B,no only to honiton i shall then go post
p00040_B,00040,B,i am afraid none at all
p00041_B,00041,B,come colonel before you go do let us know what you are going about
p00042_B,00042,B,i can guess what his business is however yes it is about miss williams i am sure
p00043_B,00043,B,and who is miss williams
p00044_B,00044,B,she is his natural daughter
p00045_B,00045,B,indeed
p00046_B,00046,B,i have found you out in spite of all your tricks i know where you spent the morning
p00047_B,00047,B,did not you know that we had been out in my curricle
p00048_B,00048,B,yes yes mr impudence i know that very well and i was determined to find out where you had been to i hope you like your house miss marianne it is a very large one i know and when i come to see you i hope you will have new furnished it for it wanted it very much when i was there six years ago
p00049_B,00049,B,why should you imagine elinor that we did not go there or that we did not see the house is not it what you have often wished to do yourself
p00050_B,00050,B,yes marianne but i would not go while mrs smith was there and with no other companion than mr willoughby
p00051_B,00051,B,shall we see you tomorrow to dinner i do not ask you to come in the morning for we must walk to the park to call on lady middleton
p00052_B,00052,B,is anything the matter with her is she ill
p00053_B,00053,B,i hope not it is i who may rather expect to be ill for i am now suffering under a very heavy disappointment
p00054_B,00054,B,it is all very strange so suddenly to be gone it seems but the work of a moment and last night he was with us so happy so cheerful so affectionate and now after only ten minutes notice gone too without intending to return something more than what he owned to us must have happened he did not speak he did not behave like himself you must have seen the difference as well as i what can it be can they have quarrelled why else should he have shown such unwillingness to accept your invitation here
p00055_B,00055,B,we have never finished hamlet marianne our dear willoughby went away before we could get through it we will put it by that when he comes again but it may be months perhaps before that happens
p00056_B,00056,B,it is he it is indeed i know it is
p00057_B,00057,B,indeed marianne i think you are mistaken it is not willoughby the person is not tall enough for him and has not his air
p00058_B,00058,B,a fortnight
p00059_B,00059,B,have you been lately in sussex
p00060_B,00060,B,i was at norland about a month ago
p00061_B,00061,B,and how does dear dear norland look
p00062_B,00062,B,dear dear norland probably looks much as it always does at this time of the year the woods and walks thickly covered with dead leaves
p00063_B,00063,B,it is a beautiful country but these bottoms must be dirty in winter
p00064_B,00064,B,marianne how can you say so how can you be so unjust they are a very respectable family mr ferrars and towards us have behaved in the friendliest manner have you forgot marianne how many pleasant days we have owed to them
p00065_B,00065,B,no i hope my mother is now convinced that i have no more talents than inclination for a public life
p00066_B,00066,B,strange that it would what have wealth or grandeur to do with happiness
p00067_B,00067,B,grandeur has but little but wealth has much to do with it
p00068_B,00068,B,hunters but why must you have hunters every body does not hunt
p00069_B,00069,B,i wish that somebody would give us all a large fortune apiece
p00070_B,00070,B,we are all unanimous in that wish i suppose in spite of the insufficiency of wealth
p00071_B,00071,B,oh dear how happy i should be i wonder what i should do with it
p00072_B,00072,B,i should be puzzled to spend so large a fortune myself if my children were all to be rich without my help
p00073_B,00073,B,you must begin your improvements on this house and your difficulties will soon vanish
p00074_B,00074,B,what magnificent orders would travel from this family to london in such an event what a happy day for booksellers music sellers and print shops you miss dashwood would give a general commission for every new print of merit to be sent you and as for marianne i know her greatness of soul there would not be music enough in london to content her and books thomson cowper scott she would buy them all over and over again she would buy up every copy i believe to prevent their falling into unworthy hands and she would have every book that tells her how to admire an old twisted tree should not you marianne forgive me if i am very saucy but i was willing to show you that i had not forgot our old disputes
p00075_B,00075,B,i love to be reminded of the past edward whether it be melancholy or gay i love to recall it and you will never offend me by talking of former times you are very right in supposing how my money would be spent some of it at least my loose cash would certainly be employed in improving my collection of music and books
p00076_B,00076,B,marianne is as steadfast as ever you see she is not at all altered
p00077_B,00077,B,she is only grown a little more grave than she was
p00078_B,00078,B,nay edward you need not reproach me you are not very gay yourself
p00079_B,00079,B,nor do i think it a part of marianne s i should hardly call her a lively girl she is very earnest very eager in all she does sometimes talks a great deal and always with animation but she is not often really merry
p00080_B,00080,B,but i thought it was right elinor to be guided wholly by the opinion of other people i thought our judgments were given us merely to be subservient to those of neighbours this has always been your doctrine i am sure
p00081_B,00081,B,you have not been able to bring your sister over to your plan of general civility do you gain no ground
p00082_B,00082,B,but you would still be reserved and that is worse
p00083_B,00083,B,do not you know my sister well enough to understand what she means do not you know she calls every one reserved who does not talk as fast and admire what she admires as rapturously as herself
p00084_B,00084,B,you must not enquire too far marianne remember i have no knowledge in the picturesque and i shall offend you by my ignorance and want of taste if we come to particulars i shall call hills steep which ought to be bold surfaces strange and uncouth which ought to be irregular and rugged and distant objects out of sight which ought only to be indistinct through the soft medium of a hazy atmosphere you must be satisfied with such admiration as i can honestly give i call it a very fine country the hills are steep the woods seem full of fine timber and the valley looks comfortable and snug with rich meadows and several neat farm houses scattered here and there it exactly answers my idea of a fine country because it unites beauty with utility and i dare say it is a picturesque one too because you admire it i can easily believe it to be full of rocks and promontories grey moss and brush wood but these are all lost on me i know nothing of the picturesque
p00085_B,00085,B,i suspect that to avoid one kind of affectation edward here falls into another because he believes many people pretend to more admiration of the beauties of nature than they really feel and is disgusted with such pretensions he affects greater indifference and less discrimination in viewing them himself than he possesses he is fastidious and will have an affectation of his own
p00086_B,00086,B,i am convinced that you really feel all the delight in a fine prospect which you profess to feel but in return your sister must allow me to feel no more than i profess i like a fine prospect but not on picturesque principles i do not like crooked twisted blasted trees i admire them much more if they are tall straight and flourishing i do not like ruined tattered cottages i am not fond of nettles or thistles or heath blossoms i have more pleasure in a snug farm house than a watch tower and a troop of tidy happy villagers please me better than the finest banditti in the world
p00087_B,00087,B,a dance impossible who is to dance
p00088_B,00088,B,i wish with all my soul that willoughby were among us again
p00089_B,00089,B,and who is willoughby
p00090_B,00090,B,i have been guessing shall i tell you my guess
p00091_B,00091,B,no none at all
p00092_B,00092,B,here comes marianne now palmer you shall see a monstrous pretty girl
p00093_B,00093,B,oh dear how beautiful these are well how delightful do but look mama how sweet i declare they are quite charming i could look at them for ever my love have you been asleep
p00094_B,00094,B,they mean no less to be civil and kind to us now by these frequent invitations than by those which we received from them a few weeks ago the alteration is not in them if their parties are grown tedious and dull we must look for the change elsewhere
p00095_B,00095,B,oh don t be so sly before us for we know all about it i assure you and i admire your taste very much for i think he is extremely handsome we do not live a great way from him in the country you know not above ten miles i dare say
p00096_B,00096,B,much nearer thirty
p00097_B,00097,B,my dear it is very provoking that we should be so few why did not you ask the gilberts to come to us today
p00098_B,00098,B,did not i tell you sir john when you spoke to me about it before that it could not be done they dined with us last
p00099_B,00099,B,you and i sir john should not stand upon such ceremony
p00100_B,00100,B,then you would be very ill bred
p00101_B,00101,B,my love you contradict every body do you know that you are quite rude
p00102_B,00102,B,ay you may abuse me as you please you have taken charlotte off my hands and cannot give her back again so there i have the whip hand of you
p00103_B,00103,B,mr palmer is so droll he is always out of humour
p00104_B,00104,B,oh my dear miss dashwood i have got such a favour to ask of you and your sister will you come and spend some time at cleveland this christmas now pray do and come while the westons are with us you cannot think how happy i shall be it will be quite delightful my love don t you long to have the miss dashwoods come to cleveland
p00105_B,00105,B,certainly he seems very agreeable
p00106_B,00106,B,yet i hardly know how unless it had been under totally different circumstances but this is the usual way of heightening alarm where there is nothing to be alarmed at in reality
p00107_B,00107,B,what a sweet woman lady middleton is
p00108_B,00108,B,and sir john too what a charming man he is and what a charming little family they have i never saw such fine children in my life i declare i quite doat upon them already and indeed i am always distractedly fond of children
p00109_B,00109,B,i should guess so from what i have witnessed this morning
p00110_B,00110,B,i have a notion you think the little middletons rather too much indulged perhaps they may be the outside of enough but it is so natural in lady middleton and for my part i love to see children full of life and spirits i cannot bear them if they are tame and quiet
p00111_B,00111,B,and how do you like devonshire miss dashwood i suppose you were very sorry to leave sussex norland is a prodigious beautiful place is not it
p00112_B,00112,B,we have heard sir john admire it excessively
p00113_B,00113,B,i think every one must admire it who ever saw the place though it is not to be supposed that any one can estimate its beauties as we do
p00114_B,00114,B,and had you a great many smart beaux there i suppose you have not so many in this part of the world for my part i think they are a vast addition always
p00115_B,00115,B,but why should you think that there are not as many genteel young men in devonshire as sussex
p00116_B,00116,B,upon my word i cannot tell you for i do not perfectly comprehend the meaning of the word but this i can say that if he ever was a beau before he married he is one still for there is not the smallest alteration in him
p00117_B,00117,B,lord anne you can talk of nothing but beaux you will make miss dashwood believe you think of nothing else
p00118_B,00118,B,how can you say so anne though we have seen him once or twice at my uncle s it is rather too much to pretend to know him very well
p00119_B,00119,B,and who was this uncle where did he live how came they acquainted
p00120_B,00120,B,indeed you are very much mistaken lady middleton i am only waiting to know whether you can make your party without me or i should have been at my filigree already i would not disappoint the little angel for all the world and if you want me at the card table now i am resolved to finish the basket after supper
p00121_B,00121,B,your ladyship will have the goodness to excuse me you know i detest cards i shall go to the piano forte i have not touched it since it was tuned
p00122_B,00122,B,marianne can never keep long from that instrument you know ma am and i do not much wonder at it for it is the very best toned piano forte i ever heard
p00123_B,00123,B,perhaps if i should happen to cut out i may be of some use to miss lucy steele in rolling her papers for her and there is so much still to be done to the basket that it must be impossible i think for her labour singly to finish it this evening i should like the work exceedingly if she would allow me a share in it
p00124_B,00124,B,indeed i shall be very much obliged to you for your help for i find there is more to be done to it than i thought there was and it would be a shocking thing to disappoint dear annamaria after all
p00125_B,00125,B,oh that would be terrible indeed dear little soul how i do love her
p00126_B,00126,B,you are very kind and as you really like the work perhaps you will be as well pleased not to cut in till another rubber or will you take your chance now
p00127_B,00127,B,i should be undeserving of the confidence you have honoured me with if i felt no desire for its continuance or no farther curiosity on its subject i will not apologize therefore for bringing it forward again
p00128_B,00128,B,thank you for breaking the ice you have set my heart at ease by it for i was somehow or other afraid i had offended you by what i told you that monday
p00129_B,00129,B,but what are your views or have you none but that of waiting for mrs ferrars s death which is a melancholy and shocking extremity is her son determined to submit to this and to all the tediousness of the many years of suspense in which it may involve you rather than run the risk of her displeasure for a while by owning the truth
p00130_B,00130,B,i can answer for it that miss dashwood s is not for he is one of the modestest prettiest behaved young men i ever saw but as for lucy she is such a sly little creature there is no finding out who she likes
p00131_B,00131,B,oh i dare say lucy s beau is quite as modest and pretty behaved as miss dashwood s
p00132_B,00132,B,i will honestly tell you of one scheme which has lately come into my head for bringing matters to bear indeed i am bound to let you into the secret for you are a party concerned i dare say you have seen enough of edward to know that he would prefer the church to every other profession now my plan is that he should take orders as soon as he can and then through your interest which i am sure you would be kind enough to use out of friendship for him and i hope out of some regard to me your brother might be persuaded to give him norland living which i understand is a very good one and the present incumbent not likely to live a great while that would be enough for us to marry upon and we might trust to time and chance for the rest
p00133_B,00133,B,i should always be happy to show any mark of my esteem and friendship for mr ferrars but do you not perceive that my interest on such an occasion would be perfectly unnecessary he is brother to mrs john dashwood that must be recommendation enough to her husband
p00134_B,00134,B,i thank you ma am sincerely thank you your invitation has insured my gratitude for ever and it would give me such happiness yes almost the greatest happiness i am capable of to be able to accept it but my mother my dearest kindest mother i feel the justice of what elinor has urged and if she were to be made less happy less comfortable by our absence oh no nothing should tempt me to leave her it should not must not be a struggle
p00135_B,00135,B,though with your usual anxiety for our happiness you have been obviating every impediment to the present scheme which occurred to you there is still one objection which in my opinion cannot be so easily removed
p00136_B,00136,B,if elinor is frightened away by her dislike of mrs jennings at least it need not prevent my accepting her invitation i have no such scruples and i am sure i could put up with every unpleasantness of that kind with very little effort
p00137_B,00137,B,i like edward ferrars very much and shall always be glad to see him but as to the rest of the family it is a matter of perfect indifference to me whether i am ever known to them or not
p00138_B,00138,B,i am writing home marianne had not you better defer your letter for a day or two
p00139_B,00139,B,i am not going to write to my mother oh elinor it is willoughby indeed it is
p00140_B,00140,B,how odd indeed if she had not known him to be in town she would not have written to him as she did she would have written to combe magna and if he is in town how odd that he should neither come nor write oh my dear mother you must be wrong in permitting an engagement between a daughter so young a man so little known to be carried on in so doubtful so mysterious a manner i long to inquire and how will my interference be borne
p00141_B,00141,B,at any rate i dare say we shall have sir john and lady middleton in town by the end of next week
p00142_B,00142,B,ay my dear i ll warrant you we do mary always has her own way
p00143_B,00143,B,don t you find it colder than it was in the morning elinor there seems to me a very decided difference i can hardly keep my hands warm even in my muff it was not so yesterday i think the clouds seem parting too the sun will be out in a moment and we shall have a clear afternoon good god he has been here while we were out
p00144_B,00144,B,you are expecting a letter then
p00145_B,00145,B,did you
p00146_B,00146,B,invited
p00147_B,00147,B,it cannot be generally known for her own family do not know it
p00148_B,00148,B,pray pray be composed and do not betray what you feel to every body present perhaps he has not observed you yet
p00149_B,00149,B,how can that be done no my dearest marianne you must wait this is not the place for explanations wait only till tomorrow marianne may i ask
p00150_B,00150,B,and have you really ma am talked yourself into a persuasion of my sister s being engaged to mr willoughby i thought it had been only a joke but so serious a question seems to imply more and i must beg therefore that you will not deceive yourself any longer i do assure you that nothing would surprise me more than to hear of their being going to be married
p00151_B,00151,B,the lady then miss grey i think you called her is very rich
p00152_B,00152,B,who can this be so early too i thought we had been safe
p00153_B,00153,B,it is colonel brandon we are never safe from him
p00154_B,00154,B,i understand you you have something to tell me of mr willoughby that will open his character farther your telling it will be the greatest act of friendship that can be shown marianne my gratitude will be insured immediately by any information tending to that end and hers must be gained by it in time pray pray let me hear it
p00155_B,00155,B,not in the stage i assure you we came post all the way and had a very smart beau to attend us dr davies was coming to town and so we thought we d join him in a post chaise and he behaved very genteelly and paid ten or twelve shillings more than we did
p00156_B,00156,B,i suppose you will go and stay with your brother and sister miss dashwood when they come to town
p00157_B,00157,B,no i do not think we shall
p00158_B,00158,B,long a time indeed why their visit is but just begun
p00159_B,00159,B,i am sorry we cannot see your sister miss dashwood i am sorry she is not well
p00160_B,00160,B,you are very good my sister will be equally sorry to miss the pleasure of seeing you but she has been very much plagued lately with nervous head aches which make her unfit for company or conversation
p00161_B,00161,B,excellent indeed their attention to our comfort their friendliness in every particular is more than i can express
p00162_B,00162,B,they are very pretty ma am an t they do you not think they are something in miss morton s style of painting ma am she does paint most delightfully how beautifully her last landscape is done
p00163_B,00163,B,this is admiration of a very particular kind what is miss morton to us who knows or who cares for her it is elinor of whom we think and speak
p00164_B,00164,B,ah poor dear
